paragraph,esg_label,count_label
also in fiscal year 2021100 percent of the identified 3tg cobalt and lithium smelters and refiners in our supply chain have participated in independent third party audits to assess and identify a broad range of risks including social environmental human rights and governance risks this marks seven consecutive years of 100 percent compliance for 3tgsix consecutive years for cobalt and two consecutive years for lithium,Supply_Chain_Management,Human_Rights_And_Community_Relations
read more on page 69 of our people and environment in our supply chain report and in our conflict minerals report,Supply_Chain_Management,Director_Removal
in the event that a smelter or refiner is unable or unwilling to meet our requirements we remove them from our supply chain since 2009 we have directed the removal of 1633tgand7 cobalt smelters and refiners from our supply chain,Supply_Chain_Management,None
for apple our work to make our company more inclusive extends to how we choose the businesses we work with when contracting with suppliers we use our purchasing power to increase diversity in our supply chain and change outdated norms that hurt those who are underrepresented in their field or industry,Supply_Chain_Management,Customer_Welfare
apples award winning supplier diversity program established in 1993 actively engages suppliers from historically underrepresented communities,Employee_Engagement_Inclusion_And_Diversity,Customer_Welfare
we have policies and procedures that require diverse supplier participation during early stage sourcing key performance indicators to measure company success and diversity awareness trainings for our global sourcing team members and related apple business units,Supply_Chain_Management,Employee_Engagement_Inclusion_And_Diversity
in calendar year 2021applespentover71 billion with diverse suppliers around the world our supplier diversity program offers support to participating suppliers and seeks active engagement in industry diversity leadership activities for example supplier development has been a longstanding commitment within apples supply chain which is facilitated internally and externally externally we partner with major universities to provide executive development and capacity building to key diverse suppliers and we are proud to have supported michigan state university and howard university on creating their first programs for diverse supplier development,Supply_Chain_Management,Employee_Engagement_Inclusion_And_Diversity
we are also promoting diversity in the companies with which we do business for example our agreements with our primary construction suppliers require the reporting of their efforts to include diverse subcontractors on all apple related projects,Employee_Engagement_Inclusion_And_Diversity,Customer_Welfare
as a result of our efforts we were chosen as corporation of the year by the national minority supplier development council nms dc in october 2021thisawardisnmsdcs highest honor to a major corporation for the utilization of ethnic minority owned suppliers specifically those with asian indian asian pacific black hispanic latin x and indigenous owners,Employee_Engagement_Inclusion_And_Diversity,Competitive_Behavior
through our global supply chain we create opportunities for people around the world including by helping to close skills gaps in manufacturing and by helping to prepare workers across our supply chain for the jobs of today and tomorrow,Supply_Chain_Management,Product_Design_And_Lifecycle_Management
in march 2022weannounceda50 million supplier employee development fund to amplify worker voice and expand access to learning and skill development opportunities to more people in our supply chain and,Supply_Chain_Management,Employee_Engagement_Inclusion_And_Diversity
as part of this fund we also launched the apple education hub informed by our previous supplier employee learning and development programs which 5 million supplier employees have taken advantage of since 2008 in partnership with local educational institutions and ngos the apple education hub will provide a scalable solution through virtual first learning to promote and develop the skills necessary for the future of work in our supply chain and surrounding communities with initial programming to begin in the,Supply_Chain_Management,Competitive_Behavior
apple s50 million supplier employee development fund will expand access to learning opportunities and skills development for people across its supply chain,Supply_Chain_Management,Employee_Engagement_Inclusion_And_Diversity
since 2017 we have offered training to supplier employees on apples swift coding language a skill that is in high demand in 2021we continued to build on feedback from students and suppliers to refine our curriculum by adding more opportunities for virtual learning while maintaining the quality and consistency of the programs,Employee_Engagement_Inclusion_And_Diversity,Competitive_Behavior
we work with our suppliers to help us address our environmental commitments including our goal to become carbon neutral by2030 across our entire product footprint our supplier energy efficiency program and supplier clean energy program both address direct and indirect emissions in our supply chain while our supplier clean water and zero waste programs help to reduce resource usage,Supply_Chain_Management,Energy_Management
in addition our code contains strict environmental protection s which require our suppliers to understand and take active steps to reduce their environmental impact while also becoming better stewards of the resources we all share and the communities in which we operate specifically our code addresses the management of regulated substances stormwater wastewater air emissions waste and noise as well as pollution prevention resource reduction and obtaining necessary environmental permits,Ecological_Impacts,Employee_Health_And_Safety
more detail about our environment work in the supply chain is covered on page 13 as well as in people and environment in our supply chain report and the environmental progress report,Supply_Chain_Management,Employee_Health_And_Safety
apple is constantly working with its global supply chain to accelerate and support its transition to clean energy as of march 2022213 of the company s major manufacturing partners have pledged to power all apple production with renewable electricity across 25 countries the dozens of new commitments announced this year will accelerate progress toward apple s2030goal to become carbon neutral across its entire supply chain,Supply_Chain_Management,Energy_Management
at apple our northstar is creating technology that empowers people and enriches their lives teams across apple are always innovating to make technology that seven better for our users that protects their right to privacy that is durable and resilient and that is inclusive and accessible for everyone and wherever we meet our customers online over the phone or in person we are committed to treating everyone with dignity and respect,Human_Rights_And_Community_Relations,Customer_Welfare
delivering exceptional products that enrich the lives of our customers i score to apples business we have enormous potential to help people use technology to overcome barriers to their goals innovate to solve problems and expand access to critical needs like health and education with our products and services we are uniquely positioned to both empower our customers to take action as well as to drive positive impact on some of the biggest issues in our society today including those addressed by the unsustainable development goals see page 75,Product_Design_And_Lifecycle_Management,Competitive_Behavior
responsibility for integrating privacy accessibility inclusion education and health into our products and services cuts across many teams including hardware engineering software engineering hardware technologies machine learning and ai and environment policy and social initiatives,Data security,Customer_Welfare
because we care about our customers we also have programs in place to understand and support their needs we work to provide positive customer experiences as well as products,Product_Design_And_Lifecycle_Management,None
that are durable and can be used for years to come and when we design our products were focused on making them safe for anyone who assembles uses or recycles them,Product_Design_And_Lifecycle_Management,None
data on device and build industry leading transparency and controls into our technology,Business ethics,Customer_Privacy
hand in hand with the privacy of our users are our commitments to free expression and access to information our products and services help our customers learn express their creativity exercise their ingenuity communicate privately and securely and share information globally whether by text message audio or sign language over facetime video,Customer_Privacy,Competitive_Behavior
our products and services are built with innovative privacy technologies and techniques designed to minimize how much of your data apple or anyone else can access they contain features designed and implemented over decades to protect customers privacy and give them control over their information,Data security,Customer_Privacy
to meet the highest standards for privacy security and content all the apps in our app store agree to comply with our app store review guidelines,Data security,Customer_Privacy
these provide developers with clear and transparent guidance on safety performance business design and legal issues including appeal rights the guidelines help ensure that the apps offered on the app store are safe provide a good user experience adhere to our rules on user privacy and secure devices from malware and threats,Data security,Customer_Welfare
safari was the first browser to block third party cookies by default as far back as2003andin2017 safari added intelligent tracking prevention to further limit tracking while still enabling websites to function normally,Data security,Customer_Privacy
random identifiers ensure that routes customers take and the places they search in maps are not associated with their apple id and messages and facetime are end to end encrypted so apple can not eavesdrop on user communications siri was designed from the very beginning in 2011to not associate the things that users say to siri with their apple id but instead uses a random identifier generated when a user first enables siri that has remained the same since then and in2021 with newly introduced on device speech recognition the audio of users siri requests is processed right on their i phone or ipad by default,Data security,Employee_Engagement_Inclusion_And_Diversity
customers control what information is shared where it is shared and when it is backed up we do not provide user information to any third parties without a clear legal basis and we publish a transparency report detailing government requests for customer data and app removal,Customer_Privacy,Management_Of_Legal_And_Regulatory_Framework
apple is committed to delivering advertising in a way that respects user privacy apple delivered ads may appear on the app store apple news and stocks depending on the jurisdiction the apple advertising platform does not track users nor does it buy or share user personal information with other companies,Customer_Privacy,Competitive_Behavior
to keep privacy at the center of our work we maintain rigorous privacy standards for both customer and employee data our chief privacy officer reports to apples senior vice president and general counsel who chairs apples privacy steering committee the committee,Data security,Customer_Privacy
privacy nutrition labels product pages on the app store feature a section that provides developers self reported summaries of some of their,Selling_Practices_And_Product_Labeling,Customer_Welfare
privacy practices in a simple easy to read label learn more,Data security,Customer_Welfare
sets privacy standards for teams across apple and addresses or escalates privacy compliance issues its members include apples senior vice president of machine learning and a i strategy and senior vice president of software engineering and across functional group of senior representatives from across the business these standards are in turn implemented and assessed by our privacy compliance team which works to continue to deliver on our privacy commitments across all personal data collections we have created a dedicated structure with executive sponsors in each functional area supported by privacy champions embedded in each functional area and taking direction from the privacy compliance team,Data security,Customer_Privacy
the audit and finance committee of the board of directors regularly reviews apples privacy and data security risks and discusses them with management the committee reviews reports on privacy and data security matters including updates on apples privacy program cybersecurity risks risk management and relevant legislative regulatory and technical developments,Data security,Customer_Privacy
we maintain current iso27001andiso27018 certifications that set user security standards for which we undergo yearly audits,Data security,Labor_Practices
we communicate privacy and security guidelines with employees and strictly enforce safeguards across the company all employees take annual training on business conduct of which privacy is an essential component employees with access to customer data and personal information are required to undergo additional privacy and security training for more information visit apples ethics and compliance website,Data security,Customer_Privacy
as part of our general data protection regulation gdp rand human rights work we undertake privacy impact assessments pias of our major products and services these assessments also consider decision making that relies on algorithmic systems and the impact such decisions have on individuals and their rights pias take into consideration how laws affect privacy and assess any associated risks in the relevant jurisdictions where we operate pia reviewers are also trained to identify and highlight potential impacts to freedom of expression apple regularly engages with a wide range of civil society representatives globally on various privacy and freedom of expression issues including privacy by design and encryption,Data security,Customer_Privacy
privacy questions concerns or complaints can be raised online or by calling our apple support number our data protection officer is available for questions regarding the privacy policy or general privacy practices,Data security,Customer_Welfare
we have spoken out time and again for strong encryption without backdoors recognizing that security is the foundation of privacy we build security into our hardware software and services including at the design and development phase to provide users with maximum security and a transparent user experience serving the ultimate goal of keeping personal information safe and we have designed the secure enclave a dedicated secure,Data security,Customer_Privacy
as part of our commitment our apple security bounty rewards researchers who discover and share with us critical issues in our latest operating systems and the techniques used to exploit them,Data security,Competitive_Behavior
data protection officer who is mandated to raise any issues of concern to apples privacy steering committee,Data security,Customer_Welfare
when we become aware of a potential data security incident we conduct prompt investigations and analysis provide notifications in a timely manner when necessary and determine what steps to take in response,Data security,Customer_Privacy
learn more about privacy at apple review privacy features,Data security,Customer_Welfare
see how apps from apple handle your data,Data security,Customer_Privacy
at apple we believe technology can play a powerful role in helping people to create learn be more collaborative and independent foster dignity and live out their dreams accessibility is a human right now here is that more evident than in our work in accessibility,Access_And_Affordability,Customer_Welfare
our work to make technology customizable to the diverse needs of all our users has become widely known for example the 2021webaim survey from the institute for disability research policy and practice utah state university which analyzed responses from over 1500 users around the world who have a vision disability and use a screen reader shows that 719of survey respondents use i phone or ipad with apples voice over as their primary mobile platform,Employee_Engagement_Inclusion_And_Diversity,Competitive_Behavior
apple has also been repeatedly honored for our accessibility work including most recently receiving a fcc chairs award for advancement in accessibility for ios14 which added a suite of accessibility features that have particular importance in the context of the covid19 pandemic these features people detection voice over recognition sign language prominence in face time and sound recognition have helped users with disabilities navigate day today life during the covid19 pandemic,Employee_Engagement_Inclusion_And_Diversity,Customer_Welfare
apple promotes authentic and positive portrayals of disability in films and series on apple tv including coda see el deaf o and little voice apple original content includes audio descriptions in dolby atmos in nine languages and closed captions and subtitles for the deaf and hard of hearing in over 40languagesinall100 countries where apple tv is available,Employee_Health_And_Safety,None
to support customers who are deaf or hard of hearing apple was the first to directly connect hearing aids or a cochlear implant to iphone and other ios devices through the made for i phone mfi program this enables customers to make phone calls and stream high quality audio directly to their mfi hearing devices and in2021 apple added support for the latest generation of bidirectional hearing aids from made for i phone partners that support handsfree phone and face time conversations sound recognition notifies users of external environmental sounds like running water,Employee_Health_And_Safety,Water_And_Wastewater_Management
alarms electrical appliances breaking glass and more with the newly introduced option to train your i phone or ipad to listen for a specific alarm or electrical appliance sound other features include live captions beta introduced in 2022 which helps users with hearing disabilities follow along with calls and media oni phone i pad and mac sign language prominence in facetime which can detect when someone uses sign language in group calls and conversation boost for air pods pro which helps users better hear conversations in crowded or noisy environments,Critical_Incident_Risk_Management,None
our products are built with an array of features to support people who are neuro divergent or have cognitive disabilities background sounds help minimize distractions and support users who want to focus stay calm or rest with speak selection for ios and macos audio can be used to support reading or writing comprehension and dictation and siri help anyone who finds speaking easier than typing or writing another feature guided access limits a device to a single app and let us users control which features are available,Employee_Engagement_Inclusion_And_Diversity,None
apple offers extensive support documentation engaging online training content and in store sessions to help anyone learn how to use our built in accessibility features customers can also call or chat with apple support staff dedicated to supporting accessibility or share,Access_And_Affordability,Customer_Welfare
feedback about an accessibility feature on an apple product,Product_Design_And_Lifecycle_Management,Customer_Welfare
the people detection feature in magnifier uses the lidar camera ini phone 12proiphone13proandipad proto help support health and safety for users who are blind or have low vision and need to maintain social distancing,Employee_Health_And_Safety,Customer_Welfare
we offer world class on demand sign language interpretation services with the sign time service available in us uk france and canada which helps apple customers and team members request an interpreter and communicate using american sign language as linus and canada british sign language bsl in the uk or french sign language lsf in france,Employee_Engagement_Inclusion_And_Diversity,Competitive_Behavior
apple subscribes to the principle of participation nothing about us without us used by disability organizations to call for inclusion in work done for by and with persons with disabilities in addition to hiring people with disabilities to develop and inform our accessibility features we welcome all users to beta test features and give feedback,Employee_Engagement_Inclusion_And_Diversity,Customer_Welfare
apples innovative software features introduce new ways for users with disabilities to navigate connect and get the most out of apple products,Access_And_Affordability,None
we work with various nonprofit organizations around the globe to strategically align and support each other and we maintain constant contact with community organizations to help ensure that we are exceeding their expectations we also work with international standards organizations to expand equal access to information and functionality while working to protect and improve the rights inclusion and equity of people with disabilities,Employee_Engagement_Inclusion_And_Diversity,Human_Rights_And_Community_Relations
apple follows policy developments and shares its best practices with regulators governments and organizations including the world health organization who and the european disability forum edf,Management_Of_Legal_And_Regulatory_Framework,Labor_Practices
working with the world federation of the deaf the american council of the blind the cerebral palsy foundation and the national association of the deaf apple proposed the adoption of accessibility theme de mojito the unicode consortium the global body in charge of setting character standards across all computing platforms in2019 the consortium adopted apples recommendation for more inclusive and representational emojiandin2021we expanded the accessibility options for me mojito include cochlear implants an oxygen tube and a soft helmet,Access_And_Affordability,Customer_Welfare
building on our accessibility work weve always believed that in order to create the most personal technology in the world we must consider the full range of human experiences all across apple there is a sustained commitment to making products more inclusive for a wide range of diverse groups apple,Product_Design_And_Lifecycle_Management,Customer_Welfare
engineers work hand in hand with teams across the business to help solve unique problems others seldom think about,Systemic_Risk_Management,None
beyond our own products and services,Product_Design_And_Lifecycle_Management,None
we launched two videos during our worldwide developers conference wwdcinjune2021 on the process and practice of inclusive design that were among the most popular of the week the process of inclusive design and the practice of inclusive design,Employee_Engagement_Inclusion_And_Diversity,None
for more than 40 years we have worked alongside educators to inspire the next generation of learners supporting creativity problem solving communication and collaboration we believe that education can be a great equalizing force and our goal is to empower all educators and learners through technology that protects student privacy and is accessible for all learners,Data security,Employee_Engagement_Inclusion_And_Diversity
we develop products programs tools and curricula for educators to create engaging learning experiences and we support education leaders and administrators so they can get the most out of the technology in the classroom and beyond,Access_And_Affordability,None
coding is a universal language and a great way to help students think critically and express their creativity we are always working to make it easy and fun to learn to code with supportive resources like swift playgrounds and the everyone can code curriculum and we work hand in hand with communities particularly communities of color and others that are under resourced to bring coding creating and entrepreneurship opportunities to learners of all ages,Employee_Engagement_Inclusion_And_Diversity,Business_Model_Resilience
knowing that everyone has their own way of learning and expressing themselves we offer products that support students and educators from kindergarten through higher education i pad provides apps and advanced technologies that help educators teach and students push the boundaries of their creativity the augmented reality capabilities on ipad let,Access_And_Affordability,None
students bring digital objects into the real world to spark curiosity and enhance understanding in new exciting ways and the powerful mac processors are equipped for the most intensive tasks throughout university and far beyond,Access_And_Affordability,None
we also developed apple school manager a free web based portal that helps it administrators in k12 and higher education institutions effortlessly configure deploy and manage i pad and mac devices,Access_And_Affordability,None
our teaching tools empower educators to personalize the learning experience for each student and manage the classroom to keep every student on task our classroom app serves as a powerful teaching assistant that makes it easy to navigate lessons and share information while the school work app aids the distribution and collection of assignments tracks progress and supports collaboration with students,Access_And_Affordability,Competitive_Behavior
