paragraph,esg_label,count_label
our programs help educators integrate creativity and coding into their lessons even if they are new to teaching with technology,Access_And_Affordability,None
everyone can create gives educators fun and meaningful ways to bring creative expression into any lesson topic or assignment the free guides teach students to develop and communicate ideas through drawing photography video and music while teacher guides help educators integrate both technology and creativity into every lesson,Employee_Engagement_Inclusion_And_Diversity,None
everyone can code guides students through the swift playgrounds app on ipad and mac this free curriculum and the app teach coding for kids through a world of interactive puzzles,Access_And_Affordability,None
educators can also try apples new one hour inclusive app design activity to introduce students to the world of coding and app development during europe code week in october 2021 and through computer science education week in december 2021 apple encouraged educators and their students to participate in an introductory inclusive app design activity this new lesson from apple helps educators guide students through a one hour session to turn their ideas into apps with inclusion and accessibility in mind the app design process helps students identify problems they care about and then plan prototype and code creative solutions it helps students think critically about how to build apps that are inclusive for all and prepares them to be the innovators of tomorrow,Access_And_Affordability,Employee_Engagement_Inclusion_And_Diversity
and playful characters and introduce swift the same programming language used by professional app developers teacher guides support educators in teaching code even if they have no experience,Data security,None
develop in swift teaches students ages14 and over how to use swift for designing and developing apps through apples integrated development environment xcodein2020 we launched a free online course taught by apple experts that helps instructors learn to teach swift and xcode,Product_Design_And_Lifecycle_Management,Competitive_Behavior
learn more about how apple empowers educators and learners of all ages,Access_And_Affordability,None
professional learning is a key piece of apples education offerings,Employee_Engagement_Inclusion_And_Diversity,None
our community of nearly 3000 apple distinguished educators in 45 countries model advise advocate and publish materials on ways to integrate apple technology into teaching and learning these educators are active leaders helping to make learning deeply personal for every student,Access_And_Affordability,Human_Rights_And_Community_Relations
apple distinguished schools are centers of leadership and educational excellence that demonstrate the impact of learning with apple technology the nearly 700schoolsacross36 countries cultivate environments where students are excited and curious about learning,Access_And_Affordability,Employee_Engagement_Inclusion_And_Diversity
we help educators share experiences ideas and inspiration so that they too can get more out of the technology in their classrooms,Access_And_Affordability,Competitive_Behavior
apple teacher is a free online self paced professional learning program that helps teachers build their skills and confidence in teaching with apple technology and earn apple teacher recognition our apple professional learning specialists are experts who provide one on one coaching sessions and group professional learning workshops for educators in addition to the support resources available online or via phone the majority of our educator tools are free and we offer special,Access_And_Affordability,Employee_Engagement_Inclusion_And_Diversity
pricing on mac i pad and other apple hardware for education institutions eligible college students and education faculty and staff,Management_Of_Legal_And_Regulatory_Framework,Competitive_Behavior
inmarch2022we unveiled apple learning coach which is a free professional learning program that trains instructional coaches digital learning specialists and other coaching educators to help teachers effectively use apple technology in the classroom through a mix of self paced lessons and virtual workshop sessions with apple professional learning specialists participants come away from the experience with an actionable portfolio a cohort of peers and the opportunity to apply for continuing education credits from lamar university through the texas education agency each apple learning coach gains a deeper understanding of how to support teachers where they are as they integrate technology into learning,Access_And_Affordability,None
apple empowers our users to take control of their health by making it easier to track and share their health and wellness information while always keeping their data secure this allows for a more informed dialogue with loved ones and doctors offering the ability to make better health choices on a daily basis,Customer_Privacy,Employee_Health_And_Safety
privacy is a fundamental aspect of our health work the right place for health information to exist is with a user on their device and where or how that information is shared should be completely up to the individual,Customer_Privacy,Customer_Welfare
since launching apple watch in2015weve been constantly inspired by the stories we hear from our users about how using apple watch for health and fitness has changed their lives these range from users who found closing their activity rings everyday motivated them to be in the best shape of their lives to those alerted to a potential irregular heart rhythm who sought medical care to confirm stories like those continually drive us to do more for our users,Employee_Health_And_Safety,Customer_Welfare
on iphone walking steadiness is an industry first providing insight into fall risk by leveraging important mobility data as users walk with their i phone directly within the health app the health app provides a consolidated view of users health information data from i phone third party apps and apple watch and since introducing the health records feature in 2018 it is supported at over 800 health care institutions with over 12500c are locations across three regions the yous canada,Customer_Privacy,Customer_Welfare
inspired by the innovative ways the research clinical and developer communities leverage our products and platforms we launched the investigator support program that provides researchers with opportunities to receive apple watch to include in their research study we have witnessed first hand how researchers and clinicians are able to accomplish even more with the addition of apple watch to their research and care programs and through this program we hope even more people can have the same kind of success currently studies around the globe are integrating apple watch into their research across heart mobility activity and other focus areas see more about the program,Access_And_Affordability,Competitive_Behavior
and the uk additionally users have the option to securely share their health data with a loved one a caregiver and in the yous their doctor through the health app,Customer_Privacy,Customer_Welfare
everything apple does in health is based in science we have a history of enabling the medical community through platforms like research kit and care kit which help researchers produce medical insights and discoveries on conditions from epilepsy to parkinsons at a pace and scale never seen before,Access_And_Affordability,Labor_Practices
apple womens health study the harvard th chan school of public health has teamed up with apple and the national institute of environmental health sciences to gain a deeper understanding of how certain demographic and lifestyle factors could have an impact on menstrual cycle sand gynecologic conditions including infertility menopause and polycystic ovary syndrome see the latest updates,Employee_Engagement_Inclusion_And_Diversity,Employee_Health_And_Safety
apple hearing study the apple hearing study is a partnership between the university of michigan and apple to study sound exposure and its impact on hearing health this groundbreaking study helps advance our understanding of how hearing could be impacted over time by exposure to sound at,Employee_Health_And_Safety,Human_Rights_And_Community_Relations
certain levels the study data is also being shared with the world health organization as a contribution to its make listening safe initiative see the latest updates,Access_And_Affordability,Customer_Welfare
conducted in collaboration with the american heart association and brigham and womens hospital the apple heart and movement study explores factors that affect heart health and potentially because deterioration in mobility or overall well being in an effort to promote healthy movement and improved cardiovascular health by collecting heart health workout mobility and activity data from apple watch and i phone users as well as survey data this study will provide insights on heart health and potential early warning signs in ways that were not possible before see the latest updates,Employee_Health_And_Safety,Customer_Welfare
our technology gives healthcare providers the tools they need to work effectively within hospitals and connect remotely with patients apps on ipad i phone and apple watch can help medical professionals deliver personalized care we have seen how our technology can also empower clinicians to be more mobile leading to time savings and more time spent taking care of patients our devices are designed to protect patient data yet remain accessible and easy to use across providers the result is care that becomes more efficient more personalized and ultimately more human learn more about how our products support medical professionals,Access_And_Affordability,Employee_Health_And_Safety
at apple we want to create products and services that enrich peoples lives to us that means making the best not the most and only building things that make us proud,Product_Design_And_Lifecycle_Management,None
we are motivated by creating the best user experience through our products and in every interaction with our customers we focus on breakthrough technologies and innovative features that set us apart and keep people coming back to apple consumer surveys have consistently shown high satisfaction ratings for our revolutionary products including iphone97 percent or higher macover87percentipad93 percent or higher and apple watch 90percentorhigher21,Product_Design_And_Lifecycle_Management,Customer_Welfare
our focus on our customers extends to a retail experience that puts the people we serve at the center of everything we do our retail teams inspire our customers to discover learn about and choose apple products services and accessories by delivering a personalized experience like no other apple specialists in our retail stores and contact centers help customers find the right products with,Product_Design_And_Lifecycle_Management,None
one on one shopping and support sessions in person over the phone or via chat today at apple and online personal sessions help customers learn how to get the most from their devices and take their creativity further,Product_Design_And_Lifecycle_Management,None
apples education teamworks to ensure that students teachers and parents have the best learning tools for the classroom for business customers the dedicated teams in every apple store provide the advice pricing and support small businesses need in our communities,Access_And_Affordability,Competitive_Behavior
we work closely with apple authorized resellers like carriers and retailers to enhance the customer shopping experience beyond our own retail locations and the apple website,Competitive_Behavior,None
to help ensure quality we continually monitor customer feedback assess key drivers and leverage analytics to improve the customer experience customer feedback is shared with team members as well as leaders so that everyone understands their impact and is focused on making the customer experience the best it can possibly be throughout the pandemic our retail teams continue to work diligently to be flexible through ever changing operational challenges as well as health and government guidelines all the while they keep the focus on helping our customers and as a result our store teams earned our highest ever customer satisfaction scores,Customer_Privacy,Customer_Welfare
as we continue delivering exceptional products we remain committed to high quality standards and transparent communication with customers we maintain a system status page to actively report on identified system issues and offer service programs to address hardware issues we encourage our customers to contact us with questions provide feedback or request support as just one example learn more about how we responded to customer feedback on air tag,Product_Quality_And_Safety,Customer_Welfare
families love i phone i pad mac apple watch and apple tv because they are some of the most powerful tools ever made for learning exploring and staying in touch we are committed to providing tools that let caregivers know and feel good about what kids are doing a range of features offer flexibility to track app usage set limits on screen time and community choose which apps children can use and manage the content and websites they can access,Access_And_Affordability,Business_Model_Resilience
features also help protect kids from what they see and send with the latest versions of ios ipa dos and macos families can set up kids devices to show warnings when receiving or sending images containing nudity the image is blurred and the child gets an alert along with,Employee_Health_And_Safety,Labor_Practices
messages can warn children when receiving or sending photos that contain nudity,Employee_Engagement_Inclusion_And_Diversity,None
apple has also expanded guidance in siri spotlight and safari search by providing additional resources to help children and families stay safe online and get help with unsafe situations for example users who asks iri how they can report child exploitation will be pointed to resources for where and how to file a report,Employee_Health_And_Safety,Labor_Practices
the made for kids section on the app store is carefully curated to be a great space for children and we review apps to help make sure they do what they say they do in content restrictions you can also tap an age range and just like that your kids can buy or download only apps appropriate for them,Access_And_Affordability,None
visit our families site and child safety site to learn more,Employee_Health_And_Safety,Labor_Practices
we believe long lasting products are best for the environment we also believe products that minimize the need for repair or replacement encourage our customers to come back to apple we design our products with this goal in mind,Product_Design_And_Lifecycle_Management,None
building durability and repair ability into our designs,Product_Design_And_Lifecycle_Management,None
designing and building durable hardware is core to delivering this customer experience we assess our designs against our strict durability standards through testing methods that mimic realistic conditions in which our customers use their products every aspect of our products is thoroughly assessed by engineers in our reliability testing lab who measure the performance of materials components and fully assembled products,Product_Design_And_Lifecycle_Management,Labor_Practices
we continue to design our products with features that enhance repair ability and durability for instance we have continued to increase the number of repairable modules on iphone while also adding durability features like water resistance,Product_Design_And_Lifecycle_Management,Water_And_Wastewater_Management
if a repair is needed we believe our customers should have convenient access to quality repair services to get their product backup and running as quickly as possible,Product_Design_And_Lifecycle_Management,Data security
over the past three years we have nearly doubled the number of service locations with access to genuine apple parts tools and training offering more ways for consumers to get repairs these repair options include apple store locations apple authorized service providers a asp participating independent repair providers mail in repair centers or onsite service and starting in 2022 self service repair our repair network has grown to over 5000aasp locations and over 3000 independent repair providers around the world in addition to our500 apple retail locations,Product_Design_And_Lifecycle_Management,Customer_Welfare
self service repair became available in april 2022 providing repair manuals and genuine apple parts and tools through the apple self service repair store self service repair is available in the yous and will expand to additional countries beginning in europe later in 2022 the new online store offers more than 200 individual parts and tools enabling customers who are experienced with the complexities of repairing electronic devices to complete repairs on the i phone 12andiphone13lineupsandi phones e3rd generation,Product_Design_And_Lifecycle_Management,Customer_Welfare
we also released expanding access to safe reliable and secure service and repair which details apples approach to designing long lasting products and increasing access to repairs,Product_Design_And_Lifecycle_Management,Customer_Welfare
keeping our products current with software updates,Product_Design_And_Lifecycle_Management,None
apple provides free software upgrades to improve our customers experience and help our products last longer our customers can count on the latest software features and security updates to their existing devices for years we continually improve the operating systems that power our products and engineer each software release to run seamlessly on all supported devices,Data security,Customer_Privacy
extending the life of products and parts through refurbishment and reuse,Product_Design_And_Lifecycle_Management,Waste_And_Hazardous_Materials_Management
we can lower the impact each device has on the environment including carbon intensity per year of life by finding ways to refurbish and reuse these products and by building our products to serve more than one owner and encouraging customers to exchange devices for an upgrade we extend the life,Product_Design_And_Lifecycle_Management,Human_Rights_And_Community_Relations
we collect devices for refurbishing and reuse through several programs including apple trade in the iphone upgrade program applecare and our corporate hardware reuse program in fiscal year 2021wesent122 million devices and accessories to new owners for reuse our trade in program extends to 25 countries providing customers with options for product end of life to access the value of their current device if they want to upgrade to a newer model or to recycle their devices for free,Product_Design_And_Lifecycle_Management,Waste_And_Hazardous_Materials_Management
we design our products to make sure they re safe for anyone who assembles uses or recycles them,Product_Design_And_Lifecycle_Management,None
the wellbeing of those who design make use and recycle our products is a priority for apple which is why we are committed to using safer materials to create safer products we assess the health and safety of all our products during every stage of their life cycle from early concept development through use service and repair to recycling during the design and prototyping process cross functional apple teams analyze potential failures and their effects from a quality and safety perspective the results drive product design improvements and manufacturing process controls,Product_Quality_And_Safety,Customer_Welfare
apple is committed to helping customers understand how to safely use apple products apples product user manuals include important safety and handling information and apple offers additional topical content to provide tips and help customers understand features,Product_Quality_And_Safety,Customer_Welfare
for example apple published articles to make sure customers with potential skin sensitivities understand what materials are used in our wearable products we also explained how to clean and disinfect apple products and provided guidance on keeping apple products with magnets a safe distance from medical devices,Product_Design_And_Lifecycle_Management,None
apples products are designed tested and certified to comply with international and regional safety standards they also meet our own specifications which often go above and beyond what is required for example apples regulated substances specification restricts the use of certain chemical substances in apple products and we apply rigorous additional controls for materials that may have prolonged contact with the skin components that are critical to safety are subject to enhanced requirements and additional supplier audits,Product_Quality_And_Safety,Labor_Practices
apple tracks customer reports of potential product safety issues and employees are trained on how to handle document and properly escalate such reports apple investigates reported incidents and also analyzes products for potential safety issues in the rare event that apple determines a product poses a potential safety risk we take action to recall the product which includes notifying customers and helping customers have their products repaired replaced or refunded,Product_Quality_And_Safety,Customer_Welfare
apples safety compliance policy defines procedures to monitor products in the field and investigate potential safety issues this policy requires escalation of safety issues to apple management and timely reporting to regulators where necessary it also requires mechanisms for employees to confidentially report safety or compliance concerns as well as training for employees on how to address the concerns our product integrity and legal teams are responsible for ensuring that apples safety compliance policy is followed,Product_Quality_And_Safety,Employee_Health_And_Safety
apple products also help customers in emergencies and in caring for their wellbeing with features like emergency calling fall detection medical id and hearing health notifications,Critical_Incident_Risk_Management,Employee_Health_And_Safety
at apple we are committed to leaving the world better than we found it that means supporting communities with global and local initiatives investments and donations that combat in equity expand access to opportunity and help respond to urgent needs many of these initiatives also contribute to the unsustainable development goals see appendix page 75,Human_Rights_And_Community_Relations,Employee_Engagement_Inclusion_And_Diversity
through our values based investments we see an important opportunity to continue to invest our capital for good often through multiyear commitments in which apple plays a substantive role in the project development our affordable housing initiative racial equity and justice initiative clean energy investments and the restore funds eepage17 are all examples of initiatives in which values based investments play a significant role,Access_And_Affordability,Business ethics
our corporate donations support work undertaken across the company to address society s toughest problems we donate to nonprofits and other organizations with which we partner to support specific initiatives as well as directly to organizations supporting our objectives to accelerate social change strengthen communities and amplify apples values we empower employees to contribute to the causes they care about and we multiply their efforts through matching their donations,Human_Rights_And_Community_Relations,Business ethics
in total we have committed over 3 billion toward corporate donations and values based investments since fiscal year 2018 our corporate donations alone were over 250 million in fiscal year 2021,Management_Of_Legal_And_Regulatory_Framework,Business ethics
fulfilling our commitments to our communities requires teamwork across the entire,Human_Rights_And_Community_Relations,None
we also know that we can impact communities around the world by creating and sustaining local jobs as our teams continue to grow were proud to foster innovation opportunity and economic support across the globe,Human_Rights_And_Community_Relations,Business_Model_Resilience
3 billion in strategic values based investments and community donations,Human_Rights_And_Community_Relations,Business ethics
we have an urgent responsibility to help dismantle systemic racism and support opportunities for black hispanic latin x and indigenous communities our racial equity and justice initiative re ji is focused on three key areas expanding access to education supporting criminal justice reform and removing economic barriers for communities of color,Employee_Engagement_Inclusion_And_Diversity,Director_Removal
re ji builds on our longstanding commitment to education and works hand in hand with our community education initiative page 62 historically black colleges and universities hbcus hispanic serving institutions hsis and tribal colleges and universities tc us are critical leaders in expanding educational access as are community colleges and other centers of learning to support their continued,Access_And_Affordability,Human_Rights_And_Community_Relations
