paragraph,esg_label,count_label
13ourapproach13 climate change 18resources20 smarter chemistry,Physical_Impacts_Of_Climate_Change,Waste_And_Hazardous_Materials_Management
23ourapproach23 inclusion and diversity 26 growth and development 27benefits28 compensation 29engagement30 workplace practices and policies 33 health and safety at apple,Employee_Engagement_Inclusion_And_Diversity,Labor_Practices
48ourapproach48privacy50 accessibility 52 inclusive design 53education54health55 caring for customers,Access_And_Affordability,Customer_Welfare
59ourapproach60 racial equity and justice initiative 62education64 affordable housing initiative 65 corporate donations 67employeegiving68 job creation,Employee_Engagement_Inclusion_And_Diversity,Customer_Welfare
74awardsandrecognition75 united nations sustainable development goals 77 stakeholder engagement 78esgdatasummary84 about the report 85 endnotes,Business_Model_Resilience,Employee_Engagement_Inclusion_And_Diversity
today our teams around the world infuse apples deeply held values into everything we make that work can take many forms but whether we are protecting the right to privacy designing technology that is accessible to all or using more recycled material in our products than ever we are always working to make a difference for the people we serve and the planet we inhabit,Product_Design_And_Lifecycle_Management,Business ethics
as a company we know that our impact on peoples lives reaches beyond the technology we create and we apply the same ethos of constant innovation and improvement to every aspect of our work from building an inclusive company culture where everyone feels welcome to becoming carbon neutral across our global supply chain and the lifetime of our products by 2030,Product_Design_And_Lifecycle_Management,Business_Model_Resilience
at the heart of our efforts is a steadfast commitment to serving the communities we are a part of we work with teachers advocates and entrepreneurs from diverse backgrounds as part of our racial equity and justice initiative we help create opportunity in communities on the front lines of climate change through the restore fund which supports carbon removal and sustainable forestry and we provide resources and training to the next generation of innovators through the apple developer academy and educational initiatives across the globe,Physical_Impacts_Of_Climate_Change,Employee_Engagement_Inclusion_And_Diversity
in this report we are pleased to share our progress which is a product of collaboration with committed partners worldwide at apple we believe that the only way to effectively tackle global challenges is by working together and we are grateful to share this road with so many passionate leaders,Human_Rights_And_Community_Relations,Competitive_Behavior
we are engaged in this work because it is right and because we want to leave the world better than we found it in everything we do by leading with our values we hope to be a ripple in the pond that inspires a far greater change,Human_Rights_And_Community_Relations,Business ethics
pay equity at the intersections of race and ethnicity with gender was achieved in 2022,Employee_Engagement_Inclusion_And_Diversity,Customer_Welfare
since april 2020 we have achieved carbon neutrality for our corporate emissions by sourcing 100 percent renewable electricity for apple facilities implementing energy efficiency initiatives and securing carbon offsets for remaining emissions,Energy_Management,GHG_Emissions
since 2017 apple has achieved and maintained gender pay equity for our employees worldwide in the yous weve also achieved pay equity with respect to race and ethnicity as well as pay equity at the intersections of race and ethnicity with gender,Employee_Engagement_Inclusion_And_Diversity,Customer_Welfare
with ios145inapril2021we released app tracking transparency for ipad and i phone requiring developers to obtain a users permission to track them across apps or web sites owned by other companies for advertising purposes,Management_Of_Legal_And_Regulatory_Framework,Customer_Privacy
we hold ourselves and our suppliers to the highest standards of labor and human rights health and safety and environmental stewardship in fiscal year 2021weconducted1177 assessments including 291 smelter and refiner assessments to verify that suppliers are meeting our strict requirements,Employee_Health_And_Safety,Labor_Practices
we announced our supplier employee development fund which will expand our best in class labor programs in our supply chain and establish a global education hub to scale the expansion of the technical and professional skills necessary for the jobs of today and tomorrow in our supply chain and surrounding communities,Labor_Practices,Competitive_Behavior
building on our initial 100 million commitment in 2020we announced an additional 30 million commitment in august 2021 the funding supports efforts including the global hsi equity innovation hub expanded learning opportunities for hbcus the first apple entrepreneur camp for hispanic latin x founders and developers and funding for organizations driving criminal justice reform and environmental justice and inmay2022wecommitted25 million to expand access to capital for community financial institutions supporting communities of color in historically underserved markets across the yous,Access_And_Affordability,Human_Rights_And_Community_Relations
to celebrate global accessibility awareness day2022wep reviewed upcoming software features to offer users with disabilities new tools for navigation health communication and more apples announcement included door detection a cutting edge navigation feature for users who are blind or low vision live captions for the deaf and hard of hearing community and apple watch mirroring which helps people with physical and motor disabilities control apple watch remotely from their paired i phone,Employee_Health_And_Safety,Customer_Welfare
our community education initiative continued to grow supporting and partnering with 147 education institutions and nonprofit organizations including 47hbcusinover500 different locations across 36 states in the yous and four locations across the uk since its launch in 2019,Access_And_Affordability,Human_Rights_And_Community_Relations
we launched apple learning coach a free professional learning program that trains instructional coaches digital learning specialists and other coaching educators to help teachers effectively use apple technology in the classroom,Access_And_Affordability,None
in2021 apples employee giving program celebrated its 10th anniversary having raised nearly 725millionfor39000 organizations worldwide with over 120 million distributed to organizations around the globe in2021 alone the funds raised through apples employee giving program include the work of 68000 employees who have logged almost,Labor_Practices,Employee_Engagement_Inclusion_And_Diversity
2 million volunteer hours,Human_Rights_And_Community_Relations,None
esg priorities are managed across apple and our senior leaders play an important role in integrating esg into functions across the company we listen to stakeholders including our people suppliers communities shareholders and other external groups to understand the issues they care about and we measure our esg progress across our business so that we can work toward being more transparent with each year,Human_Rights_And_Community_Relations,None
above all we are always working to leave the world better than we found it and to create powerful tools that empower others to do the same,Human_Rights_And_Community_Relations,Labor_Practices
we have been carbon neutral for our own operations since 2020 including business travel and employee commute and are progressing toward an urgent goal to be carbon neutral across our entire business including the full life cycle of our products by 2030 were on an ambitious journey to one day make our products using only recycled or renewable materials we design our products to be safe for anyone who assembles uses or recycles them and to be better for the environment at the same time we are partnering with communities and local leaders and working to make sure our environmental efforts are also a force for equity and justice,Product_Design_And_Lifecycle_Management,Employee_Engagement_Inclusion_And_Diversity
we are committed to inclusion and diversity for our team and in our world and we have programs and benefits to support the development of our team members we continue to prioritize the health and safety of our teams customers supplier employees and communities,Employee_Engagement_Inclusion_And_Diversity,Labor_Practices
inclusion and diversity growth and development engagement benefits and compensation workplace practices and policies health and safety,Employee_Engagement_Inclusion_And_Diversity,Labor_Practices
labor and human rights in the supply chain,Labor_Practices,Human_Rights_And_Community_Relations
we are focused on infusing our values into our products engineering privacy and security into everything we make and designing our products and services to be accessible to and inclusive of the widest range of users we also find innovative ways to support peoples education health and a range of human rights topics with a specific focus on communities too often denied opportunities,Data security,Customer_Welfare
apple has over 165000 team members who work in corporate offices and apple stores around the world,Product_Design_And_Lifecycle_Management,None
environmental progress report 245mbpdf environment website,Ecological_Impacts,Employee_Health_And_Safety
people and environment in our supply chain 225mbpdf supplier responsibility website efforts to combat human trafficking and slavery,Supply_Chain_Management,Human_Rights_And_Community_Relations
apples newsroom also provides the latest updates regarding our programs initiatives and offerings mentioned throughout this report,Management_Of_Legal_And_Regulatory_Framework,None
we are committed to helping address shared global challenges that is why we engage with public policy and the legal system when we identify an opportunity to support the rights and wellbeing of our people customers communities and planet,Human_Rights_And_Community_Relations,Management_Of_Legal_And_Regulatory_Framework
apples climate policy advocacy centers on several principles each of which govern apples public policy positions on climate set strong targets based on science disclose comprehensive emissions create sector specific policies and support a green economy for all,Physical_Impacts_Of_Climate_Change,GHG_Emissions
inmay2021 apple also became one of the first companies to voice support for the enactment of the clean energy standard ces that would de carbon ize the power grid by2035andatthe26thun climate change conference of the parties cop26in glasgow scotland in2021 apple called for bold government action on climate change joining several new initiatives including the first movers coalition the forest investor club and the clean energy demand initiative,Physical_Impacts_Of_Climate_Change,Energy_Management
we also advocate for country specific measures that motivate climate action for example we have called for enhanced climate ambition and renewable energy deployment in japans basic energy plan and nationally determined contribution japans plan to reduce emissions in furtherance of the paris agreement and for,Physical_Impacts_Of_Climate_Change,GHG_Emissions
apples vice president of environment policy and social initiatives lisa jackson alongside president joe biden and other leaders from around the world at the 2021 united nations climate change conference photo credit world economic forum,Physical_Impacts_Of_Climate_Change,Human_Rights_And_Community_Relations
de carbonization policies to prioritize support for new technologies that can fully account for reducing emissions across their life cycle,Energy_Management,Air_Quality
we believe that every person should be treated with dignity and respect and we speak out publicly in ways that reflect our values as just one recent example we have continued our public support for lgbtq equality by working with the human rights campaign and other organizations to support lgbtq equality protections and oppose discriminatory proposals this includes legislative advocacy at the federal and state levels and working with coalitions of businesses to stand against what we believe to be harmful and divisive legislation that threatens individuals families and communities most recently that included sending a letter to texas leadership opposing laws that discriminate against the lgbtq community read more here,Employee_Engagement_Inclusion_And_Diversity,Human_Rights_And_Community_Relations
in november 2021 apple filed a lawsuit against n so group and its parent company to hold it accountable for the surveillance and targeting of apple users the complaint provides new information on how n so group infected victims devices with its pegasus spyware to prevent further abuse and harm to its users apple is seeking a permanent injunction to bann so group from using any apple software services or devices,Data security,Competitive_Behavior
our commitment begins with treating everyone with dignity and respect but it does not end there we believe in the power of technology to empower and connect people around the world and that business can and should be a force for good,Human_Rights_And_Community_Relations,None
we conduct human rights due diligence to identify risks and work to mitigate them we also seek to remedy adverse impacts track and measure our progress and report our findings our board of directors adopted the policy and is responsible for overseeing and periodically reviewing it apples senior vice president and general counsel is responsible for its implementation and reports to the board and its committees on our progress and significant issues,Human_Rights_And_Community_Relations,Director_Removal
in addition to our own internal monitoring we consider reports identifying potential risks from external sources including international organizations policy makers shareholders civil society organizations news outlets customers individuals in the supply chain or supply chain communities whistleblower mechanisms and third party hotlines reports also come through the reporting mechanisms we make available directly to all supplier employees apple employees and the general public these reports can come to us in any language and can be anonymous,Supply_Chain_Management,Business ethics
respecting the rights to privacy freedom of expression and access to information promoting diversity equity and inclusion including in our workforce leadership product and services development and our industry respecting labor and human rights in our supply chain by working closely with suppliers so that people in our supply chain are treated with dignity and respect,Employee_Engagement_Inclusion_And_Diversity,Human_Rights_And_Community_Relations
respecting human rights through our efforts to protect the planet in how we design build and recycle our products and through responsible sourcing and use of materials and natural resources,Product_Design_And_Lifecycle_Management,Human_Rights_And_Community_Relations
we are committed to continually assessing our progress and incorporating what we learn,Human_Rights_And_Community_Relations,None
into our work we track and measure our performance across a range of areas and apply the lessons we learn to continually improve we publicly report detailed information on our approach and our performance in the reports websites and other disclosures listed on page 8 as well as within this esg report,Business_Model_Resilience,Employee_Engagement_Inclusion_And_Diversity
the rainbow arches at apple park in cupertino california area nod to apples original logo and an expression of our inclusive values,Employee_Engagement_Inclusion_And_Diversity,Business ethics
at apple we are acting with urgency to protect our planets limited resources and to be a leader in the fight against climate change since 2020 we have been carbon neutral for our worldwide operations and by2030we plan to expand that progress to our entire supply chain and the lifetime use of our products and today nearly 20 percent of the materials in our products were made from recycled content a number we are working to increase,Product_Design_And_Lifecycle_Management,GHG_Emissions
across our environmental work we are also committed to being a force for equity were working with communities on the front lines of climate change and the next generation of diverse entrepreneurs to create shared opportunity and to build a more just world,Physical_Impacts_Of_Climate_Change,Customer_Welfare
the environmental challenges we face today are significant and we are responding with urgency and dedication we approach our work by focusing on fundamental questions what matters most and where can we make the greatest impact these questions guide our work across our strategic focus areas of climate change resources and smarter chemistry,Physical_Impacts_Of_Climate_Change,Employee_Health_And_Safety
and inform our goals in how we can best achieve change,Human_Rights_And_Community_Relations,None
our2022 environmental progress report provides a detailed overview of our work and how we are progressing toward our goals,Human_Rights_And_Community_Relations,Employee_Health_And_Safety
we know we are not alone in working to reduce our environmental footprint so we are engaging with others to support our efforts and find opportunities to lift local communities along the way,Human_Rights_And_Community_Relations,Employee_Health_And_Safety
setting ambitious goals is essential to our approach to drive the innovation and collaboration that makes change possible and to be transparent and accountable to our progress,Management_Of_Legal_And_Regulatory_Framework,Business_Model_Resilience
our work began years ago making the transition to sourcing 100 percent renewable electricity at our offices retail stores and data centers,Energy_Management,Customer_Privacy
which we achieved in 2018andin2020 we reached the milestone of being carbon neutral for our corporate operations including direct emissions as well as business travel and employee commute,GHG_Emissions,Air_Quality
our10 year climate roadmap is addressing apples carbon footprint through five pillars,Physical_Impacts_Of_Climate_Change,GHG_Emissions
low carbon design we will design products and manufacturing processes to be less carbon intensive through thoughtful material selection increased material efficiency and greater product energy efficiency,Product_Design_And_Lifecycle_Management,Energy_Management
100 percent renewable electricity for apple production,Energy_Management,None
issued in green bonds to model how businesses can drive investments to reduce global emissions in our latest green bond impact report we share progress on the projects funded in fiscal year 2021,Management_Of_Legal_And_Regulatory_Framework,Competitive_Behavior
renewable electricity we will continue to source 100 percent renewable electricity for our facilities and transition our entire supply chain to100 percent clean renewable sources of electricity,Energy_Management,None
direct emissions abatement we will reduce direct greenhouse gas emissions in our facilities and our supply chain through process innovation emissions abatement and the use of non fossil based low carbon fuels,GHG_Emissions,Air_Quality
carbon removal working in parallel with our emissions reduction efforts we will scale up investments in carbon removal projects including nature based solutions that protect and restore ecosystems around the world,Ecological_Impacts,GHG_Emissions
to reduce the carbon footprint of our products we are increasing efficiency and transitioning to materials from recycled sources and those made using low carb on energy in2021we continued to improve the carbon efficiency of the integrated circuits we use in our products components we have prioritized because they are carbon intensive for example switching to the apple m1chipforthe13inch macbookpro reduced the energy needed to manufacture and use the device driving down the products carbon footprint by over 8 percent,Product_Design_And_Lifecycle_Management,Energy_Management
we have continued to expand our use of,Product_Design_And_Lifecycle_Management,None
100 percent recycled aluminum in the enclosures of a number of products all ipad models in our line up now use100 percent recycled aluminum in their enclosures joining apple watch series 7applewatchse macbook air mac mini and the 14inchand16inch macbookpro devices for products released in 2021 that had enclosures made with primary aluminum we,Product_Design_And_Lifecycle_Management,None
to minimize the carbon footprint of our products we seek to create less waste in the processing of materials reduce machining time and the associated energy used more efficiently transform material into the shapes we need and maximize recovery and reprocessing of manufacturing scrap,Waste_And_Hazardous_Materials_Management,Energy_Management
prioritized the use of aluminum smelted using low carbon sources of electricity rather than fossil fuels for a lower carbon impact these changes alone have decreased the carbon emissions associated with our use of aluminum by68percentsince2015,GHG_Emissions,Air_Quality
this past year we intensified our efforts to reduce apples emissions in fiscal year 2021weavoidedover23 million metric tons of emissions across all scopes initiatives that we ve been growing for years like sourcing 100 percent renewable electricity for our facilities transitioning suppliers to clean energy and using low carbon materials in products yielded indisputable results,Energy_Management,Air_Quality
225 million metric tons,Energy_Management,None
low carbon materials represents emissions savings from transitioning to recycled materials in our products or use of low carbon aluminum as described on page 18,Product_Design_And_Lifecycle_Management,Air_Quality
even a few years ago not everyone in one community in south africa had electricity at home many people had been using battery powered lanterns because up front costs and other challenges put connecting to the grid out of reach as we worked with our partners to identify new renewable energy projects for our power for impact program we saw exciting potential in this community,Energy_Management,Human_Rights_And_Community_Relations
this is just one example of how the power for impact program is working to benefit communities our company and the environment at the same time learn more on page s22and27 of our environmental progress report,Human_Rights_And_Community_Relations,Employee_Health_And_Safety
with access to electricity in their homes kids can now do homework at night and families can cook meals indoors,Access_And_Affordability,None
we continue to experience tremendous progress toward our goal of transitioning our manufacturing supply chain to100 percent renewable electricity by2030asofmarch2022213 manufacturing partners in 25 countries have committed to 100 percent renewable energy for apple production,Energy_Management,Product_Design_And_Lifecycle_Management
many components essential to products like ours including integrated circuit chips and display panels currently rely on manufacturing processes that use fluorinated gases which have high global warming potential were partnering closely with key manufacturers to prevent these gases from being,Energy_Management,Product_Design_And_Lifecycle_Management
released into the atmosphere by optimizing manufacturing processes and deploying abatement technologies,GHG_Emissions,Product_Design_And_Lifecycle_Management
to address emissions from shipping products to our customers we are shifting whenever possible toward less carbon intensive shipping modes such as rail and ocean and were seeking out technical innovations including alternative fuels and electric vehicles in fiscal year 2021appleavoided180000 metric tons of co2e by shifting the mode of transport and,Product_Design_And_Lifecycle_Management,Air_Quality
reducing product weight through the removal of the power adapter from the box of iphone devices,Product_Design_And_Lifecycle_Management,None
in2020we conducted a climate scenario analysis to help us better understand the potential physical and transition effects of climate change to align with the task force on climate related financial disclosure st cfd recommendations we considered a range of future scenarios including a scenario below 2c and we assessed geographies around the world to capture both corporate and supplier activities the analysis highlighted how our renewable energy program and carbon neutrality goals could contribute to our corporate resiliency it also provided environmental data that we considered in developing business strategies including considerations around supply chain diversification as well as safeguarding our global assets,Physical_Impacts_Of_Climate_Change,GHG_Emissions
we are committed to managing regulatory reputational and market risks related to climate change for more information on these climate related risks and apples governance of these risks read our 2021cdp submission pdf,Physical_Impacts_Of_Climate_Change,GHG_Emissions
to address the emissions we can not yet avoid we are are investing in carbon removal projects in addition to removing carbon nature based carbon removal projects also offer important ecological and social benefits such as preserving biodiversity and enhancing the resilience of ecosystems while often providing economic development opportunities for local communities,Ecological_Impacts,GHG_Emissions
