paragraph,predict_label
We successively provide specific responses to issues reflected by our employees and constantly communicate with them Also by improving various employee benefits and appreciating employees thoughts we expect our employees to identify with the Company and work at ease to drive the corporate competitiveness The improvement mechanisms that follow shall be ongoing listening to the voices of employees Meanwhile optimization assessment of the survey results will be conducted We continue to offer competitive compensations for talents with potential rewarding our employees the operational performance of the Company via the transparent remuneration policy,4
Chunghwa Telecom now applies Employees Performance Evaluation Guidelines which are used in the appraisal of employee performance to develop the corporate culture where employees customers shareholders and the Company will all be winners Supervision will be provided for underperforming employees who will be guided until the appropriate improvement has been made and they are back on track,8
CHT conducts performance appraisal at two levels general staffs and senior managers Performance appraisal involves a series of facetoface discussions between employees and line managers at the beginning of a year to set personal goals and also at midyear and years end to evaluate the degree of employee contribution to the Company Performance bonuses and employee remuneration are tied to individual performance,11
In addition to linking employees salary bonus to their annual performance CHT has established a reward of senior employees which is payable on a oneyear deferred basis and apply to all employees provided that the employee has a certain standard of continuous service and recent performance appraisal results,11
Disbursement directions are formulated for remuneration of senior management The remuneration is exercised systematically and disclosed publicly in the Annual Report in compliance with the laws For basic specialist position on the same level individuals are employed with equal treatment Also remunerations are evaluated based on the academic backgroundsexperiences expertise and certificates of individuals with relevant expertise and work experiences regardless of gender or ethnicity,8
Introduction of ISO 45001 Occupational Health and Safety Management,9
Chunghwa Telecom was the first telecom service provider in Taiwan to adopt the OHSAS 18001 Occupational Health and Safety Management System In response to ISO 45001 released by ISO in 2018 we initiated the verification process for ISO 45001 promptly to align ourselves seamlessly with the global trend in health and safety All of our 27 institutions completed the verification to ISO 45001 in 2021 We shall better our objectives in workplace safety and health management ongoing improvement in safety and health facilities establishment of a safe healthy comfortable and friendly working environment reduction of workrelated accidents,9
In addition to identifying hazards and assessing the risks associated with telecom operations the Company has also applied restrictions and enhanced risk control for highrisk tasks while taking effective precautions to reduce occupational hazards In addition to complying with safety and health regulations the Company has also been active in the improvement of the current work environment and takes regular action with regard to safety and health facilities and measures,9
We actively participate in activities related to healthy workplace 5 branch institutions were presented with the awards of Heathy Workplace Certification Health Promotion Label in 2021 In 20192021 6 branch institutions won the awards,9
Follow the Safety and Health Regulations and Enforce SelfManagement,9
Implement Hazard Identification and Enforce Risk Control,5
Strengthen both Mental and Physical Health Services,9
Encourage Participation through Open Communication and Consultation,12
Continue the Improvement of Equipment and Create a Quality Work Place,9
Conduct Safety Training Programs to Raise Safety Awareness,9
For more details of GRI 403 and ISO 45001 Occupational Health and Safety Management of Chunghwa Telecom please refer to,9
The Dedicated Occupational Health and Safety Management Unit Broadened Labor Participation,9
Dedicated occupational health and safety management units are instituted at Chunghwa Telecom and the subordinate institutions thereof in compliance with the laws The units are responsible for formulation of occupational health and safety management plans promotion of matters such as identification assessment and management of hazards in working environment and operations implementation of autonomous inspections and environment monitoring of machinery and equipment and before operation as well as ongoing improvement to the health and safety facilities to foster a working environment that is safe healthy comfortable and friendly,9
The Labor Safety and Health Committee has been established at all CHT institutions with labor representatives accounting for one third or above of the seats The committee convenes quarterly to deliberate coordinate and advise on matters pertaining to health and safety There is also Labor Safety and Health Department which is responsible for the planning and implementation of labor safety and health matters,9
The head offices Labor Safety and Health Committee has 30 members 10 members are from the labor union accounting for 3334 4 meetings were held in 2021 and 15 proposals were presented by the labor representatives 9 were related to the refinement of safety and health management and 6 were related to employee benefits All of the above are solved,9
Health Promotions for Senior Employees,8
The health checkups for the elderly in 2021 promoted autonomous health management actions from inside out Apart from physical exercise the support system among friends was established through the activities,9
The Company provided checkup services specifically targeted at senior employees including carotid duplex and echocardiography for the risk of ischemic stroke coronary artery narrowing and incomplete heart valve closure as well as fundus photography for checking macular degeneration retinal vessels and glaucoma,2
To improve our employees knowledge and skills in epidemic prevention during the pandemic Chunghwa Telecom Training Institute established H channel health series videobased program Employees could access various thematic health promotion courses online Besides in conformity with the epidemic prevention regulations it allowed the employees to acquire knowledge and skills for epidemic prevention and healthcare The course contents encompassed healthcare osteoporosis physicalmental stress management cardiovascular disease prevention etc A total of 2505 employees accessed the program in 2021,5
FullTime Physicians and Nurses to Improve Employees Health Management,9
To better provide immediate medical assistance and attend to worker health we engaged 22 fulltime nurses and contracted 19 physicians in 2021 for this specific purpose Also we set up health service centers at ten locations including the Xinyi Campus Yilan and Hualien included Aiguo Campus Daan Campus Keelung included Guoguang Campus TTI included Taoyuan Branch CHT TL Hsinchu and Miaoli included Taichung Branch Taichung Branch of the Mobile Business Group Nantou included Changhua Branch Yunlin included as well as Linsen Campus Pingtung and Taitung included offering health services consultation and care,2
The contracted doctors help with the onsite inspection at the offices offer advice in line with human factors engineering for employees using computers at work and adjust the heights of computers and chairs The procurement of office equipment besides in conformity to the materials technical specifications of the Company is in compliance with national standards Also we conduct monitoring and keep records of the temperature humidity illuminance noises indoor air quality CO2 in the working environments for our employees in order to ensure the comfortability and safety of working environments All the monitoring results in 2021 were in line with the regulations,21
24 sets of workplace health management physiological blood pressure measurement system are deployed in our facilities Combined with our Enterprise Healthcare System EHS and Personal Health Record our employees can monitor the changes in their blood pressure anytime,9
The Chunghwa Telecom Work Accident Guidelines contain detailed procedures for assessing occupational illness Employees suspected of having become ill as a result of their occupation are assisted with an application for verification at the local municipal countycity authority in accordance with the Protecting Workers from Occupational Accidents Act We manage risks at the source by making sure that construction risks are under control from the early design stages of a project The line construction management system has been amended with respect to highlighting highrisk operations as well as risk assessment information to ensure operators are able to identify potential risk in advance,9
All highrisk operations are subject to approval by the ICT Workers are also required to take site pictures with handheld devices and upload them to the monitoring system so that precautionary measures can be identified and taken to prevent such accidents as falls oxygen deprivation etc To promote employee awareness and safety and health skills we organized 174 training sessions in 2021 and there were 16938 enrollments,9
Table of Workrelated Injuries and Illnesses of Employees and Nonemployees in 2021,9
Number of hours worked hr,11
Number of recordable workrelated injuries person,9
Types of workrelated ill health,9
Fall tumble or dog bite,9
1 Number of hours worked 8 hrnumber of people number of working days,11
2 Fatalities as a result of workrelated injury rate Number of fatalities as a result of workrelated injury Number of hours worked,9
3 Highconsequence workrelated injuries rate disabled for more than 6 monthsNumber of highconsequence workrelated injuries,9
Number of hours worked 1000000,11
4 Recordable workrelated injuries rate Number of recordable workrelated injuries Number of hours worked 1000000,9
5 Definition of Onsite Contractors individuals or organizations that work on the operation sites of Chunghwa Telecom Statistics were,11
compiled based on the data of HongHwa International Corp,18
6 The main types of workrelated ill health traffic accidents fall tumble or dog bite,9
7 Traffic accidents during commute is excluded,9
As part of our effort to mobilize management the eSafe Wizard App allows employees and contractors to report safety violations and apply for operation permits The App also allows us to remotely perform spot checks on safety compliance moving the entire management process onto the cloud It is completely paperless instantaneous and highly effective Through the eSafe Wizard App the completion rate of permit applications for operations hot work work aloft scaffolding power or fire protection interrupted hit 100 temporary work stoppages due to weather accident with sensitive station or postponement of prior construction excluded while that of hazard notification reached 100 in 2021,9
Providing a safe and healthy workplace is a basic requirement to our employees On average employees spend over a third of their day in workplace Hence apart from a wide range of benefits including health checkup keynote speeches and promotional activities we also commit ourselves in the promotion of sports in workplace and in the support to sports industry In 2021 we spent NT71196 thousand on employee health care,9
The Company offers much better care than required by law and employees are given the choice,2
of various health checkup packages A total of 19048 employees had checkups in 2021,9
Family members are also entitled to checkups at the same rate and a total of 3012 persons,2
Free influenza vaccination is available for all employees who fit the requirements for vaccina tion at public expense Registration can be done online and 1170 employees were vaccinated,9
Health Examination of Employees and Dependents,9
CHT was one of the largest corporations in Taiwan to start promoting the Employee Assistance,9
The EAP carries out 5 consultation sessions each year in which outside experts are contracted,12
to help employees resolve their legal medical family workplace and stress problems,2
Case managers made 7 visits and completed 523 service sessions in 2021,12
A total of 6912 employees participated in 121 health seminars 5152 employees attended 37 educational trips Health examinations were given to 3726 employees in 23 sessions and 10602 employees participated in 170 largescale events,9
The Company published two healthrelated articles each month about the concept of disease,18
The noise level lighting temperature humidity and air quality of our offices is tested regularly The offices are also cleaned and maintained on a regular basis to ensure workers have a com fortable working environment,21
elements of a healthy work environment provided,9
Furthermore all offices feature ergonomic chairs natural ventilation indoor plants and other,24
Chunghwa Telecom provides two flexible working hour sessions in the morning and afternoon,11
The periods of 0730930 and 16001800 during workdays are flexible hours for employees to come to and off work at Chunghwa Telecom Laboratories as of December 15 2021 for employ ees to balance between work and family which is scheduled to expanded to other institutions in 2022,11
Provide employees health consultation via online or phone appointment Physicians visited the plants 34 times a month Sessions were for 3 hours and each patient was allocated 30 minutes,2
Healthcare personnel use the Employee Health Management System for the analysis and eval uation of health records Where necessary extra consultations can be arranged between the physicians and the employees for proper guidance and healthcare,9
Thirtyminute medical consultation with a physician 30 minutes per person,9
Our employee cafeteria offers a diverse range of nutritionally balanced meals to choose from,6
All food suppliers are subjected to rigorous review to ensure the safety of food served to our,14
SGS a professional audit entity is commissioned for tests of ractopamine animal drugs pre,4
Chunghwa Telecom has 30 hostels that provide travel accommodation encouraging employ,2
ees to achieve a balance between work and life,9
Call Forwarding calls forwarded from office phones,22
Instant Messaging Video Conferencing Teams a teleconferencing software used,1
Mail Delivery mail delivery via Web mail and Exchange,22
OA Online Administrative Operation using HiGate for telecommuting or mobilized adminis,4
Official leave for epidemic prevention to 95 personnel during the epidemic prevention period,5
with a total of 4017 hours granted,24
Epidemic prevention childcare leave for taking care of children at age 12 or under without,2
pay or impact to attendance granted to 184 employees with 12402 hours in total,11
Official leave for vaccination to 16279 employees in line with the government policy for epi,2
demic prevention with a total of 111479 hours granted,2
Leaves Better than the Statutory Requirements,12
Employees are the foundation for the growth and competitiveness of Chunghwa Telecom A happy family life of employees is the essential driver to our sustainable business development We offer a commitment to our employees refrain from making layoffs and salary reductions In response to the governments policy to boost birth rates CHT is providing childcare subsidies and maternity benefits to young employees with children aged 06 years old,11
Through the softwarehardware allocated we shall set up 16 workplace childcare support centers in 9 locations in Taipei City New Taipei City Taoyuan City Taichung City Tainan City and Kaohsiung City to take care of the children and grandchildren of employees aged 2 to 6 years old which are expected to open in August 2022 With services of education and childcare provided we endeavor to foster a friendly workplace to put employees at ease so as to perform to the best of their ability and create utmost values for themselves and the Company,2
We offer a 6month maternity allowance in compliance with the Employment Insurance Act CHT also offers additional monthly allowances totaling half the sum assured under the Labor Insurance Scheme,11
Employees with children aged 0 6 years old will auto matically receive childcare allowance of NT6000 per year,2
Regional activities include 3 road running events 188 hiking activities 44 ball sports activities and 366 other activities eg stairclimbing health exercise strolling and health promotion lectures,9
Improvement of employee welfare enhancement of employee coherence and sharing company achieve ments,11
NT24 Thousand month per person,11
Twice a year two semesters,2
Employment years 721 days Employment years 1028 days Employment years 1530 days,11
Employment years 715 days Employment years 1016 days Employment years 1521 days,11
Better than the statutory requirement for certain kin,12
5 days of personal leave with pay,11
7 days for personal leave and family care leave combined,11
42 days regular leave rest day and nation al holiday not included,11
8 weeks regular leave rest day and national holiday included,11
A wedding subsidy is available for employees who are to be lawfully married,12
Employees or their spouses are eligible for a childbirth subsidy,12
A funeral subsidy is available in the event of the death of a parent foster parent stepparent the spouse or a child of an employee,9
NT5225 Thousand NT2500 per person,2
NT990 Thousand NT2500 per person,2
NT3465 Thousand NT5000 per person,2
THREE DAYS OFF BE BACK SOON,11
Includes an integrated stadium swimming pool tennis badminton basketball and table tennis courts multi functional event space karaoke room and employee dormitories,2
The benefits are provided to the nonfixed term employees of Chunghwa Telecom but not for those of subsidiaries,11
Better Maternity Benefits than the Legal Requisites,11
Employee requests for retirement are processed in accordance with the Chunghwa Telecom Employee Retirement Pension and Separation Guidelines the Labor Standards Act and the Labor Pensions Act,11
The Labor Standards Act The Company makes monthly pension contributions of up to 15 of an employees monthly salary to the pension fund This fund is held under the auspices of the Labor Pension Supervisory Committee The current balance of the pension fund account is 343 billion,11
The Labor Pension Act The Company makes monthly contributions of no less than 6 of an employees monthly salary These contributions are deposited in the employees pension account held by the Bureau of Labor Insurance of the Ministry of Labor in accordance with the Contribution Rate Sheet approved by the Executive Yuan,11
Monthly pension contributions were made in accordance with the Monthly Contribution Wages,11
Classification Scheme published by the Ministry of Labor subject to biannual adjustments,11
Lifelong Learning and Training Programs,2
To help our employees to adapt and create quality lives after retirement Chunghwa Telecom Training Institute was commissioned to organize Care Program for Retirees Sweet Happy Lives A total of 10 sessions were organized with 1609 persontimes involved in 2021 Also we continued to contribute to Chunghwa Telecom Retirees Association with an amount of NT45 million to support them to organize relevant activities We also donated NT15 million for travel activities and NT300000 for the meal expenses of all volunteers across branches during the Lunar New Year,2
To help facilitate the transfer of knowledge and experience we have stipulated Consultant Recruitment Guidelines to hire paid consultants and honorary consultants Managers at a position of Senior Executive Vice President or above or the head of Level1 institutions may be hired by Chunghwa Telecom as paid consultants after retirement Paid consultants shall serve a term of no more than one year and assume honorary consultants upon the day after oneyear period has expired,8
We have been implementing an unpaid childcare leave system since 2006 to help employees juggle their attention between work and family The employees who have taken childcare leave are entitled to receive a six months maternity allowance from the authority under the Employment Insurance Act While six months expiry the Company will further pay an additional childcare subsidy of half assurance sum of Labor Insurance Scheme according to its policy Employees of Chunghwa Telecom are also entitled to other privileges such as family care leave paternity leave menstrual leave and a nursery room service In 2021 88 employees applied for unpaid childcare leave 101 employees applied for childcare leave allowances NT13926 thousand was paid out as childcare leave allowances In 2021 the epidemic prevention childcare leave was provided additionally in response to the pandemic,11
Starting from January 1 2022 any employee with the need to care for child at age 3 or under may apply for 1 work hour reduced per workday with full pay and without impact to attendance or performance appraisal There are approximately 1200 employees eligible to the application in 2022 As of the end of February 2022 there were 746 applicants Should we calculate with one work hour reduced per day for childcare and 20 days per month it is equivalent to an additional salary payment of 25 days per employee per month with 30 days for childcare a year,11
The Number Qualified for UPL for Raising Children 2021 A,2
Number of Applications for UPL 2021 B,12
Application Rate for UPL BA,12
Number of Expected Reinstatement 2021 C,12
Number of Applications for Reinstatement 2021 D,12
Number of Reinstatement 2020 E,12
One Year Retention after Reinstatement 2020 F,12
1 The number of employees entitled to apply for a parental leave of absence in 2021 A calculated as employees who had applied for,11
maternity leave and parental leave in 20192021,11
2 The number of expected reinstatements 2021 C The number of employees who applied from 2019 to 2021 and should be reinstated in,11
3 The number of actual reinstatements 2021 D The number of employees who applied from 2019 to 2021 and were reinstated in 2021,11
4 Reinstatement rate actual number of reinstated employees that yearnumber of employees who should have been reinstated that,11
5 Retention rate the number who continued working after reinstatementreinstated number for the previous year 100,8
We proactively monitor and protect human rights We respond to the UN Declaration of Human Rights and the ILO Convention on the elimination of all forms of discrimination and the prohibition of forced and child labor We also respond to the UN International Covenant on Civil and Political Rights and the International Covenant on Economic Social and Cultural Rights dedicating to promote human rights awareness and assure respect and fair treatment to all stakeholders,11
CHT is a member of the International Telecom Union and we fully comply with International Radio Regulations The regulation concerning freedom of communication transparency in global roaming charges and competition support of Telecoms in developing nations telecom services for persons with disabilities and the freedom of speech over telecom networks In addition we follow the UN Guiding Principles on Business and Human Rights by conducting a human rights due diligence investigation and make sure that each human rights issue in the operational value chain is evaluated and we maintain all risk at a minimum level,10
Human rights issues include antidiscrimination gender equality freedom of association collective bargaining child labor forced or,11
compulsory labor and indigenous rights,10
Human Rights Material Risk Issues,10
To fulfill the concept of antiforced labor and appropriate working environment we required the bidders to sign a Declaration of Minerals as ConflictFree during procurement We evaluat ed the suppliers to determine if raw materials derived from human rights highrisk areas like the Democratic Republic of the Congo to avoid harm to the basic human rights of local resi dents while we providing ICT products and services We depend on demand and require the suppliers to provide certification of material resources thirdparty verification or accepted auditing to confirm no related violations,11
We also required that all suppliers complied with the Restriction of Hazardous Substances Directive RoHS to prevent hazardous substances from the source endangering local employ ees the environment or customers,19
Due to the nature of our industry in addition to establishing information security manage ment applicable to the enterprise operation we also implement measures to safeguard our customers personal information We implemented information security in compliance with the international standards ISO 27001 and BS 10012 and carried out regular supplier auditing and supervision through employees or a third party We also carried out vulnerability scan ning and the testing of all equipment and software from outside suppliers to ensure there were no backdoors or malware,1
Besides acquiring the customers agreement before the collection of any personal informa tion we established the internal Security and Safety Principle of Customer Information Re use Related information also complies with the principle of no names are revealed to prevent the downloading of personal information and avoid leakage or disclosure,22
