paragraph,predict_label
7551 integrations executed saving approximately 700000 kWh of energy,24
Phaseout of 2G gateway switch,24
2 projects executed saving approximately 270000 kWh of energy,24
Sleep Mode for 4G service,24
Shutdown executed for 16736 cells in total saving approximately 175 million kWh of energy cumulative data since 2020,24
Sleep Mode engaged for 993 cells on the basis of no impact to customer communications saving approximately 80000 kWh of energy,24
Externalization of base station RRU with the use of natural ventilation or exhaust fans,21
283 projects executed saving approximately 650000 kWh of energy,24
Renewable Energy Usage in Banqiao IDC,24
The Most Ecofriendly Data Center in the Greater China Banqiao IDC,18
The Banqiao IDC of Chunghwa Telecom is the first worldclass data center in Taiwan that is certified as TIA942 Rated 3 and Rated 4 Meanwhile it acquired certifications and labels at home and abroad successively including ISO 27001 PCI DSS and ISO 14046 With the most rigorous standards and regulations ranging from architecture to electricity machinery telecommunication and information security of IDC in place we ensure a sustainable operation of the data center,1
To effectively reduce the risks in IDC maintenance and raise the confidence of customers it successfully obtained Uptime Institutes Management and Operations MO Stamp of Approval in 2020 which made it the first professional IDC in Taiwan that secured the MO certification It also acquired the SOC certification in the same year signaling that we have lived up to the international standards in the sustainable data center maintenance and management,18
Water usage at Chunghwa Telecom is mostly domestic Apart from bathroom use air conditioner cooling accounts for another major water use Given the ongoing increase in business activities and manpower there is limited room for water reduction besides the recovery of rainwater and cooling water,20
We benchmarked the 2012 water usage as the standard and now control the annual growth of water usage to no more than 2 In addition to a new water leakage detection feature in products we have also included Company water consumption in the EARTH system Centralized water bill payment is done through the EARTH water bill management function to reduce the printing of water bills Managers can use the system to search generate trend charts and report forms and provide exception reports to avoid mistakes in billing and meter reading Managers can also review the situation of water usage according to trend charts and reports reduce expenses in water and improve the efficiency of management,20
The management and analysis information interface can be used to promote water conservation measures and set concrete management goals We also promote watersaving measures to increase efficiency in water use,20
Install sink faucet sprayers to reduce waste Install dual flush toilets to reduce waste Use collected rainwater for watering office plants Encourage the installation of water reclamation equipment in new buildings so that physically separated and treated,19
sewage water can be reused for nonpotable purposes after it has reached a certain quality standard,20
To enhance the effectiveness of water recycling and reuse we have set up raft foundation water collection systems underground to collect clean rainwater from rooftops and the ground surface We have also initiated the recycling of cooled and condensed water from office airconditioners and promoted a recycling and reuse plan for rainwater bathwater and air conditioner water The recycled water is reused for watering plants and cleaning sidewalks being utilized to its fullest extent,20
Tap water AC water Reclaimed water,20
t o n n e s,12
The sole telecom operator in Taiwan that passed water footprint certification,20
We tie ecofriendlinessgreen energy with network services tightly Furthermore we endeavor to engagegreen communication with consumers for them to accurately comprehend the ecofriendliness and lowcarbon feature of products and services in line with our corporate philosophyAlways Ahead To accurately capture the water resource risks and in response to the UN SDG 6 3G Clean Water and Sanitation we chose the most representative Rated 4 IDC of the Greater China region Banqiao IDC and Cloud Data Center of Chunghwa Telecom for ISO 14046 certification on water footprint inventory and certification As a result it passed the verification by the SGSTaiwan and obtained the assurance statement making Chunghwa Telecom the sole telecom operator in Taiwan that passed water footprint certification The benefits achieved are as follows,20
Water resource management strategy established establishment of the SOP for organizations water,20
footprint helps in the attainment of water resource management targets,20
Enterprise water usage management enhanced the water usage distribution in the enterprise is captured effectively via water footprint inventory in order to create a complete water resource management system and stipulate proper measures to achieve the target of water conservation,20
Chunghwa Telecom understands the importance of resources reduction recycling and reuse and has combined related reduction plans into the EARTH system This is used to manage the use of resources and control energy efficiency as well as to conduct systematic management of recyclables and waste treatment We contracted a professional waste treatment company to transport our daily waste to landfills or incinerators for disposal Recyclable waste is handled by a contracted cleaning company that is responsible for classification treatment and proper disposal,19
Total waste generated general waste industrial waste,19
Waste incinerated with energy recovery,19
Waste with unknown disposal method,19
Batteries containing cadmium are TCLP waste that requires processes in line with the EPA Taiwan regulations which is to be processed,19
overseas since there is no qualified service provider domestically,12
Scrapped leadacid batteries are recyclable industrial waste regulated by the EPA Business organizations are responsible for the reduction of pollution and simple waste disposal All recycling and disposal operations are outsourced by joint contract based on the public auction The contractor must be a qualified service provider listed on the website of the Recycling Fund Management Board of the EPA to ensure legitimate management and disposal,19
Chunghwa Telecom is a highlylocalized telecom carrier a generous contributor to community development and one of the most important partners to other telecom carriers around the world As technologies progressed and improved we began some operations that were outside the conventional telecom boundaries corporate sustainability concepts were introduced into products and services research development applications and into the Company management strategies,15
Scrapped leadacid batteries from each business unit are auctioned on site and the Announcement and Delivery Slip for Removal and Disposal of Waste LeadAcid Batteries is retained for reference A total of 35871 leadacid batteries with a total weight of 1908465 kg were scrapped and sold for NT31966389 in 2021 In fulfilling our responsibility for environmental protection we also increased Company revenue The public and private waste clearance and disposal companies recognized by environmental institutions are designated to handle the treatment of other industrial waste such as cement poles fiber optic cables woods and batteries containing cadmium,19
In addition to developing products friendly to the environment we have been promoting Green Stores and were the first telecom carrier in Taiwan to fully turn service centers into Green Stores In 2021 green revenue was NT 25957 million which was 1194 of the commercial products revenue,15
Upholding the philosophy of energysavingemission reduction and green action for Earth along with saving the time and space for customers in the collection and preservation of hardcopy receipts we have been promoting electronic billing since 2001 and reduce carbon emission by eliminating the use of paper bills In 2017 we offered paperless receipt service At the end of 2021 the percentage of paperless receipts exceeded 71 The service saved 590 million sheets of paper and an estimated 54382 trees reducing carbon emission by 10768 metric tons,21
In response to the UN SDG 12 Responsible consumption and production and the circular economy promotion in Taiwans 52 Industrial Innovation Plan we drive the transition to a circular economy as well as exercise our industrial influence facilitate the value chains as a whole and collectively usher in the age of circular economy with zero waste and zero carbon emissions We proposed five commitments with the 5R Principle higher than the statutory requirements at home and abroad,24
1 Reduce Establish a green operation and consumption model to properly manage and reduce con sumption of energy and resources along with enhanced education and promotion for employees suppliers and customers,24
2 Reuse Increase circularity and improve resource cycling technology for resource regeneration and,17
3 Repair Promote ecofriendly design and extension of service life of products and offer circular,15
products that are more durable easy to repair and recyclable,15
4 Refuse Promote green procurement reject products with no green concept and purchase prod,15
ucts with green labels or with an equivalent efficiency thereof,24
5 Recycle Facilitate an industrial chain symbiosis and develop forwardlooking energy technologies,15
to elevate energyresource efficiency and promote recycling,24
Upholding the brand spirit ofAlways Ahead we introduced BS 8001 Circular Economy in 2021 to our MOD services Our MOD services offer customers multimedia content services like video on demand and applications as well as channels and programs supplied by operators In the circular economy model of MOD services for the upstream we actively work with suppliers and start from design to minimize the size and power of MOD setup boxes successfully reducing the raw materials used and the power consumed by consumers for the downstream we recover the broken MOD setup boxes for repairment and refurbishment before returning them to the market for reuse on the ground of no damage to customers rights for the disposal valuable materials in the MOD setup boxes are recycled by qualified service providers to avoid resource wasted and cut pollution,15
In October 2021 we are verified against BS 8001 Circular Economy standards as the first domestic telecom operator that is verified against circular economy standards With that we aim to lead the industrial chain to build the business models of circular economy to advance toward the vision of sustainable circularity,18
Customer applying for ebills 10 thousand,4
Ratio of customers applying for ebills,4
Quantity of paper saved per 1000 sheets,24
Reduction of carbon emission volume metric ton,21
1 The data of paper saved and reduction of carbon emission is by ebills including SMS and combined bills,25
2 Each ebill reducing the use of envelopes and paper are 25 sheets of A4 paper Total amount of paper saved number customers,15
3 1 sheet of A4 paper generates 18 grams of CO2 Carbon emission reduced number of paper saved 1000 sheets 18 grams,25
4 The number of trees saved each ton of paper pulp produced20 trees one ton of paper pulp220 thousand sheets of A4 paper,19
Therefore the number of trees saved number of papers saved220 thousand20,12
The Sole Netzero Carbon Emission Store in The Industry of Taiwan,21
In Q2 2020CHT Syntrend Store became the first service center in Taiwan with Carbon Label for Services and the only carbon neutral store in the industry Through certification and verification against standards at home and abroad ISO 14067 and EPAs Carbon Label for Services as well as the purchase of 50 metric tons of carbon credits it thus obtained the certification to PAS 2060 for carbon neutrality,12
We have connected tightly ecofriendliness and green energy with network services While offering premium services to the general public we further aim to achieve a green communication with our consumers for them to capture the ecofriendliness and lowcarbon nature in products and services precisely As such we live up to our corporate philosophyAlways Ahead,15
The responsibilities and mission of Chunghwa Telecom as the leader of the telecom industry are Green of ICT and Green by ICT This implies facilitation of the greenness of the ICT industry Green of ICT and overall greenness of society through ICT Green by ICT From 2008 onwards Chunghwa Telecom developed measures year by year to improve the sustainability of the supply chain and we accomplished two pioneering achievements,17
We were the first telecom company to propose theSustainable Supply Chain Initiative,17
Effectively connecting with internationally prominent sustainability organizations and partners also connecting the supply chain to respond to the United Nations Sustainable Development Goals SDGs,17
We were the first in the industry to join the CDP Supply Chain Project,17
We invited nearly a hundred suppliers to participate in an international platform to submit carbon management information and improve their ability in managing carbon emissions with scientific and quantification mechanisms,25
Moving forward the green supply chain will not only be limited to the green actions by our suppliers and extension of the lifecycles of green products CHT will continue to focus on the valueadded ICT applications betterment of various systems to apply them to the supply chain as well as coordinated management and comprehensive monitoring,17
Carbon Footprint Label No 2014832001 per person served httpwwwepagovtw,25
Chunghwa Telecom supports government policy and prepares annual budgets for the purchase of green products that are either environmentalcertified less polluting recyclable resourcesaving or green building material or selfdeclared to be of less environmental impact throughout the product lifecycle from raw material to disposal The Company also actively participates in green procurement programs and activities to inspire green purchases amongst others in the industry and the public,15
Our goals and policies concerning green procurement as we hope to maintain green purchases at more than 5 of the total purchases per year over the midterm and increase this percentage to more than 50 over the long term To achieve this goal we incorporated the ISO 20400 Sustainable Procurement Standard at the end of 2018 The implementation of the ISO management system helped reinforce the idea of green procurement,15
Green procurement total NT million,12
Accounted percentage of total procurement,15
1 For more information about Green Supply Chain and Green Procurement please refer to,17
2 Key drivers for the green data in 2021,24
1 Inclusion of products with Gold rating from the Electronic Product Environmental,15
Assessment Tool EPEAT promoted by US Environmental Protection Agency EPA and,23
Institute of Electrical and Electronics Engineers IEEE with criteria as follows Reduction Elimination of Environmentally Sensitive Materials Materials Selection Design for End,15
of Life Product LongevityLife Extension Energy Conservation EndofLife Management,15
2 Exclusion of items with no green marks or equivalent in services and construction works,12
Published ESG reports and disclosed environmental data to respond to the Dow Jones Sustainability,3
Execution of an annual greenhouse gas inventory and acquisition of ISO 140641 verification and,25
Responded to the annual Carbon Disclosure Project CDP questionnaire Responded to related national rating questionnaires including Common Wealth Magazine Global,12
Views Magazine and Taiwan Corporate Sustainability Award,3
Signed on as a supporter of the Task Force on Climaterelated Financial Disclosures TCFD initiative,13
and disclosed relevant information in line with the TCFD Framework,12
Merged and exploited data center spaces Adoption of efficient energysaving equipment to improve the PUE performance of IDCs PUE values of IDCs reduced year by year from 167 in the base year of 2020 to 1657 in the end of 2021,24
with an aim for 150 by 2030,2
Green building materials adopted for newlyestablished IDCs or hostels Set up rainwater underground and condensed cooling water recycling systems for the reuse of wa,20
Replaced lamps in the public areas and internal office buildings with environmentally friendly LED bulbs,24
Constructed 4506 kWp of photovoltaic systems by the end of 2021 Acquired 111 Taiwan Renewable Energy Certificate,24
One and only in the industry of Taiwan Banqiao IDC passed ISO 14046 certification Replaced old vehicles with environmentally friendly ones and used electric vehicles in trials Sponsored the construction of the YouBike station at the corner of Xinyi Road and Hangzhou South,15
Promoted clean homes energysaving offices carfree days and paperless Office Document Auto,24
The Taiwan Energy Conservation Patrol focus on increasing energy efficiency within small and me,24
dium enterprises and vulnerable social institutions,2
Set waste reduction and recycling targets,19
One and only in the industry of Taiwan netzero emission Syntrend store acquired both the EPAs,24
Carbon Label for Services domestically as well as the ISO 14067 and PAS 2060 internationally,12
Promoted ebill with a marketing section featuring ecofriendliness energysaving and emission,21
Electronic invoicing invoice data were prepared for permanent cloud storage to save material hu man resources and receive preferential tax treatment as an incentive and exemption from fines by the government,12
iEN smart energysaving services and promotion of energysaving products Mobile device recycling Cellphone Recycling for a Sustainable Earth store tradein campaign to in stall recycle bins to the service centers in line with the promotion for waste recycling 10106 metric tons of cellphones recycled with a reuse rate of 8789 in 2021,19
Green Stores transform 691 service centers nationwide into Green Stores Collaboration with the Sustainable Alliance for Lowcarbon Economy SALcE to issue the Sustaina,15
ble Partnership products services and organizations Certificate,15
Supply Chain ESG Management Strategy,17
Every year Chunghwa Telecom purchases the software hardware and services necessary for operations from international and domestic suppliers This includes networking and data equipment cables marketing design and waste disposal services Our enormous purchasing power gives us a profound influence over the supply chainhence the responsibility to guide our suppliers in the fulfillment of their ESG This is achieved by implementing conduct that complies with the international supply chain ESG standards to guide the ICT industry towards sustainability,17
We were the first telecom enterprise in Taiwan to join the CDP Supply Chain Project in 2017 when the industry was confronted by the critical issues of global climate change and its effect on corporate development In 2018 we again became the first telecom company to incorporate the ISO 20400 Sustainable Procurement Standard We strive to establish a better connection to the world on our path towards the development of sustainability We officially launched Sustainable Partner Certification mechanism in 2019 A total of 24 sustainable suppliers have been awarded with Goldtier certificates as of 2021,17
From earlier on we have encouraged suppliers to disclose their carbon emissions and reduce them gradually We plan to incorporate lowcarbon emissions into our tender regulations only groups with carbon emissions under a certain level can participate in our tendering process Through sustainable planning supplier evaluation and a green supply chain constructed on a hierarchical management system we hope to achieve the following goals of sustainability environmental protection effective operations and management robust labor rights as well as safety and health,17
CHTs Sustainable Supply Chain Initiative Sustainable Partner Certification,17
Chunghwa Telecom upholds its com pany motto and its mission as a Digital Economy Motivator and a Creative In dustry Pilot formally adopting the ISO 20400 Sustainable Procurement Stand ard in 2018 With that it evaluates its supplierssustainability performance with the sustainable framework,17
We launched Sustainable Partner Cer tification mechanism in 2019 We ex amine suppliers by SGS second party audit results as well as their type and level of importance and rate them as 4 tiers of Gold Silver Bronze and Par ticipation accordingly If a supplier fails to pass the certification process it is granted a limited period of time to implement corrective measures Rated suppliers shall receive a mark that cor responds to their rating and an excel lent mark will be seen as a favorable term when submitting a tender,17
We hope to compile a Chunghwa Tel ecom Sustainable Supply Chain list through evaluation training audit and certification wed also like to lead our suppliers toward a sustainable future improve the sustainability of telecom companies business and society as a whole as well as keep abreast with the international trends of lowcarbon economy,17
Establish the standard for sustainable procurement,15
Core Subjects of the ISO,8
Set the standard for minimum requirements,12
Performance assessment and continued improvment,3
Evaluate fulfillment of sustainability requirements,15
Integrate ESG Principles to Chunghwa telecom supplier assessment,17
Ensure ESG conduct of the suppliers complies with Code of Corporate Social Responsibility for Suppliers of Chunghwa Telecom Co Ltd,17
Continue communication activities to promote supplier climate change adaptation measures and emissions data management,13
Complete 100 of tier 1 suppliers ESG current status assessment in 2020,17
100 of suppliers completed the ESG survey questionnaire,17
Complete 100 of critical tier 1 suppliers ESG onsite visits and audits in 2023,17
ESG onsite visits and audit rate reached 75,12
Complete 100 of critical tier 1 suppli ers carbon management knowledge ed ucation in 2021,18
100 completion of carbon manage ment knowledge education and train ings for the critical tier 1 suppliers,17
Collect information on climate change and carbon emission from suppliers at least once a year,13
The first Taiwan telecom carrier to participate in the CDP Supply Chain Project,17
The number of suppliers who respond to Chunghwa Telecoms CDP Supply Chain Project questionnaire reaches 200,17
The suppliers response rate to the,17
The Chunghwa Telecom suppliers fall into three categories construction work property and service Apart from professional network communication equipment to be procured internationally and that the amount of which was higher for the 5G deployment in 2021 we procured locally as much as possible to facilitate the local economic development The domestic procurement percentage was 89 in 2021 increased by 9 compared to the previous year,17
1 Tier 1 suppliers are those that provide products,15
or services directly to Chunghwa Telecom with an,24
annual procurement of NT100 thousand,24
2 Critical tier 1 suppliers are those that provide,17
products or ser vices directly to Chunghwa,15
Telecom with an annual procurement of NT50,12
3 Critical nontier 1 suppliers are those that provide,17
critical products and services to CHT tier 1,15
suppliers but are not CHT tier 1 suppliers,17
ESG Capacity Promotion of Suppliers,17
Overview of the Supply Chain ESG Management Results,17
In 2021 aside from the existing Annual ESG Supplier Conference and environmental education visits we organized ESG education and training for suppliers which were held online instead due to the concern of COVID19 inviting 26 representatives from nearly 47 suppliers Apart from the ESG lecturers internally we also invited professional ESG consultants to offer a 4hour ESG program With the education and training we expected to communicate to the suppliers our commitment to the sustainable supply chain management and Sustainable Partner Certification system so as to collectively bridge the supply chains of telecom industry to the international trend of sustainability which also come with the benefits in the ESG area,17
To promote awareness of ESG management in supply chain partners SGSTaiwan has been granted to tier 1 supplier onsite audits since 2010 in accordance with ESG principles of supply chain of Chunghwa Telecom Since 2019 we increased the number of suppliers for secondparty audit to 20 with an additional review process We commit ourselves to 100 completion of ESG secondparty audit for our key tier 1 suppliers by 2023 To make sure all our supply chain partners will be in compliance with ESG management requirements our goal is to complete the sustainability rating of 140 suppliers and issue the certification mark by 2025,17
Supplier ESG auditing ratio per year,17
Percentage of suppliers assessed in ESG in the last 3 years,17
Occupational health and safety onsite audits,9
Secondparty audit by the SGSTaiwan Critical nontier 1 suppliers audits,17
Completion of Online Supplier ESG Survey,17
Suppliers with a procurement amount of NT5 million or above is liable to fill out the Supplier ESG Survey that covers items of corporate ethics labor rights environmental man agement and occupational safety and health,9
Procurement staff that received ESGrelated training,12
It is to ensure all CHT procurement staff understand and exe cute faithfully the Code of Corporate Social Responsibility for Suppliers of Chunghwa Telecom Co Ltd,17
Supplier contracts containing ESGrelated terms,17
Suppliers are explicitly required to abide by the Code of Cor porate Social Responsibility for Suppliers of Chunghwa Tele com Co Ltd in their procurement contracts,17
