paragraph,predict_label
CHT continues with advanced technological research and development to take advantage of many business opportunities in this digital convergence era and reduce operational risk We absorb cultivate and make good use of excellent available talent to integrate Internet and marketing resources,8
We cooperate closely with our strategic partners in the launch of new services and products that satisfy our customers We have become The Digital Economy Motivator and The Creative Industry Pilot and we create values for clients shareholders employees and society,15
Dwindled advantage in the mobile services market due to the merger of competitors,4
Increased bandwidth and user population of competitors that leads to impact to our mobile mar ket share,1
Risk Avoidance and Opportunity Seizure,18
Strengthen 4G5G construction introduce 5G dual band service and preemptively deploy during the merger of competitors,18
to increase the leading advantage in the mobile network quality,18
Establish the network advantage of Always Broadband Connected with triple networks of mobile networks optical,24
networks and WiFi services combined to boost the QoE of users,24
Twists in the energy transition for the netzero emissions policy that affects the power supply stability,24
Twists in the energy transition for the netzero emissions policy that affects the power supply stability,24
Risk Avoidance and Opportunity Seizure,18
Strengthen the resiliency of networks to ensure business continuity eg strengthen the emergency backup capacity of networks and IDCs request Taipower to adopt dualfeeder power supply for critical IDCs increase the emergency power generation units and batteries installed phase out old energyconsuming equipment and introduce lowcarbon network equipment etc,5
Preemptively deploy and invest in industries of energy transformation to have the upper hand,18
The 5G technology will drive intelligent technological applications AI will be everywhere around us in the future Completely new types of services such as AIoT AI and IoT will become the core of fast convergence The rise of new industries edge computing the volume of the IoT drones AR VR and the intelligent family will push corporations in Taiwan to move their business emphasis We predict that the global output value of AI hardware will exceed NT 5 trillion This will inevitably become an important force in pushing global economic growth With the advent of Industry 40 and the rapid emergence of new online applications cybersecurity specialists are issuing warnings regarding the looming threat of multimodal multifaceted attacks However this also creates an opportunity for companies that offer an integrated cybersecurity service package The government has classified information security as a matter of national security including it as part of the national defense industry in the 52 New and Innovative Industries Policy,1
In the face of the trends of userfriendliness and rapid launch of diversified emerging technological applications security perimeters are blurred as a result Meanwhile openness and softwareization increase the chance of exposure as well which in turn pose a threat to security Hence apart from taking user experience and service functions into consideration corporations are to employ the concept of Secured by Design in the beginning of development in order to effectively reduce potential information security risks,1
CHT spares no effort in the refinement of cybersecurity technology In response to the governments cybersecurity automatization and industry innovation policies in 2017 CHT founded Chunghwa Cybersecurity International a subsidiary dedicated to the development of integrated cybersecurity solutions especially for emerging technologies We hope that our endeavors will encourage other companies to follow suit while effectively broadening opportunities in information security and driving the growth of revenues apart from the reinforcement of national cybersecurity defense capability,1
International research institute Gartner predicts that the IoT product and service providers will create a marginal benefit of US6 trillion in 2025,15
Risk Avoidance and Opportunity Seizure,18
We developed the IoT intelligent internet platform on our own combining 5 main services including information security,1
big data the blockchain AI and AR,18
Forecasts show that 5G technology will result in an output of US 134 billion to the companies in Taiwan in 2035,24
Risk Avoidance and Opportunity Seizure,18
Launching Taiwan 5G Industry Development Alliance CHT leading team with the 5G office in DoIT ITRI and III,17
CHT Pilot Team extends laboratory testing to practical 5G Testing and Training Site All industries in Taiwan can take advan,12
tage of this environment to develop innovative applications and grasp the opportunities,15
Participate in the Asia Silicon Valley Development Plan of the National Development Council to offer open 5G network sys tem integration and reliability verification services establish the demo site for domestic open 5G networks and promote domestic open 5G networks and reliability verification mechanisms create the National Team of Open Network of Taiwan with the RD prowess of the ICT industry in Taiwan integrated for the international competition and the next industry of trillion dollars worth,4
With the advantages of the largest customer base of 5G services and the largest bandwidth available we work with ICT man ufacturers and relevant 5G product suppliers at home and abroad in line with the philosophy of Extensive Alliance to invest in the market of applications for the private 5G networks and build the 5G venues with the high bandwidth low latency and great connectivity of the 5G private networks,15
Popularization of emerging technological applications eg IoT AI and cloud services as well as diversified attacks by hackers boost the challenge of protection against cybersecurity threat while create new opportunities in the cybersecurity area,1
The FSC promulgated Financial Cyber Security Action Plan to drive the demands for cybersecurity protection monitoring and joint defense in the financial sector,1
The Executive Yuan announced the Cybersecurity Industry Development Action Plan The gross output of the industry is expected to exceed NT 78 billion dollars by 2025,18
Gartner pointed out that the global cybersecurity market accounted for ap,18
proximately 332 of the global IT expenditures and rising,12
Risk Avoidance and Opportunity Seizure,18
The cyber intelligence joint defense platform we developed and key emerging technologies like MEC security monitoring,1
offer an environment for 5G and IoT that is more secured and reliable,1
Developing interdisciplinary financial security solutions such as blockchain and CloudHSM we strive to become a cyberse,1
curity service provider for digital finance,1
With our current IT solutions we offer complex solutions for clients using ICSOT infrastructure connected to a hybrid net,24
As a managed security service provider MSSP we dedicated to the provision of a wide range of cybersecurity solutions In,1
addition to extending our market reach within the border we are actively seeking business opportunities overseas,3
With quality domestic and international products integrated ISP networks utilized and advantages in channels and RD we,15
offer overall solutions to big corporations and become the leader in the cybersecurity industrial chain integration,1
Climate Change low carbon products and services,13
The World Economic Forum WEF predicted that of the potential risks in the next decade four out of the top five risks are environmental issues es pecially the extreme weather,13
Businesses around the globe are investing in low carbon emission infra structure including green energy electric automobiles and smart cities to reduce reliance on electricity,21
The bonds issued by green enterprises worldwide in 2021 were up to 4165 billions worth accounting for 351 of the corporate bonds issued global ly and rising,12
Risk Avoidance and Opportunity Seizure,18
Green Product and Service Program we provide businesses with energysaving technology and services,15
We reduce carbon footprints through innovative green services cloud products and other technologies and build smart,24
cities through technology by tapping into our core advantages in the ICT industry,24
We are building a cloud service platform that enables clients to access real time data regarding their energy usage and equip,24
ment status so that failures can be predicted and prevented,0
We developed the Green ICT technology for deployment in renewable energy As of 2021 either the installed solar PV capac,24
ity for CHT itself or for others continued to rise significantly,24
The sustainable development bond of NT35 billions worth was issued in 2022 as the first sustainable development bond issued by the domestic telecom operator The fund raised shall be directed to green buildings comprehensive VoIP for tele phone networks and extensive broadband construction in the offshore islands and rural areas to bridge the urbanrural divide so as to realize the carbon reduction for all via technology,12
Climate Change Risks and Opportunities,13
Chunghwa Telecom builds a systematic and organized corporate governance structure to ensure that climate change related challenges are incorporated into the Companys annual strategy in real time and that relevant projects are implemented,13
The Supervisory Responsibility of the Board of Directors,7
In 2021 in line with the organizational transformation and the ESG trend Chunghwa Telecom officially renamed the CSR Committee as the Sustainable Development Committee with the Chairman and President serving as the Chairperson and Vice Chairperson Also the President serves as the Convenor of the Risk Management Committee With the dual mechanisms we ensure that risks and opportunities related to climate change can be fully deliberated and reviewed in the Sustainable Development Committee and the Board of Directors In addition with the existing internal control and risk management mechanisms combined the links between the climate change topics and the Board of Directors responsibility in the oversight thereof is strengthened through the report to the Board of Directors every half a year,13
The Environmental Group is set up under the CHT Sustainable Development Committee responsible for the strategic planning for environmental sustainability climate change carbon management and environmental protection actions as well as execution of action plans Pursuant to the ESG vision and carbon management strategies laid out by the Board of Directors and the Sustainable Development Committee in line with the needs of international institutional investors rating agencies and key stakeholders it plans enforces and manages execution of various climate change and carbon management action plans The relevant mechanisms include,13
Target setting for the netzero emissions GHG reductions and climate resilience improvement of CHT,25
Strengthening the carbon management competencies of the Company and its supply chain with mitigation and adaptation at the core along with improvement of climate resilience of the telecom infrastructure and communication equipment to ensure business continuity,3
Oversight and proposal of innovative solutions to reduce GHG emissions from itself and the industrial chain planning and execution of Action Plans for Adaptation to Climate Change in the next 20 Years for Chunghwa Telecom Communication Networks to deploy climate change adaptation actions,25
Chunghwa Telecom Disclosures to TCFD,12
The boards oversight of climaterelated risks and opportunities,13
Managements role in assessing and managing climaterelated risks and opportunities,13
The climaterelated risks and opportunities the company has identified over the short medium and,13
The impact of climaterelated risks and opportunities on the Companys businesses strategy and,13
Task Force on Climaterelated Financial Disclosures TCFD,13
Chunghwa Telecom is the first telecom company in Taiwan to sign on as supporter of the Task Force on Climaterelated Financial Disclosures TCFD initiative The Task Force on Climaterelated Financial Disclosures hereinafter as TCFD has been introduced in 2019 to conduct analyses of climate risks and opportunities so as to promote works of climate change mitigation and adaptation for an ongoing reduction of operational risks for the Company and drive the lowcarbon transformation in the industrial chain In 2021 CHT was certified to the highest grade of TCFD Conformity Check for 2 consecutive years,13
Attainment of netzero emissions is the foremost mission along with facilitation to partners upstream and downstream to collectively realize the target of 15C set in the Paris Agreement,25
Improvement of the climate resilience for the infrastructure and communication equipment of the Company is the foremost mission to ensure business continuity for the Company,3
To analyze the future impacts of climate change on the Company we employed the Sustainable Development Scenario SDS proposed by the International Energy Agency IEA and the RCP 26 scenario proposed by the Intergovernmental Panel on Climate Change IPCC to conduct our climate scenarios analysis,13
Climate Change Scenarios for Mitigation and Adaptation,13
Energy efficiency improvement IDCs and base stations are our primary sources of energy consumption Hence a series of energy efficiency plans are deployed For instance with the advantage of the fixedline facilities combined the 5G construction was deployed with the CRAN architecture which is low in failure rate easy for maintenance and more energy efficient,24
Use of Renewable energy Aside from active installation of renewable energy capacities we also work with external entities to build their solar power plants which not just complies with the renewable energy development policy of the country but also contributes to our revenue,24
In addition according to the IEA SDS regarding the issues of projected elevated carbon prices increased electricity bills energy efficiency and regulatory trends we analyzed the risks and opportunities in the shortmidlongterm and proposed responses and management measures for material and potential risks to mitigate risks and seize the opportunities ahead,12
Our climate adaptation strategy is to elevate the climate resiliency of facilitiesequipment to reduce threats from the extreme weather events Hence the Action Plans for Adaptation to Climate Change in the next 20 Years for Chunghwa Telecom Communication Networks was proposed and relevant budgets were allocated to carry out focused improvement and adaptation projects for equipment at high climate risk in order to improve the climate resiliency of the Company,13
In addition based on the physical risk topics under the IPCC RCP26 scenario the impact levels to the Company were identified Material and potential Climate risk topics are managed and supervised continuously to the level of preemptive preparedness to strengthen our capacity for climate disasters,13
The potential impact of the Companys businesses strategy and financial planning in different,3
The Companys processes for identifying and assessing climaterelated risks,13
The Companys processes for managing climaterelated risks,13
Processes for identifying assessing and managing climaterelated risks and how they are integrated,13
into the Companys overall risk management,18
The metrics used by the Company to assess climaterelated risks and opportunities,13
Scope 1 Scope 2 and Scope 3 greenhouse gas emissions,25
The targets used by the organization to manage climaterelated risks and their implementation,13
Increased sustainability laws and regulations eg Renewable Energy Development Act,12
Increased electricity bill derived from changes to the energy mix in Taiwan,24
Increased costs from GHG emissions eg additional costs of carbon fee in line with the regulations,25
More costs required to achieve netzero emissions due to rise of carbon credit prices,12
Replacement with equipment of lower energy consumption eg electric vehicles to improve energy efficiency,24
Failed new technology investment eg a technology developed not meeting the lowcarbon benefits rendering failure of the new technology invested,18
Miss the involvement in the lowcarbon RD trend for failure of investment in the lowcarbon transformation technologies,25
Changes in customer behaviors eg elevated consumer awareness for climate change or shift in productservice demands,13
Impact to reputation arising from supplier carbon reduction performance lower than expected,17
Impact to reputation from litigation risks,18
Facilityequipment damages arising from an increased frequency and severity of severe typhoons,13
Facilityequipment damages by floods due to an increased frequency and severity of torrential rain,5
Product supply disruptiondelay arising from impacts to supplier operation and production due to extreme weather events,17
Increased energy consumption due to rising average temperature,24
Operational assets are damaged owing to the rise of sea level covering the lowlying coastal areas,23
We classified risks related to the industry as transition risks and physical risks and established the list of topics of risks and opportunities by combing through the industrial risk management reports worldwide as well as the regulations and policies in Taiwan Also to capture changes to the climate change risks the risk assessment results are reviewed yearly to adjust our climate change strategies reduce risk impacts and seize climate opportunities There are 15 risk topics identified in 2021 which include 10 transition risks and 5 physical risks,13
Referring to the ISO 31000 risk management guidelines the strategy group assess the hazard caused by each climaterelated risk risk hazard likelihood impact through Delphi method which investigates the professional experience of senior executives in related departments and focuses on the likelihood from five levels which are very unlikelyunlikely probable likely to very likely and the degree of impact is divided into five levels based on the proportion of CHTs paidin capital which are extremely highvery high high moderate and minor A total of 4 high risks 2 medium risks and 9 low risks were identified in the assessment,18
t c a p m,12
The shortterm is 20212025 the midterm is 20262030 and the longterm is 20312050,3
CHT Material Climate Risks Opportunities in 2021,13
Increased electricity bill derived from changes to the energy mix in Taiwan,24
Risk Impact Summary In line with the renewable energy development policy in Taiwan an accelerated use of renewable energy in the energy mix and a rising cost in electricity shall be a future trend in Taiwan The Ministry of Economic Affairs estimated that the energy price will rise by 30 by 2025 CHT has a high demand in electricity consumption The operating cost will rise as a result,24
Risk Responses With a high demand in electricity we know for sure an increased electricity bill will pose a significant impact on the operating costs Therefore we attach important to corporate actions for energy saving and energy efficiency improvement Take the IDCs for example the selfdeveloped Intelligent Environment Network iEN Service and the Power Operation Supervisory System POSS for IDCs are used to dynamically manage energy online to achieve the benefits of carbon reduction and environmental protection via technology,24
Increased costs from GHG emissions eg additional costs of carbon fee in line with the regulations,25
Risk Impact Summary Our country has proposed the plan to achieve netzero emissions by 2050 The Greenhouse Gas Reduction and Management Act in force sets a maximum of NT1500 per metric ton of carbon Meanwhile it is planned to enact the carbon fee mechanism the current plan is to levy NT100 per metric ton of carbon on the focused manufacturers If the carbon fee is expanded to Chunghwa Telecom in the future it will increase the operating costs of CHT,25
Risk Responses Pursuant to the IEA recommendations energy efficiency improvement is an effective mean to carbon reduction Thus CHT set the target of netzero emissions by 2050 Aside from active actions for energy saving and energy efficiency improvement it also began to invest in renewable energy,24
As of 2021 CHT reached 4506 kWp of installed solar PV capacity and is planning to procure renewable energy so as to cut its carbon emissions step by step,24
Increased energy consumption due to rising average temperature,24
Risk Impact Summary Based on the Taiwan Climate Change Projection Information and Adaptation Knowledge Platform TCCIP MOST it is estimated that the average temperature in Taiwan will rise by 135C in 20212060,13
According to the Bureau of Energy every 1 C lower for airconditioning comes with an additional 6 energy consumed Since CHT relies on AC system to maintain IDC operation the rising temperature will lead to rising operating costs for CHT as well,24
Risk Responses With the emphasis on energy efficiency apart from the development of the Environment ARtificer Theurgy EARTH system iEN Service and POSS to manage and cut energy consumption the advantage of the fixedline facilities is combined to deploy the 5G construction with the CRAN architecture which is low in failure rate easy for maintenance and more energy efficient,24
Adoption of lowcarbon technologies to raise energy efficiency,24
Opportunity Impact Summary CHT has a high demand in electricity due to its industrial characteristics that 9757 of the total emissions is from Scope 2 If CHT adopts lowcarbon technologies to raise the energy efficiency it may effectively cut the energy demand and carbon emissions of the Company,24
Opportunity Responses By active adoption of lowcarbon technologies for instance we are the first domestic telecom operator to adopt the Centralized RAN CRAN architecture for 5G deployment Through the centralized management we effectively reduce costs and enjoy the benefits of rapid failure response and repairment Also it saves the energy consumption and space for AC installation to individual sites which comes with the benefits of efficiency and energy saving that helps in the performance of carbon reduction,24
Popularization of 5G IoT big data and other emerging technologies to drive industrial transformation,1
Opportunity Impact Summary The International Telecommunication Union ITU pointed out that to achieve the climate goal in the Paris Agreement the ICT sector will have to utilize its technical strengths and capabilities to contribute to the global carbon reduction efforts Take IoT for instance the IoT sector in Taiwan yielded approximately NT176 trillion worth of output value in 2021,13
Opportunity Responses Active investment of resources in innovation and development to drive the lowcarbon transformation in the industry,3
1 Active exploration of emerging businesses utilization of RD resources and energy of strategic partners to build the industrial,17
ecosystem to expand the domestic and international markets,4
2 Intelligence digitalization Network Virtualization SoftwareDefined Networking SDN and other technologies to elevate the,1
resource outputinput ratio and effectively optimize the costs in investment and construction,17
GHG emissions reduction to lower operating costs,25
Opportunity Impact Summary We have set the target of netzero emissions Also with energy efficiency improvement and renewable energy as the two axes for carbon reduction we work to cut the carbon emissions at CHT Under the assumption that CHT is subject to the relevant laws and regulations of carbon emissions in Taiwan and required to pay carbon fees if CHT successfully achieve netzero emissions it may offset the regulatory requirements posed by the government and be exempted from the carbon fees,25
Opportunity Responses Following the opinions from the International Energy Agency IEA we employ energy efficiency improvement and renewable energy as our two axes for carbon reduction to achieve our target of netzero emissions by 2050 step by step,24
In terms of energy efficiency improvement through the selfdeveloped management and energysaving systems we manage and reduce the energy consumption at CHT In terms of renewable energy we have achieved 4506 kWp of selfinstalled solar PV capacity and are planning to procure renewable energy,24
Total emissions Category 1 Category 2,25
Emission Intensity tCO2eNT in million,21
Percentage of category in revenue,12
1 Indirect emssions Category 2 are measured on a locationbased method,4
2 The decrease of total emission in 2021 shows that the switch from PSTN to SVG,21
the power consumption optimization which does not affect the network operation,24
the replacement of old access and high energy consumption base equipment and,24
Driven by the Industry 40 development and emerging network applied technologies eg 5G application softwareization virtualizationcloudification and IoT cybersecurity threats have evolved into multifaceted mixed attacks that increase challenges for enterprises in cybersecurity management,1
We continue to study and analyze measures for risk protection align ourselves with international cybersecurity standards and establish the joint defense mechanisms with governments and international cybersecurity organizations effectively enhancing the overall cybersecurity defense and response capabilities of the Company Furthermore we are actively developing key information technology and strengthening supply chain security which not only facilitate developments of emerging businesses but also offer secured reliable digital environment to our customers,1
Endoflife treatment of sold products,15
