paragraph,predict_label
We believe that the success of our business is tied to the quality of our workforce and we strive to maintain a corporate environment without losing the entrepreneurial spirit with which we were founded more than 50 years ago By providing a quality workplace and comprehensive benefit programs we recognize the commitment of our employees to bring their talent energy and experience to us Our continued success is attributable to our employees expertise and dedication,8
We periodically conduct employee engagement surveys to monitor our employees satisfaction in all aspects of their employment including leadership communication professional development and benefits offerings Employee responsiveness to the engagement surveys has been consistently high and the results help inform us on matters that our employees view as key contributors to a positive work experience Based on the employee engagement survey last conducted in 2020 with 93 responsiveness the overall companywide favorability result was a very favorable rating with ratings exceeding 80 favorability in all categories We will continue to evaluate employee engagement as needed on a meaningful basis The success of our efforts in the workplace is demonstrated by the satisfaction and long tenure of our employees 38 of whom have worked at BXP for ten or more years The average tenure of our employees is approximately 100 years and that of our executive leadership is 188 years In 2021 our total workforce turnover rate was 166,8
There is no substantial portion of our work that is performed by workers who are legally recognized as selfemployed or by individuals other than employees or supervised workers including employees and supervised employees of contractors We are not reporting on the work performed by thirdparty vendors and contractors in the construction and operation of our buildings,11
We have had no significant variations in employment numbers As of the end of 2021 BXP had 734 fulltime employees and nine parttime employees Approximately 14 of our total employees are covered by collective bargaining agreements,11
The BXP benefit programs are designed to meet the needs of our diverse workforce These programs help to protect and enhance the wellbeing work and personal life balance and financial security of our employees and their families BXP offers a comprehensive total rewards strategy in support of our business objectives and in alignment with our company values market trends and our goal of attracting and retaining top talent,8
SOME OF THE BENEFITS THAT WE OFFER OUR EMPLOYEES INCLUDE,11
Income protection plans salary continuation longterm disability and life and ADD insurance,8
ValueAdded Programs provided by our medical benefits provider include,2
Paid time off vacation holiday and personal days,11
Goal Getter track exercising activity andor calories to reach,6
Family Care Program through backup child adult and elder care,2
Our Employee Wellness Program established to encourage employees to improve their health and wellbeing offers wellness activities facilitated through an engaging and personalized approach Program participants receive a reduction in their health insurance deduction cost,9
Creating a diverse inclusive and welcoming workplace is a responsibility shared by all BXP team members and we strive to create a diverse and inclusive environment It has been and will continue to be our policy to recruit hire assign promote and train in all job titles without regard to race national origin religion age color sex sexual orientation gender identity disability or protected veteran status or any other characteristic protected by local state or federal laws rules or regulations By promoting this policy we aim to ensure that all employees have the opportunity to make their maximum contribution to BXP and to their own career goals,8
BXP complies with applicable state and local laws prohibiting discrimination in employment in each jurisdiction in which it maintains facilities Managers base all employment decisions on the principles of Equal Employment Opportunity including but not limited to decisions concerning recruiting hiring upgrading and downgrading discharge training promotions in all job titles compensation benefits layoffs returns from layoffs and social and recreational programs,8
We launched the Diversity Inclusion Committee with the mission of promoting diversity inclusion equality and transparency as part of our culture business activities and decisionmaking practices while also providing an additional mechanism through which we can make positive impacts in the communities we serve Areas of priority include recruiting retention and professional development review and assessment of our policies with a focus on business partner diversity and other relationships and community outreach In addition our Chief Executive Officer is a signatory to the CEO Action for Diversity campaign which is the largest CEOdriven business commitment to advance diversity and inclusion in the workplace,8
In 2021 the Diversity Inclusion Committee aided BXP in becoming a corporate member of the National Minority Social Diversity Council NMSDC to source qualified minority suppliers during the early stages of our RFP process BXP also created a Minority Business Partnership Pilot Program which will be rolled out across our regions The program provides an opportunity for minorityowned enterprises both office and retail entities to obtain space and grow their businesses in BXP properties at an attractive rate intended to create a more level playing field In addition over 33 of our charitable contributions were for diversity initiatives in 2021,8
Establish a charter structure and overall construct for the formation of impactful Employee Resource Groups,8
Launched the formation of three Employee Resource Groups ERGs for Women Ethnic Minorities and LGBTQ Hired a Diversity Council consultant and trainer with unique skills in workplace diversity and ERGs Selected Executive Sponsors and identified 24 leaders in each group,8
Made strategic hires in Human Resources dedicated to promoting Diversity Inclusion,8
43 ethnically diverse new hires 53 women new hires,8
4 increase of ethnically diverse employees 1 increase of women employees,8
5 increase of ethnically diverse officers 6 increase of women officers,8
Determine baselines and set appropriate goals to increase the diversity of our supplier vendor and contractor network,17
Revised our internal processes for our Property Management and Construction Departments to track and promote the inclusion of minority vendors and subcontractors as business partners,8
1 Proactively procured a minority and womanowned bank to act as comanager in two of our unsecured senior notes offerings in 2021 and,4
Implement programs to advance real estate access for minorityowned businesses,8
Worked with organizations to help facilitate relationships with minorityowned businesses to provide commercial real estate space,8
1Represents percentages for all of our employees excluding union employees for which the unions control all aspects of the hiring process,11
PERCENT OF BXPS BOARD OF DIRECTORS ARE WOMEN,7
AVERAGE YEARS OF TENURE OF OUR EXECUTIVE LEADERSHIP2,8
PERCENT OF ALL MANAGEMENT POSITIONS ARE HELD BY WOMEN,8
1As of December 31 2021 We determine race and gender based on our employees and directors selfidentification,8
2Represents percentages for all of our employees excluding union employees for which the unions control all aspects of the hiring process,11
3Other represents American IndianAlaskan Native Native Hawaiian or Other Pacific Islander and two or more races,8
All eligible employees receive an annual performance review These evaluations are done in the same time frame as the review of annual incentive compensation One of the general factors on the performance appraisal form requires the supervisor to address whether the employee has a fundamental understanding of our business and a demonstrated commitment to company policies,11
We foster an environment of growth and internal promotion and strive for a bestinclass candidate experience for our internal applicants Open positions are posted and employees are highly encouraged to apply for promotion within the organization For the calendar year 2021 we promoted 11 of our employees to elevated roles within the Company Of the employees that were promoted 43 were women and 37 were nonWhite,8
We invest significant resources in our employees personal and professional growth and development and provide a wide range of tools and development opportunities that build and strengthen employees leadership and professional skills These development opportunities include inperson and virtual training sessions inhouse learning opportunities various management trainings departmental conferences executive town halls and external programs BXPs Tuition Reimbursement Program also provides educational assistance to employees who successfully complete workrelated courses at accredited colleges or universities,8
Code of Business Conduct and Ethics Training Attendees,0
BXP is committed to advancing its responsibility to respect human rights Because we encourage all persons to be treated with dignity and respect we have adopted the following Human Rights Policy which aligns with the United Nations Universal Declaration of Human Rights BXP strives to respect and promote human rights within all aspects of the Company Its policies and directives are integrated within BXPs literature such as employee handbooks and code of conduct and compliance trainings We operate our business in a legal ethical manner that adds value to society rather than harm With this BXP is opposed to both child and forced labor in any form and we strictly prohibit involvement in any such activities This Policy includes the following components,10
Respect for the rights of all persons impacted both directly and indirectly by,10
Respect for employees rights of freedom of association and to collectively,11
bargain in compliance with applicable labor and employment laws,11
Compliance with national laws and regulations regarding the protection of,12
Provide safe and healthy workplaces compliant with all applicable health,9
Sustain and safeguard spaces free of violence harassment intimidation and,9
Reassess the needs of the Human Rights Policy as the Company grows,10
Carrying out human rights due diligence of adverse human rights impacts,10
We are a leading property owner and developer Our local teams are very engaged in their local communities not only seeking entitlements but also determining how our projects can enhance neighborhood amenities and quality of life Our community involvement was strengthened in 2021 by our ongoing commitment to volunteerism and philanthropy Throughout the year BXP and 225 of our employees donated over 892 service hours to 268 community events and contributed over 13 M in donations and event funding,10
HOLIDAY TOY DRIVES In continuation of our ongoing partnership with the United Way of Massachusetts Bay and Merrimack Valley BXP hosted a Holiday Toy Drive in 2021 Employees donated over 340 toys and gift cards for families in need,15
UNITED PLAYAZ BXPs San Francisco team continued their partnership with United Playaz a program that provides youth with adult support academic enrichment and leadership skills to prevent them from entering and reentering the justice system BXP donated to the program and attended their Community Learning Hub and the SOMA Youth End of Year Celebration,2
RIGHT TO DREAM BXPs New York regional employees donated over 100 hours to Right To Dream Its mission is to identify talented children and provide them with a transformational foundation through soccer education and character development These opportunities enable young people to become leaders and give back to their communities,2
RESTON HOLIDAY PARADE This year marked the 30th annual Reston Holiday Parade The oneofakind halfmile parade along Market Street welcomes the arrival of Santa and Mrs Claus in a horsedrawn carriage Proceeds from the carriage rides benefit local charities The Reston Holiday Parade won third place on the USA Today 10Best Holiday Parade list,8
THE GALLERY AT ATLANTIC WHARF Since 2011 The Gallery at Atlantic Wharf in partnership with the Fort Point Arts Community has hosted art installations artist talks and other opportunities to highlight the vibrant arts community around the Fort Point Channel in Boston,2
31 NIGHTS OF LIGHT Since 2009 31 Nights of light has grown as an iconic event in the Bostonarea nonprofit community Every night of December the top of Prudential Tower shined a different color in support of that nights nonprofit partner and their important work The honored organizations host events in conjunction with their lighting Over the course of 12 years 31 Nights of Light has attracted positive public attention to a multitude of important causes,24
In addition to supporting charities and community groups across our regions we are committed to enhancing our local national and global communities through education and outreach and volunteering our time with industry groups such as BOMA local chambers of commerce local tourism organizations and Nareit on government committees including regional and city sustainability efforts and green ribbon task forces building innovation districts and sustainable neighborhood planning on technical advisory teams and local engineering unions and inhouse to our neighborhoods by providing building tours offering educational programs about our buildings and operations and hosting annual sustainability and healthyliving events,10
BXP is committed to strong corporate governance policies and practices designed to make the Board of Directors effective in exercising its oversight role Our Board of Directors oversees management performance on behalf of our shareholders to ensure that the longterm interests of our shareholders are being served among over things monitors adherence to BXPs standards and policies and promotes the exercise of responsible corporate citizenship Our Board of Directors is currently comprised of eleven highly accomplished individuals with diverse backgrounds who are dedicated to serving the best interests of our shareholders Among other things the Board is responsible for reviewing managements strategy for the Company ensuring that the Board has the desired mix of skills experience reputation and diversity relevant to our strategic direction and operating environment overseeing managements succession plan approving and implementing governance policies assessing its performance and the performance of executive management overseeing our sustainability efforts monitoring our cybersecurity and risks and providing oversight of financial reporting and legal compliance policies,7
BXP is highly ranked for its governance principles among other real estate companies including,12
The Board of Directors and the Sustainability Committee support efforts to implement our sustainability strategy through our corporate sustainability program Our Boardlevel Sustainability Committee led by BXP Director Diane Hoskins serves as the senior decisionmaker on issues related to sustainability Throughout the year the Company organizes meetings presentations and regional Sustainability Summits to communicate the objectives and performance of our ESG initiatives to our Board of Directors executive management and other stakeholders including our employees and investors BXPs ESG reporting and implementation of our sustainability initiatives are led by Ben Myers our Vice President of Sustainability The sustainability program initiatives are supported and coordinated by BXPs Boardlevel Sustainability Committee a Corporate Sustainability Steering Committee and a Companywide Sustainable Operations Committee of regional leaders and key decisionmakers,3
Ben Myers Vice President Sustainability and Rich Monopoli Senior Vice President Development present pathways to netzero at a the Urban Land Institute ULI Fall Meeting,3
In 2021 BXPs Board of Directors formed a new committee dedicated to BXPs sustainability activities including climate action and resilience initiatives The new Sustainability Committee assists the Board of Directors in its risk oversight responsibilities and serves as a direct resource to management with the primary purpose of imparting any information knowledge and ideas related to environmental sustainability matters including best practices developing trends and issues The duties and responsibilities of the Sustainability Committee of BXPs Board of Directors include,3
Review and share real estate industry sustainability best practices,15
Work with the Board and management to establish environmental,12
performance goals energy emissions water and waste and initiatives related to climate action and resilience,3
Monitor and evaluate the Companys progress in achieving its sustainability goals and commitments progress and achievements as well as relevant independent ESG ratingsrankings,3
Report to and advise the full Board as appropriate on the Companys,7
Periodically review legal regulatory and compliance matters that may have a material impact on the implementation of the Companys sustainability objectives and make recommendations to the Board and management as appropriate with respect to the Companys response to such matters,12
Assist the full Board in fulfilling its oversight responsibility by identifying,7
evaluating and monitoring the environmental and climate trends issues risks and concerns that affect or could affect the Companys business activities and performance,13
Advise the full Board on significant stakeholder concerns related to,4
Perform such other functions as may be requested by the full Board from,7
The Corporate Sustainability Steering Committee is comprised of Sustainability Communications Legal Human Resources Risk Management and Investor Relations representatives This committee is primarily responsible for ESG disclosures including public reporting,3
The Companywide Sustainable Operations Committee meets throughout the year and has the following goals,3
Identify and execute new strategies for promoting sustainability in new construction existing buildings and corporate operations,15
Additionally the Companys Chief Financial Officer Senior Vice President of Finance Planning Vice President of Sustainability and Senior Sustainability Analyst work together to oversee BXPs Sustainable Operations Committee which includes over 35 representatives from all of our regions This Committee helps inform the direction of our sustainability and ESG program,3
Enhance the Companys processes for collecting sustainability performance,15
Promote communication across the Company and share best practices,10
Assess the costeffectiveness of small and large scale projects and,17
Follow new regulatory requirements and cooperate with the regulators to,12
To support the achievement of the Companys overarching sustainability and ESG goals the performance of each member of our executive team is assessed annually against preestablished corporate operational and management goals and factors such as individual contributions to overall Company results are considered in our executive compensation program Annually one of these preestablished goals focuses on sustainability and ESG accomplishments across our portfolio,3
In 2021 these goals were formulated by the Chief Financial Officer Senior Vice President of Finance Planning and the Vice President of Sustainability and are approved by the Compensation Committee Sustainability targets and objectives are also communicated to senior management in weekly and monthly meetings with progress monitored through weekly and monthly reports Sustainability objectives are effectively communicated to the Board senior management and throughout the Company consistently,3
COMMUNITY SOLAR BXPs first community solar project was commissioned in 2021 at our CityPoint development In addition to providing energy savings for BXP the solar carport provides energy savings for Caritas Communities Heading Home and other lowincome electricity customers in the greater Boston area,24
Enhance ESG reporting including disclosures related to Human CapitalDiversity Inclusion Pandemic ResponseHealth Security and Supply Chain Engagement,17
Advance TCFD alignment and complete Climate Risk Assessment,13
Improve GRESB score and maintain highest level 5star rating,12
Advance adoption of the Task Force on Climaterelated Financial Disclosures TCFD recommendations identify gaps and define pathway to full alignment 10K inclusion,12
Execute sustainability metric assurance for sustainabilitylinked revolving credit facility,18
Finalize 100 renewable energy strategy for 2025 carbon neutral operations including virtual power purchase agreement VPPA diligence,24
Complete Scope 3 emissions inventory including embodied carbon and evaluate setting a Scope 3 netzero target,25
Improve GRESB score and maintain highest level 5star rating,12
Commence implementation of proactive indoor air quality monitoring program in all regions,21
Maintain trajectory of performance toward longterm DEI goals,3
For more than five decades BXP and our employees have maintained the highest standards of integrity and ethics We take pride in our traditions of responsibility and accountability We also believe that transparent disclosure of our corporate governance policies is fundamentally important to maintaining our wellestablished reputation and preserving the trust of our investors We believe this sets a tone at the top for good governance and includes the appropriate checks and balances that a formalized system of governance should have,0
BXP has established clear policies administration communication training and enforcement of a set of strict rules and regulations found in our Code of Business Conduct and Ethics which is publicly available on the Companys website The Code governs business decisions made and actions taken by our directors officers and employees and is an expression of the Companys fundamental and core values which include i integrity and honesty in the Companys and its employees dealings with clients suppliers coventurers competitors shareholders and the community ii respect for individuality and personal experience and background and iii support of the communities where the Company operates and its employees work,0
BXP has a strong commitment to minimizing our exposure to bribery corruption and conflicts of interest The Company requires strict adherence to the US Foreign Corrupt Practices Act the UK Bribery Act of 2010 where applicable and any similar anticorruption and antibribery laws of the United States and other nations Among other things employees are prohibited from directly or indirectly through a third party i offering authorizing promising directing or providing anything of value to any government official for the purpose of influencing that person to assist the Company in obtaining or retaining business or securing an improper business advantage or ii otherwise offering or giving anything to any person in connection with Company business that could be perceived as a bribe,0
EMPLOYEE BUSINESS CONDUCT AND ETHICS TRAINING AND WHISTLEBLOWER MECHANISM,0
Across the Company every employee receives online training regarding their obligations under the Code annually Employees who deal specifically with the government also receive inperson training regarding the requirements of the Code as it relates to the Federal Government annually Additionally all employees must certify in writing at the time they are hired that they will abide by the Code and each employee must provide a recertification every time they are trained BXP requires employees to report any suspected violations of the Code including using the EthicsPointTM Reporting System Through EthicsPoint any employee can anonymously report any suspected or observed violations of the Code 24 hours per day 365 days per year either online or via telephone In addition BXP includes a provision highlighting the requirements of our Code in vendor contracts including how to file a complaint on our hotline if they become aware of any inappropriate activity by an employee We remain committed to adhering to these policies and principles and are confident that our employees will continue to conduct themselves in a manner consistent with these policies and ideals,0
The Company has established a Policy on Company Political Spending publicly posted on our website which requires the prior approval of our Chief Legal Officer in consultation with our Chief Executive Officer and President of any political contributions made by the Company The policy is available on the Governance section of investorsbxpcom In the interest of transparent reporting of political contributions of the Company BXP annually publishes on its website approved Company political spending amounts in accordance with its policy,12
