paragraph,predict_label
2GHG Protocols Averageproduct method for Capital Goods using Carbon Leadership Forums embodied carbon benchmarking data,18
BROWN TO GREEN BXP procured over 46000 MWh of green power through Constellation New Energy for our Reston office portfolio in 2021 The Company continues to reduce Scope 2 emissions by increasing energy efficiency and procuring green power,24
Managing energy consumption and implementing energy conservation measures aligns with our objective to provide the greatest benefit to our stakeholders We continually measure and manage the usage of electricity gas and steam using Energy Intelligence Software EIS EPAs ENERGY STAR Portfolio Manager and energy audits Our Regional Managers and Heads of Property Management have annual performance goals with energy emissions water and waste targets These goals are formulated at the assetlevel and roll up to regional and companywide targets,24
Since 2011 BXP has strategically partnered with EnerNOC and Hatch Data to deploy realtime energy monitoring infrastructure including 245 commodity meters at 98 sites As active managers BXP leverages interval data automated alerts conservation measure recommendations and increased energy use awareness to optimize facility operations and control utility costs by adjusting Building Management System BMS programming verifying nighttime shutdowns setbacks holiday scheduling peak load shedding optimizing equipment runtime and executing strategic demand response events Across the portfolio 158 active EIS users log in an average of 12 times per month Using interval data to optimize energy performance BXP implemented over 134 million kWh in automatically generated energy savings measures from 2017 through 2021 resulting in approximately 14 million in cumulative avoided annual energy expenses In 2021 alone BXP building teams leveraged over 1500 weatheradjusted energy consumption reports from the Hatch platform to help benchmark building performance as occupancy fluctuated due to the pandemic Interval data is also used to execute demand response events Demand response program enrollments have generated demand response payments of 42 million over the same fiveyear period,24
E S U Y G R E N E E T S,12
1Estimate based on 2019 savings and utility expenses,24
In 2021 BXP generated more than 7998 MWh renewably onsite and increased onsite capacity by 9 At specific sites distributed generation technologies like solar PV can produce energy more costeffectively than traditional technologies We are pursuing renewable energy projects where these utility cost discounts are evident We are actively researching and pursuing the adoption of alternative and renewable energy technology including energy storage at our existing buildings and new developments Fortythree percent of our current new development projects are implementing alternative and renewable energy installations To date BXP has executed 12 solar power purchase agreements and the total renewable energy consumed in 2021 both generated onsite and offsite was 375652 MWh,24
We are committed to identifying and implementing ECMs and capital improvements that reduce energy use ECMs are reviewed and the projects that meet certain investment criteria are implemented Since 2015 energy projects have cut annual use by over 50 million kWh saving approximately 57 million per year ECMs include lighting retrofits HVAC upgrades and the addition of building management system BMS programming and controls,24
Implemented measures include the relamping and replacement of fixtures with highefficiency LEDs and fluorescent lamps Lighting system improvements also include the addition of occupancy and daylighting sensors and controls Lighting improvements conserve resources improve energy efficiency and provide improved lighting quality that supports healthy and productive indoor environments for our clients,24
Implemented measures include a variety of heating ventilation and air conditioning improvements Upgrades have been made to heating and cooling systems including boiler retrofits compressor replacements air handling unit replacements the addition of variable frequency drives installation of heat exchangers and improved filtration on cooling towers HVAC equipment upgrades and replacement central plant improvements modernization and reconstruction projects are helping drive energy savings and optimize occupant comfort health and wellness,21
Implemented measures include demand control ventilation airflow stations and monitoring occupancy sensors and the addition of direct digital control points to building automation systems Adjustment of ventilation rates to meet demand improves energy efficiency and air quality particularly CO2 concentration BMS fault detection pilots have been launched in Boston and New York,21
MODERNIZING SYSTEMS AMENITIES Strong economically performing assets built in the 1960s like the GM Building require updating to maintain Class A sustainability and functionality expectations In 2021 BXP advanced execution of a new chiller plant amenity area and building management system fault detection that will better serve clients improve comfort control and reduce operational energy costs and carbon emissions,24
We recognize the growing importance of water conservation particularly where water scarcity has been an issue Over the past eight years BXP has upgraded plumbing fixtures across more than onethird of our inservice portfolio and has continued to execute LEEDcertified new development projects that are designed to use 30 to 40 less water than code Since 2008 BXP has reduced water use intensity gallonsSF by 54,20
We use ENERGY STAR Portfolio Manager to monitor and benchmark water usage in buildings where we have access to water meter data We prioritize the oldest least efficient fixtures for improvement and focus our efforts on some of our largest properties to ensure that we are maximizing our conservation efforts Implemented improvements include smart controllers low flow sprinkler heads rain sensors cooling tower retrofits and infrastructure improvements,20
E S U R E T A W,12
HARVESTING RAIN Atlantic Wharf features a halfacre green roof that captures rainwater and has helped to save over 125 million gallons of water annually equivalent to 19 Olympicsized swimming pools,20
1Estimate based on 2019 savings and utility expenses,24
In partnership with our vendors and clients BXP has implemented best waste management practices including singlestream recycling composting and ewaste programs for solid waste in all our regions As a result 495 of office waste by weight is recycled or composted across our portfolio which is a 375 increase since 2008 We also work closely with our vendors and clients to promote responsible waste management practices including haul trip optimization and composting at cafs and restaurants In 2016 we established a bold commitment to achieving a 65 diversion rate by 2020 Unfortunately we fell short of that goal by a margin of approximately 10 Diversion has become more challenging as the economics of recycling have become less favorable and waste haulers have become more discerning regarding contamination recycling that contains nonrecyclable materials Going forward we will perform more auditing of waste streams engage clients to promote recycling and will make efforts to introduce composting at more sites We have reset our waste diversion target to 60 by 2025,19
We have worked across our portfolio with our clients and waste haulers to transition to singlestream recycling programs Singlestream simplifies recycling Commingled materials are collected in one container and sorted offsite at a material recovery facility The advantages of singlestream recycling include increased client participation and potentially higher waste diversion rates,19
Our integrated composting program diverted nearly 1388 tons of organic material from landfills in 2021 We work with our clients to ensure that they have signage and receptacles and our buildings have designated central compost bins with frequently scheduled pickup Composting produces valuable nutrientrich soil avoids potentially significant methane emissions and reduces the frequency of waste hauls required,19
1Donations account for 1 of the diversion rate 421 tons,20
More than 76 of the square footage of our properties is in central business districts with ready access to public transportation Within 025 miles of our buildings the clients and communities we operate in have access to over 3000 alternatives to nonsingle occupancy vehicle SOV transportation including bike spaces bikesharing stations bus stops subway stations commuter rail stations car share spaces hybrid spaces vanpooling spaces and electric car charging stations,24
BXP promotes the use of mass transit through onsite events for clients employee newsletters and oneonone meetings with client contacts Our employees support alternative transportation programs by working with local transportation management authorities and supporting the use of carpooling We encourage our employees to use alternatives to singleoccupancy vehicles by subsidizing the purchase of transit passes and enabling employees to fund many of their additional commuting expenses such as vanpools and parking at public transportation stations by using pretax dollars through our Commuter Benefits program,9
TRANSITORIENTED DEVELOPMENT The Hub on Causeway is the epitome of transitoriented development with access to the MBTA Subway and Commuter Rail stations 568 bicycle storage spaces several carvanpool spaces and electric vehicle charging infrastructure,24
BXP makes efforts to protect and enhance biodiversity and ecosystems during the development of new buildings and the operation of our existing buildings The vast majority of our new construction involves the redevelopment of existing sites which conserves natural areas and habitats In some cases the redevelopment of sites involves the remediation of soil and water contamination caused by industrial activities by others We design buildings to minimize light pollution which increases night sky access and reduces the consequences of development for wildlife and people When we install site lighting we typically model light levels and specify fixtures that minimize the trespass of light beyond the site boundary We are also committed to supporting biodiversity by maintaining tree canopy cover and vegetated areas BXP has several green roofs and has been a leader in urban beekeeping with seven onsite apiaries We have commissioned two urban farms each in our Washington DC Boston regions which provide food for local charities In 2021 BXP did not have any environmental violations,23
BUSY BEES BXP has commissioned seven onsite apiaries across our portfolio Bees are vital in pollinating local food crops and vegetation which is especially important in urban locations Honey from our beehives is also used by some of our restaurant clients,23
PRODUCTIVE ROOFTOPS BXP has partnered with Dreaming Out Loud in its mission to increase access to healthy food At Capital Gallery we have created a rooftop garden that provides fresh and affordable produce to lowincome families in Southwest DC,6
In many ways people are the assets and buildings are the equipment that drive our business,3
Our success depends on human capital and the property of the communities that we serve We are focused on social performance and externalities including the social and economic impact of our development pipeline the delivery and operation of healthy buildings diversity and inclusion in our workforce the wellbeing of our employees their training and professional development and our positive contributions to the communities we operate in,10
PUBLIC ART DISPLAYS BXP hosts public art displays across our portfolios including both permanent installations and temporary displays Public art contributes to a communitys identity fosters community pride and a sense of belonging and enhances the quality of life for our clients and visitors,10
THE SOCIAL AND ECONOMIC IMPACT OF NEW DEVELOPMENT,10
Development continues to be an important contributor to growth and value creation for BXP During 2021 we fully placed in service four developments with an aggregate investment of 6124 million our share,3
100 Causeway Street a Class A office project with approximately 634000 net rentable square feet located at The Hub on Causeway in Boston Massachusetts The project is on track to earn LEEDBDC Platinum certification in 2022,24
200 West Street a redevelopment to convert a portion of the existing,23
7750 Wisconsin Avenue a Class A office project with approximately 733000 net rentable square feet located in Bethesda Maryland The project earned LEEDBDC Gold certification in 2022,24
One Five Nine East 53rd Street a Class A office and retail redevelopment of the lowrise portion of our 601 Lexington Avenue property with approximately 220000 net rentable square feet located in New York City The project earned LEEDBDC Gold certification in 2020,24
Additionally we commenced six new development projects of our active development pipeline with a total anticipated investment of 10 billion our share,12
103 CityPoint a new construction project in Waltham Massachusetts that,12
will consist of approximately 113000 net rentable square feet of life sciences space The project is registered for LEEDBDC certification,24
180 CityPoint a new construction project in Waltham Massachusetts that will consist of approximately 329000 net rentable square feet of laboratory space The project is Fitwel Design Certified and is registered for LEEDBDC certification,24
360 Park Avenue South a redevelopment project in New York City New,23
York that will include modernizing building systems and creating amenities collaborative spaces and client spaces to reimagine the property,15
751 Gateway a laboratory building located in South San Francisco California that is expected to be approximately 231000 net rentable square feet upon completion 751 Gateway is the first phase of a multiphase development plan at Gateway Commons,24
880 Winter Street a redevelopment project in Waltham Massachusetts that will consist of approximately 224000 net rentable square feet of laboratory space in Waltham Massachusetts The project is registered for LEEDBDC certification,24
View Boston Observatory at Prudential Center a 59000 net rentable,24
square foot redevelopment of the top three floors of 800 Boylston Street at Prudential Center located in Boston Massachusetts,3
As of December 31 2021 our active development pipeline totaled 34 million square feet and 25 billion in estimated investment our share and is projected to deliver over the next several years The delivery of our new development pipeline includes significant community engagement public consultation and community benefits and mitigation There are several positive externalities associated with the delivery of our current pipeline,10
ONE FIVE NINE EAST 53RD STREET NEW YORK NY,4
URBAN AMENITIES In 2021 BXP placed inservice One Five Nine East 53rd Street The project included a revitalized public plaza providing open space in Midtown Manhattan several shops and cafes open to the public a large food hall and an impressive water feature The building is located next to an MTA Subway station and has access to a bikesharing station Amenities and biophilic elements such as these are increasingly important in urban environments,20
1Data represents 22 billion our share of new development projects,12
MASTER PLANNING 1950 2000 Opportunity Way features two office towers that are part of a large expansion effort in Reston Town Center The office towers are part of a masterplanned project to be constructed in several phases providing mixedused transitoriented development at BXPs Reston Town Center,3
As developers and managers of buildings and occupiers of many of those buildings we are keenly aware of the influence of buildings on human health In 2018 we announced a partnership with a leading healthy building certification system Fitwel to support healthy building design and operational practices across our portfolio and became a Fitwel Champion Since then we have certified 167 million square feet of our portfolio under the Fitwel rating system The aim has been to ground healthy building claims in science by quantifying the benefits of superior air quality water purity and access building material composition indoor environments and wellness amenities We completed our initial Fitwel Champion commitments and were named a Best in Building Health award winner in 2020 and 2022 We completed the first Fitwel Design Certified project in the world and executed more Fitwel certifications by count and building area than any other company in 2019 In 2021 we certified more Fitwel Viral Response assets than any other company BXP now has 10 Fitwel Ambassadors among our Sustainability Development and Property Management teams,9
We have partnered with 9 Foundations Inc a consulting company founded by Dr Joseph Allen that provides expert consulting services In addition to his role as CEO of 9F Dr Allen is an associate professor at the Harvard TH Chan School of Public Health and an internationally renowned expert on healthy buildings Dr Allen and his team have significant experience in industrial hygiene epidemiology and infectious disease they and have reviewed and guided our cleaning air and water quality practices,20
We are advancing the following healthy building strategies to promote the positive impact of buildings on human health Additional pandemic response strategies are summarized in our Health Security Plan on Page 48,9
Cognitive Performance Productivity Infectious Disease Transmission Mitigation Clean Air Supply,21
Increase outside air CFMperson Accurately measure ventilation air,21
In existing buildings exceed ASHRAE ventilation standard by 30 minimum,21
Provide 100 outside air where and when possible Use CO2 and occupancy monitoring to provide,21
Replace and improve filtration MERV13 minimum Perform comprehensive inspections and air quality testing Use existing sensors and advanced building management,21
Maintain and improve highquality HVAC systems Continuously monitor space temperature setpoints,24
across the portfolio with advanced building management systems,3
healthy productive indoor environments making efforts to select materials that contain no volatile organic compounds VOCs ureaformaldehyde andor other chemicals of concern,6
Increase adoption of touchless systems including bathroom fixtures elevators and turnstiles Increase frequency of cleaning and disinfection of hightouch surfaces,15
Minimize the Impact of Cleaning Products on People and the Environment,15
Implement Green Cleaning requirements aligned with LEED for Existing Buildings with our cleaning vendors Use Green Seal certified cleaning products HighEfficiency Particulate Air HEPA vacuums dry cleaning for carpets and restroom supply products made from recycled materials,15
It has been more than two years since the first case of COVID19 in the US was confirmed by the Centers for Disease Control and Prevention As we emerge from the shadow of the historic COVID19 pandemic we look forward to brighter days ahead keeping in mind the farreaching impacts of personal loss economic uncertainty and social dislocation We are encouraged by recent trends including reduced case levels and fatalities and the overall rate of vaccination There is light at the end of the tunnel and we are confident that this experience will strengthen our collective resilience,5
The health security of our clients and employees remains our top priority Since the release of our comprehensive Health Security Plan in May of 2020 we have implemented a sciencebased set of measures intended to provide healthy workplaces As part of this initiative BXP received Fitwel Viral Response Certification at the entity level in 2020 The module incorporates strategies that create healthy indoor environments and mitigate viral transmission In 2021 all actively managed offices received Fitwel Viral Response Module Certification at the assetlevel In consultation with industry experts and in response to guidance from public health authorities we will continue to operate under the necessary restrictions and operational practices to mitigate the risk of infectious disease transmissions at our properties,9
This public health crisis has exposed the vulnerability of our population and of the communities in which we live and work It has also revealed the remarkable potential we have to adapt innovate and come together to support the measures necessary to create a better tomorrow We are committed to continuing to do the work necessary to maintain the health security of our properties and our communities and are confident that guided by the measures included in this plan we can move forward together,9
BXPs Health Security Plan Update Moving Forward Together released in March 2021 outlined our updated framework as we looked toward an increased repopulation of our properties Since the lifting of the initial shelterinplace orders in the summer of 2020 we have successfully begun the repopulation of our properties by adhering to the scientific framework developed in our original plan guided by internal and external expertise Moving Forward Together outlines the health security best practices our application of guidance from public health authorities and the measures we have implemented to mitigate the risk of infectious disease transmission We are excited to resume social activities that we have had to cancel and postpone Brighter days are certainly ahead including the meaningful connection collaboration and culturebuilding that comes with the resumption of inperson activities,18
Indoor Air Quality IAQ refers to the air quality within and around a building as it relates to the health and comfort of the occupants,21
At BXP we are committed to developing and maintaining sustainable properties while simultaneously providing healthy indoor environments for our clients employees contractors and other visitors at our properties As part of a smart building strategy our management and engineering teams use realtime energy consumption data to optimize facility operations including IAQ and to control energy consumption carbon emissions and utility costs Increasingly the energy we are using is from renewable sources,24
Monitoring BXP manages thermal comfort and air distribution by continuously monitoring space temperature setpoints and HVAC equipment performance using advanced building management systems BXP conducts air and water quality biannually at a minimum with samples taken from throughout the building Results are available upon request,21
MERV filtration All of our properties are provided with filtration which is certified to at least a MERV13 rating and to a MERV14 or MERV15 rating,24
Fresh air rate BXP has confirmed that all basebuilding systems are capable of exceeding the ventilation standard ASHRAE 621 The median fresh air rate capacity at BXP office properties is 36 CFM per person at 200 square feet per person 54 CFM at 300 square feet per person,21
HEPA Filters Portable hospitalgrade HEPA filters are provided in our amenity conference rooms cafes and fitness centers,2
Consumption Our management and engineering teams use realtime energy consumption data to optimize facility operations and control utility costs,24
Healthy building certification In response to the COVID19 pandemic BXP achieved Fitwel Viral Response Module enterprise certification and assetlevel certification at all actively managed office properties The Viral Response Module was created to operationalize policies and practices to mitigate the spread of infectious diseases in buildings,5
Since 2008 Weve reduced operational energy intensity by 41 water intensity by 54 and carbon emissions by 80 Today 77 of our portfolio is LEED ENERGY STAR andor Fitwel certified,24
All regions have formalized a Green Cleaning requirement with our cleaning vendors to minimize the impact of cleaning products on the environment Aspects of this requirement include using Green Seal certified cleaning products HighEfficiency Particulate Air HEPA vacuums dry cleaning for carpets and restroom supply products made from recycled materials Our Green Cleaning program benefits both the janitorial workers within our buildings and our clients because the cleaning methods and products used do not include toxic chemicals that can cause respiratory and dermatological problems Indoor air quality has also improved because of the use of HEPA vacuums,21
COLORADO CENTER SANTA MONICA BUSINESS PARK SANTA MONICA CA,3
ENHANCED GREEN CLEANING As part of BXPs Fitwel Viral Response module certification initiative all 20 of our actively managed office buildings in the Los Angeles Region totaling 22 million square feet earned Fitwel Viral Response Assetlevel certification in 2021 Enhanced green cleaning was a component of this certification and also our Health Security Plan,15
Our company culture supports and nurtures our employees and provides a unique competitive advantage We believe our employees are a significant distinguishing factor that sets BXP apart As of December 31 2021 we had 743 employees Our operational and financial performance depends on their talents energy experience and wellbeing Our ability to attract and retain talented people depends on a number of factors including work environment career development and professional training compensation and benefits and the health safety and wellness of our employees We have an established reputation for excellence and integrity and these core values are inherent in our culture and play a critical role in achieving our goals and overall success,8
