paragraph,predict_label
B O S L A N Y S F S E A D C,12
1This report contains Standard Disclosures from the Global Reporting Initiative GRI Sustainability Reporting Guidelines See pages 6974 for a complete context index,12
In 2021 we continued to execute our business while remaining focused on creating positive economic social and environmental outcomes for our clients shareholders employees and the communities we serve We advanced policies programs and projects that support sustainable development and operations and the key issues that impact our business and stakeholders including climate change health security and social justice,10
Our focus on ESG makes BXP a stronger and more purposeful company We make a positive impact through the advancement of climate action and risk management while aligning with the decarbonization ambition of our clients communities and local governments We make our buildings destinations where people want to be together by cultivating great spaces and places for our employees and clients in healthy buildings with excellent indoor air quality amenities walkability and access to services Through promotion and active efforts to increase diversity and inclusion throughout our operations we are attracting and increasing input from employees with a wide range of backgrounds and seniority levels Efforts to amplify and promote different ideas perspectives and individuals varying domain expertise foster a work environment and company culture that encourages and elevates all individual voices,8
We are proud of our position and consistent recognition,0
as an industry leader in sustainability and ESG We will,3
to conduct our business in a manner that contributes,3
IN 2021 WE CONTINUED TO ADVANCE OUR ESG EFFORTS BY,3
establishing a Sustainability Committee of our Board of Directors to increase,7
Board input and oversight over sustainability and related issues,12
announcing a commitment to achieve carbonneutral operations by 2025 and increasing renewable energy consumption to 704 of total power consumed by BXP,24
increasing actively managed property area certified under the US Green Building Council Leadership in Energy and Environmental Design LEED rating system to 261 million square feet of which 98 is certified at the highest Gold and Platinum levels,15
issuing a total of 17 billion of Senior Unsecured Notes in our third and fourth Green Bond offerings and committing to allocate the net proceeds to Eligible Green Projects that support our sustainability goals,3
adding a sustainabilitylinked pricing component to our credit facility that ties a one basis point interest rate reduction to the achievement of green building certification targets,12
engaging Moodys ESG Solutions an independent provider of sciencedriven insights and analytics on climate risk for its climate risk scoring to evaluate the forwardlooking physical climate risk exposure of our entire portfolio and potential acquisitions,13
identifying actionable diversity goals and executing initiatives in the areas of recruitment and development company policies and community outreach,8
launching the formation of three Employee Resource Groups for Women Ethnic Minorities and LGBTQ,8
working with minorityowned businesses to provide commercial real estate space on attractive terms Relationships have already commenced in two of our regions,8
procuring a minority and womanowned bank to act as comanager in,8
two of our unsecured senior notes offerings in 2021 and commencing a depository relationship with a Blackled bank and,18
surveying vendors regarding their sustainability and diversity and inclusion,8
OUR ESG LEADERSHIP WAS RECOGNIZED BY NUMEROUS INDUSTRY GROUPS AND THE DISTINCTION OF,3
ranking among the top real estate companies in the GRESB assessment earning a sixth consecutive 5Star rating 2021 was the tenth consecutive year that BXP earned the GRESB Green Star designation,3
being named an ENERGY STAR Partner of the Year Sustained Excellence,3
being named to Dow Jones Sustainability Index DJSI North America BXP was one of nine real estate companies that qualified and the only office REIT in the index scoring in the 93rd percentile of the real estate companies assessed for inclusion,18
being named to Newsweeks Americas Most Responsible Companies 2022 list for the second consecutive year BXP ranked first in the real estate industry with a ranking increase from 56th overall out of 421 companies in 2021 to 31st overall out of 499 companies in 2022,3
ranking 4 on the inaugural Forbes Green Growth 50 a list focused on large American corporations that have reduced greenhouse gas emissions while simultaneously growing earnings,25
being named a Green Lease Leader at the highest Gold level by the Institute for Market Transformation and the US Department of Energy for exhibiting a strong commitment to high performance and sustainability in buildings and best practices in leasing,15
being named a Best in Building Health winner by the Center for Active Design for the Most Approved Assets under the Fitwel Viral Response Module and,6
being named among the ten Most Sustainable Real Estate Investment Trusts in the US by Barrons with the help of Calvert Research and Management BXP improved from eighth place to third place on the list,3
Our experience demonstrates that through our activities as real estate owners developers and managers we can contribute to environmental solutions as a positive force while improving our financial performance and becoming a stronger more purposeful organization in the process We are proud of our position and consistent recognition as an industry leader in sustainability and ESG We will continue to demonstrate our commitment and capacity to conduct our business in a manner that contributes to positive economic social and environmental outcomes for our clients shareholders employees and the communities we serve,10
Boston Properties NYSE BXP is the largest publicly traded developer owner and manager of Class A office properties in the United States concentrated in six markets Boston Los Angeles New York San Francisco Seattle and Washington DC BXP is a fully integrated real estate company organized as a real estate investment trust REIT that develops manages operates acquires and owns a diverse portfolio of primarily Class A office space,3
The Company is listed on the New York Stock Exchange under the symbol BXP As of December 31 2021 BXPs portfolio totaled 528 million square feet with 201 properties and a 25 billion active development pipeline our share including redevelopment and new construction totaling 34 million square feet BXPs 2021 total revenue was 29 billion and the net income attributable to BXP common shareholders was 4962 million BXPs consolidated market capitalization was 330 billion including 201 billion in equity value and 129 billion of consolidated debt Additional financial information can be found in the Companys most recent 10K filing,18
330B consolidated market capitalization 201B equity 129B consolidated debt,18
We actively work to promote our growth and operations in a sustainable and responsible manner across our six regions The BXP environmental social and governance ESG strategy is to conduct our business the development and operation of new and existing buildings in a manner that contributes to positive economic social and environmental outcomes for our clients shareholders employees and the communities in which we serve,10
Our investment philosophy is shaped by our core strategy of longterm ownership and our commitment to our communities and the centers of commerce and civic life that make them thrive We are focused on developing and maintaining healthy highperformance buildings while simultaneously mitigating operational costs and the potential external impacts of energy water waste greenhouse gas GHG emissions and climate change,25
BXP and its employees also make a social impact through charitable giving volunteerism public realm investments and promoting diversity and inclusion at our workplace and in the community,8
We continue to address the needs of our stakeholders by making efforts to maintain and improve our ESG performance across three pillars climate action resilience and social good Through these efforts we demonstrate that operating and developing commercial real estate can be conducted with a conscious regard for the environment and wider society while mutually benefiting our stakeholders,3
This report intends to present information related to ESG performance indicators in a format that is understandable and accessible to our stakeholders BXPs reporting is aligned with the Global Reporting Initiative GRI the United Nations Sustainable Development Goals SDGs and the Sustainability Accounting Standards SASB BXP continues to work towards alignment with the Task Force on Climaterelated Financial Disclosures TCFD recommendations,12
buildings where we have operational control of building system performance and investment decisions By concentrating on similarly situated buildings we can meaningfully benchmark performance and measure the efficacy of our sustainability measures Unless otherwise noted data presented in this report relate to only occupied and actively managed office buildings Over time we intend to assess available data and determine when to expand this report to address other property types and information,24
This report is focused on the performance of our occupied and actively managed office building portfolio in our Boston Los Angeles New York San Francisco Seattle and Washington DC regions Occupied office buildings are buildings with no more than 50 vacancy Actively managed buildings are,24
As of the end of 2021 BXPs 116 occupied and actively managed office buildings totaling 448 million gross square feet SF accounted for 85 of the Companys total inservice portfolio by area,24
Sustainability data and indicators presented in this report are derived from 2021 calendar year performance at BXPs actively managed and occupied buildings in Boston Los Angeles New York San Francisco Seattle and Washington DC,3
We develop our understanding of the views and priorities of our stakeholders by engaging our supply chain clients employees communities investors and partners throughout the lifecycle of our activities BXP management identifies and seeks to understand the groups and organizations that may affect or be affected by a decision activity or outcome of a project During stakeholder engagement processes we work closely with our clients vendors and service providers to gather knowledge and plan and implement design solutions technologies and programs that drive key performance indicator improvement We regularly participate in public forums during the development process to seek community input and apply green building standards to manage our supply chain In our communities we actively participate in business improvement districts BIDs associations nonprofits and other civic engagement activities intended to strengthen publicprivate partnerships and advance sustainability at the neighborhood scale,17
We are directly engaged with several thirdparty suppliers for the procurement of materials and services required for the construction of new development projects and the ongoing operation of our existing buildings BXP requires all of its service providers and contractors to comply with applicable laws relating to the payment of wages and benefits worker health and safety interaction with labor organizations and other workplace laws such as nondiscrimination proper classification of employees and maintenance of insurance Respecting the use of unionized labor BXP is committed to a position of neutrality guided by the interests of its partners investors and clients,11
We continue to engage investors on ESG issues that matter most to them and our other stakeholders ESG investor engagement in 2021 reached more than 60 firms and was conducted through an ESG webinar with Bank of America participation in the Morgan Stanley Sustainable Future conference an ESGfocused nondeal roadshow and several oneonone meetings with ESGfocused investors,3
In 2021 our vendor engagement survey which assesses vendor diversity and ESG initiatives was made a requirement for all new vendors Since the inception of the survey 238 of our suppliers have responded representing 35 of our 2021 spending that covers the operations and development activities of our business Results are being compiled and will be used for benchmarking goal setting and additional vendor engagement,17
HAVE PROGRAMS OR INITIATIVES TO INCREASE THE DIVERSITY OF THEIR EMPLOYEE POPULATION,8
The environmental impact of our inservice portfolio is heavily dependent on the behavior of our clients Effective engagement with our clients is necessary for the successful execution of our sustainability strategy We have integrated sustainability into our property management practices regional annual goals leasing and construction documents space improvement guidelines and our routine meetings with existing and prospective clients In addition to client meetings we survey regularly to collect feedback regarding client satisfaction We believe that by developing green buildings we maximize the likelihood of sustainable performance and that through effective stakeholder engagement we can align efforts towards positive economic social and environmental outcomes,10
We recognize and have taken steps to address the role of our clients in supporting the execution of our sustainability strategy through our leasing activity Approximately half of our active leases incorporate green lease language and all of our Master Lease forms for new and ongoing leasing include the language BXP has been named a Green Lease Leader by the Institute for Market Transformation and the US Department of Energy for exhibiting a strong commitment to high performance and sustainability in buildings and best practice leasing To align our sustainability efforts with our clients our Master Lease forms include cost recovery for capital expenditures made to reduce operating expenses cost recovery for certifications including LEED and ENERGY STAR submetering of highintensity equipment and required client energy disclosure benchmarking Our internal legal and leasing teams actively negotiate our leases with the intent of preserving green lease clauses without alterations or exceptions,24
BXP has been named a Green Lease Leader at the highest Gold level by the Institute for Market Transformation and the US Department of Energy for exhibiting a strong commitment to high performance and sustainability in buildings and best practices in leasing,17
GREEN LEASING INITIATIVES BXP demonstrated a commitment to social and environmental issues through leasing activity in 2021 In addition to standard green lease language in BXPs master lease form the Company advanced its first netzero lease and a new shortform lease for BXPs Minority Business Partnership In addition a client at Metropolitan Square added netzero lease language as an addendum in 2021,10
BXP first conducted a materiality assessment in 2016 to identify the significant economic social and environmental issues that impact our business and that are important to our stakeholders We refreshed our materiality assessment in 2019 with more input from stakeholders including clients investors community members and BXP employees In defining material aspects BXP has evaluated the main ESG interests topics and indicators raised by stakeholders The results of the 2019 materiality assessment and input received during 2021 have been used to establish and confirm ESGrelated performance indicators for our organization prioritize resources and determine the contents of this report,10
This report prioritizes the following material aspects economic performance resource use energy GHG emissions water waste customer satisfaction public transportation climate preparedness and resilience green building local community impact diversity and inclusion and the health safety and wellness of our clients and employees Our stakeholders interest in ESG issues is increasing particularly related to healthy buildings climate action and diversity equity and inclusion This report includes more information detailing BXPs efforts to address these important issues BXP plans to refresh this materiality assessment in 2022,10
S R E D L O H E K A T S O T E C N A T R O P M,12
The purpose of the management approach is to control major risks and opportunities for all material financial and nonfinancial aspects of our business Material topics identified in our materiality assessment are governed by BXPs i Board of Directors including the Sustainability Committee of the Board of Directors ii executive management iii Vice President Sustainability iv CompanyWide Sustainable Operations Committee v regional management and vi Property Management Human Resources Risk Management Development Construction and Information Services Departments,18
This document is complemented by a set of key policies with more detailed information about roles responsibilities and commitments for the material topics,12
Targets and actions on our material aspects are included in the Goals and Progress and Sustainable Development Goals sections of this report BXP continues to support the advancement of the industry on ESG issues by sharing knowledge and learning from our peers BXP actively participates in the following industry groups and organizations,3
National Association of Real Estate Investment Trusts Nareit,12
17 21 24 2829 34 36 40 60,0
Real Estate Roundtable RER Sustainability Policy Advisory Committee SPAC,3
ENERGY STAR PARTNER OF THE YEAR SUSTAINED EXCELLENCE,3
DJSI NORTH AMERICA 93 rd PERCENTILE REA REAL ESTATE,18
BXP was named to Newsweeks Americas Most Responsible Companies 2022 list for the second consecutive year BXP ranked first in the real estate industry with a ranking increase from 56th overall out of 421 companies to 31st overall out of 499 companies,3
BXP was named an ENERGY STAR Partner of the Year Sustained Excellence Award Winner This is the fourth year BXP has been named a Partner of the Year and the second year with Sustained Excellence distinction,3
BXP ranked 4 on the inaugural Forbes Green Growth 50 a list focused on large American corporations that have reduced GHG emissions while simultaneously growing earnings,25
Barrons with the help of Calvert Research and Management named BXP among the ten Most Sustainable Real Estate Investment Trusts in the US BXP improved from eighth place to third place on the list,3
In 2014 2015 2017 2018 and 2019 BXP was selected by the National Association of Real Estate Investment Trusts Nareit as a Leader in the Light award winner Nareits annual Leader in the Light Award honors Nareit member companies that have demonstrated superior and sustained ESG practices,3
BXP was named to the Dow Jones Sustainability Index DJSI North America BXP was one of nine real estate companies that qualified and the only office REIT in the index scoring in the 93rd percentile of the real estate companies assessed for inclusion,18
BXP has been named a Green Lease Leader at the highest Gold level by the Institute for Market Transformation and the US Department of Energy for exhibiting a strong commitment to high performance and sustainability in buildings and best practices in leasing,17
BXP has been recognized as an international leader in sustainability and ESG We maintain strong ESG ratings and focus on improving our performance where it matters for our business and our stakeholders,3
BXP ranked among the top real estate companies in the GRESB assessment earning a sixth consecutive 5Star rating the highest rating and recognition It was the tenth consecutive year that BXP earned the GRESB Green Star designation,3
E R O C S L L A R E V O,12
Sustainalytics Top 6 Global Universe LowRisk Score 136,4
SP ESG 93 rd Percentile Real Estate Score 67,18
of our time the climate crisis health security,13
and social justice We have a special culture of,10
build a better more prosperous future for all,3
Our sustainability goals establish reduction targets for energy GHG emissions building certifications water consumption and waste In 2016 we achieved our first round of energy emissions and water goals three years early By resetting companywide goals we seek to increase stakeholder awareness and endeavor to drive continuous yearoveryear likeforlike key performance indicator improvement We have adopted goals with the following specific time frames metrics and targets below the noted baseline years,25
Reduce energy use intensity targets a 32 reduction by 2025 Units are kBtuSF,24
Reduce Scope 1 and Scope 2 GHG emissions intensity targets a 45 reduction by 2025 Units are kgCO2eSF1,25
Reduce Scope 1 and Scope 2 GHG emissions intensity targets a 39 reduction by 2024 Units are kgCO2eSF1,25
Reduce Scope 3 Capital Goods GHG emissions intensity targets a 14 reduction by 2025 Units are MTCO2em2,25
NOTES In 2020 and 2021 we exceeded our 32 energy reduction target We are on track to meet the target by 2025 through energy conservation measures The impacts of the pandemic on physical occupancy resulted in a 41 decrease in energy use intensity when compared to the 2008 baseline year The status of our current goal will remain in progress until our buildings are repopulated in 2022 and 2023,24
NOTES We have reduced actively managed office portfolio carbon emissions intensity by 80 and met our second goal a 45 intensity reduction by 2025 six years early,25
NOTES We have aligned emissions reduction targets with climate science The Science Based Targets initiative SBTi Validation Team classified BXPs emissions reduction target ambition and determined that it is in line with a 15C trajectory currently the most ambitious designation available The sciencebased target for Scopes 1 and 2 has been met but will remain in progress pending final SBTi validation See Page 36 for details on emissions calculation methodologies,21
NOTES BXPs sciencebased target for Scope 3 focuses on reducing the emissions intensity of Category 2 Capital Goods The sciencebased target for Scope 3 has been met but will remain in progress pending final SBTi validation See Page 36 for our full Scope 3 Emissions Inventory and details on emissions calculation methodologies,21
Reduce Scope 1 and Scope 2 GHG emissions intensity targets netzero carbon emissions from operations by 2025 Units are kgCO2eSF,25
Increase building certifications including ENERGY STAR LEED and Fitwel 10 by 2025 Units are SF certified,14
Commitment to reduce water use intensity targets a 30 reduction by 2025 Units are gallonsSF,20
Increase waste diverted from landfills targets a 60 diversion rate by 2025 Units are diverted,19
NOTES We have committed to achieving carbonneutral operations or netzero carbon dioxide equivalent emissions by 2025 The commitment includes Scope 1 and Scope 2 emissions associated with total wholebuilding energy consumption landlord and client at actively managed buildings where client power is purchased by BXP See Pages 3536 for more details on our carbonneutral operations strategy and emissions calculation methodologies,25
NOTES We are on track to increase the certification percentage of our actively managed portfolio to 87 In 2021 BXP added a sustainabilitylinked pricing component to our credit facility aligned with our 87x25 Building Certification Goal Certifications increased from 77 to 84 in 2021,14
NOTES In 2021 we exceeded our 30 water reduction target We are on track to meet the target by 2025 through water conservation measures The impacts of the pandemic on physical occupancy resulted in a 54 decrease in water use intensity when compared to the 2008 baseline year The status of our current goal will remain in progress until our buildings are repopulated in 2022 and 2023,20
NOTES In 2021 we established a commitment to achieve a 60 diversion rate by 2025 See the Waste section on Page 40 for more details,19
We believe that our efforts can contribute to resolving the key issues that the global community faces Our sustainability policies practices and projects are aligned with the direction set by the United Nations Sustainable Development Goals SDGs We have aligned our efforts with SDG goals 3 5 6 7 8 9 11 12 and 13 The status of our alignment is provided on Pages 1921,10
Adopt health security measures and restrictions in response to the COVID19 pandemic that are guided by evidencebased science public health authorities federal state and local laws guidelines andor advisories,12
Align design and operational practices with leading healthy building rating systems and expert guidance,3
Create a diverse and inclusive workplace by following the principles of Equal Employment Opportunity including but not limited to decisions concerning recruiting hiring upgrading and downgrading discharge training promotions in all job titles compensation benefits layoffs returns from layoffs and social and recreational programs,8
including women in the total workforce 45 management and above 42 and BXPs Board of Directors 36,8
Ensure the sustainable use and management of water resources,20
Reduce water use intensity by 30 by 2025,20
below a 2008 baseline 54 reduction to date,12
Continue to responsibly execute water quality protection practices including stormwater runoff control treatment and mitigation efforts such as rainwater harvesting,20
periodically purging water from distribution systems and equipment,20
Ensure access to affordable reliable sustainable and modern energy,24
2025 below a 2008 baseline 41 reduction to date,12
buildings and procure onsite and offsite renewable energy sources,24
Research technology that reduces energy use and adopt such technology across the portfolio,24
