paragraph,predict_label
Use iterative energy modeling during an integrated design process to maximize the energy use reduction below a code compliant baseline,24
Ensure a safe work environment and assist in the economic development of local communities,10
contractors comply with applicable laws relating to the payment of wages and benefits worker health and safety labor organizations and other workplace laws such as nondiscrimination proper classification of employees and maintenance of insurance,11
properties support the longterm prosperity of our company natural environments and the vital centers of research commerce and civic life where we operate,23
Build resilient infrastructure promote inclusive and sustainable industrialization and foster innovation,3
during real estate activities including business continuity transitional and physical risks such as flooding precipitation extreme heat wildfires and water scarcity,20
and implement tailored Emergency Response Plans at the property level,5
portfolio level for natural catastrophes such as floods wildfires earthquakes and wind events,13
Participate in publicprivate partnerships that make our cities inclusive safe resilient and sustainable,3
the industry on sustainability issues by sharing knowledge and learning from our peers industry groups and organizations committed to sustainable cities and communities,10
renovation projects that create great public spaces and places,23
transparency as part of our culture business activities and decisionmaking practices Areas of priority include recruiting retention and professional development review and assessment of our policies with a focus on business partner diversity and other relationships and community outreach 2021 Diversity Inclusion highlights are on pages 5354,8
Ensure the sustainable use and management of resources,23
for building materials by cost on new development projects,15
debris diversion rate of 75 for all new construction and major renovation projects,20
Reduce GHG emissions from operations and prepare for environmental impacts,25
Reduce GHG emissions intensity by 45 by 2025 below a 2008 baseline 80 reduction to date,25
E S U Y G R E N E E T S,12
1 See the Climate Strategy section on Pages 3536 for more detail on emissions scopes and calculation methodologies,13
SCOPE 1 12980 MTCO2e SCOPE 2 MARKETBASED 67837 MTCO2e SCOPE 2 LOCATIONBASED 159434 MTCO2e SCOPE 3 111122 MTCO2e,25
S N O S S M E G H G,12
F S e 2 O C g k,12
E S U R E T A W,12
T E E F E R A U Q S,4
AVERAGE YEARS OF TENURE OF OUR EXECUTIVE LEADERSHIP2,8
S E E Y O L P M E,12
N O G E R R E P,12
OF ALL MANAGEMENT POSITIONS ARE HELD BY WOMEN1,11
1 As of December 31 2021 We determine race and gender based on our employees and directors selfidentification,8
2 Represents percentages for all of our employees excluding union employees for which the unions control all aspects of the hiring process,11
3 Other represents American IndianAlaskan Native Native Hawaiian or Other Pacific Islander and two or more races,8
Code of Business Conduct and Ethics Training Attendees,0
1 BXP is reporting Lost Workday Rate instead of Lost Time Injury Rate The denominator for Lost Workday Rate does not include paid time off only employee hours worked including overtime,11
TRANSIT OPTIONS WITHIN 12 MILE WALKING DISTANCE OF NEW DEVELOPMENTS,24
BXP is a corporate member of the US Green Building Council USGBC and has a long history of owning developing and operating properties that are certified under USGBCs Leadership in Energy and Environmental Design LEED rating system The LEED Green Building Rating System is a voluntary consensusbased national standard of design guidelines for highperformance and sustainable buildings Since 2008 BXP has certified over 261 million square feet of our actively managed office portfolio of which 98 is certified at the highest Gold and Platinum levels,15
BXP has a proud history of delivering the greenest buildings in our markets We target LEEDBDC Gold certification or better on all developments Between 2008 and 2021 we completed 25 LEEDBDC certified new office development or redevelopment projects that we currently own and manage totaling 100 million square feet As of the end of 2021 we are pursuing LEEDBDC certification for more than 26 million square feet of new office construction,24
Green building certification of our existing properties is an important component of our strategy to achieve operational sustainability BXP continues to actively pursue LEEDEB certification across our portfolio and has a Companywide Sustainable Operations Committee dedicated to sharing best practices Using the LEED rating system and the Arc platform we are using performance scoring to benchmark new LEEDEB projects across five performance areas energy water waste transportation and human experience Currently we have certified 22 of our actively managed properties under the LEEDEB program totaling 176 million square feet,15
BXP certified Reston Town Center in Reston VA under the LEED for Cities and Communities scorecard This 26 million square foot mixeduse development area earned Platinum certification In addition the next phase of BXPs Reston Town Center development has also earned LEED for Neighborhood Development Platinum certification,3
DOUBLE PLATINUM 145 Broadway in Kendall Square achieved LEEDBDC Platinum certification in 2021 The project was the first in New England and the third in the US to earn the distinction In addition Akamai achieved WELL Building Platinum in 2021 making 145 Broadway BXPs first doubleplatinum LEED and WELL certified building,14
As part of our commitment to developing LEED projects sustainability criteria inform the building materials selection process These criteria aligned with the LEED rating system support sustainable construction material procurement green building delivery conservation of natural resources waste reduction and occupant health Project teams review vendor disclosures and aim to costeffectively procure building materials that are,15
Extracted harvested recovered and manufactured within 500 miles of,15
Nontoxic and support healthy productive indoor environments containing no volatile organic compounds VOCs ureaformaldehyde andor other chemicals of concern,6
Maintaining and strengthening BXPs internal green design construction and operations capabilities and knowledge base is a key aspect of the Companys overall environmental strategy Ongoing training and education of our employees are essential to sustainable operations and growth We have made a concerted effort to train and accredit our managers and staff in green design construction and operations Ninetyseven employees across our development construction and property management departments are LEED Accredited Professionals Green Associates or Green Professionals representing 25 of all employees in these departments Seventyeight building engineers have received Green Professional GPRO Operations Maintenance building skills training a program that is endorsed by the USGBC Our trained property management professionals are equipped to effectively engage clients to promote more sustainable client behavior and discover opportunities,15
EMBODIED CARBON In 2021 BXP commenced embodied carbon assessment on several projects and in 2022 will require embodied carbon assessment on all large new development projects to more accurately measure and manage Scope 3 emissions,25
BXP is a leading REIT in the issuance of Green Bonds BXP has marketed and issued 355 billion of Green Bonds in four separate bond offerings and subsequently provided impact reporting for the first three offerings Green Bonds restrict the use of proceeds to Eligible Green Projects Eligible Green Projects are defined as i investments in acquisitions of buildings ii building developments or redevelopments iii renovations in existing buildings and iv client improvement projects in each case that have received or are expected to receive in the three years prior to the issuance of the notes or during the term of the notes a LEED Silver Gold or Platinum certification or environmentally equivalent successor standards,12
On June 15 2021 our operating partnership Boston Properties Limited Partnership BPLP entered into its 2021 Credit Facility which features a sustainabilitylinked pricing component such that if the Company meets certain sustainability performance targets the applicable per annum interest rate will be reduced by one basis point The sustainabilitylinked pricing component informed the creation of BXPs 87x25 Building Certification Goal which targets an increase in building certifications including ENERGY STAR LEED and Fitwel from 77 to 87 by 2025,12
BXP has financed the installation of solar photovoltaic PV onsite renewable energy systems with power purchase agreements PPAs since 2010 Under a PPA contract a counterparty designs finances builds owns operates and maintains the renewable energy system BXP agrees to host the system and purchase power generated by the system from the counterparty over the contract term Advantages of the PPA delivery model include no significant upfront costs to BXP energy cost savings over the term and the ability to capture the indirect economic benefit of monetized federal tax credits As of December 31 2021 BXP has executed 12 onsite solar PPAs,24
Impact metrics quantify the environmental result associated with the allocation of Green Bond proceeds The selected metrics and methodology have been informed by The Green Bond Principles Harmonized Framework for Impact Reporting The impact metrics below illustrate the environmental performance of eight properties that received an allocation of Green Bond proceeds from three offerings through December 31 2021,12
The annual savings associated with the environmental impact metrics based on the allocation of Green Bond proceeds to the eight Eligible Green Projects are equivalent to the following,12
Energy Heating cooling and power for 985 US homes12,24
Carbon Emissions Removing 3474 gasolinepowered vehicles from the road annually13,21
1Estimated Savings for two Eligible Green Projects have been adjusted to 70 and 87 of total estimated savings for those projects respectively because the net proceeds allocated from the offerings amounted to 70 and 87 of the total project costs,24
At BXP we believe we can play a leading role in advancing the transition to a low carbon economy through our climate action efforts As a longterm owner and active manager of real estate assets in operation and under development we take a longterm view of climate change risks and opportunities We are focused on understanding how climate change may impact the performance of our portfolio and the steps we can take to increase climate resilience We continue to evaluate the potential risks associated with climate change that could impact our portfolio and are taking proactive steps to plan for andor mitigate such risks,13
We have aligned our climaterelated disclosures with the recommendations of the Task Force on ClimateRelated Financial Disclosures TCFD The TCFD framework has informed the development of our strategy for identifying and managing both physical and transition risks associated with climate change As defined by the TCFD framework physical risks associated with climate change include acute risks extreme weatherrelated events and chronic risks such as extreme heat and sealevel rise and transition risks associated with climate change include policy and legal risks and other technology market and reputationrelated risks,13
SOLAR SYSTEM BXP continues to advance the design permitting and installation of solar canopies for garages and surface parking In Princeton New Jersey a series of large surface parking canopies totaling 52 MW provide power for four BXP properties 101 302 510 and 701 Carnegie Center In 2021 the canopies generated over 6 million kWh which is more energy than the four allelectric properties consumed,24
Managements role in overseeing assessing and managing climaterelated risks opportunities and initiatives is spread across multiple teams throughout our organization including our Board of Directors executive leadership and our Sustainability Risk Management Development Construction and Property Management Departments BXP has a dedicated team of sustainability professionals focused on ESG issues that coordinate and collaborate across corporate and regional teams to advance environmental sustainability issues and initiatives As a vertically integrated fullservice real estate company we are engaged in addressing climaterelated issues at all levels of our Company In 2021 our Board of Directors established a new Boardlevel Sustainability Committee to among other things increase Board oversight over sustainability issues including climaterelated risks and opportunities The Sustainability Committee directly reports to and advises the full Board of Directors on matters related to the environment sustainability climate change and resiliency,13
Our approach to climaterelated issues is informed by robust stakeholder engagement We are in frequent dialogue with investors clients community members governmental policymakers consultants and other nongovernmental organizations We are heavily involved in industry associations and participate in conferences and workshops covering ESG sustainability and climate resiliency topics Through these engagements we enhance our knowledge of climaterelated issues and those issues that are most important to our stakeholders and industry best practices,13
We continue to proactively assess the potential risks that may impact the properties in our portfolio but our assessment and analysis remain preliminary in nature as we gather information and monitor the evolving regulatory landscape related to climate change Our process for assessing climaterelated risks and their implications on our properties and business includes conducting climate change scenario analysis on our portfolio assets We engaged Moodys ESG Solutions formerly branded as Four Twenty Seven Application an independent provider of sciencedriven insights and analytics on climate risk for its climate risk scoring to evaluate the forwardlooking physical climate risk exposure of our entire portfolio The scenario analysis and physical risk scoring was based on an RCP 85 emissions scenario which is a worstcase high emissions scenario under a time horizon up to 2040 The scenario analysis included all,13
inservice assets owned by BXP and included climate events such as hurricanes wildfires heat stress water stress flooding and sealevel rise We are also using Moodys ESG Solutions data to identify potential risks during the new acquisition diligence process The analysis of our portfolio yielded no material findings,13
We consider climaterelated risks and opportunities in the context of the following time horizons shortterm 12 years mediumterm 310 years and longterm 10 years Based on the foregoing process for evaluating climaterelated risks including the scenario analysis we have identified 1 the following potential physical and transition risks associated with climate change that could impact our portfolio in the future across the stated time horizons and 2 BXPs climaterelated opportunities We will continue to analyze the results of the Moodys ESG Solutions analysis and the following risks and opportunities to understand our potential exposure and inform our climate resilience strategy and future investments which include climaterelated risk mitigation and initiatives,13
LOW CLIMATE RISK In addition to allrisk property insurance that mitigates the impact to BXP from losses associated with natural catastrophes BXP teams including Risk Management Property Management and Engineering prepare for climaterelated events by creating and executing business continuity emergency response and life safety plans,5
Increased severity of extreme weather events including flooding and wind damage extreme heat and sealevel rise may cause one or more of the following to occur,13
Costs associated with capital expenditure and infrastructurerelated remediation projects,12
Alteration of designs at new and existing buildings,2
Increased costs of real estate taxes or other assessments,12
Building adaptation including architectural and mechanical improvements could increase capital expenditure requirements,24
Extreme drought and wildfires could adversely impact demand in markets prone to water scarcity and annual wildfire risk,13
Sealevel rise and extreme weather events could make property insurance unavailable in highrisk areas,13
Public transportation system disruptions could impact access to BXP buildings,5
Chronic climaterelated physical risks and associated downtime could result in declining demand for office space at impacted buildings,18
Noncompliance with regulatory requirements including energy and carbon performance standards may increase costs andor introduce potential fines,12
Compliance with green building codes including electrification of heating systems may increase development and operational costs,24
Failure to meet sustainability needs eg netzero requirements of clients and investors could result in lost business,3
Additional growth particularly in life sciences may increase energy and emissions intensities,3
Real estate taxes may increase because of public projects to improve regional and neighborhoodscale resilience,3
Energy and carbon reductions could result in greater product differentiation and competitive advantage,15
Stronger ESG disclosures particularly regarding climate action and resilience may qualify BXP for greater inclusion in ESG ETFs and other funds,3
BXP may benefit from a lower cost of capital from Green Bonds andor sustainabilitylinked credit,18
BXP may avoid operating cost increases from rising energy costs through actions focused on efficient operations,24
BXP may avoid penalties associated with building energy and carbon performance standards,12
Assets may be converted andor certified netzero which may increase demand for office space,24
By focusing on the risks of climate change associated with acute and chronic physical risks during the development acquisition and operating life of assets BXP may mitigate losses and downtime resulting from extreme weather events,13
BXP is committed to managing the avoidable and avoiding the unmanageable impacts of climate change Our risk management program includes physical and transition risks including both climate mitigation resource efficiency and emissions reduction and adaptation integration of climate resilience into our investment decisionmaking We are actively acquiring developing and operating a geographically diverse portfolio of highquality commercial real estate properties Individual assets have unique risk profiles and insurance requirements Through the processes of acquisition development and operation of our inservice portfolio our experienced real estate professionals are identifying risks including business continuity risks loss exposure related to extreme weather events and impacts of regulation including permitting requirements codes and energy and carbon performance standards The climate risk profile of each individual property is largely dependent on the propertys unique attributes physical location and jurisdictional regulatory requirements,13
We carry allrisk property insurance on our properties including those under development Insurance coverage mitigates the impact on BXP from losses associated with natural catastrophes such as floods wildfires earthquakes and wind events,13
We are preparing for longterm climate risk by considering climate change scenarios and will continue to assess climate change vulnerabilities resulting from potential future climate scenarios and sealevel rise We will continue to evaluate existing plans and procedures and proactively implement practical costeffective resiliency measures and infrastructure enhancements including,13
Elevation of vault switchgear and critical equipment during new,5
Onsite energy resources and distributed generation storage and solar,24
Our exposure to physical climate risks and the resilience of our markets may depend on the actions taken by cities to adapt transportation energy and communication infrastructure for extreme heat weather events sealevel rise and flooding We will continue to influence the adaptation of our cities and management of physical and transition risks by maintaining a voice in policy decisionmaking at the local level through direct engagement andor advocacy through collective membershipbased groups,3
We are managing transition risks by benchmarking energy carbon water and waste performance at the assetlevel and are prioritizing interventions at underperforming assets We develop operate and maintain a large portfolio of buildings that are LEED ENERGY STAR andor Fitwel certified In 2021 84 of our actively managed portfolio was certified under one or more of these frameworks As a leader in green building we will continue to make investments in building performance energy efficiency and decarbonization,24
Through our climate action efforts we believe we can play a leading role in advancing the transition to a low carbon economy and are taking action to decarbonize operations GHG sources include the generated electricity and steam at offsite generation facilities the onsite combustion of fuels eg natural gas and emissions associated with other business activities including business travel and new development We continue to explore and implement creative and costeffective measures that reduce GHG emissions from our operations The Company will continue to explore and implement creative and costeffective measures that reduce GHG emissions from our operations GHG sources include the generation of electricity and steam at offsite generation facilities and the onsite combustion of fuels eg natural gas GHG mitigation efforts include energy efficiency measure implementation at existing inservice assets highperformance new development onsite renewable energy eg solar PV systems procurement of offsite renewable energy public portfolio and assetlevel GHG short and longterm reduction targets engagement of property engineers using realtime energy consumption data sustainability education and client engagement,25
BXP became a proud signatory of the We Are Still In pledge after the US withdrawal from the Paris Agreement and has aligned emissions reduction targets with climate science The SBTi Target Validation Team has classified BXPs emissions reduction target ambition and has determined that it is in line with a 15C trajectory the most ambitious designation available at the time of submission We are committed to achieving carbonneutral operations or netzero carbon dioxide equivalent emissions which includes direct and indirect Scope 1 and Scope 2 emissions by 2025 from our occupied and actively managed buildings where we have operational control,25
Our strategy to achieve carbonneutral operations includes the following goals,3
1 Energy Efficient Operations approximately 13 of total carbon,24
reductions by 2025 below a 2008 base year from energy conservation and efficient operations,24
2 Renewable Energy Advancement of onsite development of renewable,24
energy systems and sourcing offsite renewable energy to meet 100 of our electricity needs by 2025,24
electrification of new developments and replacement of onsite gasfired systems at existing buildings at the end of their useful lives,24
4 Carbon Offsets To the extent necessary offset any remaining emissions,25
The SBTi Target Validation Team has classified BXPs target ambition and has determined that it is in line with a 15C trajectory currently the most ambitious designation available,3
NETZERO DESIGN The netzero conversion of Building A at 140 Kendrick Street will be a milestone for BXP and will establish a new industry benchmark The building will be BXPs first netzero conversion featuring electrification envelope insulation improvements modernization of HVAC systems including advanced heat recovery and the addition of onsite battery storage and enough solar capacity to produce the total energy consumed by the building on an annual basis,24
BXP works closely with governments policymakers strategic partners and our clients to decarbonize our operating activities with the longterm objective of achieving carbon neutrality The Company monitors and benchmarks all primary sources of GHG emissions at the assetlevel in units of metric tons of carbon dioxide equivalent MTCDE and GHG emissions intensity MTCDE per square foot per year We established two carbon emissions targets and hit them early in 2016 and 2019 We closely monitor energy consumption and associated GHG emissions and provide a detailed accounting of ESG key performance indicators in our annual ESG reporting BXP has reduced energy use by 41 and operational emissions by 80 on an intensity basis since 2008 BXPs carbonneutral commitment includes direct and indirect Scope 1 and Scope 2,25
emissions from our actively managed office portfolio Scope 1 and Scope 2 emissions include emissions associated with total wholebuilding energy consumption landlord and client Scope 1 emissions include all emissions associated with the onsite combustion of fossil fuels for heating hot water and standby generators Scope 2 emissions include all emissions associated with the offsite generation of electricity and steam As our business continues to grow carbon reduction targets and the transparent disclosure of ESG metrics will remain a priority,21
BXPs sciencebased target for Scope 3 emissions focuses on reducing the emissions intensity of Category 2 Capital Goods A full Scope 3 emissions inventory has been provided,25
Scope 3 Category 3 Fuel and EnergyRelated Activities Not Included in Scope 1 or Scope 21,24
