paragraph,predict_label
Market data talent sourcing Schwab uses unique market data through Talent Neuron to review and understand the distinct makeup of the talent pool for certain requisitions based on location and position Our Talent Acquisition team uses this data to collaborate with business partners on what they can do to help increase the diversity representation for a role,8
Campus recruiting and organizational partnerships Schwab partners with historically Black colleges and universities and Hispanicserving institutions by leveraging our alumni from those universities to expand our presence at campus career fairs and career panels We also reach out to underrepresented student groups at other colleges to provide job mentoring and career panels,8
We partner with and sponsor over 25 organizations to help recruit diverse talent to Schwab Our partnerships range from organizations and websites like The Muse a goto resource for workers to research and identify career opportunities to partnerships like the Toigo Foundation Conference to actively recruit Black and Latinx talent and to support and sponsor Financial Women of San Francisco,8
Schwab recognizes that cultivating a diverse workforce does not end after employees join the organization We offer a number of unique programs focused specifically on retaining and developing our diverse workforce,8
Diverse Talent Mentorship Program Mentoring is a critical component in retaining talent and mentors play an instrumental role in career progression As a complement to our recently launched Employee Resource Group Mentorship program mentioned on page 22 and a key component in our 2020 strategy Schwab established a new structured mentoring program for colleagues of color Dedicated mentors from senior leadership are paired with Schwabbies who selfidentify as employees of color at the director level and mentees focus on leadership development to prepare them for career advancement opportunities broaden their professional network and develop meaningful supportive relationships with senior leaders Following a pilot our first cohort included approximately 90 diverse directorlevel employees participating as mentees and approximately 40 senior leaders participating as mentors Our second cohort which launched in October 2021 included approximately 120 diverse directorlevel employees participating as mentees and approximately 120 senior leaders participating as mentors,8
More than 30 years ago we started our first ERG Black Professionals at Charles Schwab BPACS As of 2021 we have 10 ERGs Since 2018 ERG participation has increased 157,12
Currently more than 35 of employees are members of an ERG which host more than 1000 events a year All ERGs receive equal access to funding from a centralized budget,12
In 2020 we launched a companywide ERG Mentorship program built to meet the career growth and employee engagement needs of our underrepresented employees We had 1000 participants in our first year,8
Schwab understands that employees have diverse experiences needs and expectations in the workplace We strive to create an environment that allows each employee to bring their authentic self to work Schwab has also developed a number of employee resources to help promote DI in the workplace,8
Employee Resource Groups Our ERGs are employee driven and provide communities of support for our diverse range of employees Our ERGs are made up of employees who share characteristics or life experiences and are committed to enhancing DI at Schwab In 2021 we integrated Schwabs ERGs with TD Ameritrades Associate Resource Groups,8
Week of Belonging Schwab holds an annual Week of Belonging which is a weeklong intersectional event highlighting inclusion and belonging through employee and leadership engagement and development activities The 2021 virtual program featured more than 100 events including a cultural talk show during which colleagues shared aspects of their culture and heritage,8
and programs that promoted wellbeing Leading up to and during the Week of Belonging 468 Schwabbies joined ERGs,9
Progress on diversity We make our EEO1 report publicly available on our website Schwab EEO1 Report Our leadership and workforce representation by gender and ethnicity on a percentage basis is,8
Ethnicity and gender data is based on the percentage of employees who selfidentified for purposes of EEO1 reporting as of December 31 2021 and for directors for purposes of proxy statement disclosure as of December 31 2021 Ethnic includes Asian Black Hispanic and Other Ethnicity,8
Our efforts and progress have not gone unrecognized in the market We have received a number of external awards from leading DI organizations for our initiatives and progress For instance Schwab has Scored 100 on the 2021 Disability,12
Received a 100 rating on the Human Rights Campaigns Corporate Equality Index for LGBTQ inclusion for over 15 years,8
Been identified as one of Americas Best Employers for Diversity by Forbes based on a survey of 50000 workers across the US in 2019,11
We are dedicated to cultivating and developing our talent by creating capabilities and opportunities for both personal and professional development Through our cohesive and integrated talent solutions model Schwab has implemented a centralized approach to talent development that spans the entire employee life cyclefrom hire through retirementand gives employees choice in how to shape their skills and grow their careers at Schwab,8
We offer many different programs and resources to help employees achieve their personal and professional aspirationsno matter how big or small or what stage of their careers,8
Professional development programs In 2020 and 2021 we expanded our existing programs to offer employees at all levels of the organization access to programs that suit their career stage and aspirations The programs below are just a sampling of how we invest in our people,8
Aspiring Leader Program ALP Leadership is a shared responsibility at Schwab This program creates that shared understanding of leadership at Schwab while providing opportunities for participants to make meaningful connections across the organization and unlock the value of onthejob learning,10
ALP is a multifaceted threemonth program for individual contributors with a strong desire to learn more about leading self leading others and leading with purpose ALP is designed for our next generation of leaders who have specifically expressed interest in people leadership,8
Programming topics include introduction to emotional intelligence selfleadership building your personal brand managing up and exploring personal obstacles to people leadership The 2021 cohort included 306 participants 56 were male and 44 were female and 31 of participants selfidentified as employees of color,8
Manager LEAD Introduced in 2020 Manager LEAD is a virtual sixmonth program for selected senior managers team managers and other individual contributors to gain visibility in the organization and additional development opportunities to build their leadership skills Similar to ALP but for employees who already hold leadership positions this program is designed to build leadership capabilities around increasing and demonstrating managerial courage identifying and measuring business outcomes building highperforming teams increasing visibility and Schwab business knowledge and building networks across and within peer groups Programming topics include building highperforming teams and demonstrating managerial courage,8
The 2021 cohort included 151 participants 50 were male and 50 were female and 36 of participants selfidentified as employees of color,8
Advanced LEAD A flagship program Advanced LEAD is a highintensity actionlearningcentric experience for our highestpotential leaders at the Director and Managing Director levels The program is designed to accelerate leader readiness to invest in retention development and engagement of our highestpotential leaders and to drive leadership capability innovation and growth mindset,3
Some of the learning objectives and programming topics include exploring and defining the participants leadership style addressing identified gaps and enhancing the ability to lead and be a member of a highperforming team We also focus on building upon critical thinking and strategic decisionmaking capabilities with a focus on a participants development to be ready for their next opportunity Finally we help participants learn how to engage more deeply within and across Schwab increasing internal networks and visibility,8
The 2021 cohort included 80 participants 47 were male and 53 were female and 31 of participants selfidentified as employees of color,8
Securities Industry Institute at Wharton The Securities Industry Institute at Wharton program is aimed at accelerating readiness and development of our highestpotential leaders at the Director and Managing Director levels in service of our companys vision and purpose Hosted by Wharton Executive Education and the Securities Industry and Financial Markets Association participants receive instructional course work and the opportunity to expand their external network within the industry Coursework focuses on challenges faced by executives in the financial services industry,12
Some of the learning objectives and programming topics include enhancing working knowledge of participants in key functions of the financial services industry leadership viewpoints and experiences for future career development and equipping participants with practical information and resources useful in their present and future responsibilities,8
Open registration development courses In addition to our selective enrollment nominationbased professional development programs employees can choose to take courses that help develop a variety of skills including effective communications and presentations leadership enhancing productivity coaching essentials and project management On average over 800 employees a year take advantage of these opportunities to enhance their skills and take ownership of their career paths,8
Regulatory and compliance training Schwab offers over 40 mandatory training courses to help employees understand Schwabs legal and regulatory compliance obligations and how all employees play a part in ensuring Schwab meets them Regulatory and compliance training topics include Advanced AntiBribery and Corruption Record Coordinator Training Conflicts of Interest Identification and Management Advisor Services Fraud Prevention and Signature Verification Compliance Essentials Financial Crimes Essentials Conduct Risk Essentials Verification Schwab Bank and Trust Curriculum Enterprise Risk Management Annual Curriculum Risk Management Essentials FINRA Requirements and Obligations Investment Advisory Training Affirmative Action and Workplace Environment Training,0
Schwab goes above and beyond to ensure that all Schwabbies feel supported safe and secure in the workplace We understand that employees are more than just the work they do and we are here to support them in both their professional careers and their lives outside of work Recognizing that our employees span many different life stages and have a variety of different worklife needs Schwab offers a wide range of resources and benefits to support all employees,9
Schwabs COVID19 response Like all organizations we faced and continue to face one of the most challenging times in historythe COVID19 pandemic We have remained agile acting and reacting quickly to address the everchanging landscape of workplace health and safety guidelines to maintain a safe and productive workplace while prioritizing our employees health safety and worklife needs Schwab embraced new flexible and remote work arrangements and created a Remote Leader Playbook with resources and tools to help our leaders keep their teams engaged,9
To stay connected and share information we made the quarterly leadership calls hosted by our Chief Executive Officer available to all employees via our intranet and let employees submit questions to the Chief Executive Officer via an Ask Walt link Members of the Executive Council similarly hosted podcasts to answer questions and provide information needed for Schwabbies to continue to serve our clients and communities,7
As vaccines were made available employees were provided up to four hours of paid time off per vaccine dose for a total of eight hours to receive the two vaccine doses,11
While our returntooffice plan has evolved and continues to evolve Schwab offered a gradual voluntary returntooffice plan understanding the need to balance serving our clients and protecting our people Schwab has been and will remain dynamic and flexible in our approach to returning to the office including the phases and timing which have been predicated on many variables These include continued and widespread vaccine deployment no major spikes in hospitalizations near our locations and schools reopening among other factors We continue to prioritize the health and safety of our employees and recognize people have different comfort levels and needs throughout various phases of the pandemic,9
To help us move through the pandemic we created a Workplace Flexibility Program WFP to provide managers and employees with greater flexibility with remote work options if thats whats best for them The WFP is designed to balance the importance our employees place on workplace flexibility with the benefit of inperson interactions to train and learn from one another build human connections and maintain Schwabs culture as we serve our clients It reflects the trust we have in our employees to work in support of our clients and at the same time create a better worklife balance for themselves,8
As a guideline and with some exceptions employees can work remotely up to 90 days each year and managers have wide discretion to consider further flexibility based on the employees role business needs and other jobrelated factors Employees have enthusiastically embraced the WFP and as of December 31 2021 a substantial portion of the workforce has taken advantage of the opportunity for additional flexibility once the workforce returns to office More than onethird of employees have elected to work remotely for more than 90 days and more than a quarter have elected to work from home full time We expect these numbers will fluctuate with time,11
Elder care Employees who need guidance throughout the elder caregiving journey are provided with free personalized support and access to online care planning communication tools onsite care assessments and an experienced care coach who can connect them to resources and specialized providers at every caregiving stage,2
worried about their childs academic success and need guidance on the college admissions process this program provides access to live events personalized assistance and online resources to assist with important aspects of a childs education This offering now includes increased oneonone personalized support ranging from mastering middle school to planning for college,2
For employees who have children with learning difficulties developmental disabilities or struggles with social skills this program offers free guidance on their childs unique situation and includes access to oneonone personalized assistance to help employees advocate for their child in school,2
receive free access to a database of family support services including free premium access to Sittercity virtual sitting pet care providers and housekeepers The program also includes discounts for a local hightouch placement service for fulltime childcare elder caregiving resources learning pods discounts on academic support tutoring and test prep services and special privileges for fulltime childcare,2
At yearend 2021 the Company had employees working successfully onsite in a safe way and was watching COVID19 case trends to determine the right time to begin a full return to the office while still providing the flexibility employees need taking into account local regulations in our different locations,12
Paid parental leave To support all parents in the workforce Schwab offers six weeks of fully paid parental leave following the birth adoption or fostering of a childregardless of the employees gender sexual orientation marital status or caregiver status The benefit is available for both fulltime and parttime employees who work a minimum of 20 hours per week and have completed at least 12 months of service,8
Managing lifes challenges We recognize that life can be a juggling act between work raising kids caring for aging parents looking after pets maintaining a house applying for college and somehow finding time to care for yourself To help employees better manage through lifes challenges Schwab offers various support and resources through Bright Horizons including,2
adult and elder care support for children with special needs and access to a database of support for longerterm daycare solutions and babysitters pet care nannies It also includes discounts on academic support such as test prep learning pods and homework help Outofnetwork care option enhanced through December 31 2021 This allows employees to use someone in their personal care network eg grandparents friend neighbor to provide backup care and receive up to 100 reimbursement,2
Employee sabbatical program We believe that having time off for personal or professional development contributes to higher levels of future performance and retention Schwab believes that extended continuous time off offers longterm employees valuable time to engage in community services career reflection and education For eligible employees Schwab offers a 28day paid sabbatical after five years of employment and every five years thereafter,8
Health benefits Schwab offers competitive medical dental and vision plans for its employees In addition Schwab contributes to employees Health Savings Accounts HSAs and offers employees an opportunity to receive up to 550 in additional HSA contributions by participating in the wellness program Through 2021 employees may receive 300 in HSA contributions by participating in a wellness challenge that requires an online health risk assessment and completing and logging healthy activities at least three times each week throughout a sixweek wellness challenge Employees may also receive the Lifestyle Reward of up to 250 as reimbursement for expenses associated with healthy activities including gym memberships and other inperson or virtual fitness classes,9
Schwab also supports employees mental wellbeing by offering an Employee Assistance Program through United Healthcare Through this program at no extra cost employees have access to six mental health provider visits a year This program also offers support for employees with autism spectrum disorder or behavioral needs for themselves or dependent family members,2
Dependent Care FSA As an additional benefit Schwab contributes to our employees Dependent Care Flexible Savings Accounts FSA every month for employees with base salaries up to 100000 a year Eligible employees scheduled to work 30 or more hours per week receive 100 per dependent up to 200 per month while employees scheduled to work 2029 hours per week receive 50 per dependent up to 100,11
401k All employees at Schwab are eligible to contribute to the 401k plan as of their date of hire through either pretax or aftertax Roth contributions Schwab contributes 250 after an employees first contribution and every year thereafter and matches employee contributions thereafter dollar for dollar up to 5 of the employees eligible compensation These Schwab matching contributions vest immediately,11
As of December 31 2021 98 of our employees participate in the 401k plan Almost all participants are contributing at a level that allows them to receive the full match,12
Employee stock purchase plan Schwab offers all eligible employees the opportunity to participate in a taxqualified employee stock purchase plan Through this program employees may purchase Schwab stock at a 15 discount with payroll deductions Recognizing the value of this program 4050 of employees participate,12
Bank services This program gives employees special offers only available to employees on bank products including discounted mortgages and home equity lines of credit,12
Employee branch and advice service Wealth management isnt just for our retail clients All employees have access to nocost financial planning sessions specific to their needs unless they are in a managed account Consultations can include retirement planning investment advice debt management education planning estate planning and budgeting This service is paid for by Schwab and provided through a branch that is specifically dedicated to serving employees Employees pay no account maintenance fees and can open many types of accounts without required minimum balances,12
Tuition reimbursement Schwab supports employees in their educational aspirations by offering up to 3500 in annual reimbursement for workrelated undergraduate courses taken for credit at accredited colleges and universities and up to 5250 in annual reimbursement for workrelated external training certification and graduate and postgraduate degree programs,2
Charitable matching and volunteer time off Schwab strives to be part of our communities and we want our employees to be involved too We encourage our employees to get involved in their communities and support their charitable endeavors by offering paid volunteer time Fulltime employees are provided with eight hours and parttime employees are provided with five hours each year to volunteer And through the Employee Matching Gifts program Schwab matches up to 1000 per year of employees charitable contributions to eligible nonprofit organizations See Giving Back to Our Communities for more information on the different ways we invest in our communities nationally and locally,10
Organizing and governing to build and maintain trust,0
Earning and keeping our clients trust is at the heart of everything we do and guides how we operate Risk management is not just the responsibility of our compliance department nor is it viewed as a checkthebox exercise,0
At Schwab managing risk is a shared responsibility starting at the top with our Board of Directors who oversee our risk management and managements execution of our Through Clients Eyes strategy We earn clients trust by exercising a careful balance of stability thoughtful entrepreneurship and measured risk calculation,18
We are fortunate to have the guidance and leadership of our founder Chuck Schwab who serves as chairman of the Board of Directors He continues to instill a steady vision of trust and client service that permeates our organization,7
Our board maintains four committees Audit Risk Compensation and Nominating and Corporate Governance Each committee is chaired by an independent director and has a charter Directors of each committee are required to maintain their independence according to our standards Over 82 of our board is independent from management in accordance with New York Stock Exchange corporate governance standards The documents and standards and backgrounds on each of our directors are available on our website,7
We recognize the importance of continuity and experience among our directors as an effective governance practice for fulfilling Schwabs purpose and risk appetite Directors traditionally have served staggered threeyear terms At the,7
2021 Annual Meeting stockholders approved a shareholder proposal recommending the phasing out of our classified board structure The board expects to address this issue with a proposal of its own at the 2022 Annual Meeting,7
ESG oversight For Schwab ensuring that our boards expertise evolves with changing norms and requirements and allows for steadfast oversight of managements execution of our Through Clients Eyes strategy is a key priority While recognizing that ESG is ultimately the responsibility of the full board our Nominating and Corporate Governance Committee will have primary oversight of our ESG programs and priorities with reporting to the full board The board has amended the committees charter to reflect this new responsibility,12
Board size With the TD Ameritrade acquisition and three new directors from TD Ameritrade our board expanded from 14 to 17 directors At this time in our history while we maintain one of the larger boards among our peers in the financial services industry we are integrating two of the largest organizations to improve our scale and efficiency for clients The board expansion provides continuity in the transition and supports the boards oversight of this integration,7
Board diversity As noted in our Proxy Statement we specifically consider diversity of experience and background including race ethnicity and gender among the qualifications of our director candidates With the appointment of two new,8
female board members on August 1 2020 our board is 35 diverse based on gender and ethnicity Beginning with the 2022 Proxy Statement the board has begun disclosing each directors selfidentified diversity characteristics,8
Executive compensation Our Compensation Committee has oversight and approval of our compensation philosophy consistent with our risk appetite As described in our most recent Proxy Statement the Compensation Committee approves the executive compensation design In making its decisions the Compensation Committee takes into account advice and recommendations from an independent compensation consultant hired by the board as well as input from the Chairman and Chief Executive Officer Head of Human Resources the Chief Financial Officer and the Chief Risk Officer,12
