paragraph,predict_label
In 2018 we developed a Diversity Inclusion strategy that focused on four pillars our workforce the workplace the marketplace and the community In 2020 we focused this strategy with a view to develop and implement programs that make a meaningful impact across four dimensions inside to support our employees outside to support our clients and local communities today with programs that create immediate impact and tomorrow with programs that create impact over time,8
Demonstrating our commitment to our talent we expanded our professional development opportunities for our colleagues across all levels to develop and further hone their skills for the future including introducing and expanding several leadershipcentric programs,8
Organizing and governing to build and maintain trust,0
The board appointed the Nominating and Governance Committee to have primary oversight of our ESG programs and priorities as reflected in the committees updated charter To improve our process and reporting of Schwabs ESG efforts we have created a new ESG Policy and Reporting Office led by a Managing Director to build upon our efforts in 2021 and this inaugural report The position will be supported by a newly created team with the goal of advancing our ESG efforts on a crossfunctional basis together with our Through Clients Eyes strategy,3
The Community Development Group of Charles Schwab Banking Trust Services leverages our resources to reinvest in communities in ways that allow us to outperform our requirements under the Community Reinvestment Act CRA With the change in headquarters to Westlake Texas we amended our CRA Strategic Plan to specifically include the DallasFort Worth area and Texas more broadly We engaged in community outreach and other efforts to assess how we could not only fulfill but exceed our CRA requirements primarily through our CRA activities of supporting affordable housing small business development and community facilities as well as through community service and grants to support financial literacy,10
Founded in our belief that education can help solve some of the social issues facing our country Schwab has created impactful financial literacy programs supported by our financial people and intellectual resources As part of our 2020 DI strategy and community pillar in 2021 we introduced Moneywise America with a focus on youth from underresourced communities and schools,10
Recognizing that our environmental footprint has an impact on the climate at large we continue to take appropriate steps for the nature of our business that allow us to conduct our business in ways that reduce and mitigate our environmental impact These steps include solar projects and designing new facilities with energy efficiency at the forefront along with smaller ways of reducing our energy use,24
We believe investment stewardship begins with establishing and maintaining trust with our clients Our clients are longterm investors and we apply that same longterm lens to create and evolve our products and services in a manner that fosters trust and a resilient business,3
Through Clients Eyes guides how we do business,3
Trust is paramount in the many roles we play in serving our individual and institutional clients with their investment needs including As a broker empowering the individual investor with a spectrum of investment products and services,15
As a manager of separately managed accounts and proprietary investment funds professionally managed by our portfolio managers,12
In this section we highlight the ways clients can engage with us and how we are evolving our products and services including ESG offerings to match with the different ways clientsat any stage of lifecan take control of their financial futures We also discuss our relentless focus on protecting client assets,15
As a fiduciary for our clients we also outline how we exercise our proxy voting responsibility and shareholder engagement with issuers,12
From the beginning we set out to empower the individual investor Implicit in empowering our clients is helping them develop a sustainable investing approach that enables them to adapt to the market and their needs through lifes changes The retail investor remains our primary client base even as we have grown to serve institutional clients independent advisors and employers through our retirement plan services business Our focus has always been on serving the client through trusted relationships Staying true to our roots we offer a variety of products services and solutions for clients These include indexbased and actively managed thirdparty options Schwab proprietary mutual funds ETFs and separately managed accounts Many of these investment products include options dedicated to ESG considerations,3
The variety of ways that different clients can use our scale to personalize their investing is evident in our varied product offerings and the different service models we offer Our Through Clients Eyes strategy drives us to embody the diversity of our investor base and how different clients choose to approach investing Our spectrum of investment products educational tools and access to investment professionals lets clients choose how hightech andor hightouch of an investment experience they would like to create,8
Key ways clients can manage their investment journey include Selfdirected brokerage At Schwabcom,18
any individual in the US can open a brokerage account with any dollar amount Through our scale and offerings the individual investor who wants to control all aspects of their investments can access the whole suite of investment products and services available on Schwabcom These include our entire range of investment offerings These run the gamut of our Schwab proprietary options such as Schwab Funds and Schwab Stock Slicesand include stocks fixed income alternatives and thirdparty mutual funds and ETFs,4
Schwab Managed Portfolios portfolio solutions Schwab Asset Management creates and manages a number of distinct proprietary Schwab mutual funds and ETFs managed by our portfolio asset managers Schwab Managed Portfolios is an advice solution that uses Schwab Funds and ETFs and thirdparty mutual funds and ETFs to create a variety of model portfolios with different investment strategies intended to match a variety of risk tolerances and objectives,18
mutual fund clients have access to a range of investment strategies with direct ownership control and transparency of underlying securities The account is managed on a clients behalf by a thirdparty professional asset management firm of the clients choice that has been vetted by Charles Schwab Investment Advisory Inc CSIA based on rigorous researchbased quality standards Schwab Private Client Advisors Clients,0
and a Schwab Financial Consultant can work with a professional investment advisor to customize their portfolios,4
See more investment advice options on our Advice page,12
We cater to all individuals with accounts of any size We believe a strong relationship is based on transparency and trust and our website includes extensive explanations and details about how we are compensated for each product or service along with the associated risks potential conflicts of interest and other considerations,0
From the beginning we set out to empower the individual investor Implicit in empowering our clients is helping them develop a sustainable investing approach that enables them to adapt to the market and their needs through lifes changes,3
We recognize that increasingly individual and institutional clients are looking for ways to either manage portfolio risk by considering ESG factors or themed products andor have an impact on the world through sustainabilitythemed products that align with their values or both To meet these changing investment approaches Schwab is investing in ways to offer additional products and services that help empower clients with personalized investing,15
ESG is often used interchangeably with sustainability investing Whether its called ESG or socially responsible or sustainability investing these are terms that capture a way of investing that is being defined in many different ways and by many different stakeholders including by Schwab Asset Management At this time we use the term ESG investing as an umbrella term that encompasses Traditional investment vehicles either active or passive that are applying ESG factors to manage risk build resiliency and create opportunities for the long term,3
Social impact investing Valuesbased investing which can include screens to exclude certain sectors or types of companies such as tobacco firearms or fossil fuel companies,18
Currently Schwab offers clients access to approximately 401 thirdparty socially responsible investment or ESG options including ETFs The options available include funds identified by Morningstar as Sustainable Investment Overall which aligns with how Schwab classifies ESG See Socially Responsible Investing and Socially Responsible ETFs As of December 31 2021 these thirdparty funds represented approximately 273 billion in assets under management,3
As we move forward Schwab is evaluating its investment stewardship and strategy given our diverse client base while staying true to our Through Clients Eyes strategy This strategy is grounded in empowering the client to personalize their investing,3
The steps we have taken and are looking forward to further developing are,10
Head of ESG Strategy In 2020 we created,3
this position within Schwab Asset Management to serve as point for our vision and strategy on ways to further incorporate ESG or sustainabilitythemed product offerings and services,15
technology capabilities of fintech pioneer Motif in 2020 is playing a key role in implementing our Through Clients Eyes strategy Since the acquisition we continue to make strides using Motifs technology and data science to offer a more personalized investing experience including thematic investing which will allow impact and sociallyminded clients to select stocks aligned with their personal sustainability and ESGrelated interests and values,3
We continue to make strides using Motifs technology and data science to offer a more personalized investing experience including thematic investing which will allow impact and sociallyminded clients to select stocks aligned with their personal sustainability and ESGrelated interests and values,4
Wasmer Schroeder Strategies We also acquired Wasmer Shroeder in 2020 a fixed income investment manager This signaled a shift for us as we had historically fulfilled almost all our clients fixed income portfolio management needs through thirdparty asset managers Schwab Asset Management offers two positive impactfocused options with the Wasmer Schroeder Strategies Positive Impact Tax Exempt and Positive Impact Bond options As of December 31 2021 these strategies represent 393 million in assets under management,18
The Positive Impact Strategy considers the following to identify bonds that exhibit a positive impact on society and the environment whether there are clearly defined and quantifiable community andor environmental benefits expected from the financing whether the mandate or objectives of the lending program align with social environmental or community benefits or whether the proceeds will be used to create enhance sustain or improve upon an essential government function,10
Active Schwab Ariel ESG ETF In November 2021 Schwab launched the Schwab Ariel ESG ETF an actively managed semitransparent also referred to as a nontransparent ETF The ETF is designed to identify attractively valued highquality small and midcap companies with favorable ESG risk ratings based on a proprietary assessment of industry exposure disclosure and management of material ESG issues Please see the ETFs Summary Prospectus for more information Connecting with clients and nonclients Our educational resources and product offerings for clients are intentionally vast Socially responsible ESG and impact investing presents risks for some and opportunities for others We also recognize the changing demographics of clients and a desire among younger clients in particular to align their investments with their values,3
Through surveys in 2020 and 2021 Schwab Asset Management has connected with clients and potential clients across the income and age spectrum to listen to and gain an understanding of their familiarity interest needs and concerns with this investing style These engagements provided valuable information that we are using to find ways to create provide and tailor educational resources in a way that allows clients to build awareness fill knowledge gaps address any concerns and make informed investment choices for themselves as these investing approaches take shape,2
For more information on our history of providing industryleading products services advice and education see Access to Investing on the Schwab website,12
Shareholder engagement and proxy voting at Schwab Asset Management,4
Historically we have taken a mostly quantitative approach to evaluating investment options and strategies reflecting the largely passiveindex orientation to our investment products In 2020 we created a team and process for company and shareholder engagement with respect to the investment assets managed by Schwab Asset Management As a fiduciary for our clients Schwab Asset Management began to engage with certain issuers that met certain criteria andor requested to engage with us on matters important to them As we move through our second year of engagement we are building learning and enhancing a process and strategy to consistently and efficiently implement effective communication with select issuers and their shareholders on both a proactive and a reactive basis,3
As ESG matters become a more dominant focus in the investment process we expect to continue to build and refine our engagement process which includes engagement both during proxy season and offseason We intend to use the engagement process to better understand concerns and align with best practices as well as to inform our discretionary voting decisions on proxy contests environmental and social disclosurerelated shareholder proposals and certain sayonpay proposals,12
As the ESG space evolves the marketplace is also putting greater emphasis on the consideration of ESG factors in proxy voting Similarly the proxy advisors Glass Lewis and ISS are evolving their proxy voting recommendations to reflect the emphasis on ESG factors As part of our diligence in shaping our proxy voting guidelines we regularly engage with both proxy advisors to understand the thinking behind their respective policy updates which increasingly include updates regarding a variety of ESG factors,12
We maintain a proxy voting policy that guides our proxy votes for all securities held by the Schwab Funds and ETFs and other clients of Schwab Asset Management that have delegated proxy voting to us In general the recommendations of both Glass Lewis and ISS inform the Schwab Asset Management teams voting decisions Our proxy voting policy is publicly available on the Schwab Asset Management website,12
Schwab Asset Management is currently evaluating our ESG investment philosophy and continues to update our proxy voting policy to identify its approach to considering ESG factors We expect this process to be iterative and any updates to our proxy voting policy will be made available on the Schwab Asset Management website,12
In the meantime our proxy voting records are publicly available on our Investment Stewardship page,22
The foundation of our values is earning clients trust Schwabs cybersecurity and privacy programs play a key role in maintaining the trust of our stockholders our regulators and most importantly our clients,1
Cybersecurity defenseindepth approach As a financial institution we have implemented a defenseindepth approach for addressing cybersecurity risk that incudes technical administrative and procedural safeguards This means that if a control fails additional overlapping controls are in place to secure data and systems to mitigate threats,1
Technical safeguards Schwabs technical safeguards are designed to protect stockholder client and partner data in todays modern threat landscape Among other things these safeguards include,1
Intrusion detection and prevention tools Encryption of data in transit and at rest,1
Use of secure coding practices Periodic penetration testing and vulnerability,1
Disciplined patch management Robust authentication and authorization measures to guard against unauthorized access to data,1
Administrative safeguards Our commitment to cybersecurity includes teams that monitor and maintain the cybersecurity of Schwabs systems that collect use or store personal or confidential data We employ hundreds of cybersecurity professionals across all lines of business as part of this effort In addition to our operational staff cybersecurity is also a core component of both our external,1
and internal audit functions We review and test our safeguards on an ongoing basis as part of our audit program and we work diligently to consider additional safeguards where needed to address new and emerging threats,1
Procedural safeguards With technical and administrative safeguards in place we recognize that Schwab is part of a larger ecosystem As part of putting clients first we have instituted a number of clientfacing processes to help maintain their trust in the ecosystem,0
Schwabs Security Knowledge Center helps our clients understand common threats and the steps they can take to proactively mitigate those threats Additionally we regularly communicate with clients on security awareness risks and cybersecurity hygiene and we view cybersecurity as an important tool to combat elder financial abuse We routinely work with elder populations to better protect them from financial scams and various forms of social engineering See more on our Cybersecurity page,1
Privacybydesign approach Schwab has long been committed to privacy and privacybydesign principles Our privacy practices are detailed in our public Privacy Notice and our use of personal data is rooted in several core principles,22
We do not use personal data in unexpected ways and do not tolerate the misuse of data by marketing partners or others,22
We provide clients with control over how their data is used for marketing with optouts and unsubscribe mechanisms that are easy to find and use,22
We recognize we are custodians of our clients data in the same way that we are custodians of their financial assets,12
Chuck Schwabs original vision was to bring more people from Main Street into the world of investing so they could take ownership of their financial futures Almost 50 years later we remain as committed as ever to that vision of democratizing investing and operating our firm in a way thats as inclusive as possible for our clients and our employees,3
At Schwab our employees are the foundation of our business and at the heart of executing our Through Clients Eyes strategy Like all businesses the global pandemic that began in early 2020 has tested our people in a myriad of ways While we continue to navigate this challenging time our team remains focused on integrating the Schwab and TD Ameritrade teams as the result of one of the largest acquisitions in the financial services industry Its our obligation to support our employees in the best way we can and find ways to support their professional development and their diverse needs both at and away from work,8
Led by our Managing Director Head of Human Resources the team supporting talent acquisition and development was reorganized in 2021 to centralize and harmonize the different elements of the employee life cycleincluding talent acquisition management and development and workforce learningboth from a diversity and inclusion perspective as well as investing in all employees professional development Our Managing Director Head of Human Resources meets with the board in executive sessions for the Chief Executive Officer evaluation a talent review and Chief Executive Officer succession planning annually The Managing Director Head of Human Resources and Chief Risk Officer also have been providing the board with regular updates on pandemic planning throughout the pandemic,8
In 2018 we created an HR Advisory Council composed of representatives from a cross section of the organization The council creates an opportunity for dialogue and support for HR initiatives from a diverse set of internal stakeholders across the organization It is intended to provide a forum to discuss significant issues provide open and honest feedback offer a nonHR perspective be a sounding board for ideas and offer valuable input on project direction and potential obstacles,12
Key HR initiatives Reorganized HR team to allow for a more holistic and integrated approach to supporting our talent from acquisition to retirement Recommitted to a DI strategy for,8
the short and long term Expanded our professional,8
development opportunities to all employees with more choices to invest in themselves,8
We believe diversity helps us appreciate a wider range of perspectives which supports our business strategy to see Through Clients Eyes To that end we have been on a longterm journey to improve our workforce diversity enhance our inclusive culture better serve our diverse clients and build stronger connections to our diverse communities It is important for our business and our clients that our talent reflects the diverse communities of clients that they serve,8
Our fourpillar DI strategy In 2018 we created a fourpillar strategy to advance our Diversity Inclusion efforts,8
The Workforce Increasing and fostering diverse talent Schwab is focused on attracting more diverse talent through enhanced partnerships with professional organizations that represent diverse communities including women people of color people with disabilities and people with military backgrounds among others,8
The Workplace Creating and building on our culture of inclusion Through our Employee,8
Resource Groups ERGsemployeedriven groups developed around specific dimensions of diversity in support of our DI strategieswe are building and maintaining a community of support leadership development opportunities mentorship and connection to our diverse client base,8
The Marketplace Serving the needs of a diverse marketplace As the United States becomes more diverse the financial services industry is increasingly demanding new capabilities to meet the needs of diverse clients We are meeting our clients needs for financial education specific to their communities such as women people of color and LGBTQ individuals through customized education sessions among other program and resource offerings,8
The Community Making an impact on historically underrepresented communities At Schwab we focus on financial literacy as a way to empower diverse communities To that end we support many organizations serving underrepresented communities with longterm goals of broadening the diversity of our talent and clients Please see Giving Back to Our Communities for more information,8
In 2020 underpinned by our four pillars we focused on supporting our colleagues and communities of color by making meaningful impact across four dimensions,8
Today Programs that create immediate impact Tomorrow Programs the create impact,2
Schwabs Head of DI with a team of six is accountable for supporting the DI strategy across the organization and our talent acquisition and retention efforts Three members of the,8
team support different parts of our business and work with the respective leadership teams to help meet the unique needs of the business In 2021 we added a new position that will lead our new Accessibility and Accommodation Program The DI team supports our ERGs and DI programs as well as talent acquisition,8
We also created a DI Sponsorship Committee which is a subcommittee of our Executive Council This Sponsorship Committee provides centralized oversight and governance to ensure that DI partner sponsorships align with our fourpillar strategy,12
This work is hard and long term Our approach is to evaluate develop and implement programs aimed at advancing our workforce DI efforts both today offering immediate impact for our employees and with lasting impact tomorrow providing longterm change for our industry and communities,8
The following describes a number of ways that we are working toward these goals,10
True to our heritage Schwab takes actions to promote a fair and inclusive hiring process Some examples include,8
InterviewingSchwab To reduce potential bias and enhance diversity in the workplace we prioritize consistency in the interview process through our InterviewingSchwab program InterviewingSchwab provides interviewers the training and tools needed to effectively evaluate candidates using the Targeted Selection system This system is a competency based behavioral interviewing method that focuses on the quality of people hired,8
Biasdetection tools We implemented a biasdetection tool to ensure all job descriptions and recruiting communications are reflective of the diverse candidate pools we want to attract Through this tool all job descriptions and other recruiting communications are reviewed and updated to reduce language that may be harmful or offensive to certain underrepresented groups and to add more gender and ageneutral tones in the language used in our recruiting materials,8
Slate Analytics Diversity Dashboard To continuously monitor progress towards meeting the companys diverse talent attraction goals our Talent Acquisition team uses a Slate Analytics diversity dashboard to help track diversity statistics for candidate pools Seeing and monitoring realtime data of our candidate pools diversity allows us to adjust sourcing and other recruitment strategies,8
