paragraph,predict_label
With respect to our executive team to encourage collaboration and shared responsibility we take a rise together fall together approach to compensation as the performance metrics are based on organizational metrics with adjustments for individual performance See our most recent Proxy Statement for more information,10
Our board has oversight of managements execution of our Through Clients Eyes strategy This strategy emphasizes placing our clients perspectives needs and desires at the forefront of everything we do We use our scale and resources now further enhanced by the integrated TD Ameritrade teams coupled with expense discipline to reduce costs to ensure our products and solutions are affordable and responsive to client needs,15
Our strategy is based on the principle that developing trusted relationships will translate into more assets from new and existing clients ultimately building earnings growth and long term stockholder value,3
Our clientfocused organizational design is structured into two operating segments supported by several centralized support organizations offering products and services delivered by a number of specialized legal entities or subsidiaries This design allows us to maximize our focus on providing personalized client service while benefitting from the scale created by performing similar functions across distinct client groups In addition this design also enables the rationalization of decisionmaking and resource allocation,4
Until October 15 2021 our Chief Executive Officer also served as President However with the increased growth and success of the company the board and the Chief Executive Officer agreed to separate the Chief Executive Officer and President roles to share some of the increased duties related to growth As a result effective October 15 2021 the board appointed a new President reporting to the Chief Executive Officer,7
Organizationally our Executive Council led by our Chief Executive Officer consists of all Managing Directors running corporate functions or business lines with our Chief Risk Officer and General Auditor having reporting responsibilities to the board The Executive Council leads the,7
execution of our strategy To create a cohesiveness in how we execute we also maintain various councils including a Communications Council HR Advisory Council and Regulatory Strategy Council The councils do not have any formal reporting lines or decisionmaking authority Rather each council is a discussion forum made up of crossfunctional leaders which allows for strategic discussions and a diversity of perspectives,12
A fundamental commitment to strong and effective risk management is integral to achieving our vision and executing on our strategy to be the most trusted leader in investment services Our risk management is a competitive advantage for deepening trust among clients and other stakeholders and preserving our foundation of stability We continuously evolve risk management consistent with changes in our business and the regulatory environment,18
Our board is responsible for holding senior management accountable for implementing the boards approved risk tolerance maintaining an effective risk management structure that appropriately identifies monitors measures and controls major types of risk and managing the companys actions in a safe and sound manner Our 2021 Form 10K explains in more detail the various types of risk we manage,18
At the senior management level our executives manage the process of shaping policies and procedures for the business and control units to identify measure and control risks The Chief Risk Officer leads a Global Risk Committee comprised of senior executives from each major business and control function which is responsible for the oversight of risk management This includes identifying risks assessing risk management practices and the control environment reinforcing business accountability for risk management supervisory controls and regulatory compliance supporting resource prioritization across the,18
Our teambased companywide approach to risk management is formally structured with three lines of defense Our first line of defense is embedded in the business functions supported by the First Line Risk Management Office This independent organization supports our business units and support organizations by creating efficient and consistent risk management practices expanding risk identification management and reporting and ensuring effective integration of risk information within our business units,18
Our second line of defense is our Corporate Risk Management team which is responsible for developing and maintaining enterprise risk management It is also responsible for among other duties developing and maintaining the companys risk appetite framework and risk appetite monitoring metrics and for reporting risk matters to the boards Risk Committee,18
Our third line of defense is our Internal Audit Department Using a systematic disciplined approach this team evaluates and improves the effectiveness of risk management control and governance processes for the benefit of the first and second lines and for reporting to the Audit Committee of the board This helps the company to enhance and protect our enterprises value by providing riskbased and objective assurance advice and insight,0
organization and escalating significant issues to the board Several functional risk sub committees across the enterprise report to the Global Risk Committee,18
The Chief Risk Officer advises the board and its committees on risk management activities consistent with the companys risk appetite statements and strategic plan Our boards Risk Committee assists the full board in fulfilling these responsibilities by setting the types and levels of risk the company is willing to take and supporting the independence and stature of independent risk management More information on our boards Risk Committee is provided here,18
The boards Audit Committee reviews reports from management and the boards Risk Committee concerning the companys risk assessment and major risk exposures and the steps management has taken to monitor and control such exposures The boards Compensation Committee oversees incentive compensation risk and reviews the compensation program with respect to the potential impact of risktaking by employees The Compensation Committee is supported in part by a managementlevel Incentive Compensation Risk Oversight Committee that conducts the annual risk assessment of incentive plans,18
Our board has approved an Enterprise Risk Management framework that enables a comprehensive approach to managing risks encountered in the course of Schwabs business activities Our risk appetite under this frameworkdefined as the amount of risk the company is willing to accept in pursuit of its business activitiesis developed by senior management and approved by the board See our Annual Report for more information,18
The Compliance Risk Committee a functional risk subcommittee reporting to the Global Risk Committee oversees compliance risk management programs and policies This subcommittee includes additional sub committees covering fiduciary and conflicts of interest risk The Human Resources Policy Governance Committee is responsible for workforcerelated policies,12
We maintain a number of workplace and corporate compliance policies and standards as well as avenues for reporting and oversight We have a set of core policies and documents that serve as the foundation of our business and culture These include our Code of Business Conduct and Ethics Enterprise Risk Management Policy and Compliance Risk Management Policy Our Code of Business Conduct and Ethics captures our policies on General Corporate and Personal Standards of Conduct Conflicts of Interest Confidentiality of Information Employment Practices Business Practices and Compliance Procedures More importantly it underscores how we earn our clients trust by treating clients in an ethical empathetic and proactive way,0
supports the minimum requirements for risk management activities across Schwab and our framework described above,18
Our Compliance Risk Management Policy outlines our compliance risk management program consistent with our boardapproved compliance risk appetite,12
We separately maintain a number of additional policies covering a range of topics including employmentrelated policies antibribery antimoney laundering and conflicts of interest Schwab maintains a policy on Workplace Behavior Expectations which embodies expected standards of behavior that extend beyond an expectation of complying with laws such as antidiscrimination and antiharassment laws,0
For workplace issues we encourage open communication to resolve any conflicts by discussing concerns with managers compliance andor human resources all of whom will treat matters confidentially and are obligated not to engage in any retaliatory behavior Understanding that these matters can be uncomfortable we offer a number of alternatives for employees to assess a pathway to resolution These alternatives include working with Human Resources Consultants and our Corporate Responsibility Officer or using the Ombudsperson Program While each reporting matter can be made anonymously and treated confidentially using an outside ombudsperson allows for added assurance of confidentiality and anonymity We also offer employees the opportunity to make reports of suspected violations to the Corporate Responsibility Officer or to Conduct Risk Management via a tip line,0
We have a series of required trainings including for our Bank Secrecy Act BSAAntiMoney Laundering Program For example clientfacing employees and those who handle or move client assets receive education and training upon employment annually and whenever it is deemed that employee preparedness and performance for compliance needs to be tested and upgraded,0
Internal reporting channels and procedures are communicated through trainings and policies We maintain hotlines for antimoney laundering Office of Foreign Assets Control OFAC issues through the compliance department and corporate legal services Concerns about potential financial crimes may be confidentially reported to the BSA Officer in the Corporate AntiMoney Laundering Department in Financial Crimes Investigations and escalated to the Corporate Responsibility Officer,0
Schwab maintains a nonretaliation policy for any employee who reports or is the subject of any allegations of unlawful or unethical behavior in violation of laws Code of Conduct or any other policies,0
Guided by our longstanding vision to democratize investing and our belief that investing has the power to transform lives active participation in the regulatory and legislative process is one way we seek to fulfill our vision The Schwab Office of Legislative and Regulatory Affairs mission is to encourage and support the creation of responsible government policies that help our clients achieve their financial dreams and the company grow and be successful,12
We work to educate policymakers at the international federal state and local level about the effect of public policy proposals on individual investor and registered investment advisors We proactively encourage legislation and regulations that benefit our clients and individual investors generally and participate in the legislative and regulatory processes by communicating the companys views on policy proposals that affect investors We also keep our employees informed of key legislative issues to allow them to better serve our clients and enhance our clients abilities to achieve their investment goals,12
Oversight Our Office of Legislative and Regulatory Affairs located in Washington DC executes our lobbying activities with oversight by the Corporate General Counsel and the Nominating and Corporate Governance Committee of the Board of Directors which receives regular reports on lobbying activity in accordance with the mandate in its charter to review our public policy and advocacy activities Our head of Legislative and Regulatory Affairs has standing meetings with the General Counsel and the Legislative and Regulatory Affairs team meets regularly with the Regulatory Strategy Council a committee of senior executives that provides counsel and oversight of Schwabs advocacy strategies on policy issues of importance to clients and the company as well as our,12
relationships with trade associations Depending on the issue we engage with the appropriate business unit to gain insights that help shape the advocacy strategy needed to reflect our vision We provide quarterly reports on pending legislative and regulatory policy issues of significance to the company to the Risk Committee of the Board of Directors in addition to reports on lobbying activity provided to the Nominating and Corporate Governance Committee of the Board of Directors as mentioned above,12
The company is subject to extensive federal state and local lobbying disclosure requirements which include the filing of reports with Congress and applicable state agencies The companys reports on federal lobbying activities are publicly available on the websites of the US House of Representatives and the US Senate These reports provide information on activities to influence legislation through communication with any member or employee of Congress or with any covered executive branch official The reports also provide disclosure on expenditures for the applicable quarter describe the specific pieces of legislation that were the topic of communications and identify the individuals who lobbied on behalf of the company or any of its subsidiaries,12
In addition as required under state law we disclose our lobbying activity in the states in which we are actively engaged in lobbying In most cases these disclosures are publicly available at the government disclosure sites by following the instructions on each website and searching for Charles Schwab Corporation where appropriate,12
Our publicly available Statement on Public Policy and Political Participation further outlines the companys oversight with respect to lobbying activities and reporting,12
Political contributions Schwab does not endorse or financially support any political party or individual political candidate,12
Any financial support was previously and solely provided through Schwabs Political Action Committee PAC funded by voluntary contributions from our employees and directors As announced in January 2021 we discontinued the PAC and contributed the remaining funds to the Boys Girls Clubs of America and historically Black colleges and universities The PACs previous contributions are part of the public record and available on the Federal Election Commissions website,12
Relatedly we respect the right of our employees to individually participate in the political process Employees may participate in the political process or make political contributions from personal funds subject to applicable law and in accordance with our Statement on Public Policy and Political Participation,12
Advocacy Consistent with Schwabs vision and as described on our Advocacy and Ethics page we focus our advocacy efforts on policy positions that support our clients investment goals We also use our position as the leading custodian to drive awareness and support the continued growth of the independent Registered Investment Advisor RIA industry and our nearly 15000 client firms Some examples of our lobbying efforts include,12
advocated for improvements to the system by which market data is distributed to investors with the goal of leveling the playing field between the depth and quality of market information available to institutional investors and that available to individual investors Those efforts have included multiple comment letters to the SEC testifying at hearings on Capitol Hill and an ongoing education effort to help policymakers understand the differences between the cost and quality of information available to institutional and individual investors,18
Schwab has been a leader in the ongoing effort to ensure money market mutual funds remain a resilient investment option while also seeking to improve the transparency and stability of these funds As US and global regulators have made a series of changes to the rules governing money market funds Schwab has been a consistent participant submitting comment letters meeting with regulators and other policymakers and suggesting reforms that balance the needs of individual investors with the importance of ensuring the systemic stability of money market funds,18
We belonged to the following trade associations in 2020 and 2021 through our Office of Legislative and Regulatory Affairs American Bankers Association ABA American Bankers Association Securities,12
European Union Bank Policy Institute California Chamber of Commerce Consumer Bankers Association Council of Institutional Investors Financial Data Exchange Investment Company Institute ICI National Business Coalition on ECommerce,12
San Francisco Chamber of Commerce Securities Industry and Financial Markets,12
Securities Industry and Financial Markets Association Asset Management Group SIFMA AMG,12
Texas Bankers Association US Chamber of Commerce discontinued,12
Finally we are members of a number of trade associations that are core to our business and vision Trade associations provide valuable professional education training and networking opportunities Many trade associations also engage in lobbying activities on issues of importance to the businesses they represent,12
Schwabs membership in a trade association is not an endorsement of the groups activities or positions on public policy issues Indeed Schwabs views on an issue can and do differ from that of a trade association of which we are a member In keeping with federal requirements the percentage of dues paid to trade associations that are attributable to lobbying activities must be included in the calculation of the total amount the firm spends on lobbying on a quarterly basis Based on the information reported to us by these trade associations for 2021 the aggregate amount of our dues designated by these trade associations as attributable to the company for lobbying was approximately 792000 Finally the company also now discloses that it does not make any donations or payments to 501c4 social welfare nonprofits,12
Membership in trade associations that engage in lobbying activity is reviewed annually by the Nominating and Corporate Governance Committee of the Board of Directors and the company regularly evaluates its participation in trade associations and industry groups weighing the costs and benefits of continued membership From time to time the company determines not to renew its membership in an organization For example the company discontinued its membership in the US Chamber of Commerce in 2021,12
We provide selected banking services through Charles Schwab Banking Trust Services Schwab Bank Our banks are wholly owned subsidiaries of The Charles Schwab Corporation We opened our doors to banking in April 2003 by offering a narrow range of products for the benefit of our individual clients through Charles Schwab Bank,15
These products include interestbearing checking accounts and savings accounts and loan products such as overdraft lines of credit home equity lines of credit residential mortgage loans for home purchase and refinance and securitiesbased lines of credit,18
Two of our bank subsidiaries are subject to the Community Reinvestment Act CRA Through the Community Development Group of Charles Schwab Bank we take a strategic and tailored approach to meeting the needs of the communities in which we do business including the needs of low and moderateincome neighborhoods Our programs reflect our Through Clients Eyes strategy and increase access to investing support our DI programs enhance our efforts to give back to community and meet our requirements under the CRA,10
This section provides an overview of how we approach our CRA program and the impact we make on our communities in which we do business,10
Schwab Banks CRA committees are charged with the responsibility for implementing the CRA program The CRA Committee is composed of senior officers of Schwab Banking Trust Services and The Charles Schwab Corporation and is a subcommittee of Schwab Banks Management Committee Together the CRA Committee and the Management Committee,12
ensure that adequate resources are dedicated to the CRA program in order to implement the Schwab Banks CRA Strategic Plan,12
Schwab Banks Board of Directors is responsible for approving the CRA Strategic Plan and assessment areas and for appointing the CRA Officer who also serves as Chairperson of the CRA Committee and may delegate such authority as it deems appropriate The CRA Officer oversees a team responsible for Developing managing and coordinating CRA Strategic Plan implementation across business and support units,3
Providing community development loans investments and services as defined in the Strategic Plans,10
The diverse backgrounds of other CRA Committee members help ensure that each Strategic Plan is effectively administered,8
To comply with the CRA the CRA Committee develops a threeyear Strategic Plan that is tailored to the needs of a particular community Each plan is submitted for public comment and to the Federal Reserve Board for approval three months before the plans effective date The plans in effect for the period of this ESG Report expired December 31 2021 and new Strategic Plans have been approved for the period from January 1 2022 through December 31 2024,12
We generally evaluate an assessment area for four types of opportunities loans and investments primarily through Community Development Financial Institutions CDFIs and LowIncome Housing Tax Credit grants and community service In determining what opportunities to pursue we seek ways to understand the communities needs as influenced by a number of factors including population changes demographics economic and housing information unemployment rates poverty rates unbanked and underbanked households homeownership rates and market competition We also engage in community outreach which can include meetings with nonprofits state and local governments chambers of commerce and universities as well as hosting roundtables,2
Our evaluation and community outreach efforts help us assess and prioritize the needs of the communities and in turn our opportunities to leverage our resources to create impact Typically the needs include affordable housing small business development for job growth and financial capability We set annual goals based on how much we expect to lend and invest as well as annual goals for community service,10
Most recently with the change in Schwab Banks headquarters to Westlake Texas we amended our current Strategic Plan to include the DallasFort Worth area and determined that we could best serve the community by committing time and effort into building long term capacity with strong partnerships to yield lending and investing opportunities,3
facilities such as charter schools health care and childcare centers In 2020 we made 464 small business loans totaling 221 million and 17 community development loans totaling 3048 million,2
Affordable housing Another approximately 40 of our CRA program funds are used to create affordable housing These mostly consist of investing in real estate partnerships that invest in projects eligible for lowincome housing tax credits for multifamily affordable housing,2
Community service and grants Aligned with Schwabs broader community efforts to advance financial literacy Schwab Bank makes grants to advance the goals set forth above We provide grants to local organizations that deliver programs that advance these goals In 2020 we provided 2930 hours of community development services for the assessment areas in our 20192021 Strategic Plan,10
The Federal Reserve and previously the Office of the Comptroller of the Currency evaluates our performance and we have received an Outstanding CRA rating in our last three performance evaluations In support of this rating we met or exceeded our goals for performance under the lending investment and service tests of our Strategic Plans exceeding our annual interim goals for each of these tests,12
in loans to 464 small business in 2020,12
We typically employ an intermediary strategy for our investment and lending activities This allows us to partner with institutions and organizations that know the communities While our efforts are tailored to a community our focus and activities can include the following,10
Fueling local and regional economies We partner with and invest in CDFIs primarily throughout the Western United States Our loans and investments in CDFIs represent about 40 of our CRA program funds We seek to loan and invest in CDFIs that primarily support affordable housing as well as small business development microfinance and community,10
We are invested in our communities Aligned with our vision of being the most trusted leader in investment services we support our communities in a multitude of ways Our community initiatives advance financial literacy at all stages of life with a focus on underrepresented groups and communities Separately we support our communities through our volunteer efforts corporate and employee giving initiatives and mentorship,10
Serving our communities is also one key pillar in our fourpillar strategy for advancing our DI goals We believe that making an impact on historically underrepresented communities as well as supporting the communities where we work and live will lead to greater DI both within our own walls and throughout the marketplace,10
