paragraph,predict_label,count,different,empty,diff rate,empty rate
2021 TCFD Formosa Plastics Corporation Climaterelated Financial Disclosure Report,18,12,diff,,0.7090069284064665,0.279445727482679
FPCs Task Force on Climaterelated Financial Disclosures Report,13,26,diff,empty,,
33 Summary Table of Impact of Risks and,18,10,diff,,,
In recent years global warning due to greenhouse gas emissions has caused significant,25,25,,,,
risks to the global economy and has affected a lot of enterprises However it is difficult for,18,26,diff,empty,,
investors to learn which companies are susceptible to climate change risks which companies,13,25,diff,,,
are adequately prepared and which ones are taking response actions Accordingly the,5,5,,,,
Financial Stability Board FSB has assembled a special task force Task Force on Climate,13,7,diff,,,
related Financial Disclosures TCFD which has published its Recommendations of the Task,12,26,diff,empty,,
Force on Climaterelated Financial Disclosures the Recommendations in short in June,13,26,diff,empty,,
2017 after spending 18 months gathering opinions from business and financial leaders The,18,26,diff,empty,,
Recommendations provides businesses and investors with a complete and welldefined,4,26,diff,empty,,
assessment framework for disclosing risks and opportunities associated with climate change,13,10,diff,,,
In December 2021 to cope with the international trend Formosa Plastics Corporation,15,26,diff,empty,,
hereinafter referred to as FPC has committed to disclose the risks and opportunities,18,26,diff,empty,,
associated with climate change according to the Recommendations on the TCFD website in,13,25,diff,,,
order to demonstrate the responsibilities and strategies of FPC thereby appropriating capital,18,26,diff,empty,,
more reasonably and effectively to achieve the vision of lowcarbon economic transformation,3,26,diff,empty,,
The Board of Directors is the highest governing body to make decisions and supervise the Company in response to climate changes The Chairman of the Board is the leader and is responsible for overseeing issues and matters related to climate change,13,7,diff,,,
Report the climate changerelated matters of the company to the Board of Directors in order to use such information as important reference and basis for establishing sustainability directives,13,0,diff,,,
Establish an energy conservation and carbon reduction promotion team to handle the establishment and execution of response measures related to climate change The Chairman of the Board convene energy conservation and carbon reduction team meetings monthly in order to review execution progress and target achievement outcome,13,24,diff,,,
To demonstrate the companys determination in sustainable operations FPC has completed the TCFD support registration on the TCFD website in December 2021,12,26,diff,empty,,
Coal burning heading toward the low zero carbon energy transformation promote transformation of coal into gas replace old and obsolete coalburning boilers implement carbon capture and reuse promote hydrogen power generation,24,24,,,,
Energy conservation and carbon reduction circular economy implement artificial intelligence AI technology and apply to energy conservation equipment upgradeprocess optimization research and develop catalyst of low energy consumption,24,24,,,,
Increase renewable energy consumption construct solar power generation equipment and use the wind power of Formosa Heavy Industries Corporation,24,24,,,,
Other carbon reduction measures use biomass ethylene for the manufacturing of polyethylene PE recycle materials for renewable energy products lightweight product application and renewable energy equipment materials application,15,24,diff,,,
Collect analyze and summarize information on risks and opportunities of climate change and energy semiannually and identify and assess climate change related risks and opportunities according to ISO 14001 risk identification procedure,13,25,diff,,,
Use a risk matrix to determine major risks and opportunities and the assessment indicator includes financial impact level and risk and opportunity occurrence probability divided into 5 levels with the score from 1 to 5 points If the assessment total score is greater than or equal to 15 points it is considered as a major risk and opportunity and is assessed to have substantial potential impact on finance or strategy,18,10,diff,,,
FPC uses the year of 2020 as the base year and establishes the absolute target for carbon emission reduction including,21,25,diff,,,
Shortterm reduction target reduction of carbon emission by 20 from the base year in 2025,21,25,diff,,,
Mediumterm reduction target reduction of carbon emission by 40 from the base year in 2030,21,25,diff,,,
Longterm reduction target reach carbon neutrality in 2050,25,25,,,,
The capital of FPC is NT636 billion and its main businesses include production and sale,12,26,diff,empty,,
of plastics fibers and chemical raw materials FPCs annual production capacity for the products of PVC VCM and liquid caustic soda including overseas investees is ranked,15,26,diff,empty,,
among the top five manufacturer worldwide Other products of FPC are also ranked at,15,26,diff,empty,,
FPC values Environment Society and Corporate Governance ESGrelated issues as the,12,0,diff,,,
fundamental of corporate sustainable development Accordingly on May 10 2022,3,4,diff,,,
the Board of Directors has approved the establishment of the Sustainable Development,23,4,diff,,,
Committee in order to enhance the supervision responsibility of the Board of Directors,7,7,,,,
on sustainable matters in response to climate change,13,5,diff,,,
FPC has also established the Sustainable Development Promotion Task Force as shown in the image below The Chairman of,10,4,diff,,,
the Board acts as the convenor Senior Vice President acts as the deputy convener in charge of the establishment of corporate,7,7,,,,
sustainability strategy performance supervision and promotion of social responsibility and risk management,10,10,,,,
Climate change is considered to be an important issue in environmentrelated affairs Accordingly FPCs Board of Directors is the highest decision making and supervisory unit for climate change related operations and the Chairman of the Board acts as the,13,7,diff,,,
highest managerial officer in charge of supervising climate changerelated issues and affairs,13,25,diff,,,
FPC has established the Energy Conservation and Carbon Reduction Promotion Team in charge of collection of climate,13,24,diff,,,
changerelated information in order to establish response strategies and action plans In addition the Chairman of the Board,12,5,diff,,,
convenes Energy Conservation and Carbon Reduction Team meetings monthly in order to review execution progress and target,24,24,,,,
achievement outcome Furthermore the climate changerelated matters of the company are also reported to the Board of,13,7,diff,,,
Directors in order to use such information as important reference and basis for establishing sustainability directives,12,0,diff,,,
Taipei Office No 201 Tung Hwa N Rd Taipei City,12,26,diff,empty,,
Mailiao Complex No 1 Formosa Industrial Park Mailiao Township Yunlin County,17,26,diff,empty,,
Hsinkang Complex No 3 Zhongyang Industrial Park Zhongyang Village Hsinkang Township Chiayi County,3,26,diff,empty,,
4th Complex No 5 Jianji St Qianzhen Dist Kaohsiung City,12,26,diff,empty,,
Linyuan Complex No 1 Shihua 1st Rd Xizhou Village Linyuan Dist Kaohsiung City,3,26,diff,empty,,
Tungshan Complex No 201 Dongfu Rd Tungshan Township Yilan County,12,26,diff,empty,,
No 100 Shuiguan Rd Renwu Dist Kaohsiung City,12,26,diff,empty,,
14GovernanceMetrics and TargetsAppendix32Management of Climate Change Risks and OpportunitiesStrategyClimaterelated Financial Disclosure Report,13,12,diff,,,
FPC upholds the business philosophy of Equal Emphasis for Safety Health Environment and Economy and actively promotes pollution prevention and environmental protection including climate change based on the approach of root cause analysis and,13,9,diff,,,
continuous improvement in order to ensure sustainable operations and to fulfill social responsibility,10,10,,,,
With regard to the business strategy of FPC climate change is considered an important issue and it is also a challenge to be,13,25,diff,,,
overcome and a business opportunity to be seized by the company In response to the global ESG development trend and the,3,4,diff,,,
13 climate actions of the Untied Nation UN Sustainable Development Goals SDGs FPC aims to achieve the goal of carbon,13,25,diff,,,
neutrality by 2050 and has established four main aspects coalburning heading toward low zero carbon energy transformation,24,24,,,,
implementation of energy conservation carbon reductioncircular economy increase of renewable energy consumption and,24,24,,,,
execution of other carbon reduction measures The shortterm mediumterm and longterm carbon reduction strategies for each,25,25,,,,
1 Coalburning heading toward low zero carbon energy transformation,24,24,,,,
1 Promote the change of high carbon emission energy source of coal to the use of energy of relatively low carbon emission,21,24,diff,,,
such as natural gas For example replace the Renwu Utility Plant Linyuan Utility Plant coalburning and fuelburning boilers,25,25,,,,
of the company with gasburning boilers and replace old and obsolete coalburning boilers etc,24,26,diff,empty,,
2 FPC and academic units engage in the research and implementation of carbon,12,4,diff,,,
capture and reuse and a carbon sequestration pilot plant is set up at the Renwu,25,19,diff,,,
Complex in order to convert CO2 in the waste gas of the Utility Plant into methane,19,25,diff,,,
such that it can be used as the fuel for the cracking furnace of the VCM plant,24,26,diff,empty,,
Sustainable Development Website Carbon Dioxide Capture and Reuse,25,4,diff,,,
The aforementioned measures are expected to reduce 674 thousand tons of CO2e,25,26,diff,empty,,
2 Energy conservation carbon reduction and circular economy,24,24,,,,
1 Implement artificial intelligence AI technology such as the implementation of AI power plant use of AI technology to,1,26,diff,empty,,
optimize and adjust the steam and power supply of the entire complex in order to reduce waste of resource,19,19,,,,
2 Develop low power consumption electrolyzer and develop the worlds No 1 energysaving electrolyzer for the caustic soda plant with Formosas own technologies and the unit power consumption target is to be lower than 1960 kWhton of alkali heading toward the increased scale and size development in order to save on electrolyzer power consumption,24,4,diff,,,
3 Research and develop process with the use of catalysts of low energy consumption Through the new catalyst technology,24,4,diff,,,
the original cracking reaction temperature can be reduced from 480 C to below 250 C thereby reducing the fuel consumption and carbon emission,24,21,diff,,,
4 Continue to replace old and obsolete high energy consumption equipment and perform equipment upgrade and,24,24,,,,
The aforementioned measures are expected to reduce 569 thousand tons of CO2e,25,26,diff,empty,,
1 At the main plant sites of Renwu and Linyuan Complexes construct solar power generation equipment,24,24,,,,
2 Wind power Formosa Heavy Industries FHI invested by FPC with shareholdings of 3292 plans to develop wind power,12,24,diff,,,
generation and will wholesell the electricity and green power certificate to FPC in order to ensure the use of green power,24,24,,,,
and source of green power certificate without any difficulties,12,26,diff,empty,,
The preceding two renewable energy consumption plans are expected to reduce 708 thousand tons of CO2e,24,24,,,,
1 Assess the use of biomass ethylene for the manufacturing of polyethylene PE recycle materials for renewable products,15,15,,,,
2 In response to the governments policy FPC has implemented the measure of providing direct subsidy to employees for,12,5,diff,,,
the purchase replacement of new electric motorcycles in 2022 For the purchase of a new electric motorcycle a subsidy,12,26,diff,empty,,
of NT10000 is provided for the replacement of old vehicles with a new electric motorcycle a subsidy of NT16000 is,12,26,diff,empty,,
provided in order to encourage employees to consider the selection of electric motorcycles in priority if they have the,11,26,diff,empty,,
need to change their motorcycles The estimated subsidy total amount is approximately NT6215 millionNT9944,12,26,diff,empty,,
million FPC aims to implement carbon reduction together with employees and domestic electric motorcycle,12,25,diff,,,
3 Promote lowcarbon transportation policy Based on the consideration that the carbon emission of an energysaving,21,21,,,,
vehicle is at least 20 lower than a fuel vehicle since 2022 FPC starts to replace new small passenger cars light trucks,24,26,diff,empty,,
and old fuel vehicles aged above 11 years old with energysaving vehicles of hybrid vehicles or electric vehicles as priority,2,26,diff,empty,,
4 Continue to promote lightweight product application and renewable energy equipment materials application,15,24,diff,,,
The aforementioned carbon reduction measures are expected to assist the value chain to reduce 5255 million tons of CO2e,25,25,,,,
Coalburning heading toward low zero carbon energy transformation,24,24,,,,
Continue to develop and install low zero carbon power,24,21,diff,,,
Continue to research and develop carbon fixation technology,12,4,diff,,,
Continue to promote energy conservation and carbon reduction improvement projects,24,24,,,,
Assess the introduction of special new catalysts in the vinyl chloride process,15,26,diff,empty,,
Continue to implement AIAIoT technology research and develop technologies related to new catalyst and equipment upgrade,24,4,diff,,,
Install solar power generation equipment and collaborate with FHI in the installation of onshore wind power generation equipment,24,24,,,,
Assess the use of biomass ethylene for the manufacturing of PE,24,15,diff,,,
Use recycled materials and renewable products in the manufacturing process,15,15,,,,
Continue to promote a circular economy and develop ecofriendly products,15,26,diff,empty,,
Expand ecofriendly lowcarbon products promote product carbon footprint certification and smart management,15,24,diff,,,
14GovernanceMetrics and TargetsAppendix32Management of Climate Change Risks and OpportunitiesStrategyClimaterelated Financial Disclosure Report,13,12,diff,,,
All functional teams Sales Management Unit Management Unit Management Analysis Unit and Research and Development Unit,3,4,diff,,,
of the Presidents Office Safety and Health Department and all business departments Managers Office Technology Department Sales Department and Production Plant are responsible for the collection of information related to the risks and opportunities of,9,6,diff,,,
climate change and energy and a review is performed semiannually,13,24,diff,,,
Transformation risks policy and legal market technology reputation and physical risks chronic and acute are considered In,18,12,diff,,,
addition for events that may occur risk assessment including impact level impact duration short medium longterm parties,18,10,diff,,,
impacted in the value chain and risk probability are conducted,18,12,diff,,,
During the establishment of opportunity scenarios the resource efficiency energy source product and service market and,15,24,diff,,,
adaptability are considered In addition for events that may occur opportunity assessment including financial impact level,3,10,diff,,,
impact duration short medium longterm parties impacted in the value chain and the opportunities probability are conducted,3,10,diff,,,
Upon reviewing the Risk and Opportunity Matrix identification procedure described in the ISO 14001 Environmental Review,18,9,diff,,,
Operational Rules and after assessing the climate change related risks and opportunities for potential events of major risks,13,25,diff,,,
response strategies such as risk transfer or risk aversion and handling solutions such as reduction of the number of occurrence,18,12,diff,,,
reduction of financial impact in order to reduce possible loss caused by the risk are planned in advance and reported to the,18,10,diff,,,
2 All functional teams Sales Management Unit Management Unit Management Analysis Unit and Research and Development Unit of the President s Office Safety and Health Department and all business departments Manager s Office Technology Department Sales Department and Production Plant are responsible for the collection of information related to the risks and opportunities of climate change and energy,13,11,diff,,,
Step 2 Scope of risk and operations assessment,18,10,diff,,,
Step 3 Analysis of risk and operation impact,18,4,diff,,,
1 The scope of assessment includes upstream and downstream of the value chain,17,10,diff,,,
2 The organization boundary includes the Renwu Complex Linyuan Complex Taipei Office Tungshan,12,26,diff,empty,,
Complex Hsinkang Complex Mailiao Complex and 4th Complex,4,26,diff,empty,,
1 Convene climate change risk and opportunity identification review meeting semiannually,13,12,diff,,,
2 Use the matrix diagram of financial impact level and risk score 15 and opportunity occurrence probability score 15 to determine the risk and opportunity impact level,18,10,diff,,,
1 FPC uses the year of 2020 as the base year and establishes the absolute target for greenhouse gas emission reduction including,25,25,,,,
Reduction of 20 from the base year in 2025,12,19,diff,,,
Reduction of 40 from the base year in 2030,12,19,diff,,,
Convene identification review meetings semiannually on the risks and opportunities due to climate change,13,25,diff,,,
Impact and duration of impact short medium long,13,10,diff,,,
Parties impacted or affected in the value chain,18,26,diff,empty,,
The matrix diagram of financial impact level and risk and opportunity probability is used to determine the risk and opportunity,18,12,diff,,,
impact level The assessment indicator is divided into five levels with scores ranging from 1 to 5 points as shown in the image,12,10,diff,,,
No occurrence within a certain period of time such as 10 years,12,26,diff,empty,,
May occur more than once within a certain period of time such as 10 years,12,26,diff,empty,,
May occur many times within a certain period of time such as 10 yeas,12,26,diff,empty,,
Greater than NT1 billion but less than NT10 billion,12,26,diff,empty,,
Greater than NT100 million but less than NT1 billion,12,26,diff,empty,,
Greater than NT10 million but less than NT100 million,12,26,diff,empty,,
Transformation Risk Policy and Legal Renewable Energy Development Act,12,12,,,,
Opportunities Product and Service Renewable Energy Supply Chain,17,6,diff,,,
Transformation Risk Policy and Legal Carbon Tax Collection,12,12,,,,
Transformation Risk Market Carbon Reduction Demanded by Customer,18,25,diff,,,
For relevant content of each riskopportunity and response strategy please refer to 33 for details,18,5,diff,,,
14GovernanceMetrics and TargetsAppendix32Management of Climate Change Risks and OpportunitiesStrategyClimaterelated Financial Disclosure Report,13,12,diff,,,
33 Summary Table of Impact of Risks and Opportunities in the Company,18,10,diff,,,
Analysis of Current Risks or Opportunities possible impact on the company,18,4,diff,,,
1 The National Climate Change Action Guidelines and the Greenhouse,13,25,diff,,,
Gas Reduction and Management Act specify Taiwans longterm greenhouse gas reduction targets and establish a total greenhouse gas emission control and allocation method for manufacturing departments,25,25,,,,
2 In addition the amendment of the Greenhouse Gas Reduction,25,25,,,,
and Management Act in 2022 is expected to list manufacturers of large volume of carbon emission in the manufacturing industry with greenhouse gas emissions reaching 25 thousand tons of carbon dioxide equivalent CO2e and above as the subjects for carbon tax collection such that the cost and expenditure is increased Assuming that the carbon cost cannot be transferred the product price will be less competitive resulting in a significant financial impact,25,25,,,,
3 FPCs annual greenhouse gas emission exceeds 8 million tons and is classified as the large carbon emission manufacturer and will be one of the first organizations to be listed under control according to the law The Environmental Protection Administration EPA is expected to start the collection of carbon tax in 2024 In addition after 2026 the European Union EU will start the collection of carbon border tax and it is expected to cause an impact on vinyl chloride monomer VCM and polyvinyl chloride PVC,25,25,,,,
The amendment to the Renewable Energy Development Act in Taiwan was officially passed in April 2019 Since the contracted capacity 25000KW of electricity consumed by the Linyuan Complex of FPC located in Kaohsiung Taiwan is greater than the 5000 KW required by the law it is necessary to install 10 of the contracted capacity of renewable energy power generation facilities storage facilities or to purchase renewable energy certificates within five years otherwise monetary substitution must be paid,24,24,,,,
In recent years customers of plastic products are affected by the Paris Agreement and the Carbon Disclosure Project CDP such that they have started to develop lowcarbon green products and they also expect raw materials of the supply chain can also jointly reduce the carbon emission Accordingly users may reduce the purchase of nonlow carbon and non energy conservation products,15,24,diff,,,
1 In recent years due to the increasing trend of ESG financial institutions tend to evaluate clients ESG performance during the determination of investment and loan extension If a business fails to meet the ESG sustainability requirements its reputation can be negatively affected and financial institutions may increase the interest rates on loans or even refuse to provide loans to industries with high carbon emissions,18,21,diff,,,
2 During the COP26 Summit 40 countries have committed to gradually eliminating coalburning activities Regarding FPCs assessment results on the continuing coalburning activities it can cause an immediate impact on the reputation of the company,24,10,diff,,,
1 FPC establishes reasonable and feasible carbon emission transaction mechanism and relevant regulations through communication with,21,21,,,,
industry unions or association and the government in order to achieve a winwin solution,11,26,diff,empty,,
2 Coalburning heading toward the low zero carbon energy transformation promote the change of burning fuel from coal to gas replace,24,24,,,,
old and obsolete coalburning boilers and use electricity of lowcarbon source,24,26,diff,empty,,
3 Energy conservation carbon reduction and circular energy implement intelligent plant AI technology assistance improve raw materials,24,24,,,,
conversation rate reduce unit consumption equipment upgradeprocess optimization research and develop process with low energy,24,4,diff,,,
consumption catalyst install a carbon sequestration pilot plant and convert CO2 in the waste gas into methane burning fuel,19,25,diff,,,
4 FPC will implement an internal carbon pricing mechanism in 2022 with reference to the draft of the Climate Change Response Act in terms,13,25,diff,,,
of carbon fees and charges for excessive carbon emissions Relevant carbon emission cost is included in the internal income statement,21,21,,,,
as the basis for the implementation of carbon risk management In addition to continuing to establish greenhouse gas emission reduction,25,25,,,,
measures relevant information is an important indicator for performance evaluation products and operations and investment evaluation in,15,8,diff,,,
order to maintain the competitiveness of the company,4,26,diff,empty,,
Report the energy consumption water consumption and carbon emission of each plant to the responsible person of the Water Saving,20,20,,,,
and Energy Conservation Team on a monthly basis It is estimated that by 2030 the total investment amount in water saving and energy,24,24,,,,
conservation improvement plan will reach NT698 billion including the following investment costs,23,20,diff,,,
1 Coalburning heading toward low zero carbon energy transformation NT137 billion,24,24,,,,
2 Energy conservation carbon reduction and circular energy NT249 billion,24,24,,,,
1 To comply with the regulatory requirements the Engineering Div of FPC has proposed the response solution of installation of renewable,12,5,diff,,,
energy demonstration sites and to conduct preliminary assessment on the location and type of the renewable energy facility installation,24,24,,,,
Since all of the main complexes are located in central and southern Taiwan and daylight is abundant such that it is suitable for the installation,24,26,diff,empty,,
of solar power generation facilities After assessment photovoltaic energy of 114MW will be installed in order to comply with the regulatory,24,24,,,,
2 FPC plans to further purchase wind power and green power certificates from FHI in order to ensure adequate use of renewable energies and,24,24,,,,
After assessment the polypropylene PP plant in the Linyuan Complex will be established as a renewable energy demonstration site with the,24,10,diff,,,
installation of 652KW solar panel modules and the construction cost is approximately NT39120 thousand,24,24,,,,
Since 2018 FPC has promoted green product plans for the promotion of green products based on the eight aspects of energy efficiency,15,24,diff,,,
emission reduction waste reduction water saving toxicity free health renewable product and safety In addition based on such eight aspects,15,19,diff,,,
FPC continues to invest research and development resources and to expedite the product realization schedule in order to develop differential,15,4,diff,,,
