paragraph,predict_label,count,different,empty,diff rate,empty rate
Note 1 RCP refers to the Representative Concentration Pathways RCP For example RCP26 scenario refers to that the radiative forcing per square meter is increased by 26W,24,26,diff,empty,,
Note 2 Rainfall variability refers to the percentage obtained by dividing the difference between the annual rainfall of a certain area and the longterm average annual,13,26,diff,empty,,
rainfall of that area by the longterm average annual rainfall of that area,13,26,diff,empty,,
41 Carbon Reduction Absolute Targets and Emission Indicators,21,25,diff,,,
FPC s greenhouse gas emission inspected annually has been disclosed in the environmental aspect chapter of the Sustainability Report which is also verified by a third,25,25,,,,
party authentication such as SGS Taiwan and British Standards Institution BSI in order to,12,1,diff,,,
ensure the accuracy of the greenhouse gas emission The greenhouse gas emission for,25,25,,,,
Sustainable Development Website Greenhouse Gas and Energy Management,25,25,,,,
FPC has declared to enroll in the Science Based Target initiative SBTi and cooperates with the policy to adopt the progressive,2,12,diff,,,
approach for carbon reduction The greenhouse gas emission 8635 million tons in 2020 is used as the base year in order to,25,25,,,,
establish the shortterm mediumterm and longterm absolute targets for greenhouse gas emission Accordingly the greenhouse,25,25,,,,
gas emission in 2025 shortterm is set to be 20 less than the emission of base year reduced to 6908 million tons the,25,25,,,,
greenhouse gas emission in 2030 mediumterm is set to be 40 less than the emission of base year and carbon neutrality is set,25,25,,,,
14GovernanceMetrics and TargetsAppendix32Management of Climate Change Risks and OpportunitiesStrategyClimaterelated Financial Disclosure Report,13,12,diff,,,
FPC conducts an annual inventory of the relevance and emission data of Scope 3 and such data has been verified by a third,21,22,diff,,,
party authentication unit No plan and target related to Scope 3 were set in 2020,12,1,diff,,,
Land house and building machine and equipment transportation equipment electrical electronic and computer equipment boilers utility equipment general office equipment and miscellaneous equipment are included in the calculation,24,17,diff,,,
Include all fuel and energy activities such as coal pyrolysis low sulfur fuel oil and natural gas,24,21,diff,,,
100 of the emissions generated by the disposal of industrial wastes,19,19,,,,
Emissions from employees commuting to and from work with transportation vehicles,21,21,,,,
Relevance of business on upstream leased assets is relatively low,4,26,diff,empty,,
All products 81 are transported and sold to the doors of key customers,15,26,diff,empty,,
The calculated processing methods refer to injection extrusion aggregation film blowing products For the rest of products numerous processes are performed such that presently they cannot be analyzed,15,26,diff,empty,,
For the plastic raw materials manufactured by FPC the products need to be processed after being sold and no greenhouse gas emission is generated from the use of the products sold,25,25,,,,
Calculate the carbon emissions from the endoflife treatment of cartons and plastic packaging materials used in sold products,15,21,diff,,,
Relevance of business on downstream leased asset is relatively low,4,26,diff,empty,,
The relevance for investment in business capable of generating additional greenhouse gas emission is relatively low,25,25,,,,
In addition to the establishment of the carbon reduction target FPC has also established the energy saving target for reducing 5,24,24,,,,
of the unit energy consumption and continuously increasing the energy use efficiency In 2021 the energy conservation for steam,24,24,,,,
was increased by 6 from 2020 and the electricity saving was increased by 29 The implementation status of energysaving,24,26,diff,empty,,
for steam electricity and fuel related to greenhouse gas emissions in 2021 is summarized as follows,25,25,,,,
FPCs Energy Conservation Performance Execution Status in 2021,24,24,,,,
Source of Data FPCs safety and health environmental management computer database this database is used as the basis for the calculation Note 1 fuel is under Scope 1 externally purchased electricity and steam are under Scope 2 The type of greenhouse gas emission reduced includes carbon dioxide,25,9,diff,,,
Note 2 1 ton of steam 3008 MJ 1kWh of electricity 36 MJ,24,26,diff,empty,,
FPCs other energy conservation and carbon reduction targets are as follows,24,24,,,,
Sustainable Development Website Water Resource Use and Management,20,4,diff,,,
In addition to the methods of process improvement equipment performance enhancement operating criteria optimization,15,8,diff,,,
waste recycle and reuse in order to increase the water consumption efficiency FPC also promotes the rainwater recycle and,19,20,diff,,,
reuse Accordingly the product unit water consumption is expected to be 5 less than the average value of previous year,20,20,,,,
2 Complete main product carbon footprint inspection in 2022,15,24,diff,,,
To enhance the carbon management in addition to the establishment of the carbon emission target FPC has obtained,25,21,diff,,,
product life cycle assessment and verification certificates including carbon footprint inspection issued by a third party since,15,24,diff,,,
2019 and FPC has also declared that the main product carbon footprint inspection is to be completed in 2022,15,24,diff,,,
3 Electricity for the administrative area of the complex will completely use renewable energy in 2025,24,24,,,,
FPC plans to gradually increase the renewable energy use ratio via the methods of selfinstallation of renewable energy power,24,24,,,,
generation facilities and purchase of green electricity The target for the renewable energy is to completely use renewable,24,24,,,,
energy for the electricity consumption of the administrative area of the complex in 2025,24,24,,,,
4 Complete the greenhouse gas inspection verification for all levels of subsidiaries listed in the consolidated,25,25,,,,
All levels of subsidiaries listed in the consolidated financial statements of FPC have implemented the greenhouse gas emission,25,25,,,,
inspection work The third party verification work is expected to complete in 2025 and relevant information will be disclosed in,12,26,diff,empty,,
5 Invest in plastic recycle and reuse develop and sell products containing recycled plastic pellets,15,19,diff,,,
1 Develop HDPE containing recycled plastic pellets which can be sold to manufacturers of cleaning agent bottles and,19,26,diff,empty,,
containers The sales ratio will be increased from 0 in 2021 to 50 in 2025,24,26,diff,empty,,
2 Develop PP containing recycled plastic pellets which can be sold to manufacturers of woven bags The sales ratio will be,15,26,diff,empty,,
increased from 0 in 2021 to 20 in 2025,12,26,diff,empty,,
14GovernanceMetrics and TargetsAppendix32Management of Climate Change Risks and OpportunitiesStrategyClimaterelated Financial Disclosure Report,13,12,diff,,,
