paragraph,predict_label,count,different,empty,diff rate,empty rate
highvalue and prospective products thereby transforming the climate change issue into business opportunities and increasing corporate value,13,25,diff,,,
For example the use of biomass ethylene made from the raw materials of sugar cane and corn for the manufacturing of PE is able to reduce,6,15,diff,,,
1 In 2017 FPC has established the Composite Materials Center and in 2021 FPC has continued to develop polypropylene PP green,15,26,diff,empty,,
products emission reduction such as EPP foam bead raw materials that can be used for the vehicle dashboard decorative panel lamp,21,19,diff,,,
inner casing and bumper thereby effectively reducing vehicle weight saving vehicle energy consumption and greenhouse gas emission,25,25,,,,
2 To develop PP green products 2 management staff are necessary to participate in this project and FPC makes the estimation based on,15,11,diff,,,
the average monthly salary of NT52600 per person the estimated management cost is NT12624 millionyear,11,11,,,,
1 FPC actively participates in domestic and foreign ESG rating and advocacies such as The Carbon Disclosure Project CDP TCFD advocacy,12,10,diff,,,
and Science Based Target initiative advocacy etc demonstrating the companys determination in promoting ESG and carbon reduction,25,25,,,,
2 In addition FPC also actively heads toward the lowcarbon energy transformation and in the future the company will guide waste gas into,19,19,,,,
the coalburning boilers in order to reduce the fuel consumption,24,26,diff,empty,,
Replace the coalburning and fuelburning boilers of the Utility Plant of the Renwu and Linyuan Complexes with gasburning boilers The,24,26,diff,empty,,
33 Summary Table of Impact of Risks and Opportunities in the Company,18,10,diff,,,
Analysis of Current Risks or Opportunities possible impact on the company,18,4,diff,,,
1 The National Climate Change Action Guidelines and the Greenhouse,13,25,diff,,,
Gas Reduction and Management Act specify Taiwans longterm,25,25,,,,
greenhouse gas reduction targets and establish a total greenhouse gas,25,25,,,,
emission control and allocation method for manufacturing departments,21,15,diff,,,
2 In addition the amendment of the Greenhouse Gas Reduction,25,25,,,,
and Management Act in 2022 is expected to list manufacturers of,15,11,diff,,,
large volume of carbon emission in the manufacturing industry with,21,15,diff,,,
greenhouse gas emissions reaching 25 thousand tons of carbon dioxide,25,25,,,,
equivalent CO2e and above as the subjects for carbon tax collection,12,21,diff,,,
such that the cost and expenditure is increased Assuming that the,12,26,diff,empty,,
carbon cost cannot be transferred the product price will be less,15,21,diff,,,
3 FPCs annual greenhouse gas emission exceeds 8 million tons and is,25,25,,,,
classified as the large carbon emission manufacturer and will be one,21,21,,,,
of the first organizations to be listed under control according to the law,12,12,,,,
The Environmental Protection Administration EPA is expected to start the,23,9,diff,,,
collection of carbon tax in 2024 In addition after 2026 the European,12,21,diff,,,
Union EU will start the collection of carbon border tax and it is expected,12,21,diff,,,
to cause an impact on vinyl chloride monomer VCM and polyvinyl,6,10,diff,,,
The amendment to the Renewable Energy Development Act in Taiwan,12,4,diff,,,
was officially passed in April 2019 Since the contracted capacity 25000KW,24,26,diff,empty,,
of electricity consumed by the Linyuan Complex of FPC located in,24,26,diff,empty,,
Kaohsiung Taiwan is greater than the 5000 KW required by the law it is,12,12,,,,
necessary to install 10 of the contracted capacity of renewable energy,24,24,,,,
power generation facilities storage facilities or to purchase renewable,24,24,,,,
energy certificates within five years otherwise monetary substitution must,12,24,diff,,,
In recent years customers of plastic products are affected by the Paris,15,26,diff,empty,,
Agreement and the Carbon Disclosure Project CDP such that they have,12,12,,,,
started to develop lowcarbon green products and they also expect raw,15,26,diff,empty,,
materials of the supply chain can also jointly reduce the carbon emission,17,21,diff,,,
Accordingly users may reduce the purchase of nonlow carbon and non,24,21,diff,,,
1 In recent years due to the increasing trend of ESG financial institutions,18,26,diff,empty,,
tend to evaluate clients ESG performance during the determination,3,8,diff,,,
of investment and loan extension If a business fails to meet the ESG,12,26,diff,empty,,
sustainability requirements its reputation can be negatively affected,17,0,diff,,,
and financial institutions may increase the interest rates on loans or even,12,26,diff,empty,,
refuse to provide loans to industries with high carbon emissions,25,21,diff,,,
2 During the COP26 Summit 40 countries have committed to gradually,12,26,diff,empty,,
on the continuing coalburning activities it can cause an immediate,5,26,diff,empty,,
1 FPC establishes reasonable and feasible carbon emission transaction mechanism and relevant regulations through communication with,21,21,,,,
industry unions or association and the government in order to achieve a winwin solution,11,26,diff,empty,,
2 Coalburning heading toward the low zero carbon energy transformation promote the change of burning fuel from coal to gas replace,24,24,,,,
old and obsolete coalburning boilers and use electricity of lowcarbon source,24,26,diff,empty,,
3 Energy conservation carbon reduction and circular energy implement intelligent plant AI technology assistance improve raw materials,24,24,,,,
conversation rate reduce unit consumption equipment upgradeprocess optimization research and develop process with low energy consumption catalyst install a carbon sequestration pilot plant and convert CO2 in the waste gas into methane burning fuel,24,25,diff,,,
4 FPC will implement an internal carbon pricing mechanism in 2022 with reference to the draft of the Climate Change Response Act in terms of carbon fees and charges for excessive carbon emissions Relevant carbon emission cost is included in the internal income statement as the basis for the implementation of carbon risk management In addition to continuing to establish greenhouse gas emission reduction measures relevant information is an important indicator for performance evaluation products and operations and investment evaluation in order to maintain the competitiveness of the company,25,25,,,,
Report the energy consumption water consumption and carbon emission of each plant to the responsible person of the Water Saving and Energy Conservation Team on a monthly basis It is estimated that by 2030 the total investment amount in water saving and energy conservation improvement plan will reach NT698 billion including the following investment costs 1 Coalburning heading toward low zero carbon energy transformation NT137 billion 2 Energy conservation carbon reduction and circular energy NT249 billion 3 Increase renewable energy consumption NT218 billion 4 Other carbon reduction measures NT940 million,24,24,,,,
1 To comply with the regulatory requirements the Engineering Div of FPC has proposed the response solution of installation of renewable,12,5,diff,,,
energy demonstration sites and to conduct preliminary assessment on the location and type of the renewable energy facility installation Since all of the main complexes are located in central and southern Taiwan and daylight is abundant such that it is suitable for the installation of solar power generation facilities After assessment photovoltaic energy of 114MW will be installed in order to comply with the regulatory requirements,24,24,,,,
2 FPC plans to further purchase wind power and green power certificates from FHI in order to ensure adequate use of renewable energies and,24,24,,,,
After assessment the polypropylene PP plant in the Linyuan Complex will be established as a renewable energy demonstration site with the installation of 652KW solar panel modules and the construction cost is approximately NT39120 thousand,24,24,,,,
Since 2018 FPC has promoted green product plans for the promotion of green products based on the eight aspects of energy efficiency emission reduction waste reduction water saving toxicity free health renewable product and safety In addition based on such eight aspects FPC continues to invest research and development resources and to expedite the product realization schedule in order to develop differential highvalue and prospective products thereby transforming the climate change issue into business opportunities and increasing corporate value For example the use of biomass ethylene made from the raw materials of sugar cane and corn for the manufacturing of PE is able to reduce the carbon footprint,15,19,diff,,,
1 In 2017 FPC has established the Composite Materials Center and in 2021 FPC has continued to develop polypropylene PP green,15,26,diff,empty,,
products emission reduction such as EPP foam bead raw materials that can be used for the vehicle dashboard decorative panel lamp inner casing and bumper thereby effectively reducing vehicle weight saving vehicle energy consumption and greenhouse gas emission 2 To develop PP green products 2 management staff are necessary to participate in this project and FPC makes the estimation based on,21,25,diff,,,
the average monthly salary of NT52600 per person the estimated management cost is NT12624 millionyear,11,11,,,,
1 FPC actively participates in domestic and foreign ESG rating and advocacies such as The Carbon Disclosure Project CDP TCFD advocacy and Science Based Target initiative advocacy etc demonstrating the companys determination in promoting ESG and carbon reduction outcome,25,25,,,,
2 In addition FPC also actively heads toward the lowcarbon energy transformation and in the future the company will guide waste gas into,19,19,,,,
the coalburning boilers in order to reduce the fuel consumption,24,26,diff,empty,,
Replace the coalburning and fuelburning boilers of the Utility Plant of the Renwu and Linyuan Complexes with gasburning boilers The estimated investment is NT137 billion,24,26,diff,empty,,
14GovernanceMetrics and TargetsAppendix32Management of Climate Change Risks and OpportunitiesStrategyClimaterelated Financial Disclosure Report,13,12,diff,,,
Analysis of Current Risks or Opportunities possible impact on the company,18,4,diff,,,
1 With the period of 19862005 as the base period the recent weather,13,26,diff,empty,,
condition at the complex 20162035 is predicted Under the scenarios of RCP45 and RCP85 the maximum consecutive days of precipitation are 59129 days with a total precipitation of 1017mm2373mm For the RCP85 scenario it is predicted that the number of typhoons in Taiwan will decrease by 15 the rate of strong typhoons will increase by 100 and the typhoon precipitation will increase by 20 2 Considering the impact of strong winds or typhoons caused by,13,10,diff,,,
abnormal climate events it is necessary to provide safe shutdown at the complex in order to prevent process hazard Considering the impact of heavy rainfallflood operations at the complex will be suspended due to floods resulting in revenue loss,5,9,diff,,,
1 With the period of 19862005 as the base period the recent weather condition at the complex 20162035 is predicted For each year there will be a period of two months with the condition of water shortage or drought,20,13,diff,,,
2 Water shortage or drought caused by abnormal climate will cause,20,13,diff,,,
Considering the product life cycle and product value chain in 2021 FPC has invested an amount of NT273 billion in research and development in order to develop lowcarbon products FPC has made improvements in three aspects of reducing the consumption of raw materials improving the process and reducing transportation in the supply chain while adopting the concept of a circular economy by recycling and reusing the waste gas and waste from the processes in order to reduce production costs and to promote the sustainable use of resources at the same time,15,19,diff,,,
1 According to the requirements of EUs new vehicle emission standard imposed on the automobile manufacturing industry by 2030 the average carbon dioxide emission of new exfactory vehicles and vans must be reduced by 13 from the emission in 2021,21,15,diff,,,
2 The lightweight PP material manufactured by FPC can be applied to auto parts thereby reducing vehicle weight and improving fuel efficiency and reducing carbon emission Accordingly the sales order on such material is expected to increase in the future,24,24,,,,
Paris Agreement was passed in the UN COP21 Summit on December 12 2015 Nations around the globe all agree with the voluntary reduction of greenhouse gas emission and the world is under the crucial era for energy transformation Renewable energyrelated issues will become the new engine driving the economic growth in the future Since the products manufactured by FPC can be applied to wind power generation and solar power generation the product revenue is expected to increase in the future,25,24,diff,,,
FPC periodically monitors and manages the energy consumption and water consumption of each complex on a monthly basis and establishes,24,20,diff,,,
climate change countermeasures to mitigate the risk arising from the climate change,13,25,diff,,,
1 The Renwu Complex is installed with the flood control pumps and inspection repair and maintenance are performed periodically in order,5,26,diff,empty,,
to reduce the occurrence of flooding in the complex due to heavy rainfallflood To maintain the normal operations of the flood control,5,26,diff,empty,,
facility the annual flood control pump maintenance repair and inspection expense is approximately NT1622 thousand,5,26,diff,empty,,
2 For the Mailiao Complex major desilting and dredging operation is performed annually and its annual cost is approximately NT37085,23,26,diff,empty,,
thousand in order to reduce the probability of flooding in the complex due to heavy rainfallflood,5,26,diff,empty,,
FPC periodically monitors and manages the energy consumption and water consumption of each complex on a monthly basis and establishes,24,20,diff,,,
climate change countermeasures to mitigate the risk arising from the climate change,13,25,diff,,,
1 To cope with potential risk of production suspension due to water shortage or drought at the complex the Renwu Complex has excavated,20,12,diff,,,
2 antidrought wells and an amount of 2300 M3 water supply can be increased daily,20,20,,,,
2 FPC also cooperates with government departments to develop the subsurface water of the Donggang River and Gaoping River in order,20,20,,,,
to stabilize the water source supply In addition FPC also assesses the development of the Huliao River high ammonia nitrogen wastewater,20,20,,,,
treatment in order to acquire water rights via the reclaimed water exchange method,20,20,,,,
FPC implements a circular economy and develops PCR postconsumer recycled resin materials in order to effectively reduce the oil extraction,15,26,diff,empty,,
plastics raw materials production and carbon emission of the product,15,21,diff,,,
PP renewable materials will be used in the PCR woven bags and the annual production and sales volume for 2025 is estimated to be 1620,15,26,diff,empty,,
tonsyear and is expected to increase the revenue by NT2160 thousandyear,12,26,diff,empty,,
FPCs Polypropylene PP Div has developed lightweight PP ecofriendly automobile materials that can be used for vehicle dashboard,15,26,diff,empty,,
decorative panel lamp inner casing and bumper thereby effectively reducing vehicle weight saving vehicle energy consumption and reducing,24,24,,,,
The estimated existing lightweight PP material sales volume is 61313 tonsyear and it is expected to increase the revenue by NT2262449,15,26,diff,empty,,
To cope with the international trend FPC continues to research and develop carbon fiber used for the wind power generator blades the EVA,15,24,diff,,,
materials used for solar power packaging film and HDPE used for solar power offshore platform pipelines,19,24,diff,,,
1 In 2022 the global demand for offshore wind power continues to increase and the demand for largetow carbon fiber is greater than,24,24,,,,
supply FPCs wind power carbon fiber revenue in 2022 increases by NT336000 thousand from the revenue in 2021,24,24,,,,
2 In alignment with the global energy conservation and carbon reduction and new energy development trends according to the,24,24,,,,
resolution approval of FPCs Board of Directors on May 10 2022 FPC invests NT175 billion to jointly establish Formosa Smart Energy,12,7,diff,,,
Tech Corporation to promote the transformation and development of the energy industry which will integrate the new energyrelated,24,4,diff,,,
departments within the Formosa Group to build a layout in the new energy industry,12,24,diff,,,
Taiwan will decrease by 15 the rate of strong typhoons will increase by,13,26,diff,empty,,
100 and the typhoon precipitation will increase by 20,13,26,diff,empty,,
1 With the period of 19862005 as the base period the recent weather,13,26,diff,empty,,
condition at the complex 20162035 is predicted Under the scenarios,12,26,diff,empty,,
of RCP45 and RCP85 the maximum consecutive days of precipitation,23,26,diff,empty,,
are 59129 days with a total precipitation of 1017mm2373mm,23,26,diff,empty,,
For the RCP85 scenario it is predicted that the number of typhoons in,13,26,diff,empty,,
2 Considering the impact of strong winds or typhoons caused by,13,10,diff,,,
abnormal climate events it is necessary to provide safe parking at the,13,25,diff,,,
complex in order to prevent process hazard Considering the impact of,5,9,diff,,,
heavy rainfallflood operations at the complex will be suspended due,5,26,diff,empty,,
condition at the complex 20162035 is predicted For each year,12,26,diff,empty,,
1 With the period of 19862005 as the base period the recent weather,13,26,diff,empty,,
there will be a period of two months with the condition of water shortage,20,20,,,,
2 Water shortage or drought caused by abnormal climate will cause,20,13,diff,,,
Considering the product life cycle and product value chain in 2021 FPC,15,26,diff,empty,,
has invested an amount of NT273 billion in research and development,2,4,diff,,,
in order to develop lowcarbon products FPC has made improvements in,15,26,diff,empty,,
three aspects of reducing the consumption of raw materials improving the,24,26,diff,empty,,
process and reducing transportation in the supply chain while adopting,17,17,,,,
the concept of a circular economy by recycling and reusing the waste gas,19,19,,,,
and waste from the processes in order to reduce production costs and to,19,19,,,,
promote the sustainable use of resources at the same time,23,26,diff,empty,,
1 According to the requirements of EUs new vehicle emission standard,21,26,diff,empty,,
imposed on the automobile manufacturing industry by 2030 the,24,15,diff,,,
average carbon dioxide emission of new exfactory vehicles and vans,21,21,,,,
must be reduced by 13 from the emission in 2021,21,26,diff,empty,,
2 The lightweight PP material manufactured by FPC can be applied,15,26,diff,empty,,
to auto parts thereby reducing vehicle weight and improving fuel,24,26,diff,empty,,
efficiency and reducing carbon emission Accordingly the sales order,21,24,diff,,,
on such material is expected to increase in the future,15,26,diff,empty,,
Paris Agreement was passed in the UN COP21 Summit on December,12,26,diff,empty,,
12 2015 Nations around the globe all agree with the voluntary reduction,12,19,diff,,,
of greenhouse gas emission and the world is under the crucial era for,25,25,,,,
energy transformation Renewable energyrelated issues will become the,24,24,,,,
new engine driving the economic growth in the future Since the products,15,4,diff,,,
manufactured by FPC can be applied to wind power generation and solar,24,24,,,,
power generation the product revenue is expected to increase in the,15,24,diff,,,
Analysis of Current Risks or Opportunities possible impact on the company,18,4,diff,,,
FPC periodically monitors and manages the energy consumption and water consumption of each complex on a monthly basis and establishes climate change countermeasures to mitigate the risk arising from the climate change,13,25,diff,,,
1 The Renwu Complex is installed with the flood control pumps and inspection repair and maintenance are performed periodically in order to reduce the occurrence of flooding in the complex due to heavy rainfallflood To maintain the normal operations of the flood control facility the annual flood control pump maintenance repair and inspection expense is approximately NT1622 thousand,5,26,diff,empty,,
2 For the Mailiao Complex major desilting and dredging operation is performed annually and its annual cost is approximately NT37085,23,26,diff,empty,,
thousand in order to reduce the probability of flooding in the complex due to heavy rainfallflood,5,26,diff,empty,,
FPC periodically monitors and manages the energy consumption and water consumption of each complex on a monthly basis and establishes climate change countermeasures to mitigate the risk arising from the climate change,13,25,diff,,,
1 To cope with potential risk of production suspension due to water shortage or drought at the complex the Renwu Complex has excavated,20,12,diff,,,
2 antidrought wells and an amount of 2300 M3 water supply can be increased daily,20,20,,,,
2 FPC also cooperates with government departments to develop the subsurface water of the Donggang River and Gaoping River in order to stabilize the water source supply In addition FPC also assesses the development of the Huliao River high ammonia nitrogen wastewater treatment in order to acquire water rights via the reclaimed water exchange method,20,20,,,,
FPC implements a circular economy and develops PCR postconsumer recycled resin materials in order to effectively reduce the oil extraction plastics raw materials production and carbon emission of the product,15,21,diff,,,
PP renewable materials will be used in the PCR woven bags and the annual production and sales volume for 2025 is estimated to be 1620 tonsyear and is expected to increase the revenue by NT2160 thousandyear,15,26,diff,empty,,
FPCs Polypropylene PP Div has developed lightweight PP ecofriendly automobile materials that can be used for vehicle dashboard decorative panel lamp inner casing and bumper thereby effectively reducing vehicle weight saving vehicle energy consumption and reducing greenhouse gas emission,25,25,,,,
The estimated existing lightweight PP material sales volume is 61313 tonsyear and it is expected to increase the revenue by NT2262449 thousandyear,15,26,diff,empty,,
To cope with the international trend FPC continues to research and develop carbon fiber used for the wind power generator blades the EVA materials used for solar power packaging film and HDPE used for solar power offshore platform pipelines,15,24,diff,,,
1 In 2022 the global demand for offshore wind power continues to increase and the demand for largetow carbon fiber is greater than,24,24,,,,
supply FPCs wind power carbon fiber revenue in 2022 increases by NT336000 thousand from the revenue in 2021,24,24,,,,
2 In alignment with the global energy conservation and carbon reduction and new energy development trends according to the,24,24,,,,
resolution approval of FPCs Board of Directors on May 10 2022 FPC invests NT175 billion to jointly establish Formosa Smart Energy Tech Corporation to promote the transformation and development of the energy industry which will integrate the new energyrelated departments within the Formosa Group to build a layout in the new energy industry,24,24,,,,
14GovernanceMetrics and TargetsAppendix32Management of Climate Change Risks and OpportunitiesStrategyClimaterelated Financial Disclosure Report,13,12,diff,,,
According to the TCFDs recommendations FPC adopts the worstcase scenario for the transition and the physical risks and includes the analysis results in the strategic resilience assessment,3,4,diff,,,
Regarding the transformation risk FPC makes reference to the IEA WEO 450 Scenario 2016 and the Nationally Determined,18,12,diff,,,
Contribution NDC target set by each manufacturing site In Taiwans Intended Nationally Determined Contribution INDC report,17,15,diff,,,
the greenhouse gas emissions are set to be reduced by 50 by 2030 based on the businessasusual BAU scenario Under such,25,25,,,,
scenario the power generation structure in 2025 will be 20 for renewable energy 30 for coals and 50 for gases After the,24,24,,,,
above scenarios are implemented the impact on FPC is analyzed with respect to the aspects of market technology reputation,18,10,diff,,,
As for the physical risk we refer to the Taiwan Climate Change Projection Information and Adaptation Knowledge Platform TCCIP,13,9,diff,,,
and the National Science and Technology Center for Disaster Reduction to estimate sea level rise of 20202040 areas below the,5,19,diff,,,
tide line flood levels below the 2050 level temperature rise maximum continuous rainfall days and total rainfall for the scenarios,13,26,diff,empty,,
IEA WEO 450 Scenario Intended Nationally Determined Contributions Report,12,26,diff,empty,,
TCCIP National Science Technology Center for Disaster Reduction RCP 26 RCP 45 RCP 85,5,19,diff,,,
2030 greenhouse gas emission is estimated to be reduced by 50 according to the current development trend,25,25,,,,
Estimated condition of the temperature rise and rainfall for 20202040,13,26,diff,empty,,
The extreme climate risk assessment is mainly conducted using RCP 85 scenarios with some of the RCP 26 and RCP 45 scenarios,13,10,diff,,,
Area below the 2050 flood line RCP 85,13,26,diff,empty,,
Maximum number of days of continuous rainfall RCP 4585,24,26,diff,empty,,
