paragraph,predict_label,count,different,empty,diff rate,empty rate
According to the Global Risks Report 2021 published by the World Economic Forum WEF extreme weather climate action failure and humanled environmental damage take the first to third places among the top five highest likelihood risks of the next 10 years with extreme weather topping the list of the highest likelihood risks for five years in a row This goes to show that climate change has become one of the most important global issues at present As the first Taiwanese company in the steel industry to sign up as a supporter of the Task Force on Climaterelated Financial Disclosures TCFD in September 2020 CSC makes disclosures based on the TCFD framework after conducting a host of exchanges and discussions with external professional organizations holding a series of meetings with various divisions at the company and identifying the risks and transformation opportunities brought by climate change to the company so that stakeholders can fully understand CSCs efforts in the formulation of risk controls and countermeasures to cope with climate change This concept is also disseminated to CSCs senior executives and employees at all level,13,25,diff,,,
CSC identifies the risks and opportunities brought by climate change to all divisions based on the TCFD framework thereby effectively responding to a wide range of issues arising from climate change CSC disclosures its management actions according to the four core elements on which the TCFD recommendations are made as detailed below And for more details please refer to appendix 3,13,25,diff,,,
The Sustainable Environment Development Team under the Corporate Governance and Sustainability Committee convenes at least two meetings each year and reports the implementation results for the current year to the implementation plan for the following year to the Corporate Governance and Sustainability Committee every six months before the implementation plan and results are submitted to the Board of Directors At the same time CSC has also established the Task Force on Energy Saving Carbon Reduction and Carbon Neutrality which is chaired by the Chairman of the Board to charge of carbon management and carbon neutralityrelated issues This task force holds regular meetings and reports the progress of related actions to the Board of Directors,12,25,diff,,,
CSC Energy and Environmental Meetings CSC holds two energy and environmental meetings each year which are chaired by the President with the aim of comprehensively studying energy saving and carbon reduction issues within CSC Group,24,24,,,,
Energy Conservation Committee This committee is chaired by the Vice President of Production Division Three teams are formed under this committee to promote energy saving and carbon reduction within CSC Group Regular meetings are held by this committee in which CSCs energy policies are approved by the Chairman and updated when necessary,24,24,,,,
CSC reviews the impact of various climate risks and opportunities under different scenarios according to the Shared Socioeconomic Pathway 585 SSP585 proposed by the Intergovernmental Panel on Climate Change IPCC as well as Net Zero Emissions NZE and Announced Pledges Scenarios APS studied by the International Energy Agency IEA,13,25,diff,,,
After conducting a series of discussions across divisions and identifying climaterelated risks and opportunities CSC carries out risk identification and ranking based on time of occurrence likelihood of occurrence and degree of impact as well as evaluates the potential operational and financial impact of such risks on the company,18,10,diff,,,
CSC analyzes policies and regulations technology market corporate reputation as well as acute and chronic climate risks one after another based on the TCFD framework and discusses the impact of climate risks and opportunities through communications between managers and employees at various divisions Climaterelated risks and opportunities are identified from time to time to ensure its identification results are consistent with the current situation,13,25,diff,,,
CSC draws up response plans according to the climate riskopportunity identification results Carbon neutrality is included in the CSCs risk management and the Task Force on Energy Saving Carbon,13,25,diff,,,
Reduction and Carbon Neutrality leads the carbon reduction policies and strategies,12,25,diff,,,
Carry out GHG inventory each year after conducting its first GHG inventory according to ISO 14064 in 2006 and commission a thirdparty verification body to verify its GHG inventory each year and obtain the relevant verification statement,25,26,diff,empty,,
Assign the Environmental Protection Department to calculate its Scope 3 emissions since 2015 and commission a thirdparty verification body to verify its Scope 3 emissions and obtain the relevant verification statement,25,9,diff,,,
Identify opportunities for GHG reduction based on GHG inventory results Set short medium and longterm targets for GHG management and energy management these targets can,25,11,diff,,,
CSC has invited internal relevant units and external experts to conduct four sessions of exchanges discussions and seminars on climaterelated financial disclosures Internal meetings are also held to review the impact of various climate risks and opportunities based on the TCFD framework,13,10,diff,,,
Taking into consideration topics in various areas including product application supply chain adaptation and mitigation activities emerging technology development and investment and operational processes CSC has identified seven transition risks four physical risks and seven opportunities according to the CDP Climate Change Questionnaire framework and international reports Risk identification is conducted based on time of occurrence likelihood of occurrence and degree of impact Interviews are conducted with managers and employees at the Production Commercial Technology and Corporate Planning Division about their professional experience to identify the importance of climate changerelated risks and opportunities to CSC By calculating the impact of risks and opportunities based on two dimensions ie likelihood of occurrence and degree of impact these risks and opportunities are then classified into high impact medium impact and low impact and ranked accordingly The climaterelated riskopportunity identification results are listed as follows,13,10,diff,,,
e c n e u l f n,12,26,diff,empty,,
f o e e r g e D,12,26,diff,empty,,
Payment of carbon fees in accordance with new carbon feerelated regulations eg the Carbon Border Adjustment Mechanism CBAM could increase operating costs,12,21,diff,,,
Lowcarbon transition may result in cost increase due to tight supply of raw materials,17,26,diff,empty,,
Steel demand among customers could change due to climate change,13,4,diff,,,
Active development of new steelmaking techniques in response to the trend of low carbon development could result in cost increase,12,4,diff,,,
Raising energy and resource efficiency standards for various assets in response to the trend of lowcarbon development such as replacing equipment with high efficiency ones could increase operating costs,24,24,,,,
Suppliers inability to normally produce or distribute raw materials due to increased frequency and severity of extreme weather events such as typhoons and floods could affect operations,17,13,diff,,,
Increased frequency and severity of extreme weather events such as typhoons and floods could affect operations,13,13,,,,
Laws and regulations customer and international initiatives and carbon reduction targets set by the company could lead to a continuous increase in the proportion of renewable energy in overall energy consumption,24,24,,,,
Increased risk of water scarcity arising from extreme changes in weather patterns could affect production,20,12,diff,,,
Coastal flooding in port areas due to global sea level rise could cause damages to assets,5,26,diff,empty,,
Risks could arise from environmentrelated news and public opinion and response,12,5,diff,,,
e c n e u l f n,12,26,diff,empty,,
f o e e r g e D,12,26,diff,empty,,
Provide wind powerrelated materials produce topgrade electrical sheets and expand into the electric vehicle supply chain to expand the scope of business,17,24,diff,,,
Continuously develop and expand the companys low emission technologies as well as provide lowcarbon products to gain favor from customers,15,26,diff,empty,,
Strengthen climate resilience to increase profits as countries respond to climate change,13,25,diff,,,
Engage in lowcarbon transition in collaboration with industry chains and reduce product life cycle footprint to gain favor with customers,15,8,diff,,,
Reduce the consumption of product resources through the development of new technologies,15,4,diff,,,
Continue to develop a diverse range of renewable energy sources in response to lowcarbon transition to increase resilience to carbon fees,24,24,,,,
Actively engage in energy conservation and carbon reduction develop carbon rights and participate in the carbon market,12,24,diff,,,
Payment of carbon fees in accordance with new carbon feerelated regulations eg CBAM could increase operating costs,12,21,diff,,,
Lowcarbon transition could result in cost increase due to tight supply of raw materials,17,26,diff,empty,,
Steel demand among customers could change due to climate change,13,4,diff,,,
CSC continues to discuss and review GHG reduction measures with various divisions according to its carbon reduction targets In conjunction with Kaohsiung City Governments call to phase out coal CSC ceased coal combustion in three boilers starting on August 24 2021 and began eliminating the use of coalfired boilers which is estimated to reduce 340000 tonnes of CO2 each year,25,25,,,,
Enhance the use of steel scrap in manufacturing processes to promote the sustainable use of raw materials Diversified procurement will be initiated if there is a growing demand for steel scrap in the future,19,4,diff,,,
Set out in two directions to meet demand for lowcarbon steel First CSC continues to improve its manufacturing processes and reduce the use of fossil fuels with the aim of minimizing carbon emission intensity per unit of molten iron In addition CSC collaborates with research institutions on the development of new low carbon processes and lowcarbon steel for the purpose of assisting downstream customers in achieving the greatest carbon reduction benefits,21,21,,,,
Suppliers inability to normally produce or distribute raw materials due to increased frequency and severity of extreme weather events such as typhoons and floods could affect operations,17,13,diff,,,
In an effort to cope with the possible impact of climate change on supply of raw materials CSC continues to diversify the source of raw materials and moderately increase the storage space of raw materials expected to reduce the risk of raw material supply,17,10,diff,,,
As far as renewable energy is concerned CSC carries on with its plans to develop offshore wind power generation and produce steel for wind power generation In the electric vehicle industry CSC continues to develop topgrade electrical sheets for electric vehicle motors and highstrength auto steel to reduce the carbon footprint of its products to maintain the competitiveness of its products,15,24,diff,,,
Due to high GHG intensity the steel industry becomes the focus of public attention when it comes to climate change and carbon reduction Domestic and overseas stakeholders have cared more about the planning and actions that the steel companies would take for climate change mitigation They also ask the steel companies to carry out their businesses by following relevant mechanisms Therefore CSC promptly sets up control mechanism evaluates the risks and discovers the opportunities to mitigate the impacts,25,25,,,,
Achieve a 4 reduction in carbon emissions by 2022 compared to 2018,25,25,,,,
Achieve a 7 reduction in carbon emissions by 2025 compared to 2018,25,25,,,,
Achieve a 22 reduction in carbon emissions by 2030 compared to 2018 and the ultimate goal of carbon neutrality by 2050,25,25,,,,
GHGs control is highly emphasized in Taiwan with relevant regulations being amended Some regulatory revisions and amendments eg carbon fee make enormous impacts on CSC production and operation Therefore CSC not only emphasizes legal compliance as its basic principle but identifies risks according to the regulatory revisions and amendments optimizing internal countermeasures continuously to mitigate impacts,25,12,diff,,,
Strengthening the control is expected to increase the companys operating cost Meanwhile indirect potentials exist eg carbon credits which may create revenue for the company CSC has its own Corporate Governance and Sustainability Committee directly under the Board of Directors It is the top authority for CSC sustainability development The meeting is held every half a year The Task Force on Energy Saving Carbon Reduction and Carbon Neutrality under the Committee holds a meeting every two months and additional meetings are held as needed discussing issues like carbon management,12,25,diff,,,
Greenhouse Gas Inventory Scope 1 2 and 3,25,25,,,,
CSC conducted its first ever GHG inventory according to ISO 14064 2006 in 2006 with the scope of inventory covering Scope 1 and Scope emissions within the companys organizational boundary under the operation control method With a view to ensuring that the inventory data are measurable reportable and verifiable in compliance with the principle of measurement reporting and verification MRV CSC commissions an impartial thirdparty verification body each year to verify its inventory data and obtain the relevant verification statement The relevant data are also uploaded onto Taiwans National Greenhouse Gas Registry,25,22,diff,,,
While Scope 3 inventory is not a mandatory item under the current laws and regulations CSC has assigned the Environmental Protection Department to calculate Scope 3 emissions at the company since 2015 considering that the inventory results enable the company to keep track of the status of GHG emissions throughout its supply chain and identify possible opportunities to reduce GHG emissions while answering calls from international initiatives such as CDP to promote Scope 3 inventory among companies Starting in 2016 CSC carries out inventory of Scope 3 emissions from three categories namely business travel waste generated in operations and fuel and energyrelated activities and commissions an impartial thirdparty verification body each year to verify its Scope 3 inventory and obtain the relevant verification statement With the implementation of Scope 3 inventory CSC has also extended GHG management to its supply chain to deepen and expand GHG management The content of inventory is also refined continuously with new external verification items added depending on the integrity of the inventory data In 2021 upstream transportation and distribution is added as an external verification item,25,21,diff,,,
CSC conducted its GHG inventory according to this new version of ISO 14064 2018 standards in,25,11,diff,,,
2021 and presented the related data in this report,12,22,diff,,,
CSC has formulated the Carbon Trading and Management Regulations in accordance with EPAs rules and regulations as well as international practices with the relevant operations incorporated into ISO 14001 Environmental Management Systems Meanwhile applications for GHG offset credits are submitted by the Environmental Protection Department at CSC to the competent authority As of the end of 2021 CSC has 45187 million tonnes of CO2e in GHG offset credit balance through previous GHG reduction projects Upon continuous monitoring of reduction effectiveness in the Offset Program for Change in Mode of Transportation at Hualien Yard and the Offset Program for Energy Conservation via Hot Charging of Slabs at CSC during the crediting period CSC has submitted the first and second applications for GHG offset credits in 2021 which are currently under review by EPA Once approval for these applications are acquired CSC will be able to increase its GHG offset credit,25,21,diff,,,
Since 2005 CSC has been cooperating with IDB and as of 2021 a total of 1182 reduction projects were implemented and the cumulative reduction reached 1452 million tCO2eyear Due to our outstanding performance in reducing emissions CSC has been awarded by IDB over the years and was honored as one of the best performers in 2021,25,25,,,,
Participation in worldsteels Greenhouse Gas Data Collection Program,25,25,,,,
Since 2008 CSC has participated in worldsteels CO2 Data Collection Program and submitted its GHG emissions data each year The company also participates in worldsteels conferences on best carbon reduction practices and carbon reduction technologies to not only learn about the progress of carbon reduction efforts at international steel mills but also refine its energy saving and carbon reduction efforts on an ongoing basis On the other hand worldsteel has established a database of GHG emissions and carbon reduction technologies in the steel industry by collecting and compiling GHG emissions data from major steel mills around the globe in hopes of contributing to global carbon reduction efforts,25,25,,,,
Indirect GHG emissions from imported energy Scope 2,25,21,diff,,,
Indirect GHG emissions from products used by an organization,25,21,diff,,,
Fuelandenergyrelated activities not included in Scope 1 or 2,24,26,diff,empty,,
Note IThe boundary of CSC GHG emissions refers to the Operation Control Approach and calculates with the Emission Factors Methodology,25,21,diff,,,
GHG include carbon dioxide methane nitrous oxide hydrofluorocarbons perfluorocarbons sulfur hexafluoride and nitrogen trifluoride,25,21,diff,,,
After completing the brand new CSC China Steel Building in 2013 we adjusted our GHG inventory boundary in accordance with ISO 14064 1 and redefined our base year to 2014 The GHG emissions of 2014 is 20629824 tCO2e based on the GWP value from the IPCCs Fourth Assessment Report The source of the coefficient includes the emission coefficient management table announced by the EPA the World,25,10,diff,,,
Steel Association coefficient and the estimated emission coefficient of the carbon content measured by the plant,21,21,,,,
Note II The data of scope 2 is recalculated based on the electricity emission factor of 2020,21,22,diff,,,
Note III CSC conducted its 2021 GHG inventory according to ISO 1406412018,25,26,diff,empty,,
Note IV It was added as an external verification item in 2021,12,26,diff,empty,,
For more details The Scope 3 Emission httpswwwcsccomtwcscehrcsrenvenv3htmCCRGHG,12,26,diff,empty,,
Participated in the Kaohsiung City Governments Greenhouse Gas Reduction Project Across Departments,25,25,,,,
In recent years CSC has continued to cooperate with Kaohsiungs Environmental Protection Bureau in handling the Greenhouse Gas Reduction Project Across Departments assisting rural area and underprivileged groups to replace energysaving equipments The number of projects the amount of subsidy and benefit of carbon reduction in the past three years are as follows,25,25,,,,
Carbon Reduction Pathways and Carbon Reduction Strategy Planning,25,25,,,,
CSC has set short medium and longterm carbon reduction targets With the longterm goal of achieving carbon neutrality by 2050 CSC has preliminarily formulated a number of strategies and mapped its pathway towards carbon neutrality,25,25,,,,
CSC Path Planning for Carbon Reduction and Carbon Neutral,25,25,,,,
Strive to achieve the carbon neutral target to,24,21,diff,,,
Arrange resources needed Choose the optimal path accord ing to cost effectiveness and producing premium steel ability,24,26,diff,empty,,
C a r b o n e m s s o n s,12,26,diff,empty,,
Understand the flow direction of carbon emissions by tracing manufacturing processes and boost energy efficiency to improve work performance which coupled with introduction of BAT and AloT It is expected to greatly promote carbon reduction,25,24,diff,,,
t e n t h o u s a n d t o n s,12,26,diff,empty,,
BF auxiliary fuel changed from coal to H2rich gas,24,25,diff,,,
Convert CO and CO2 in emissions into chemical,25,21,diff,,,
BFs using CCS to transfer lowcarbon BF to,12,26,diff,empty,,
Considering the lack of mature technology and green resources and the need for equipment upgrading CSC will face,24,26,diff,empty,,
CSC Path Planning for Carbon Reduction and Carbon Neutral,25,25,,,,
On top of that CSC has also drawn up a twostage pathway to ensure that it can achieve carbon neutrality However CSC currently encounters a number of problems in some of its strategies such as a lack of mature technology and hydrogen resources and the need for equipment revamp and will eventually face challenges in three areas technology resources and costs which are also similar to other steel mills across the globe Therefore CSC will actively engage in RD operations while reviewing and adjusting the progress of each strategy on a rolling basis,24,25,diff,,,
2030 BF auxiliary fuel changed from coal to H2rich gas,24,25,diff,,,
Convert CO and CO2 in emissions into chemical products through CoProduction of Steel and chemicals,25,14,diff,,,
2050 Capture and store CO2 emitted from lowcarbon BFs using CCS to transfer lowcarbon BF to Netzero carbon BF,25,21,diff,,,
Considering the lack of mature technology and green resources and the need for equipment upgrading CSC will face three major challenges technology resources and cost,24,26,diff,empty,,
CSC has been devoted to process improvement including,12,26,diff,empty,,
For a blast furnace fueled by coke and pulverized coal the injection of hydrogenrich gas into the blast furnace as a partial replacement of carbon fuel could be an effective way for the reduction of CO2 emissions It is similar to the pulverized coal injection as the hydrogenrich gas is injected into the raceway of furnace through injection lances It is estimated that the optimal hydrogen injection rate is 275 kg per ton of iron which can cause a 21 reduction in carbon emissions Many research works have been proposed for the hydrogenrich gas injection A high temperature furnace will be established in 2022 and experiments will be carried out in 2023 to study the reactions in the blast furnace with a high hydrogen concentration Besides CSC has lined up hydrogenrich injection tests in its No1 blast furnace in 2025 to assess the combustion characteristics and safety operation of the injection in the raceway of the furnace In the long term countermeasure for the low carbon ironmaking CSC will also develop the hydrogenbased direct reduced iron HDRI technique In the process natural gas or coke oven gas will be reformed into CO and hydrogen which is injected into a shaft furnace as the reductants of ferrous for the production of direct reduced iron DRI with low carbon emissions The DRI could be used in blast furnace and electric furnace As a result the low carbon ironmaking could be achieved,25,25,,,,
Process improvement for energy conservation and carbon reduction,24,24,,,,
With the continuous promotion of direct hot charge rolling DHCR for products CSC will set up a steelmaking and rolling platform in sync with DHCR When equipped with the specially scheduled DHCR slabs produced from the steelmakingcontinuous casting process are sent via the roll table directly to reheating furnaces in hot rolling mills,24,26,diff,empty,,
CSC will develop the flue gas desulfurization FGD pump control technology for power houses to reduce electricity use in pumps as well as the crossprocess equipment control technology in the cooling water system for power houses to reduce the cost of purchased electricity At the same time the company will also develop the heating value prediction technology using production schedule and process data for basic oxygen furnaces and apply this technology to feedforward control for Boilers 9 to 11 in Power Plant II This technology can not only reduce main steam fluctuations and lower the opportunities for carbon emissions from main steam but also increase boiler load In 2021 CSC has made comprehensive improvements to the ladle preheating system at the Steelmaking Department including adjusting the combustion system and optimizing its operation at the preheating stand and also initiated the development of its own oxyfuel combustion system to reduce the use of purchased natural gas,24,21,diff,,,
Reducing pollution arising from energy production and consumption and improving related,24,19,diff,,,
CSC will design experimental conditions and conduct onsite tail gas scrubber experiments using scrubber testing equipment based on the experimental design method and assess the optimal operating procedure for tail gas scrubber through data analysis and model simulation to develop techniques for reducing the concentration of hydrogen sulfide H2S in tail gas Meanwhile CSC will also conduct an inventory of potential energy saving opportunities at its light oil facility establish a light oil facility simulation model and analyze energy saving operations strategies,24,25,diff,,,
For more details Green Life httpswwwcsccomtwcscehrcsrenvenv12htm For more details Green Building httpswwwcsccomtwcscehrcsrenvenv7htm,15,26,diff,empty,,
CH 3Value CreationOverviewCH 1 Sustainable OperationCH 2Corporate Governance,12,0,diff,,,
6CH 4Industry Chain ImprovementCH 5Environmental ProtectionCH 6Employees CareCH 7Social ParticipationCH 8Appendix,4,26,diff,empty,,
