paragraph,predict_label
Building Taiwans First 10 nmClass DRAM FAB with SelfDeveloped Technology,4
In 2021 the world was ravaged by COVID19 pandemic and geopolitical tensions that have created serious challenges for many industries across the globe Nanya Technology has further strengthened our preventative measures to protect our employees and the continuity of our FAB operation with strong effortswe have flexibly adjusted operational strategy to minimize external impacts and successfully achieved nine consecutive years of profitability Thanks to the joint efforts of the management team and all employees and deeply grateful for all the support and recognition of every sector,18
Innovation is Nanyas longterm strategic goal and core value which is the foundation of our developments for advanced process technologies and new generation products and well positions us as a key memory supplier With accumulating RD experience and cultivating excellent technology team we successfully transformed into a selfdevelopment process technology IDM company In 2021 Nanya has completed the firstgeneration 10nmclass process technology 1Anm and product verification and scheduled forvolume production in 2022 The secondgeneration 10nmclass process technology 1Bnm is under development and trial production is expected to begin in 2022 1Bnm process technology will improve energyefficiency by more than 60 Furthermore Nanya has introduced AI smart manufacturing to improve our automated production We developed 70 AI applications and cultivated 350 AI specialists in 2021 which comprehensively improved our process efficiency and production capacity making AI a driving force for adding value to production In order to enhance the future competitiveness of Nanya and meet longterm development needs we also planned invest NT300 billion for Taiwans first 10nm DRAM FAB and volume production is expected to begin in 2025 and will create 3000 employment opportunities driving economic and local development in Taiwan,15
DRAM become a critical component for the smart era We have developed advanced and high performance ecofriendly DRAM products to meet the needs of the market and our customers All of our products integrate life cycle thinking and designs for the environment from the early design stages In 2021 our energysaving products accounted for 87 of our total revenue and helped customers save approximately 71217 million kWhof electricity over the year allowing our innovative green products and technologies to make quantifiable contributions to the environmentNanya is also actively implementing cleaner production practices and incorporating green management into our business operations We implemented 33 energysaving action plans in 2021 saving over 759 million kWh of electricity With regard to renewable energy we purchased 104 million kWh of electricity from onshore wind farms in 2021 and will continue to purchase renewable energy eg solar power or offshore wind power in 2022 We expect that our renewable energy consumption will reach 250 million kWh within 10 years start from 2023 moreover we will continue to make efforts toward RE 100 initiatives and work toward SBT ScienceBased Targets,24
Talents are the foundation of a companys innovation operation and sustainable development We have implemented various methods to deepen the core values and management ideals of integrity and responsibility efficiency and innovation and sustainable management and plan to unite our employees while building a business that is a source of prideIn 2021 we established We Together We Learn We Grow plan which stepped up the cultivation and development of comprehensive talent so that internal knowledge and creativity could sprout Compared to 2020 the average number of training hours per employee increased 325 to 416 hours in 2021the highest in the past four years Furthermore demand on talent has increased in the memory industry due to the rapid growth of the semiconductor industry In response Nanya signed an agreement with Chang Gung University to establish a masters program on memory technology Students that enroll in the program not only receive a large scholarship but also have a job waiting for them when they graduate Nanya hopes to enhance the international competitiveness of Taiwans memory industry through talent cultivation recruitment introduction gathering and retention and hopes to provide more learning support and planning options for students,8
In addition to following our own path to sustainability Nanya is also collaborating with our upstream and downstream partners to move forward as one towards sustainability We are guiding 295 suppliers towards our ideas of sustainability and 100 of our partners have cosigned the Nanya Corporate Social Responsibility Guarantee We have assisted our suppliers in implementing sustainable improvements through guidance and audits which have resulted in tangible improvements that have been completed across our supply chainIn 2021 we continued to host supply chain seminars Furthermore we have also jointly promoted human rights and environmental projects with suppliers In terms of social projects we assisted in refunding migrant workers a total of NT451million in 2021 In terms of environmental projects we lead 14 suppliers to promote energy conservation projects and saved 3315 MWh in 2021 Nanya will continue to exert its influence to strengthen partnerships with suppliers and further improve the sustainability performance of the overall value chain,17
Facing the global economy uncertainties in 2022 Nanya will continue to utilize our team wisdom to enhance our innovation and RD capabilities and will strive to achieve sustainable development through three strategies Creating Shared Value Promoting Sustainable Mutual Prosperity and Achieving Sustainable Development Our vision is to become the Best DRAM Partner for Smart Worldwe are committed to working closely with our global partners and stakeholders on the path towards sustainable development This will further strengthen our competitive advantages and leadership in the global semiconductor industry,4
Nanya continued to monitor the spread of COVID19 through its Epidemic Response Team in 2021 to protect employee health and maintain a safe work environment We also implemented a number of epidemic prevention and response measures and collaborated with the medical team of Linkou Chang Gung Memorial Hospital in setting up a screening station providing over 5552 people including employees and contractors with free rapid testing services In addition Nanya donated 3200 rapid test kits to the New Taipei City Government and 2000 epidemic prevention user packs to Cardinal Tien Hospital Furthermore we also helped schools in rural areas of New Taipei City purchase live streaming equipment achieving interschool colearning and digital equality in distance learning during the pandemic benefiting 2000 students,5
As a responsible corporate citizen Nanya considers ESG to be an important commitment of companies and continues to dedicate efforts to sustainable development in fact our sustainability performance has been recognized in Taiwan and overseas This shows that Nanya has achieved a balanced development of its business performance and ESG In terms of international recognition Nanya was awardedthe DJSI World Index and Emerging Markets Index ranked 1st in the global memory industry in 2021 We were also recognized with the CDP Climate Change Evaluations highest honor A List Leadership Level for the second year and were awarded the MSCIFTSE4Good Emerging Markets Index for the fourth consecutive year In terms of domestic recognition Nanya received the National Enterprises Environmental Protection Award and the Green Factory Certificate We were also recognized with the Most Prestigious Sustainability Awards Top Ten Domestic Corporate Award from the TCSA the ESG Integrated Performance Award from Global Views Monthly and wereawarded the FTSE4Good TIP Taiwan ESG Index for four consecutive years In addition we ranked in the top 5 of the Corporate Governance Evaluation for the fourth time and were selected for the CommonWealth Magazine Sustainable Citizen Award,13
Internal employee substitution rate for job openings continued to reach a new high,8
RD expenses accounted for 88 of revenue and RD personnel accounted for 268 of employees,11
Reduced VOC emissions per unit capacity by 463 compared with 2017,21
Greenhouse gas verification in the factory area and coverage rate of climate change risk identification,25
An Active Participant in Giving Back to Society,10
Number of hours invested by Nanya in social engagement,10
Held 44 talks with a total of 2964 participants,12
Used fair trade coffee and assisted community development and economic growth in the Third World,10
Critical suppliers completion of selfevaluation questionnaire nsustainability issues,17
Accumulated amount of refunds to migrant workers of suppliers,11
Electricity saved through asking suppliers to implement energysaving projects,24
Inclusion as a Constituent of the DJSI World Index and DJSI Emerging Market Index,18
Customers are satisfied with the overall performance of Nanya,4
Top 5 in the 8th Corporate Governance Evaluation of TWSE Listed Companies,18
World Index Emerging Markets Index Ranked 1st in the global memory industry,18
Bronze Class Medal in the Sustainability Yearbook 2022,3
Climate Change A List Water Security Leadership Level,13
Prime Status by the Institutional Shareholder Services ISS ESGs Corporate Rating,4
2021 National Enterprises Environmental Protection Award from the EPA,23
2021 Green Factory Label by Industrial Development Bureau Ministry of Economic Affairs,12
Top 5 in the 8th Corporate Governance Evaluation Taiwan High Compensation 100 Index Taiwan Employment Creation 99 Index,8
Health Promotion Administration Badge of Accredited Healthy Workplace,9
FTSE4Good Emerging Markets Index FTSE4Good TIP Taiwan ESG Index,18
Top 10 TCSA ModelCorporate Sustainability Report Platinum Award Climate Leadership Award Social Inclusion Leadership Award Information Security Leadership Award Growth in Innovation Leadership Award Talent Development Leadership Award Circular Economy Leadership Award Supply Chain Leadership Award,17
Feature Stories Towards a Future with Net Zero Emissions Commitment to the SBT and being geared to RE100 with the Goal of Achieving Net Zero Emissions by 2050,25
Nanya concerned about global climate change and has identified related risks and opportunities We strive to implement low carbon transition and jointly work towards net zero emissions together with stakeholdersThe impact of climate change has been scientifically proven to be extremely urgent Hence countries around the world in 2021 declared and took action to achieve net zero emissions by 2050 and Taiwans government in April 2021 declared the goal of net zero emissions by 2050 As the leader of Taiwans DRAM industry Nanya responds to the goal of foreign governments and Taiwans government to achieve net zero emissions by becoming A Producer of Green Technology We support the Paris Agreement through our own actions and have committed to achieving Net Zero Emissions,13
Setting SBTScience Based Target is a critical first step to achieving net zero emissions and Nanya proposed its SBT commitment in 2021 Nanya proposed SBT of our current operation locations for review in January 2022 and planned carbon reduction strategies for Scope 1 2 and 3 emissions laying out the path to net zero emissions,25
Scope 1 Manage raw material use and install endofpipe reduction equipment,15
Nanyas Scope 1 emissions are mainly from the use of process gases for film and etching Even though the use of process gases cannot be avoided the Company has adopted source reduction and endofpipe removal to manage GHG emissions,25
The Company is actively improving process efficiency and product yield to maintain competitiveness in the industry The transition to the 20nmclass process significantly increased production capacity per unit area and effectively reduces energy and resource consumption per unit production capacity Nanya has also installed an AI system and uses the assistance of smart factories to analyze data improve the arrangement of machinery and manage raw material inputs Process gases used per unit die has continued to decline in recent years decreasing 18 in 2020 compared to 2017,15
Reduce absolute emissions by 25 Emissions per unit production capacitynote2 decreased 27,21
Local scrubbers are installed at the end of Nanyas process equipment and use combustion to break the chemical bond of gas molecules while using cleaning solution for cleaning to remove the majority of GHGs such as PFCs NF3 and N2O At present the removal efficiency of equipment used by Nanya is at 90 and above reducing GHG emissions by approximately 600 thousand tons Local scrubbers will also be installed in equipment of the new factory to minimize the impact on the environment,25
The calculation of production capacity was the output of Good Electronic Chip GEC and the output of various products was converted into around 4Gb product particle numbers using per thousand die kpcs as the calculation unit,15
Scope 2 Low carbon and renewable energy use,24
Scope 3 Supply chain management and product energy consumption management,17
Overall Nanya will become aligned with international trends via the SBT and will achieve reduction goals for 2030 through product RD cleaner production and upstream and downstream collaboration utilizing our ability to innovate Furthermore Nanya will continue to monitor the latest developments of emerging technologies including semiconductor green process technologies hydrogen energy carbon neutral methane and direct carbon capture technologies In coordination with the governments carbon trading policy we hope to offset residual emission by investing in new carbon removal technologies or purchasing carbon rights gradually achieving the vision of net zero emissions through diverse carbon reduction actions in order to contribute to the Earth,25
Scope 2 emissions of Nanya are mainly from purchased energy The Company implements energy conservation management through ISO 50001 and also responds to global trends by using low carbon energy,24
Nanya first installed solar panels in its own factories and obtained 362 TRECs on the TREC trading platform in 2020 We purchased 104 million kWh from onshore land farms in 20212022 and signed a 10year contract with a solar power plant in 2022 to purchase and use 25 million kWh of renewable energy by 2025 We plan to use even more renewable energy to achieve the SBT and RE100 in order for renewable energy to reach at least 25 of electricity use in 2030,24
Nanya Renewable Energy Blueprint for the Next Decade,24
Before 2030 Before 2030 Renewable energy usage reaches 2530,24
20232032 20232032 25 million kWh of solar power,24
Nanyas Scope 3 emissions mainly consists of two items namely purchase of raw materials from upstream supply chain and electricity consumption from downstream product use We continue to conduct supply chain sustainability audits for upstream supply chain management and assist suppliers with environmental management and planning electricity saving projects The Company jointly implemented ice water pump cooling water pump and freezer replacement projects with 14 suppliers in 2021 saving over 3315 MWh In the future Nanya will continue to encourage suppliers to use renewable electricity and implement clean production plans in order to reduce the carbon footprint of their raw materials,17
As for downstream product management we have focused on the development of advanced processes in recent years Development of 10nm process technology is currently going smoothly and trial production using secondgeneration 10nmclass process technology 1Bnm is expected to begin in 2022 which will improve our production efficiency per unit wafer area by 60 and above Furthermore we are also actively developing and carrying out the volume production of lowpower products in which the power consumption of new generation LPDDR5 products is 35 or more lower than LPDDR4 products,15
20212022 20212022 104 million kWh from onshore wind farms,24
Nanya joined the Taiwan Alliance for Net Zero Emission,21
Feature Stories Building Taiwans First 10nmClass DRAM FAB with SelfDeveloped Technology,15
Moving towards the smart era DRAM is a key component to be used in the applications of smart city smart home smart office unmanned vehicles internet of things IoT cloud artificial intelligence AI The global DRAM industry began to recover in 2013 after mergers and became an oligopolistic market Nanya ranks fourth in terms of market share The Company began engaging in transformation and engineering in 2013 including making adjustments to business strategies actively developing niche memory markets focusing on consumer electronics and automobile markets and expanding into server and lower power product markets,15
Innovation is Nanyas longterm strategic goal and core value Instead of engaging in joint technology development with other DRAM companies or technology licensing we began developing SelfDeveloped 10 nm process technology in 2017 With accumulating RD experience and cultivating excellent technology team we successfully transformed into a selfdevelopment process technology IDM company The firstgeneration 10nmclass process technology 1Anm is expects to begin mass production in 2022 This is the first 10nm DRAM technology in Taiwan and proves that Taiwans DRAM technology development ability is among the top companies across the world The secondgeneration 10nmclass process 1Bnm is also under development and trial production is expected to begin in 2022 1Bnm process technology will improve energyefficiency by more than 60,15
Demand on DRAM has benefited from 5G applications and stably increased at a rate of 1520 each year Besides planning the investment of NT60 billion to upgrade processes in current factories we will invest NT300 billion to build a 12inch advanced fab in New Taipei Citys Nanlin Technology Park in order to enhance our future competitiveness and meet longterm development needs This new factory will be the first 10nmClass DRAM fab in Taiwan with SelfDeveloped technology and will allow Nanya to successfully apply several generations of 10nmclass process technology which can be used to manufacture next generation products such as DDR5 and LPDDR5The new fab will be the largest investment project in New Taipei City and construction is expected to begin in the first half of 2022 with the goal of commencing mass production at the end of 2025 It is expected to create 3000 employment opportunities The advanced fab investment project will secure Nanyas leadership in Taiwans DRAM industry and position as a key memory supplier worldwide while enhancing our international competitiveness,4
Furthermore it will also drive the development of memoryrelated industries such as smart city 5G AI big data and IoT increasing the output value of up mid and downstream industries and indirectly creating several thousands of employment opportunities in the industry chain which will help drive Taiwans economic and local development,11
Nanya press conference on investing in a new fab,18
Complete the verification of 1Anmclass process and component technology reliability,24
Complete Taiwans First 10nmClass DRAM FAB with SelfDeveloped technology,24
Create 3000 employment opportunities and increase the output value of up mid and downstream industries by over NT100 billion,11
Memory has become an indispensable to the diverse applications of 5G AI electric vehicles and electronic products The output value of Taiwans memory industry is currently nearly NT300 billion The memory industry plans to invest over NT1 trillion to increase its production capacity to meet longterm consumer needs and therefore urgently needs memory design and process talent Nanya has been actively implementing the Youth Empowerment FOCUS Project on campuses in response to the shortage of memory talent in Taiwan With the power of academic research we assist college students on campus to reduce the gap between the campus and workplace so that they may more quickly adapt to the workplace At the same time we integrate the resources of industry and academia to lay the foundation for the Companys talent and to enhance the international competitiveness of Taiwans memory industry,8
Nanya hopes that cooperation with schools will help cultivate the next generation of memory talent for the country and also provide students with more learning support and planning options attracting students to join Nanya and consolidate the countrys semiconductor soft power,8
Collaborating with College Departments to Improve Students Understanding of the Memory Industry Nanya organizes a variety of seminars or programs to strengthen the connection between what students learn in school and the actual situation in the workplace This approach more systematically passing on the experience of industry mentors to students closely combines theory with applications and closes the gap between education and employment We have jointly developed industry courses that meet needs in the workplace and organize company visits to help students understand the semiconductor industry Seminars organized by Nanya on campuses to promote knowledge of memory had a total of 4000 participants and company visits had over 3000 participants,2
Industryacademia Collaboration to Strengthen Students Knowledge of Memory Through many campus projects and twoway cultivation we provide college students with internship platforms that combine academic and industrial resources and provide training courses and opportunities for accumulating practical experience We hope that we can become a bridge between enterprises and fresh graduates and encourage students to develop different abilities while reserving specialized talent in advance Nanya has cultivated over 300 semiconductor talents through its internship program Promoted the internship program and offered credit courses in departments cultivating over 3000 science and engineering talents,8
Enhanced Students Expertise in the Field of Memory Nanya encourages outstanding students to focus on academic research and innovative technologies and established various scholarships or sponsored the scholarships of colleges in order to cultivate elite semiconductor talent We hope that outstanding students will continue to learn in fields they are passionate about and thereby enhance the semiconductor industrys competitiveness To promote industryacademia exchanges and fully utilize resources of academia Nanya implemented industryacademia collaboration projects nearly 30 projects in total and sponsored events eg NTU VLSI NTU SystemonChip SOC Center and NTU IC Summer Camp of wellknown universities,4
Contract signing ceremony for industryacademia collaboration in memory talent training,8
Furthermore Nanya and Taipei City University of Science Technology jointly established the Nanya Semiconductor Talent Cultivation College in 2022 in order to rapidly pass on experience and cultivate memory talent to meet future market demand Furthermore Nanya joined forces with Macronix International Co Ltd Elite Semiconductor Microelectronics Technology Inc and Etron Technology Inc and established a masters program for memory in Chang Gung University in 2022 Nanya provides students with professional training in memory IC design and processes through collaborations with schools This trains students with the core skills needed by the memory industry and cultivates talent for Taiwans memory industry The cooperation model between Nanya and schools includes internships corporate courses and scholarships which combine theory with practice The schools provide complete teaching resources general education and theoretical knowledge while the Company provides a site for internships and large scholarships and well as guidance in professional knowledge This allows students to understand the industry and attempt to solve practical problems during their internship,8
Contract signing ceremony for the Nanya Semiconductor Talent Cultivation College,8
Nanya insists on leaving the best environment to every future generation and fulfill its responsibility to low carbon production and environmental protection To become aligned with international ecofriendly trends Nanya implemented the Green Factory Label certification project in 2020 and looked into every detail from the hardware to software process Thanks to the collective efforts of all employees factory buildings are required to obtain the Ministry of the Interiors Green Building Label and production processes are required to pass the clean production evaluation system We received the Green Factory certification from the Industrial Development Bureau Ministry of Economic Affairs in 2021 and became the first DRAM company in Taiwan to obtain the Green Factory Label Nanyas new factories in the future will be designed as green buildings green factories and smart buildings in order to drive cleaner production in the domestic DRAM industry and become a manufacturer using green technology,15
Nanya continues to make improvements according to clean production evaluation indicators including energy and resource conservation green process and pollutant management technologies and further incorporates ecofriendly design green management and social responsibility concepts to face the environmental impact of our production and operation processes Nanya obtained the clean production evaluation system compliance certificate issued by the Industrial Development Bureau Ministry of Economic Affairs in 2021 through the evaluation of various qualitative and quantitative indicators,17
