paragraph,predict_label
Driven by the demand for 5G communications cloud AI and smartphone memory upgrade DDR5 and LPDDR5 low power double data rate memory became the main supply of new generation memory Compared with current mainstream memory new generation memory possesses faster transmission efficiency while saving energy due to lower operating voltages When comparing DDR4 with DDR5 average power is about 16 lower but bandwidth is doubled,24
DDR5LPD5 provided specifications that save more electricity with high bandwidthhigh speed,24
Nanya has focused on the development of advanced processes and began independently developing 1Anmclass process technology in 2017 trial production began in 2020 1Anmclass process technology will significantly shrink the size of chips and increase the capacity of a single wafer by 30 Furthermore we also began developing 1Bnmclass process technology in 2019 and expect to begin trial production in 2022 1Bnmclass process technology further shrunk chips made using 1Anmclass process technology and increased the capacity of a single wafer by 30 This will allow factories to further achieve energy conservation and carbon reduction goals while achieving the same production capacity,24
To enable 30 productivity gain per technology node,24
NTC cooperates with major chip customers adopting the method of multi chip package MCP to reduce backend assembly and testing as well as energy consumption,24
NTC strengthens the development of low energy consumption product lines and enlarges product portfolios in order to satisfy the need of various mobile devices and electronic products,15
NTC continues to develop advanced manufacturing processes so the energy consumption of new generation products developed with new processes is reduced by 15 compared with the previous generation,15
When we develop new products the environmental impact of the entire life cycle is considered To electronic products the energy consumption in use is one of the most significant indicators in environmental impacts Nanya actively researches and develops low energy consumption products and assist clients lower demand for energy during their usage of electronic products so that greenhouse gas emissions can be reduced,15
Product low power DRAM and 20nm consumer DRAM,15
Calculation Based on the quantity of products sold in one year and compared the energy consumption of the aforementioned DRAM products with that of the previous generation,15
Benefits Saved the annual electricity consumption of 189710 householdsNote1 and reduced greenhouse gas emissionsNote2 by 357509 tonCO2e which is the equivalent of 919 times the carbon absorption of Daan Forest Park in an entire year3,25
Note 1 Estimated based on the actual monthly electricity consumption of 3754 kWhyear of housing units and small stores on the website of Taiwan Power Company 2022119,24
Note 2 The carbon emission factor of electricity is based on the announcement of the Bureau of Energy in 2020 0502 kg CO2ekWh,21
Note 3 According to the Bureau of Energy Calculated using the CO2 absorption of Daan Forest Park at 389 metric tons per year,24
In 2005 Nanya established the Green Product Promotion Committee GPPC to promote hazardous substance free HSF management During the product manufacturing process we continued to prevent pollution save energy reduce wastes and avoid hazardous substances Through concatenating suppliers of raw materials process materials rearsection packaging outsourcing and packaging materials Nanya built an effectively green product supply chain to managed raw material provider process material provider backend assembly house subcontractor and shipment packing material provider and its materials to meet green product policy and conform to the laws and regulations of current global environmental protection trend,15
Through the GPPC we referred to laws and regulations of the EU and countries in other regions and the hazardous substance management specifications of major international customers to stipulate the General Rules of Environmental Management Substances for Components and Materials continuing to effectively control and manage the sources of raw materials and related materials in order to achieve standards of green products and mitigate impacts on natural environment during manufacturing process of products Under the instruction of the General Rules of Environmental Management Substances for Components and Materials all of our products needed to conform to international regulations WEEE Such as WEEE and RoHS PPWD and as well as clients requirements Moreover we do not use chemicals concerned by the IEC 62474 so products noncompliant with the IEC 62474 Material Declaration account for 0 of revenue In addition through the establishment of HSF management system of materials we ensured the finished goods that the product wafers IC assembly products and DIMM module products are green products would conform to the international regulations and related specifications of clients towards HSF management,15
Restricted use of the substances in the Annex XVII to REACH,16
Complied with the requirement for Halogen Free in 2009,6
Restricted use of 4 specific phthalate esters PAEs,6
Process substances switched to use PFOAfree photoresist in 2018,24
Process substances all photoresist delivered to factories from 2019 was PFOA free,24
RoHS report items of 6 contractors and 47 raw material suppliers were reviewed while 898 RoHS reports were reviewed The completion rate was 100,17
Two versions of REACH SVHC item survey REACH SVHC V24V25 were completed while 158 hazardous substances survey reports were reviewed The completion rate was 100,19
Completed 7 copies of one version of HS survey HS Survey V41 required by clients while 165 hazardous substances survey reports were reviewed The completion rate was 100,19
In order to create momentum for growth even amid continuous changes in the external environment Nanya uses talent retention and cultivation to preserve competitive advantages We also accept employee opinions to create a safe human rightsbased and harmonious workplace and fulfill our business targets,8
Internal employee substitution rate for job openings 845,8
The average level of approval indicated by employee survey responses reached 72,8
Disabling frequency rate and disabling severity rate were both 0,5
Improvement of professional skills Establish yearly training development plans based on the Companys strategy plan diversified learning courses and channels,2
Training of key talents Strengthen the training of key talents and increase the proportion of key talents,8
Individual development Establish independent learning and employee personal development mechanisms to increase the internal employee substitution rate for job openings,8
Percentage of key talent to total employees 4,8
Percentage of employees that are key talents 3 Internal employee substitution rate for job openings 60,8
Regulatory compliance Comply with international human rights standards and apply relevant policies and standards in practice,12
Protect equality Build workplace equality by establishing risk management and precautionary measures as well as designing diversified communication and complaint channels,8
Workplace violence 0 cases Employees educational training on labor ethics completion rate 100,11
Workplace violence 0 cases Employees educational training on labor ethics completion rate 100,11
Manpower stabilization Implement talent retention plans to stabilize outstanding employees and increase the retention rate of key talents,8
Retention rate of key talent 98 Voluntary turnover rateNote1 5 Average approval rate inf Employee Engagement Survey 75,8
Retention rate of key talent 98 Voluntary turnover rate 5 Average approval rate inf Employee Engagement Survey 73,8
Early diagnosis and early improvement Continuous PDCA improvements for the occupational health and safety system,9
Safety culture Build employees safety awareness and establish a highquality safety culture,9
Crossinspection Crossinspection by internal and external institutions to strengthen independent inspections,12
Voluntary turnover rate includes employees in Taiwan and overseas Disabling injuries frequency rate FR total employees with disabling injuries 106total work hours Severity of disabling injuries SR total days lost to disabling injuries x 106total work hours Independent inspection rate Number of cases reported by departmentsnumber of discrepancies reported by safety and health units 100,9
Employees are not only the most important capital to Nanya but also the key to supporting sustainable operations and innovative RD within the Company We strive to create a humane and comfortable office environment where new employees are subjected to systematic training and have access to diverse learning resources to help them quickly accumulate professional knowledge and skills for the semiconductor industry and receive reasonable compensations in return The Company also has an Employee Welfare Committee that organizes exciting and interesting recreation activities on a yearly basis to maintain employees worklife balance as well as physical and mental wellbeing and create a sustainably healthy workplace,9
We believe a competitive and stable workforce to be essential for improving the productivity and competitive advantage of the Company We continue to design and provide an environment where talents may thrive Through talent cultivation we strive to become the best employer that looks after talents,8
Since Nanya has business operations based in Taiwan and overseas the nationalities of the Companys employees are quite diverse In addition to Taiwanese staff employees of the following 14 nationalities were also hired in 2021 Chinese French German Japanese American Thai Vietnamese Burmese Italian Kenyan Korean Turkish British and Indonesian Our employees form an internationally diversified workplace We had 116 foreign employees in 2021 accounting for 326 of all employees Taiwanese nationals accounted for the largest proportion of employees in management levels at 8976 In descending order the top five nationalities of foreign managers were American Japanese German Chinese and French which made up 889 of all employees in management levels,8
Nanya also supports the governments policies of hiring people with disabilities as part of its workplace friendly diversity initiative As of December 2021 Nanya hired a total of 36 employees with disabilities into Taiwan operations which represented 105 of total employees We continue to work towards hiring more people with disabilities and provide appropriate job positions Through increasing job opportunities for people with disabilities we intend to build a diversityfriendly workplace,8
2021 Nationalities Taiwanese Chinese French German Japanese American Thai Vietnamese Burmese Italian Kenyan Korean Turkish British and Indonesian,8
Percentages of Managementlevel Employees of the Top Five Nationalities in 2021,8
2020 Nationalities Taiwanese Chinese Turkish Japanese Indonesian French Kenyan USA British Malaysian Indonesian Italian German Burmese Korean,8
2019 Nationalities Taiwanese Chinese German Italian Japanese Korean British USA French Turkish Singaporean,8
2018 Nationalities Taiwanese Chinese German Italian Japanese Korean British USA French Turkish,8
Note The percentage of employees with disabilities is calculated based on the 3444 formal employees in Taiwan,8
The semiconductor industry is both capital and technology intensive It not only involves multibillion dollar plants and manufacturing equipment but also requires a substantial number of outstanding engineering talents to join the production team of Nanya Nanya has a very stable workforce structure In 2021 the Company has a total of 3554 permanent employees in Taiwan and in overseas subsidiaries including 77 interns in which 8652 are specialistsNote 1 The Company has also hired 42 informal employees Note 2 Overall the Company has a competitive healthy and growing talent base to support development of innovative production procedures technologies and products Nanya has 3444 formal employees in Taiwan accounting for 9690 of all employees overseas subsidiaries have 110 formal employees accounting for 310 of all employees Formal male employees totaled 2572 accounting for 724 whereas formal female employees totaled 982 accounting for 276 representing a gender ratio of 264 male 1 female The average age of the Companys employees was 3761 years old The 3050 age group was the most dominant of all representing 6970 of total employee size Most employees had a bachelor or masters degree All formal and informal employees are directly hired by the Company The Company did not hire any parttime staff in 2021 and 100 of its employees worked on a fulltime basis,8
Note 1 Specialist refers to offline production personnel Note 2 Nonpermanent employees include consultants contract staff and interns,11
Statistics of employees in Taiwan and overseas subsidiaries in 2021 by age,8
As a percentage of total females in Taiwan operations,11
As a percentage of total males in Taiwan operations,11
As a percentage of total females in overseas operations,8
As a percentage of total males in overseas operations,8
As a percentage of total male and female employees,11
In 2021 Nanya had 24 female midlevel managers which accounted for 1250 of all midlevel managers there were also 3 female seniorlevel managers representing 536 of all seniorlevel managers there currently are no entrylevel female managers Due to the special nature of the semiconductor industry and realities concerning talent supply males still dominated the management roles As for production line management roles such as team leader and shift leader females accounted for as high as 9314 and had significant influence on the productivity of Nanya There were a total of 114 female managers in section chiefgrade management in revenuegenerating departments which accounted for 3689 of total managers,8
Number and Percentage of Female Staff in the Last 4 Years Note 14,8
Head of revenuegenerating department management level 108 106,12
The Company adopts recruitment policies that comply with labor regulations in Taiwan as well as its own ethical employment principles The Company strives to provide equal employment opportunities and environment and recruit talents solely based on individual professional capabilities and experience without discrimination whether in terms of age ethnicity gender sexual preference religion political association place of birth marital status appearance or disability Employees promotion performance evaluation training reward and discipline after hiring have been explicitly stated in policies This gives everyone job and training opportunities in a fair manner,8
NANYA invested approximately NT211 million to expand talent recruitment in 2019 in which NT450000 was used for the design and woodworking for the booth set up on the campus of National Taiwan University and average talent recruitment expense per person was NT6855,8
In 2021 243 engineers were recruited into Taiwan operations to support organizational transformation and transition into advanced production processes The Company recruits entrylevel engineering talents through factory sites and campus recruitment programs The Company approaches renowned local colleges each year to recruit engineering talents with various skill levels and matches them to open positions onsite We invested approximately NT128 million in recruiting in 2021 averaging NT3573 per person Due to the impact of COVID19 the Company only participated in 15 college recruitment events in 2021 The Company approached campuses and engaged young students in a series of interaction communication and discussion based on the theme You be the Leader of the Future It is our hope to encourage all willing students to pursue a dream career in the hightech industry and contribute to semiconductor development in Taiwan Recruitment of entrylevel production line operators is carried out with the help of local employment service stations near the Companys plants Onsite interviews are held from time to time and local residents are hired as a priority to promote local employment Managers of Taiwan operations consist entirely of Taiwanese nationals for 100 localized hiring,8
Most campus talent recruitment events were canceled in 2020 due to the pandemic so the number of events significantly decreased The pandemic subsided in 2021 schools organized campus talent recruitment events online and invited companies to participate in the events We allocated funds for advertising on job banks to maintain high exposure of campus talent recruitment events increase exposure of job openings and gain an advantage in the severe competition thus improving our brand image as an employer,8
Statistics on recruitment costs from 2018 to 2021,8
Managerial role refers to senior managers plant manager director and above midlevel managers department manager and section manager and entrylevel managers team leader and shift leader Revenuegenerating department refers to any department other than planning administration operational support quality assurance legal affairs and safety health departments Heads of revenuegenerating departments are included in the number of entrylevel managers STEM Job positions related to science technology engineering and mathematics The number people and percentage in 20192020 was revised but the statistical method was not changed,8
Statistics on new recruits in Taiwan and overseas in 2021,8
Total new recruits As a percentage of all permanent employees,8
Note 1 New recruits refer to personnel hired and remained employed in 2021 excluding those who resigned during the year Note 2 3 4 The denominator is the number of employees in the group,8
In order to promote the development of the semiconductor industry and company operations Nanya proactively recruits new employees into the Nanya big family Company employees work cooperatively to move forward together New recruits accounted for approximately 76 of the Companys total employees in 2021 Gender distribution of new recruits was approximately 419 male1 female,8
Statistics on new recruits of Taiwan and overseas operations from 2018 to 2021,8
Nanya not only offers salary packages that are competitive for the semiconductor industry but also introduces a full range of welfare measures and training systems that address employees needs on all aspects from work life to health It is the goal of the Company to create a work environment where employees may realize their full potentials with a peace of mind and for which we have implemented an employee assistance program as part of our corporate social responsibilities,11
In response to changes in the industry and challenges in the business environment the Company continues to not only push for fairness and reasonableness in various operations but also prioritize the work rights and interests of employees Under the human resource coordination system of the Formosa Plastics Group employees are transferred first before they are made redundant Transfer and redundancy of employees are announced and notified in advance in accordance with the Labor Standards Act and relevant laws whereas department managers would also communicate fully with the employees in question and execution decisions in accordance with law In order to motivate employees to achieve organizational goals and retain outstanding talents the Company uses a quarterly incentive system to not only encourage employees to actively reach for business goals but also share company profit,11
With a favorable working environment and lifestyle security Nanya has won the trust and recognition of employees The Company continues to promote various retention and incentive measuresincluding employee stock warrants employee bonuses incentive bonusesto manage employee turnover risks and effectively retain talents The voluntary turnover rate in 2021 was 709 the male to female ratio of those who resigned is approximately 4191 Compared to the voluntary turnover rate of 474 in 2020 there was a 235 increase in 2021 Semiconductor manufacturers expanded their production capacity in response to market demand due to the pandemic and offered appealing benefits to attract talent Even if external pull strengthens the Company adjusted the starting salary of unexperienced new recruits made an annual salary adjustment for all managers and employees and made structural adjustments to the salaries of special departments and specialists in July 2021 The margin of adjustments was higher than competitors and epidemic prevention measures implemented during the outbreak allowed employees to work in a happy and safe environment Hence even though the Companys turnover rate increased it was still lower than competitors For employees who have the intention to leave the Company conducts interviews with them one by one to understand the reasons for their resignations and future plans the Company also provides relevant suggestions based on employee needs,11
Analysis of turnover rate in Taiwan and overseas in 20182021,18
Calculating formula for turnover rate number of resignations in Januarytotal number of employees at the end of January x 100 number of resignations in Februarytotal number of employees at the end of February x 100 number of resignations in Decembertotal number of employees at the end of December x 100,11
Voluntary separation refers to resignation initiated by the employee The Company calculates turnover rate mainly based on voluntary separation Total turnover rate includes voluntary including retirement and involuntary separation including dismissal redundancy death etc,11
In 2019 the calculation of turnover rate began excluding direct interns personnel turnover due to expiration of internship contracts,11
Voluntary turnover rate began excluding those who went on unpaid leaves starting in 2020 Based on the calculation that excluded those who went on unpaid leaves the adjusted voluntary turnover rate of 2019 was 555 and the adjusted overall turnover rate was 589,11
Statistics on total number of employees turnover rate in Taiwan and overseas in 2021,11
Total number of employees separated As a percentage of total employeesNote 5,11
Note 1 Total turnover rate includes voluntary including retirement and involuntary separation including dismissal redundancy death etc Note 2 Percentage of employees separated that were female Note 3 Percentage of employees separated that were male Note 4 As a percentage of all employees separated Note 5 The denominator is the number of employees in the group,11
To ensure employees retirementrelated rights and interests for employees who choose the retirement scheme under the Labor Standards Act 2 of the total monthly salary is deposited into the designated Bank of Taiwan account The accumulative labor retirement reserve in 2021 totaled NT540041197 and had been fully contributed For other employees who choose the Labor Retirement Pension system the Company contributes 6 of individual monthly salary to each employees personal retirement account Employees are eligible to contribute more amounts voluntarily and the amount is deposited into the employees retirement account along with the 6 providing substantial retirement security,11
Nanya conducts an organizationwide Employee Engagement Survey annually to gain insight into employees level of approval towards the Company on several aspects including work management and organizational vision This survey used 29 questions to collect employees opinions on 6 aspects It received a response rate of 93 which was the same as 2020 The results revealed that the average level of approval from all employees was 72 a slight increase of 1 compared to the 71 in the previous year Observing results of the Employee Engagement Survey in 20192021 the slight decline in 2020 may be due to benefits being limited by the pandemic During the severe outbreak in the second half of 2021 senior managers periodically explained the Companys epidemic prevention measures through internal mail and employees were willing to cooperate with the measures The Companys overall performance was not affected by the pandemic and also did not cut salaries or benefits so approval slightly increased but still did not reach the original standard of 73,9
Note This survey uses a tenpoint system Average approval refers to 7 points or more The percentages in the columns represent the percentages of survey responses that indicated 7 points or more,12
When the epidemic situation was the most severe we implemented the two shifts two rotations mechanism for employees with school age children to flexibly arrange their work schedule and take care of their children,2
The outbreak caused internal and external events to be suspended so the Employee Welfare Committee distributed gift certificates to thank employees for their cooperation,11
Planned two circular routes between Danfeng Station and A8 Station to provide employees living in Taoyuan Linkou and Taipei Xinzhuang and Taishan with a more convenient option for commuting to work,11
Communication group trainings for midlevel managers Set up group trainings for midlevel managers to help them strengthen leadership and communication skills,8
We continued to improve promotion and compensation measures in hopes of increasing employee approval in the aspects,11
