paragraph,predict_label
The Company has diverse open and transparent communication channels in place to maintain harmonic employment relation facilitate labormanagement collaboration and improve workers benefits These communication channels not only enable employees to express opinions on various issues concerning health safety benefits and basic work conditions but also allow the Company to take initiative in learning employees thoughts and address problems in a timely manner The Company also has complaint mailbox whistleblower hotline and sexual harassment prevention hotline available for reporting illegal matters and any opinions concerning corporate policies may be raised using the Management System Improvement Opinion Form Employees are entitled to communicate openly and thoroughly with the management about workrelated or personal affairs terms of employment salary benefits and personal opinions through the following channels,9
Number of feedbacks and opinions raised in 2021,12
Average time of reply per casereply per case,4
The top 3 issues Plant environment issues 25 cases 2976 TansportationParking issues 22 cases 2619 9 informationinformation security issues 1071,1
The employees of Nanya have established a labor union since April 2012 Although the Company and the labor union have not signed a group agreement we still actively maintain communication and harmony Various communication channels are still utilized to exchange information allowing the labor union to fully perform its functions and express opinions This strengthens the harmonious employment relationship and benefits Employees currently communicate through the Nanya labor union Labor representatives are elected by the labor union representative assembly according to Article 5 of the Regulations for Implementing LaborManagement Meeting Hence the Company believes that labor representatives may overlap with directors and supervisors of the labor union The Company communicates with the labor union on a monthly basis so labormanagement meetings are not convened,11
Number of union members in the last 3 years Taiwan,11
Regular convention of employee meetings Administration contact window forum Production line workers quarterly meetings Unscheduled department meetings,11
Communication Space Suggestion Interchange Area Epidemic prevention mailbox,5
Satisfaction with catering service Satisfaction with activities Employee Engagement Survey,8
Employee meetings are held two times a year,11
The president of Nanya has signed a safety and health policy declaration the Taiwan plant obtained ISO 45001 Management System certification and the NDAZ0002 EHS Management Manual was established to provide a safe healthy and excellent work environment to all workers at Nanya the average of employees was 87 and other workers who are not employees was 13 in 2021 The Company is committed to ensuring that all workers of the Company have the ability to recognize hazards when conducting business activities so that occupational injuries can be prevented,9
Nanya continues to dedicate its efforts to achieve zero disabling injuries in our factories We have not let our guard down when it comes to disaster prevention and we are constantly improving the safety concepts and behavior of workers We have implemented the following measures to prevent occupational accidents,9
Annual regulatory and hazard identification and risk assessment procedures Annual occupational safety and health education and training plan Periodically organize safety culture seminars Job safety analysis JSA to analyze potential operational risks Safety Walk and Talk SWAT Process Safety Management PSM HazOp analysis to analyze potential equipment risks,9
Nanya implemented the following measures to protect employees from occupational disease during special operations that are hazardous to health,9
Annual regulatory and hazard identification and risk assessment procedures Monitoring of work environment is performed twice a year Implement classified management of chemicals and exposure assessment Annual special hazard health exams noise ionizing radiation arsenic indium nHexane and mercury and classified health management Health management plan monitor and assess personnel working too many hours each month repetitive musculoskeletal hazard prevention survey Maternal health hazard assessment for pregnant women 5 or more health seminars are organized each year,9
In 2021 a total of 35 safety and health training courses were completed and 9962 enrollments were recorded New recruits and senior employeesmanagers were trained for certifications required by the law and hazardous operations An emergency response team ERT was established and motorcycle defensive driving courses were provided We organized 48 emergency response drills to strengthen the training and response ability of personnel including medium and high risks such as chemical leakage and fire accidents rescue of injured personnel evacuation during an earthquake or fire accident and actual operations of fire extinguisher In addition to training the Safety and Health Division conducted monthly onsite SWATs at the workplace of various teams based on 36 themes The 35 suggestions for improving operational behavior safety were put forward for personnel to act accordingly to the contents of regulations Improvements to the operational environment focus on safety and health improvements for medium and high risks in clean rooms,9
Three employees implemented level 4 health management due to noise in 2021 After onsite assessment by an occupational medicine specialist and nurse the management measure of reducing noise exposure was implemented,9
Statistical Analysis of Safety and Health Organization Accident Investigation and Disabling Injuries,9
Nanya places great importance on occupational safety and health Occupational safety and health committee meetings are held every month at a regularity higher than what is required by the law Each meeting is directed by the executive vice president while the whole process is participated by senior managers department heads and committee members Labor representatives make up 397 of the committee members They jointly review the achievement statuses of various safety and health management goals accident investigations and the performance of safety and health projects To strengthen communication on health and safety issues in addition to existing channels of the Company eg opinion box on the homepage each department has appointed dedicated personnel to collect inquiries from employees matters requiring participation and proposals through department meetings SWAT and the Safety Environment Event Tracking System SETS The personnel directly contact receive information from respond to and consult the Safety and Health Division establishing smooth channels for safety and health management and communication,9
When an accident is verified by central control after investigation occupational accident false alarm incident that affects physical and mental health the Safety and Health Division will issue a Corrective Action Request CAR to the department that the accident occurred in to conduct a preliminary investigation and take corrective action Whether or not an Incident Investigation Team is established to cooperate with the investigation is decided based on the severity of the accident The Safety and Health Division strictly reviews corrective action taken for accident investigation The department that the accident occurred in must conduct root cause analysis RCA including direct and indirect causes and propose improvement and prevention measures to close the case,9
Nanyas Proactive Safety and Health Improvement Plan for Clean Room Work Environment,9
No of medium and high risks and improvement plans,18
Summary of Improvement Plan Fall protection for machine maintenance personnel working on platforms liquid suction device for residuals in empty buckets pipeline support enhancement and protection measures for pipeline modification residual risk management,19
Earthquakeproof construction for clean room machines and material shelves lighting improvement for clean room areas efficiency improvement for clean rooms local air exhaust equipment leakage prevention measures for pipeline valve and chemical storage areas,21
Work safety for working aloft in clean rooms adding lifelines lighting improvement for clean room areas adding protection nets for material shelves in clean rooms fall protection for machine maintenance personnel working on platforms rust and leakage prevention for pipeline valves,9
Clean room machine cover shaker improvement and work platform personnel collision prevention power connector insulation improvement local air exhaust equipment improvement pipe coating prevention and valve leakage prevention measures,21
Central control reports and verifies labor safety accident,9
Safety and Health Division issues CAR to the department that the accident occurred in,9
The department that the accident occurred in conducts an accident investigation and proposes corrective action,9
The Incident Investigation Team investigates the accident the department that the accident occurred in responds to the CAR,9
Safety and Health Division reviews the corrective action,9
Safety and Health Division conducts review to close case,9
Note Incident Investigation Team 1 Head of the department of the incident 2 Personnel of the department of the incident 3 Work safety personnel 4 Other Nurse contractor construction supervisor or other personnel 5 Labor representative,9
There was a total of 26 false alarms in 2021 The main improvement to false alarms this year is liquid leak alarm 77 which is mainly caused by personnel not taking machinery offline when performing abnormality improvements or maintenance and old connectors of chemical pipes Improvement measures that were taken include reviewing the procedures for constructing chemical pipes and connectors and making important valves a part of daily inspections and periodic replacements,5
Disabling injury frequency rate No of disabling injuriesMillion work hours and severe disabling injuries rate No of lost work daysMillion work hours were both 0 in 2021 However there was 1 case of contractor personnel injured in the machinery installation and construction process in 2021 in which personnel stepped into a hole in the elevated floor and bruised his right calf After investigating the incident Nanya provided the contractor with a loadbearing acrylic plate to cover the hole in the elevated floor and conducted a job safety analysis to reassess the risk of operating procedures as an enhanced improvement measure,9
Number of deaths resulting from occupational injuries number of people,9
Number of recordable occupational injuries no of people,9
Note 1 The occupational injury death rate and rate of recordable occupational injuries is calculated based on million workhours Note 2 There were no serious occupational injuries excluding number of deaths and those who lost more than six months of work days in 2021 Note 3 In 2021 the Company had no financial loss resulted from compensations or fines as outcomes of lawsuits involving employee occupational injuries or occupational illness Note 4 Other workers who are not employees refer to contractors Note 5 Number of recordable occupational injuries is consistent with the number of occupational accidents reported by the Company,9
Safe contract work division of labor based on specialization,11
Contractor safety has always been an important safety and health management item of Nanya We have also treated the personnel of contractors as our own employees and show respect and gratitude to contractors for using their professional abilities equipment and technologies to assist Nanya in completing various projects Besides monitoring quality and progress we prioritize providing an excellent environment and management for projects to be smoothly and safely carried out We provide guidance to personnel of contractors to abide by regulations and engage in safe behavior in order to achieve zero disasters and zero accidents,9
In order to further strengthen and optimize safety measures Nanya established a grading system for all contractors that undertake construction works outsourced from the Company The system exists not only to control contractors quality and occupational safety and health standards but also to protect their employees from occupational injury We collect data on professional contractors for each type of project evaluate their construction site machinery and equipment their construction site safety management ability technical ability and past performance and then divide contractors into Grade ABC based on their ability and performance Contractors that are not assigned a grade can apply for an upgrade review We also periodically convene contractor forums and provide a contractor platform providing guidance for contractors to be upgraded according to their category construction safety personnel professional technicians main technicians subcontractors construction machinery and performance Safety and health management expenses are listed as a required item during budgeting and safety and health facilities must be listed in detail and included in the construction specifications in the contract Nanya manages contractors according to regulations and standards of Formosa Plastics Group and also prepared an application form for controlled constructions application form for hot work application form for lifting and suspension cage operation and high risk construction worker checklist We also control and inform contractors of the work environment hazards and safety and health regulations to maintain construction safety,9
The Company currently has a number of safety and health management mechanisms to maintain a safe work environment for workers such as selfinspection conducted by each unit inspection and proposals by personnel of the safety and health department SWAT and accident report investigations The mechanisms are also applicable to contractors Employees are encouraged to monitor contractors for unsafe conducts and may report abnormalities to Central Control through the their team leader or safety and health personnel via safety and health management mechanisms for immediate tracking and improvement,9
All personnel of contractors must take the contractor preentry safety and health training course before entering our factory The purpose of the course is to inform them of work environment hazards regulations that require compliance and raise their safety awareness Employees that serve as safety supervisors are required to complete the safety supervisor course required by internal regulations This is to ensure that they are clear about the duties of a safety supervisor in order to prevent an occupational accident from occurring,9
Preentry Safety and Health Training for Contractors and Training Completion Rate,9
With the green concept that we have only one earth Nanya insists on leaving the best environment to every future generation We actively manage all impacts on the environment incurred during operational processes On the aspects of energy resources emissions and waste we adopt higher standards than regulations to avoid or reduce risks of the impacts setting goals to review execution results of sustainability performance in order to fulfill our responsibilities for cleaner production and safeguard the natural environment As climate change has become one of the most significant global risks we implemented risk identification assessment and management in accordance with the framework of the TCFD Recommendations to enhance our operational resilience under the risk of climate change,13
Note The scope of environmentalrelated data in this chapter is mainly based on Nanya Technology Corporation which does not include subsidiaries,1
Greenhouse gas verification in the factory area and coverage rate of climate change risk identification,25
Reduced VOCs emissions per unit production capacity by 463 compared with 2017,21
Energy conservation and carbon emissions reduction Set short medium and longterm goals and actively implement related management measures,25
Lowcarbon manufacturing Commit to improvement in production technologies and reduce greenhouse gas emissions in the production process,25
Circular economy Increase waste recycling and reuse rate to use resources effectively,19
Source reduction Continue to promote waste reduction and increase waste recycling rate,19
Reduce unit greenhouse gas emissions by 38 from 2017,25
Reduce greenhouse gas emissions per die by 25 from 2017,25
0 cases in violation of environmental laws and regulations,12
0 cases in violation of environmental laws and regulations,12
Reduction rate of Fluorinated Greenhouse Gases Fgases emissions from processes reaches a minimum of 93,25
Reduction rate of Fgases emissions during processes reaches 90,25
Rate of auditing and coaching waste disposal contractors onsite 90,19
Rate of auditing and coaching waste disposal contractors onsite 80,19
Reduce Fgases emissions per die by 38 from 2015,25
Reduce Fgases emissions per die by 25 from 2015,25
Reduce VOC emissions per die by 46 from the base year of 2017,25
Reduce VOC emissions per die by 40 from the base year of 2017,25
Implementation of energy conservation measures Implement ISO 50001 Energy Management System for systematic management and improve the efficiency of energy usage,24
Response to risks Establish backup water sources and water storage tanks and use emergency response organization between company plants to coordinate water usage,5
Innovative applications Use external exchanges or training to obtain the latest energy conservation technology or energysaving methodology,24
Wastewater recycling and reuse Establish wastewater collection processing and adopt different multiple recovery and reuse to improve the water recovery rate,20
Water usage reduction Conserve water through daily management,20
Cumulative energy saved with energy conservation measures from 2017 to 2022 reaches 64000 MWh 2304 Terrajoule and above,24
Cumulative energy saved with energy conservation measures from 2017 to 2021 reaches 58300 MWh 210 Terrajoule and above,24
Cumulative energy saved from 2017 to 2021 totaled 58850 MWh 212 Terrajoule,24
Annual renewable energy use reached 7880 MWh 284 Terrajoule,24
Annual renewable energy use reached 1260 MWh 454 Terrajoule,24
Annual average process wastewater recovery rate 90 and above according to the formula set by Hsinchu Science Park Bureau,20
Annual average process wastewater recovery rate 87 and above,20
Other losses in production caused by restricted water supply 0 wafer,20
Other losses in production caused by restricted water supply 0 wafer,20
Other losses in production caused by restricted water supply 0 wafer,20
Nanya responded to the international trend of carbon reduction by implementing the Recommendations of the Task Force on Climaterelated Financial Disclosures TCFD which was provided the international Financial Stability Board FSB in 2018 and publicly supported the TCFD in 2021 actively establishing mechanisms and strengthening operations We developed strategies and actions in response to climate change on aspects of governance strategy risk management and metrics and targets in hopes of reducing the impact of climate risks,13
Establishing the Risk Management Committee under the board Climate change strategy are established by Sustainability Committee which is chaired by the President,13
Sustainability Committee Risk Management Promotion Center and Project Improvement Organization energysaving wastereduction and carbonreduction are responsible to implement climate change management,13
Risk Management Committee had held 6 meeting to supervise operation risks which include emerging risks carbon fee or renewable energy Energy conservation management plans are formulated each quarter and implementation is reviewed Of the 35 plans in total 33 were energy conservation plans and an estimated 7585 MWh was saved,24
The Corporate Sustainability Committee convened quarterly discussing corporate sustainability topics such as corporate governance society environmental protection and energy conservation Responses to climate change was also one of the discussion topics The discussion topics were listed as resolutions or action items that required followups and improvements For example formulating a renewable energy plan and discussing the SBT,13
Based on the TCFD framework short medium and longterm climaterelated risks and opportunities are periodically identified and so are impacts of climaterelated risks and opportunities on organizational operation strategy and financial plans,13
The resilience of organizational strategy is considered under different climate scenarios Establishing 5 strategies which are Low Carbon Product RD Green Technology Production Adapting to Climate Risks Join Hands with Sustainable Partners and Cultivate Climate Awareness,13
In accordance with the TCFD methods short medium and longterm climaterelated risks and opportunities were discussed and identified crossdepartmentally A total of 23 risks and 11 opportunities were identified We have submitted an application to achieve the SBT certification by 2030 and completed the schedule for purchasing renewable energy and planning of financial expenses,18
We used the 2 global warming scenario of the UN Intergovernmental Panel on Climate Change IPCC and International Energy Agency IEA to analyze climate risks during operational processes and updown stream and developed relevant mitigation measures that complied with the Adaptation Policy Framework for Climate Change In addition we formulated a longterm mitigation and adaptation strategies and goals,13
Impact levels and occurrence probability are used to assess the significance of related risks and opportunities brought by the climate change and relevant response measures are set,13
Climate risk identification and assessment results are incorporated into the Enterprise Risk Management ERM and are periodically verified by senior management,13
Material risks that were identified include carbon fee renewable energy requirements from regulations and customers The financial impacts were estimated and reported to senior management for review in the annual meeting of the Finance Risk Management Committee,12
Identified a total of 9 material risks and 11 material opportunities such as carbon fee and low carbon production RD,17
Greenhouse gas management and goals of resource recycling and reuse are stipulated Compiled an inventory of the carbon footprint of all products and implemented management plans to improve hot spots of carbon footprint Compliance with renewable energy regulations on major electricity users and set the mid and longterm renewable energy targets,25
The scopes 123 of greenhouse gas inventory and verification are conducted annually to confirm sources of greenhouse gases for key project management Implementing supplier chain improvement projects We aim to participate in the international Carbon Disclosure Project CDP disclosing information on carbon emissions and communicating with stakeholders,25
We set the goal to reduce GHG emissions per die by 25 from 2017 and the goal was achieved Completed the inventory of the carbon footprint of all products and implemented management plans to improve the three hot spots of carbon footprint in the 2020 Inventory We Used 26 million kWh of electricity from onshore wind farms signed a 10year contract with a solar power plant in 2022 to purchase and use 25 million kWh of renewable energy by 2023 We set a target of renewable energy to reach at least 2530 of electricity use in 2030,25
A total of 33 energy conservation plans were completed in 2021 and saved an estimated 7585 MWh Setting Science based target we will reduce 25 carbon emissions by 2030 compare to 2020 Implementing supplier chain improvement projects which save 3315 MWh in 2021 We received the ratings of A in the CDP in 2018 and 2019 and acquired excellent result by receiving the rating of A List leadership level in 2020 and 2021,24
The main sources of greenhouse gas emissions from semiconductor fabrication plants are electricity and perfluorocarbons PFCs Among them electricity is essential for operation and production enabling all machinery and equipment at plants to normally operate PFCs are perfluorocarbons and other compounds of the same kind used in production process categorized into the greenhouse gases with high global warming potential,25
We refer to the ISO 140641 four regulations formulated by the Environmental Protection Administration under Taiwans Executive Yuan ie the Greenhouse Gas Reduction and Management Act the Regulations Governing Greenhouse Gas Emissions Inventory and Registration the Greenhouse Gas Verification Guidelines and the Greenhouse Gas Registration Guidelines and the requirements of the WBCSDWRI Greenhouse Gas Protocol using the method of 100 percent operational control to set organizational boundaries At present Nanya commissioned SGS to complete verification of ISO 140641 GHG emissions including Scope 1 Scope 2 and Scope 3,25
The inventory scopes of Nanya were all operating locations in Taiwan The main sources of GHG emissions were purchased electricity and steam accounting for about 8688 and process emissions accounting for about 1312 GHG emissions in 2021 totaled 430048 metric tons CO2e Scope 1 emissions totaled 56409 metric tons CO2e and there was no CO2 emissions from biomass fuel Scope 2 emissions totaled 373639 metric tons CO2e,25
