paragraph,predict_label
In order to respond to trends in corporate sustainability enhance sustainability awareness in the supply chain and expand influence to the entire product value chain we continued to hold the 2nd Nanya Sustainable Supply Chain Seminar in November 2021 inviting scholars from the Taiwan Academy of Corporate Sustainability TACS and 22 critical suppliers to jointly participate in corporate sustainability The sustainable supply chain management strategy of Nanya was promoted during the seminar and issues of concerned were shared with suppliers Suppliers GlobalWafers Co Ltd and Powertech Technology Inc shared the measures they implemented for environmental and social sustainability so that other suppliers attending the event can learn from each other Furthermore Professor Allen H Hu at the Taiwan Academy of Corporate Sustainability was invited to analyze supply chain management trends Exchanges during the seminar allow us to jointly move forward on the path to sustainability together with suppliers,17
Nanya uses the annual assessment to convene seminars and discuss requirements regarding production with suppliers We also educate suppliers about related sustainability topics on an ad hoc basis In addition we organize award ceremonies for outstanding suppliers based on the results of the annual assessment During the ceremonies senior executives directly communicate to suppliers regarding goals and requirements of the supply chain for quality technology delivery services costs and sustainable operations We compared suppliers of raw materials components and equipment in 2021 and presented awards to 8 outstanding suppliers,17
Suppliers stable and good supply capabilities come from stable production manpower and friendly working environments Migrant workers are indispensable sources of labor for a majority of factories However most of migrant workers are brought to Taiwan through manpower agencies which is prone to high risks of human rights management Therefore we have promoted the human rights protection for migrant workers to be the main theme of our sustainability project in the supply chain We started to assess human rights risks of contractors migrant workers in 2019 The assessment was based on the provisions of Freely Chosen Employment in the RBA Code of Conduct including voluntary work and redundancy zero fees for workers and not holding their identity cards and personal certificates under any circumstances and no unreasonable restrictions on workers freedom of movement and their primary movement areas We continued to implement the project of human rights protection for migrant workers in 2021 The project targets the top 25 critical suppliers in terms of transaction amount and employee migrant workers aspects include Zero payment including commissions fees of accommodation transportation documentation and health checkups installing lockable safe boxes for storage of important documents and possessions direct remittance of wages to employees bank accounts free access to working and living space holding religious and cultural activities and preventive measures against infectious diseases In 20192021 the amount refunded totaled approximately NT451 million benefiting 2009 migrant workers,11
Nanya held meetings promoting the use of renewable energy by suppliers in order to accelerate the use of renewable energy to replace fossil fuels and achieve energy transition to control global temperature rise within 15C Many suppliers responded and will purchase 23 million kWh and above of green electricity before 2023,24
Climate change is a critical topic facing the entire world in this century The Company has actively promoted energy management programs for years During the sustained promoting process we have considered sharing our experience of energy management improvements with suppliers with relevant equipment so the suppliers may implement effective energysaving programs to lower their energy consumption Suppliers selected by Nanya in energy conservation projects are mainly suppliers of equipment that consume relatively more electricity and include 14 packaging and testing contractors and raw materials and photomask suppliers We saved over 3351 MWh of electricity and reduced emissions by 1664 metric tons CO2e in 2021 Improvement items include ice water pump cooling water pump and freezer replacement,24
Nanya is committed to a responsible procurement management strategy for the ban on conflict minerals to satisfy current and future market legal and regulatory expectations We aim to meet requirements for the ban on conflict minerals and bear responsibilities specified by the Responsible Business Alliance RBA and satisfy the Responsible Minerals Assurance Process RMAP Nanyas 6 tier1 contractors and 7 tier1 materials suppliers have completed investigations on conflict minerals in their supply chains and confirmed that all 34 of the Tier2 and Tier 3 minerals suppliers in the supply chain meet requirements of the Responsible Minerals Assurance Process in the smelter survey making substantive contributions to the environment and the industrial supply chain,17
Contractors and raw materials suppliers that use 3TG and cobalt are required to comply with our policies,17
Hence users or suppliers of 3TG use the Conflict Minerals Reporting Template CMRT while users or suppliers of cobalt use the Cobalt Reporting Template CRT as survey tools to provide survey results on the source of 3TG and cobalt in order to ensure that the supply chain is not a part of actions by warlords or armed groups that harm basic human rights and complies with the responsible minerals assurance policy 06,17
Nanyas production line increased production of wafers packaged IC and DIMM modules As a result the number of 3TG and cobalt smelters replied by the supply chain increased by 45 from 181 to 226 smelters in 2021,17
Nanya began adding the Statement of Comply with RMI Policy and Conflict MineralFree on its product labels in 2022 declaring that none of our products use conflict minerals,15
Multi area sourced by procure some from DRC or countries located africa,17
Multiple sources from Recycle Scrap or Mineral Mining,19
Multi area sourced by procure some from DRC or countries located Africa,17
Multiple sources from Recycle Scrap or Mineral Mining,19
Minerals used in our existing products are gold tantalum tin tungsten and cobalt collectively referred to as 3TG Approximately 25 of the 55 smelters replied that the source of the minerals might come from the Democratic Republic of the Congo or neighboring countries as well as from recycled or discarded metals The 55 smelters have confirmed that the source of all the minerals conformed to the Responsible Minerals Assurance Process RMAP policy and were accredited by the Responsible Minerals Initiative RMI team as legitimate smelters,19
Applications of gold tantalum tin tungsten and cobalt used by the Company are as follows,24
Wafer manufacturing target material and passive components alloy material,15
Wafer manufacturing target material and passive components alloy material,15
Wafer manufacturing target material and passive components alloy material,15
Conflict Minerals Initiative Group policies or customers requirements,17
Nanyas supply chain maintains multilevel supply chain relations with the raw ores Before investigations we shall inspect the supply chain materials and define the applicable categories of gold tantalum tin tungsten 3TG and cobalt in the Companys products We shall screen and select suppliers for the conflict minerals investigations and implement a series of topdown investigations on the suppliers We shall use the standard investigation tools defined in the Responsible Minerals Initiative RMI and obtain the latest lists,17
Consolidate information about wafer material suppliers who use the 3TG,17
Consolidate information about rearsection minerals suppliers who use the 3TG,17
Confirm and consolidate CMRT information in supply chains,17
Refer to the latest CMRT standard questionnaire and smelter information announced by the RMI,17
Formulate corporate conflict minerals policies and record information about 3TG usage,12
Periodically verify the latest developments and updates of the Responsible Minerals Initiative RMI,12
Corresponding Product Categories for 3TG and Cobalt and Investigation Data,15
Nanya provides memory products According to due diligence in the supply chain and comparison with the list of qualified smelters of the Responsible Minerals Initiative RMI a total of 47 minerals suppliers including 6 Tier1 contractors and 7 Tier1 raw materials suppliers as well as 34 Tier2 and Tier3 suppliers have provided information on the source of 3TG and cobalt and we identified information for 226 smelters in the supply chain investigation Currently all these 226 smelters are accredited smelters by the Responsible Minerals Initiative RMI and completely comply with the conflictfree minerals and responsible minerals policy,17
Nanya shall continue to implement due diligence based on the Responsible Minerals Assurance Process RMAP and lower risks in the supply chain,17
Continue to cooperate with supplierscontractors and implement supply,17
chain investigations to ensure the accuracy of the information,0
Audit suppliers to evaluate the supply chains policy and practice of the,17
Consolidate forces in the supply chain and request 3TG smelters to pass the verification procedures in the Responsible Minerals Assurance Process RMAP to verify the source of the minerals,17
Nanya has implemented conflictfree mineral supply chain investigations since 2009 Our implementation method is bases on supply chain survey results RBARMI management guidelines and customers requirements We adhere to the management spirit of continuous improvement continuously communicate with the supply chain and identify supply chain conditions and analysis of the investigation results timely adjustment of the Companys nonconflict management indicators and responsible mining policy showing positive cycle management results,17
06 Distribution of 3TG and cobalt production by region,17
Based on supply chain survey resultsexamine the suitability of the Responsible Minerals Policy,17
Distribution of 3TG and cobalt production by country,24
Is it from disputed regions or traded from countries with low concern for human rights,10
Collecting information on smelters will gradually become the norm due to the Responsible Minerals Initiative RMI Natural resources will gradually be depleted and most resources are managed and controlled by a few countries or governments due to geography In the mining process of natural resources tremendous energy consumption water resource pollution land loss and even illicit incidents such as infringements of human rights may occur Hence companies should fulfill their social responsibility take environmental protection labor rights and basic human rights seriously and extend management indicators to suppliers based on the spirit of lawful procurement,10
In the past decade in response to requirements from clients and various social aspects Nanya has participated in investigations of rareearth materials metalloids and volatile organic compounds VOCs and actively introduced backup suppliers into our qualified supply chain Moreover we have ensured that all suppliers in the supply chain are very cooperative in replying to our requests and gradually meeting regulatory requirements on company indicators so as to meet clients expectations and achieve sustainable operations,17
An Active Participant in Giving Back to Society,10
Nanya is committed to social engagement and participates in public affairs and local care to become an active participant that gives back to the society We promote social influence and community development to lead society to a better and sustainable future,10
Number of hours invested by Nanya in social engagement,10
A total of 2964 participants in 44 seminars,2
As of 2021 a total of 17404 people consumed fair trade coffee and assisted community development and economic growth in the Third World,10
Talent cultivation Conform with the education system and cultivate outstanding semiconductor talent,8
Environmental protection Connect different types of NPOs and promote environmental protection ideals,23
Humanistic care Improve social welfare by working with local art and charity groups,2
Good neighbor Participate in public affairs in the neighborhood communities and build a harmonious and mutually beneficial living sphere,10
Total investments increased by 15 from 2020 Target achievement status,12
Establish a volunteer team and the number of volunteers 100 people Target achievement status,8
Establish a volunteer team Volunteer team has 73 people,10
Awarded the WorkLife Balance Award Target achievement status,4
Suspended and postponed this year owing to the COVID19 pandemic,13
Acquired the Accredited Healthy Workplace certification Target achievement status Did not receive award,8
As an industry leader Nanya earnestly commits itself to creating positive influences The Company has responded to the challenges proposed by the United Nations in the Sustainable Development Goals SDGs by combining our core capabilities with SDGs We have connected our core capabilities with three SDGs and developed four main developmental directions We continue to promote these four directions to exert social influence One of the three SDGs we have connected to is SDG 8 Decent Work and Economic Growth which is our driving force for talent cultivation and industryacademia collaboration to actively promote technology upgrades and enhance economic value through innovation so as to help young people and students develop professional skills By connecting to SDG 8 we have set up a main public welfare theme of talent cultivation SDG 13 Climate Action allows us to deeply experience the impacts that extreme climates have had on the community environment and the ecology Therefore we have set up a main direction of environmental conservation to safeguard environmental biodiversity and move toward a low carbon society SDG 17 Partnerships for the goals is the foundation for the Companys public welfare implementation so we have built two main themes of humanistic care and community harmony so that we are able to make longterm contributions to the communities and neighborhoods in which we have been operating,23
We have set short medium and longterm goals for the four main directions of social engagement namely talent cultivation environmental conservation humanistic care and community harmony We combined funds supplies and manpower inside and outside the company to take social engagement actions In 2021 we continued to stride forward on the basis of the promotion paths and cumulative results in past years taking the lead in creating greater influence,10
Driving force By using the Companys core operational capabilities we conform with the strength of industry government and academia to connect with the governments technology policy and we also conform with the education system to jointly cultivate talent,8
Driving force Integrate the strength of internal employees with that of external nonprofit organizations to promote environmental protection awareness We also reach to business partners and initiate attention to climate change topics hoping that we may exert greater influence,13
Driving force We work with local art and culture groups and charity establishments to implement the plans for humanistic activities to take root Moreover we aim to form a society of truth kindness and beauty with humanistic culture on the basis of expansive vision,10
Driving force Participate in public affairs in the neighborhood communities and take practical actions such as sponsoring local art and culture and responding local needs to promote a harmonious and mutually beneficial living sphere,10
Vision Build a green and sustainable ecological environment,23
Vision Create and convey the power of beauty and kindness,10
Vision Establish an inclusive and harmonious living sphere,10
Social influence Promote general science education Implement industryacademia collaboration,10
Subjects Local arts and culture organizations and charities,2
Social influence Mitigate ecological impact Popularize environmental protection knowledge,23
Social influence Enhance social wellbeing Promote arts and culture,10
Social influence Make contributions to the neighborhoods Realize community inclusion,10
Influence starts with change Nanya has adopted the London Benchmarking Model LBG to evaluate the benefits and influence of each public welfare activity and adjust public welfare programs and invested resources step by step Moreover Nanya reviews the effects and results to tightly link core operations with social issues To deepen and expand corporate longterm influence on society the Company focuses on connecting its core operational capabilities with social demands We hope that through our professional innovative capabilities which are our most competitive advantage we are able to resolve social issues and create a mutually beneficial and beautiful home Shared value is the core concept of Nanyas participation in social public welfare Our shortterm goal is that our invested resources will deliver the maximum benefits Our longterm goal is that the behaviors awareness and wellbeing of the entities we have helped will generate positive influence,10
Content Future Stars Outstanding Projects Cultivate Students Understanding Projects Speech Projects,2
Commercial benefits Future Stars Scholarship 27 nominated 9 recipients and 5 internship scholarships Innovative technology RD 5 industryacademia collaboration cases Enterprise Understanding Projects 184 visitors Supervisors serving as industry experts 23 supervisors,12
Social benefits Cultivated students Scholarships amounted to approximately NT550000 Assistance in employment opportunities approximately NT351 million was invested in internship projects Enhanced technological capabilities NT66 million million in industryacademia collaboration projects Industryacademia connections 1475 participants for the lectures of professionals from industries,8
Media favorability 800 hours of online media exposure,12
Environmental protection initiative participated in 1 environmental protection initiative event,23
Reduction of plastic paper and carbon usage 125000 kWh saved in electricity consumption through turning off the lights for one hour in all of Taiwancarbon reduction of 36 metric tons in all of Taiwan,24
Media favorability 1689 hours of online media exposure,4
Prospering community environment purchased 288 kg of fair trade coffee,10
Reducing the wealth gap provided financial aid to 8 entities,12
Deepen community communication interacted with 29218 people in the neighborhoods,10
In recent years cash and commodities have been the main resources Nanya has invested in public welfare activities accounting for 90 of all resources while employee volunteering accounts for a part of Nanyas participation The main types of public welfare activities are commercial activities aimed at technological talent cultivation followed by longterm investments in the communities Only a small part of the activities are purely for charity In the future we will continue to examine the results of charity events through LBG and set longterm goals for charity events in hopes that the types of resources invested in commercial initiatives will be greater than investments in charity and communities Furthermore we formally established a volunteer team in 2021 and expect the percentage of volunteers will increase each year through system planning,2
Nanya is committed to cultivating technology talent and the investment amount has increased from over NT2 million to over NT40 million with substantial increases year by year The increased budget was mainly invested in talent cultivation under Focus On U The commercial innovative public welfare activities which use our core capabilities to resolve social issues have always been our priority in implementing our public welfare themes Nanya has actively promoted technological upgrades and innovations for economic value enhancement in order to cultivate professional skills of youngsters and students allowing us to be in line with the ideas of Decent Work and Economic Growth of SDG 8 on the aspects of talent cultivation and industryacademia collaboration,8
Nanya hope that we may solve current social and environmental issues when participating in social engagement rather than only sponsoring public welfare activities or making donations Therefore in the process of forming the four main themes we were constantly thinking how we could connect the resources of industry government and academia to jointly exert influence taking the lead in promoting the aspects of talent cultivation environmental conservation humanistic care and community harmony Moreover we want to show the results to the public to convey Nanyas ambition to be interactive mutually beneficial local and connected,10
In addition to doing our utmost to promote social engagement Nanya whose core business is semiconductor also takes advantage of its competitiveness in the technology industry and utilizes the existing resources manpower and supplies to collaborate with universities and colleges as well as industrial and academic institutions Not only do we make contributions to cultivating Taiwans technology talent but we also reinforce the Taiwans competitiveness in the technology industry,4
Nanya continued its community involvement efforts under the four themes Talent Cultivation Environmental Conservation Humanistic Care and Community Harmony in 2021 We combined the efforts with the 4U Project Focus On U Light Up Power Up and Line Up in order to gain greater influence by improving the effectiveness of event promotions,10
IndustryAcademia partnerships are instrumental in advancing and creating a skilled workforce Nanya has been contributing towards bridging the gap between Academia and Industry Meanwhile we integrate the resources of industry and academia to jointly enhance the capabilities of Taiwans technology industry,8
Distributed a total of NT2211269 in scholarships Industryacademia collaboration with 5 schools Jointly implemented internship programs with 12 schools,2
Sponsored 4 campus events Organized 5 company visits Organized 44 seminars,2
Enhance humanistic qualities of the public and broaden their horizons on the humanoriented base in order to build a loving and caring social atmosphere,10
Donated to 8 social welfare foundations Donated to 1 hospital A total of 17404 people consumed fairtrade coffee,2
The burdens on our earth resulting from climate change and environmental pollution are getting serious and gradually becoming a global focus Thus it is imperative to fulfill our responsibilities as citizens of the Earth through enhancing environmental conservation awareness,13
About 716 employees participated in the initiative activities and the amount of NT548920 was invested,12
Local prosperity and local value preservation should not be contradictory but complement each other As cultivating local connections how to incorporate themselves into community reconstruction is a crucial subject when enterprises think about social responsibility,10
A total of 37 participants joined the mountain cleanup event at our plant the mountain area Invested NT1175064,9
Chinese New Years Eve Dinner held by the Taishan District Office,2
Improvement of Access Road to Nanlin Technology Park,23
Nanya in 2020 began to show its gratitude by helping residents in Taishan District organize family gatherings on Lunar New Years Eve based on the spirit of giving back what is taken from society The family gathering event was suspended this year due to the pandemic but Nanya continues to express its most sincere blessings and makes donations to 0 8 local residents that are in need hoping to set an example for others to follow so that people will be more willing to help each other out,2
Nanya is located in Nanlin Technology Park and the main access roads are farm roads and Liming Rd which are important roads for employees of Nanlin Technology Park and Nanya to travel to Taishan and back However the roads are narrow and risky during peak hours Nanyaand Taishan District Office surveyed the roads numerous times and planned to add covers over the sidegutters and widen the roads in order to make it safer for drivers Nanya provided NT998250 to the district office for road improvements,1
Visit of the Department of Electronics Engineering Chang Gung University,8
Visit of the College of Electrical Engineering and Computer Science National Taipei University of Technology Taipei Tech,8
Future Stars We offered NT 221 millions for awarding 5 outstanding students with scholarships and provided future Stars Scholarship to 9 talented students,2
Outstanding Projects We cooperated with 5 universities on 5 industryacademia research plans and the invested amount totaled NT66 millions The Company sponsored 4 campus activities with a total of NT129 millions,12
We cooperated with12 colleges on the internship programs A total of 193 interns worked at the plant including 38 indirect and 155 direct staff members,8
A total of 5 corporate visits were held with about 184 teachers and students participants,2
Speech Projects We conducted 44 seminars to share experts industrial experience in the key schools of northern Taiwan it attracts a total of 2964 attendees in 2021,2
During the Level 3 epidemic alert Nanya donated 2000 epidemic prevention user packs contains disinfectant spray and face masks to Cardinal Tien Hospital supporting and showing appreciation to front line epidemic prevention personnel for remaining at their posts and protecting the health of citizens,5
