paragraph,predict_label
S T N E T N O C F O E L B A T,12
Task Force on ClimateRelated Financial Disclosures TCFD 39,13
We continually work to provide meaningful disclosure on a wide range of sustainability efforts taking place throughout our facilities around the world Throughout this report we will show how the pillars of our sustainability program are woven into our business and demonstrated through our management approach key initiatives performance success stories and future goals Each year we aim to enhance our disclosure on Environmental Social and Governance ESG matters while monitoring developments in ESG reporting This year we remain aligned to the Sustainability Accounting Standards Board SASB disclosures for Marine Transport and Air Freight and the Taskforce on Climaterelated Financial Disclosures TCFD,3
Jeff Musser President and Chief Executive Officer,7
A Letter from Our CEO,0
At Expeditors we take sustainability seriously and are proud to present our current sustainability report which we update at least annually to highlight our continuous progress and latest achievements This year we highlight how we continued to take care of our people and our service providers in the midst of the ongoing global pandemic that created extremely challenging conditions for global supply chains,17
l Service Provider Appreciation We made special efforts this year to recognize and appreciate our trucking airline and ocean carrier partners for their hard work in the face of what at times felt like impossible circumstances,17
l No Layoffs We implemented a no,18
layoff policy in 2020 at the outset of the pandemic Not only was it the right thing to do for our people just as it was during the global financial crisis in 2008 but it allowed us to be there for our customers when demand rose and capacity became more constrained,18
l Protecting Our People We continued to,10
protect our people with the safety protocols in our phased approach to COVID19 response while complying with widely varying rules from local health officials in different countries and navigating multiple waves of virus transmission globally,14
We are proud of the fact that we have always put our people first This strategy fueled by our unique culture has been crucial to our success over the years,8
Above all Expeditors focuses on sustaining its financial health while meeting our customers primary need for pricing efficiencies,18
On the environmental front we recognize that we have the greatest positive impact on the environment when we help our customers eliminate waste and pursue their supply chain transformation strategies,17
l Eliminating Waste Our core business,19
freight consolidation involves the combining of multiple different shipments in an efficient manner to maximize space utilization and consequently minimize the consumption of resources Our business saves money for our customers while being measurably better for the environment,24
l Green Supply Chain Transformation We are uniquely positioned to help our customers leverage more fuelefficient fleets and lower carbon routing options precisely because we do not own transportation assets We remain free to tailor solutions to customers needs and poised to accelerate the transition to next generation assets as they become available,17
l Datadriven Metrics Our visibility tools and supply chain digital twin solutions deliver the critical data customers need to drive and measure their green supply chain transformation targets,17
Given stakeholders increased expectations for companiesincluding oursto measure manage and report their ESG risks and opportunities Expeditors can provide customers increased efficiencies and reduced costs while minimizing their environmental impacts,18
We explain our approach and highlight key accomplishments in greater detail throughout this report We invite you to explore what we are doing ask questions and provide valued feedback,12
I want to thank our entire team for their tireless efforts around sustainability in 2021 as we continued to persevere through the COVID19 global pandemic By investing in sustainability continuing to safeguard our people and recognizing our service providers we invest in Expeditors future and the future of our employees customers service providers and communities,3
Jeff Musser President and Chief Executive Officer,7
Todd Brown Vice President Associate General Counsel ESG Executive Sponsor,12
A Letter from Our ESG Executive Sponsor,12
By almost every measure 2021 was the most challenging year in supply chain that anyone can recall fraught with disruptions and operational challenges the likes of which no one had seen previously A year ago the world was emerging from the Second Wave of COVID19 with first responders and vulnerable populations beginning to receive vaccines There was a sense that we might be almost out of the woods We could not know at that time that we had such a long trail ahead throughout 2021 that would include Delta and Omicron For us the story of 2021 was one of endurance and resilience,17
Fortunately at Expeditors we had our culture and we had each other As Expeditors founder and thenCEO Peter Rose said during the Great Recession of 200809,18
You cant go around some challenges you just have to go through them and were doing that Expeditors didnt progress from having 20 employees in 1981 to become a Fortune 500 company in 2007 through the efforts of employees living in constant fear of being laid off It is our people who are responsible for those accomplishments We need them all and the leadership culture that permeates this company at all levels now more than ever,8
More than a dozen years later his words ring true today Reflecting on 2021 and seeing that our ESG initiatives continue to advance we are proud of the fact that we have had a formal ESG Committee in place for more than 5 years now More importantly Expeditors commitment to sustainability is rooted in our business model and is reflected in multiple longstanding mechanisms that we have put in place to promote the best interests of all Expeditors stakeholders including our customers employees service providers communities and shareholders,3
WHAT IS THE PURPOSE OF OUR SUSTAINABILITY REPORT,3
By publishing this report Expeditors is pleased to be able to tell our storyhow ESG fits into our companys culture mission and goals and how we are making consistent progress through our initiatives We hope this report serves not only as a source of education and validation for our stakeholders but also as a source of inspiration for sustainability efforts in supply chain and logistics as a whole,17
HOW DO WE APPROACH SUSTAINABILITY AT EXPEDITORS,17
At Expeditors we have been quietly and steadfastly going about our work in these important areas for many years,12
In our report you will see that,12
l We have always said our people come,10
l We have always said that superior financial results are essentialno change there,18
l We have always said that ours is a place of unlimited opportunityno change there,12
What is evident from our report is the power of our unique culture that has organically set in motion our efforts to,8
l Build Green Teams in our districts,15
motivated by passionate people seeking ways to save the planet while saving the bottom line,10
l Create opportunities for youth and,2
l Expand our corporate charitable giving program and encourage districts to get involved locally through giving and volunteer activities and,2
l Organize Safety Teams in every district to make sure we continue to protect our people,9
On the environmental front we made additional strides both to manage our own GHG emissions and to help our customers eliminate waste and pursue their own supply chain transformation strategies,25
Continued A Letter from Our ESG Executive Sponsor,12
These efforts have culminated in several key decisions,12
l We are creating a new role for our,12
l We have engaged a thirdparty to help us complete a formal ESG materiality assessment and,12
l We plan to set our own Scope 1 2 GHG,25
As we gain momentum with these steps forward we will continue to focus on making a difference not only by managing our own emissions but also collaborating with our customers and service providers something we are wellpositioned to do because we operate as an intermediary at the supply chain orchestration level ie we are nonasset based,17
On the metrics front we remain mindful of the rapidly evolving and varied landscape of ESG reporting We continue to monitor competing proposals and standards These include the Stakeholder Capitalism Metrics created by the International Business Council of the World Economic Forum as outlined in their report entitled Toward Common Metrics and Consistent Reporting of Sustainable Value,3
Creation with its four organizational pillars 1 Principles of Governance 2 Planet 3 People and 4 Prosperity as amplified in September 2020 by the supplemental report entitled Measuring Stakeholder Capitalism,10
While we wait for the emergence of a standardized ESG disclosure framework in this years report we are once again mapping our disclosures on a range of ESG topics to selected metrics outlined in the Value Reporting Foundations SASB Standards and in the Task Force on ClimateRelated Financial Disclosures TCFD that are directly relevant to our nonasset knowledge based business model You will find our SASB and TCFD disclosures indexed in the Indices section at the end of this report,18
We want to thank all of our employees for their tireless effortsyear in and year outto reinforce our culture through their sustainability efforts worldwide We also wish to thank our ESG team members for their work in leading our sustainability efforts at Expeditors I am extremely proud of not only what we are doing but also how we are doing it authentically tirelessly methodically and always in keeping with our culture mission and goals,10
Finally we extend our sincere condolences and sympathy to those who have suffered directly during the tragic events of the global COVID19 pandemic While the pandemic caused untold loss of life suffering and disruption worldwide its impacts have only caused us to reaffirm our commitment to building and nurturing our resilient sustainable organization one that is built to last,5
Todd Brown Vice President Associate General Counsel ESG Executive Sponsor,12
SCOPE 1 EMISSIONS 705628 metric tons CO2e,25
SCOPE 2 EMISSIONS 4214294 metric tons CO2e,25
SCOPE 3 EMISSIONS 31916 metric tons CO2e,25
9 million pages of paper saved,24
As of the date of publication of this report,12
60 hours of training per employee,11
049 Days Away Restricted or Transferred DART Rate,11
034 Lost Time Incident Rate,9
13 increase in total employee contributions to Corporate Matching Gift Campaign,12
20 Opportunity Knocks Youth locations hired apprentices placed students or financially contributed to youth programs,2
30 Women on the Board,7
100 employees completed required compliance trainings,0
Founded in 1979 Expeditors International of Washington Inc is a global servicebased logistics company that specializes in transportation and supply chain management solutions,17
We work with customers across industries including retail fashion technology oil and energy manufacturing healthcare automotive and aerospace,15
We offer reliable costeffective transportation choices to our customers via air ground ocean and multimodal options and improve customers supply chain performance through our technical solutions,17
We also provide customs and compliance management warehousing and distribution services,12
Our employees are our most valuable asset they set us apart in the industry by promoting both operational excellence and customer service As of December 31 2021 we employed approximately 19000 people worldwide,3
Freight consolidation is at the core of our business and involves the combining of multiple different shipments in an efficient manner to maximize space utilization It minimizes the consumption of resources therefore saving our customers money while being measurably better for the environment by reducing unnecessary waste,19
Expeditors uses a nonasset business model to perform this important supply chain optimization role meaning that we do not own or operate any airplanes ships or trucks,17
For more information on our services and performance please review our 2021 Annual Report on Form 10K,12
In addition to our corporate headquarters in Seattle Washington USA and our regional headquarters in London Dubai Shanghai and Singapore Expeditors operates 176 district offices across the globe We also maintain branch offices in several locations that report into a given district office,7
Our culture is driven by our commitment to our people and devotion to exceptional customer service Our vision statement shown below reflects these commitments and further solidifies the peoplefirst culture we aim to cultivate,8
Our Vision To create unlimited opportunities for our people through sustainable growth and strategic focus inspiring our premier customerfocused logistics organization,3
We foster a higher level of customer service by emphasizing organic company growth rather than growth by acquisition Without fear of a merger our employees can learn and grow faster work harder and with more confidence and are better rewarded for their effort,3
We feel a great sense of pride in our work energy in what we do and focus on customer satisfaction,15
Middle East Africa India 24,12
Our employees embrace our CORE VALUES and help support our company culture,8
Appearance A neat office and a neat personal appearance speak to our commitment to a higher level of professionalism in everything we do,22
Confidence When we trust in ourselves and in our coworkers we can achieve great things together,4
Curiosity We encourage our people to inquire investigate be curious and grow with the knowledge and inspiration that come with a great discovery,8
Excellence Our people challenge themselves every day to go beyond that which is expected and push to another levela level of excellence,10
Pride It feels good to be part of something special and unique and to know that you are valued,8
Visionary We believe in doing more than what may be askedto lead with insight and vision that manage the evolving needs of our clients and our company,3
Attitude Every day we bring the right attitude for service for teamwork and for what it takes to succeed for our clients and our company,10
Sense of Humor While our business is serious a sense of humor keeps us listening learning and having fun with the talented people we work with and for,8
Integrity The pillars of integrityfairness honesty and dignityrest in the heart of successful relationships with coworkers our clients and our service providers,0
Resolute We are resolved to do what we say to take risks to be competitive and to be determined loyal firm and fair,4
Sustainability is not only the right thing to do it also enables us to make good business decisions by being efficiencyoriented highlighting potential risks and opportunities and strengthening the lives of our employees communities and future workforce,10
Our holistic view of sustainability embraces the importance of five groups of stakeholders as espoused by the Business Roundtable,3
LDER S C U S TOMERS,12
O Y E E S,12
O H E R A H S,12
l Delivering Value to Our Customers,15
As indicated in our Mission Statement we have always focused on delivering worldclass customer service,15
l Investing in Our Employees Our,10
unique Vision Statement prioritizes our employees first We create unlimited opportunities for our people through sustainable growth and strategic focus inspiring our premier customerfocused logistics organization,8
l Dealing Fairly and Ethically,0
with Our Suppliers Through our Total Value Proposition we emphasize a win win philosophy with our service providers so that our success is also theirs,17
l Supporting the Communities in which We Work We have a strong tradition of giving back to the communities in which we work through our Corporate Social Responsibility activities as highlighted in the Social section of this report,10
l Generating Longterm Value for,25
Shareholders Our financial performance in terms of cumulative returns to our shareholders over 40 years speaks for itself,3
Business Roundtable Statement on the Purpose of a Corporation,12
Conducting business with integrity is central to our mission of excellence and leadership in the global logistics industry and we hold ourselves to high standards across the three pillars of our sustainability program,0
We believe in the pursuit of environmental quality and taking care of the environments in which we operate We strive to make the communities where we live and work better places to do both and the safety and security of our people and the security of our customers supply chains are a top priority,17
To hear more about sustainability at Expeditors visit our website,15
solutions to industry issues through,17
involvement in key organizations and,10
focus on solutions for the largest industry,17
issues including climate security and,13
ethics Despite our nonasset business,0
model we participate in various climate,13
related initiatives focused on helping,10
our service providers reduce their,4
At Expeditors we go beyond environmental compliance Our goal is to make a positive difference through our own operational footprint and our partnerships with customers and service providers Expeditors nonasset based business model provides several important environmental advantages including our ability to accelerate transitions to more modern fuelefficient fleets as they become available in the market thereby further improving Expeditors and our customers overall supply chain footprint,17
Expeditors manages our environmental impact through a tiered approach Responsibility starts at the senior management level with our President of Global Products leading our environmental strategy and rolls down to the district level where local employees implement and assess environmental initiatives,10
We use Scope 5 a thirdparty environmental management system EMS which allows our employees around the world to upload facility energy data online from utility bills regardless of language and calculates Expeditors carbon emissions We have deployed Scope 5 to all of the facilities under our operational control,24
Select locations use Scope 5 to track additional metrics such as water use diesel gasoline for forklifts garbagerecycling volume and paper purchases Scope 5 enables us to validate data find opportunities to reduce our impact and implement targeted efficiency programs Beyond our EMS several of our locations are ISO 14001certified including two locations in the United States one in France and seven in Germany We aim to strategically increase the number of facilities that are ISO 14001certified,20
We are taking additional steps both to manage our own GHG emissions and to help our customers eliminate waste and pursue their own supply chain transformation strategies,25
In 2021 we took the step of creating a new role for our organization Director Environmental Sustainability,23
This position will help further our external environmental engagement efforts with customers and service providers as well as our internal initiatives around recycling efficiency and GHG reduction To that end we also plan to set our own Scope 1 2 GHG emissions targets in 2022As we gain momentum with these steps forward we will continue to focus on making a difference not only by managing our own emissions but also by collaborating with our customers and service providers something we are well positioned to do because we operate as an intermediary at the supply chain orchestration level ie we are nonasset based,25
Environmental Management Structure at Expeditors,23
Employeeled volunteer teams present at most districts Address opportunities for increased efficiency regarding energy and waste Leaders oversee environmental initiatives,24
Share best practices across operations through quarterly calls,0
Provides resources and guidance to Green Teams worldwide for implementing environmental initiatives,10
Sponsors the Environmental Steering Committee and is responsible for passing strategic decisions between the Global Environment Team and our executives,12
Advises strategizes and ensures alignment across ESG activities throughout the organization,3
Work with their business units to fold our environmental strategy into our business strategy,3
Influencing our Customers Service Providers Environmental Impacts,17
At Expeditors we work closely with our customers and service providers to help them reduce their impact on the environment We suggest sustainability best practices to our customers when requested based on an analysis of their supply chains including modal shifts supply chain speed optimization warehouse space optimization freight consolidation and databased decision making We provide carbon emissions data to our customers using the Greenhouse Logistics Emissions Council GLEC Framework and EcoTransIT software tool This data allows them to better understand the environmental impacts of their value chains and analyze their supply chain impact on a mode and lane basis see Working with Our Customers to Reduce Emissions for further details,17
We also provide information in the EcoVadis supplier questionnaire which is available to our customers who are members of EcoVadis and provides them with transparency into our programs and progress,17
Expeditors service provider contracts require compliance with environmental regulations We even go a step further to include environmental criteria as part of our selection process for service providers We foster partnerships with service providers that have strong environmental attributes such as operating fuelefficient fleets using energyefficient equipment and having strong environmental programs Expeditors is also actively involved in Smart Freight Centres Clean Cargo Working Group and BSRs Sustainable Air Freight Alliance which work to collaboratively bring together carriers shippers and forwarders to reduce freight transportations environmental impact,10
We use a total value approach to select utilize evaluate and reward our service providers While competitive pricing is a high priority we look at the entire longterm value a service provider brings to both our customers and Expeditors,4
Service Provider Management The SPM Program is aligned across the company through a fourphase approach,3
Qualify Assess Needs Plan Source,2
Engage Review Expectations Integrate Execute,12
Relationship Monitor Performance Improve Optimize Strengthen Partnership,12
As a nonasset based logistics company serving more than 100 countries both directly and indirectly Expeditors is committed to reducing our impact on climate,13
We have direct opportunities to reduce energy consumption and emissions at Expeditors offices and warehouses and indirect opportunities through our relationships with customers and service providers We provide supply chain transparency that enables our customers to make informed decisions about their service providers and logistics solutions including their carbon footprint We also submit our global climate performance to CDP annually,17
Expeditors districts across the globe are implementing local practices to help reduce our emissions Several of our districts in China and India have transitioned to more energyefficient LED lighting and implemented initiatives to reduce electricity consumption through signs and reminders,24
Expeditors has been implementing Companywide efforts to reduce our carbon footprint for over a decade As a nonasset owning logistics provider our largest measured source of greenhouse gas emissions comes from the electricity we consume in offices and warehouses Our Scope 1 emissions come from fuel used in our operations Scope 2 emissions from the electricity we consume in offices and warehouses and Scope 3 emissions from employee business travel,25
Our Green Teams track fuel and electricity usage across facilities through our EMS and energy usage is estimated at facilities where electricity is included in rent and primary data is not available We use our energy and emissions data to pinpoint locations in need of enhanced energy saving programs as well as to complete our annual CDP and EcoVadis responses and fulfill similar requests CO2 CH4 and N20 are included in our emissions calculations We consider SOx to be immaterial to our overall emissions and thus do not include them in our inventory,24
Scope 1 2 Emissions METRIC TONS CO2e,25
Scope 3 Emissions METRIC TONS CO2e,25
Scope 2 values for FY 2019 and FY2020 were recast and the decrease vs previously reported numbers is primarily due to the retroactive application of the new US EPA 2020 eGRID emissions factors and improved data reconciliation procedures,21
A significant upturn in business new facilities added and improved data reconciliation procedures were the primary contributing factors to the slight increase in Scope 1 and Scope 2 in 2021,1
Scope 3 includes business travel emissions only excluding Asia which is not currently measured Nonessential business travel continued to be suspended in 2021 due to COVID19,12
Expeditors monitors climaterelated risks and opportunities and assesses their potential impact on our business in the short medium and longterm We monitor climaterelated risks and opportunities through our engagement with our customers and service providers and through our active participation in key initiatives and organizations focused on climate Expeditors operational model and success is based on our ability to meet our customers logistics needs To best do this we use a nonasset model which provides flexibility to work with a range of air ocean and road carriers,13
