paragraph,predict_label
Data minimization We will not collect data that we do not have a legitimate purpose to collect and we will not use it for something other than what it was collected for For example in connection with an online service we will not collect personal data eg contact details that is not strictly necessary in connection with the provision of that service unless a data subject chooses to provide such additional data to us,22
Data accuracy We are responsible for taking all reasonable steps to ensure that personal data is accurate and where necessary current We take reasonable steps to ensure any inaccurate data is either erased or rectified without delay,22
Data retention Personal data may be stored in a local Expeditors branch at an Expeditors national regional or global headquarters at the locations of our service providers and customers at one or more of our international data centers and in the cloud We will retain personal data only for as long as it is necessary to fulfill the purposes for which it was collected including for the purpose of meeting any legal accounting or other reporting requirements or obligations for a period in accordance with our record retention policy If destroying or erasing personal data is not mandatory by law we may make it anonymous such that it cannot be tracked back to the individual,22
Security and confidentiality We have in place appropriate technical and organizational security measures to protect personal data against accidental or unlawful destruction or loss alteration unauthorized disclosure or access Similar to the manner in which we protect our customers confidential information the same standards extend to all personal data that we process,1
Our Flexible Framework Adapts to All Types of Events,12
Expeditors ability to meet the toughest supply chain challenges instills a great sense of pride Weve successfully navigated through hurricanes typhoons wildfires political unrest and cyberattacks The COVID19 pandemic has been no different Although the pandemic has presented its own unique challenges including unprecedented levels of supply chain disruptions delays and other operational impacts Expeditors has persevered Through the strength of our worldwide Business Continuity Plan BCP and our dedicated employees we were able to safely continue our operations and reduce the impact on our customers,17
Our BCP provides a framework for protecting the safety of our people and minimizing adverse impacts on our operations and our customers businesses Within the plan employees can find additional guidance on how it should be implemented The plan also includes protocols on cybersecurity and how to escalate in response to an attack on Expeditors system along with information on key communication systems and tools We exercised these protocols in late February 2022 when we were the subject of a targeted cyberattack that prompted us to shut down most of our operating systems globally to manage the safety of our overall global systems environment As we are finalizing this report we are making significant progress in returning to normal operations leveraging our continuity plans The BCP strengthens our ability to resume regular operations process shipments communicate status updates to our global network and reroute shipments as needed during times of crisis The BCP also sets us up for success through its flexibility and enables us to respond to multiple disasters of various types and levels of severity even if they are occurring simultaneously in different locations,5
The BCP is made up of four overarching steps and a wide range of interconnected systems processes and standard operating procedures,18
Our People Our Customers Our Systems Our Facilities,15
1 Prepare Expeditors prepares our employees through training on the infrastructure processes and strategic teams in place to respond to an event,2
Our employees respond to the event using their training to protect our people and mitigate adverse impacts,10
3 Recover After the event passes our employees work to return all facets of operations to normal levels,11
4 Reassess Once we have recovered we analyze how Expeditors responded to the event and make continuous improvements,24
We encourage our employees to raise ethical concerns by providing two ways to communicate concerns our opendoor policy and our ethics helpline Our opendoor policy encourages direct communication between employees and leadership by ensuring that our employees know they can talk to any supervisor manager or executive Our ethics helpline is operated by an independent thirdparty and allows employees to report their concern anonymously if they choose Employees can find a direct link to the ethics helpline in the Code We take any reports of Code violations seriously Our Chief Ethics and Compliance Officer reviews all submissions and periodically communicates findings to our Audit Committee Expeditors follows up with employees who have raised concerns based on their original method of communication either directly through the opendoor policy or indirectly through the hotline even if employees chose to report anonymously,0
Given our global nature we take a comprehensive approach to compliance and strictly adhere to all applicable regulations We require annual training for our employees to ensure that we remain compliant with the most uptodate standards Each year every employee goes through a onehour Code of Business Conduct training course and more than 10 hours of mandatory compliance related training based on role,12
In 2021 100 percent of our employees completed the required trainings globally which include,8
l AntiCorruption l Code of Business Conduct l Competition and Antitrust l Confidential Information and Computer,0
l Cybersecurity Level II l Data Privacy and Protection l Internal Controls l International Traffic in Arms Regulations,1
l US Sanctions and Export Controls Awareness,12
We also provide a voluntary sustainability course to educate employees on company efforts The course shares messages from senior leadership that focus on our sustainability programs,3
