paragraph,predict_label
Our valued partners are an essential ingredient to our success and we are committed to recognizing and celebrating achievement through our Service Provider Rewards and Recognition Program Our top local providers are invited to attend a program where we highlight outstanding performance and show our appreciation for their partnership,10
We have a tradition of showing appreciation to our truck carriers during the annual Truck Driver Appreciation Week usually held in September Over the years our Districts have embraced the spirit of this event by organizing food and other tokens of appreciation to demonstrate our gratitude for these valuable partners,9
Expeditors Xiamen selected a longtime warehouse provider as their Service Provider of the Year for providing excellent service in daily operations and fully supporting their business development for more than ten years Even with the impact of COVID19 and severe personnel shortages they still treated Expeditors as a priority Their outstanding support and dedicated efforts deserved to be recognized,18
In 2021 our Global Air Ocean and Transcon teams showed their appreciation to our carriers through prepared videos social media posts and commemorative plaques given in person where possible We are truly grateful to our partners for continuing to support Expeditors in delivering world class service to our customers,3
Towards the end of last year our office in Vienna said Thank You to our truck service providers for their excellent performance wishing them a Merry Christmas and Happy New Year As many of the drivers worked over the holidays our team provided gifts of Tirolian sausages Christmas cakes and Expeditors jackets to help them stay warm,2
Prioritizing security health and safety is key to Expeditors success Hear more about security health and safety at Expeditors from our Senior Manager of Environment Health and Safety here,9
At Expeditors the security of our employees and our customers supply chains is one of our top priorities Our security efforts aim to protect our people information systems customers assets and our brand To help achieve this goal we have a robust Security Program built on Expeditors Security Standards a set of global standards integrated into our daily practices and procedures The Security Standards cover our employees and our service providers with the expectation of strict adherence Expeditors is actively involved in industry organizations and government initiatives to help implement best practices around supply chain security throughout the industry We consider ourselves leaders in supply chain security and want to ensure the entire industry has processes in place to keep everyone safe,1
While every Expeditors employee is responsible for following the Security Standards we have dedicated teams that ensure the Security Standards are properly followed and routinely updated,1
Security Management Structure at Expeditors,1
Oversee all aspects of district security including l New initiatives l Systems l Awareness,0
Align efforts with strategies developed by the Global Security Team and support,1
Develops strategies for regional security teams,3
Expeditors Security Standards apply to all districts incorporate industry standards government initiatives and best practices and cover the following topics,12
l Service Provider Selection and,4
l Container Security and Seals,1
OUR STANDARDS DRAW UPON GUIDANCE FROM,12
l Business Alliance for Secure,18
l Customs Trade Partnership Against Terrorism CTPAT,12
l World Customs Organization SAFE,12
l Incident Reporting and Analysis,5
l Physical Security and Security Systems,1
l Measurements Audits and Followup,0
l EUs aviation security program,1
including the tenets of Regulation EC No 300,12
Expeditors carefully selects our service providers to maintain supply chain security Potential suppliers must go through our prequalification process and participate in an audit to confirm they are willing and able to meet our rigorous security standards Our supplier requirements depend on the services provided and include contractual obligations that bind our service providers to Expeditors Security Standards Other requirements include inperson reviews of the candidates security and safety protocols proof of insurance with required coverage amounts and compliance with laws We review our expectations with our service providers and measure their performance on a regular basis This review cadence depends on a variety of factors including the level of risk associated with the service provider changes in ownership or company expansions among others,17
Risk management is an important component of our service provider security We conduct annual onsite risk reviews for our key district service providers based on agreedupon standards In addition Expeditors follows a riskbased service provider due diligence program This program is part of our efforts to ensure that our service providers are conducting business in a compliant manner and in accordance with applicable laws rules and regulations to support our customers logistics needs,12
GovernmentIndustry Partnerships to Bolster Supply Chain Security,17
We have been involved in key security innovation projects such as,15
Expeditors actively participates in many governmentindustry partnerships to provide toplevel supply chain security for our customers One of our strongest partnerships is with the Customs Trade Partnership Against Terrorism CTPAT a voluntary publicprivate sector partnership with US Customs and Border Protection CBP to protect supply chains from terrorism CTPAT requires participating companies to identify security gaps and implement specific security measures and best practices Expeditors became one of the first CPTAT certified and validated brokersforwarders in 2003 We received our most recent revalidation in 2019 at a tier 2 level the highest level of certification available to Expeditors During the pandemic we transitioned to virtual audits where necessary to keep our employees safe and ensured that we remained in line with CTPAT best practices Despite the challenges we experienced due to the pandemic we continued to focus on meeting and exceeding the global Authorized Economic Operator AEOCTPAT security requirements,1
Leadership Involvement in Security Initiatives,12
Expeditors takes part in various security focused initiatives and organizations to aid in the improvement of security throughout the industry,1
l Air Cargo Advance Screening Program,18
A program by the CBP and US Transportation Security Administration TSA that requires participants to submit air cargo information in advance for shipments arriving in the United States from a foreign location,22
l Certified Cargo Screening Program,12
A program by TSA that certifies cargo screening facilities in the United States to screen cargo prior to providing it to airlines for transport on passenger flights The program requires participants to carry out a TSAapproved security program and adhere to a strict chain of custody requirements,19
Expeditors representatives participate in key security associations such as,12
l American Society for Industrial Security An organization providing security certification career development and resources to a global community of security practitioners,1
Association A nonprofit coalition of manufacturers shippers carriers insurers service providers law enforcement and government agencies tackling the multi billiondollar problem of cargo thefts from supply chains,17
Expeditors participates in over 20 supply chain security AEO programs globally We continue to evaluate other AEO programs for participation and certification,17
We have actively participated in Partners in Protection in Canada since 2003 the Secure Trade Partnership TradeFirst in Singapore since 2009 and the Authorized Economic Operator AEO programs in China Taiwan and several Member States of the European Union EU since 2010 among others Most recently we received certification in Australias Trusted Trader Program,12
Safety Management Structure at Expeditors,9
Administer safety trainings conduct annual selfaudits and ensure employees comply with program elements,9
REGIONAL HEALTH AND SAFETY MANAGERS,9
Ensure health and safety compliance through regular communications with Safety Managers at their districts,9
VP SECURITY HEALTH AND SAFETY,9
SENIOR MANAGER ENVIRONMENT HEALTH AND SAFETY,9
Oversee Health and Safety program at the corporate level,9
The health and safety of our employees is not only a pillar of our Code of Business Conduct it is synonymous with our culture and mission Our employees are our most valuable asset and it is critical that we offer a safe working environment that attracts the best and brightest in the logistics industry,9
Our Health Safety Program Since 2010 we have followed our global Health and Safety program which is focused on maintaining workplace safety across our operations The program elements include,9
l Designated local leadership who set,8
the tone and manage health and safety,9
l Internally developed and tailored safety,14
l Local emergency response plans,5
l Fire prevention procedures and training,5
l Jobspecific training for manual and,2
l Working environments that are clean professional and in compliance with our culture and global standards,0
l Regular safety monitoring review,14
We manage our Health and Safety program at the corporate regional and district levels Additionally our Global Business Operations team completes operational performance assessments annually on all facilities globally to monitor compliance,9
To ensure we identify and manage health and safety risks we require that each district perform an annual risk assessment based on the specific hazards associated with their business activities The Safety Manager oversees completion of the risk assessment as well as the coordination of any additional risk mitigation items that may result from the assessment Our program also requires updated risk assessments when the working environment changes such as a facility expansion engineering restructure or new facility acquisition In 2021 Expeditors completed a total of 366 individual risk assessments across all of our facilities globally,9
To manage Health and Safety we use our roadmap which includes,9
l Working environment enhancements such as air quality noise control and radiation protection,21
l Chemicalhazmat safety and compliance awareness,14
l Spill containment and environmental,5
l Incident reporting and review,5
l Periodic safety reviews of our strategic,14
l HazComm and Right to Know focus,3
l High Hazard Work Activities safety,9
Our hazardous waste standard aims to ensure employees know how to identify respond to and correctly manage instances involving hazardous waste that may arise from our business Expeditors provides jobspecific training to all EHS managers globally on the adherence of our hazardous waste standard which includes,19
l Development of local Hazardous,19
l Posting and communication of,12
Expeditors Hazardous Waste Identification Chart in all warehouse facilities,19
l Procurement and placement of Hazardous Waste Management equipment,19
We track Health and Safety training completion in our PDC for data analysis and accountability,9
In 2021 Expeditors employees and contingent labor completed 50681 safety specific trainings that accounted for a total of 62149 hours of training,9
In 2021 we successfully implemented a new certification program for all Safety Managers which requires 12 weeks of health and safety training and provides consistent foundational knowledge for employees within these roles In 2021 over 160 Expeditors employees representing 93 of our Safety Managers worldwide completed and were certified in Expeditors 12week Environmental Health and Safety Certification course,9
We track our Days Away Restricted and Transferred DART Incident and Lost Time Rates as a way to measure the success of our Health and Safety program Our safety metrics continue to reflect that Expeditors performs better than the industry average We set a target of 075 or less for each of our safety metrics and we have continued to meet our safety goals for the last five years,9
We require all new hires to take a onehour computerbased Health and Safety training course An additional Security Health and Safety refresher course is required annually for all employees globally and over 19000 employees completed this course in 2021 We also offer specialized trainings based on employee roles including a Manual Materials Handling training for specific positions a Safety Hazard and Incident Reporting training for all supervisors and managers and an extensive Forklift Training course for forklift operators,9
DART Rate Number of incidents that had one or more lost days one or more restricted days or that resulted in an employee transferring x 200000work hours,9
Lost Time Incident Rate LTIR An occupational injury or illness which results in an employee being unable to work a full assigned work shift x 200000 work hours,9
Total Case Incident Rate TCIR Number of Occupational Safety and Health Administration OSHA recordable cases x 200000work hours,9
Industry averages are based on published US Occupational Safety and Health AdministrationBureau of Labor Statistics data They are reported midcalendar year therefore 2021 industry averages are not available for this report,9
COVID19 Global Recovery Plan Going Forward,5
As the pandemic continued to evolve throughout 2021 we remained focused on the health and safety of our employees Given the magnitude and complexity of the pandemic we developed a globally consistent recovery plan with the help of a crossfunctional team of employees,9
Our mantra in developing this plan was simple One Network One Plan Staying Safe Together Our global plan is the same across Expeditors and was built around consistent precautions required for distinct phases of pandemic severity with the goal of protecting our essential workers operating in our warehouses and allowing our office staff to work remotely until conditions improved in each location,9
This phased approach provides districts with the flexibility to shift between phases depending on the local environment including the state of local healthcare infrastructure case counts and local transmission rates While conditions have improved in many locations and vaccines continue to be deployed we continue to review COVID matters on a weekly basis at both the district level and executive level adjusting our approach as needed,2
Throughout 2021 our districts continued to safely manage their business operations and provide protection to our employees service providers and customers,3
As we move toward recovering from the pandemic we continue to follow the protocols and procedures enacted to maintain safe operations including,5
l Safety protocols for our warehouse,9
operations such as healthtemperature screening procedures and driver validation procedures that protect our employees and service providers,8
l Contactless delivery solutions and,15
paperless processes where possible to limit the number of inperson interactions,4
We remain grateful for our employees and service providers and their dedication and perseverance during these tough times as they continue to safely move essential goods for our customers We look forward to continuing to follow our phased approach to safeguard our people and provide continuity of operations,10
Our districts in India organized a vaccination drive for all employees to receive their COVID19 vaccination,9
Building value over the long term for ourselves our stakeholders our customers and our employees is imperative to the success of Expeditors and we have principles and standards in place to help achieve this Our SVP Chief Strategy Officer provides further insight on governance at Expeditors here,3
Our Board of Directors Board represents our most senior governance body and is actively involved in the companys sustainability efforts As of the date of publication of this report Expeditors has ten directors sitting on the Board of which 30 are female Because diversity is part of our global culture we believe that our Board should be comprised of directors with diverse backgrounds experiences and perspectives that will improve board decisionmaking and effectiveness The Board is comprised of three committees the Audit Committee the Compensation Committee and the Nominating and Corporate Governance Committee NCGC The NCGC is responsible for overseeing our sustainability program and meets quarterly Its responsibilities include reviewing climate related matters and identifying industry trends and opportunities to advance the companys sustainability initiatives and reporting among others The Vice President Associate General Counsel who serves as our ESG Executive Sponsor reports annually to the NCGC on company progress,3
Oversight responsibilities for certain areas of risk are assigned to the Boards three standing committees and others are assigned to the full Board The Board and its committees regularly discuss with management the Companys strategies operations compliance policies cybersecurity and inherent associated risks,18
in order to assess appropriate levels of risk taking and steps taken to monitor mitigate and control such exposures,18
Expeditors ESG Executive Sponsor develops our companywide sustainability strategy in conjunction with the Executive Sponsors for each of the three pillars of our sustainability program This crossfunctional team includes several Vice Presidents and Senior Vice Presidents reflecting broad seniorlevel representation Each pillar has a program,3
manager who facilitates sustainability programs empowers employees measures and reports progress responds to customer and investor inquiries ensures employee compliance and more Senior executive management is also responsible for the assessment and daytoday management of risk and bringing any material risks to the attention of our Board of Directors who are responsible for overseeing the conduct of our business and monitoring significant enterprise risks,18
ESG Management Structure at Expeditors,3
Code of Business Conduct and Policy Handbook,12
Our Code of Business Conduct Code is an important reference that guides employees on how to do business the right way It covers a range of compliance and ethics topics including anticorruption conflicts of interest community activities and political contributions privacy and data protection labor standards security health and safety and the environment among others Our Code of Business Conduct applies to all employees and service providers and is published on our global website Additionally the Code is currently available on our internal website in nine languages and we plan to continue increasing the number of translations,0
Expeditors compiled our policies into an internal Policy Handbook The Handbook serves as an enterprisewide framework to harmonize existing policies categorize them into relevant themes link the themes to more detailed operational standards and provide overall policy guidance The Handbook provides a coherent structure under which all of Expeditors policies are created enforced and reviewed to meet the companys goals all while referencing the Code which outlines our primary company business principles,12
Expeditors Policy Framework outlines the clear hierarchy of controls for all our governing documents The Code provides the governing principles that all other documentation stems from Policies establish roles responsibilities and controls,12
Standards provide a uniform method of implementing the policies and establish performance measures Procedures provide stepbystep instructions on how to carry out the standards and guidelines provide additional suggestions,12
Code of Business Conduct Internal Controls Senior Management,0
Related Policies linked to Governing Principles Policy Committee,12
Operational Performance Standards Functional Leaders,12
Detailed Procedures Guidelines Functional Leaders,12
Protecting our stakeholders personal data is of the utmost priority to Expeditors Given the technology and dataintensive nature of our knowledgebased business model we have invested in mandatory cyberspecific training and frequent companywide reminders and in a number of controls to maintain the privacy and security of our information and data,1
Expeditors employs a dedicated team of cybersecurity experts with technical expertise,1
including several Certified Information Systems Security Professionals and cybersecurity staff in our district offices in each region We work to continuously enhance our cybersecurity capabilities in order to detect and protect against threats and system compromise including running tabletop exercises and simulationsIn late February 2022 we were the subject of a targeted cyber attack that prompted us to shut down most of our operating systems globally to manage the safety of our overall global systems environment underscoring the critical,1
nature of our ongoing vigilance and attention to cybersecurity We have since been working around the clock to restore our systems and as we finalize this report we are making significant progress in returning to normal operations As we do so we will continue to focus on the key fundamentals of protect monitor and respond and leveraging industry experts and government resources and associations including the National Institute of Standards and Technology Cybersecurity Framework to safeguard the security of our systems,1
Cybersecurity and Privacy Management Structure at Expeditors,1
Responsible for global operational cybersecurity as well as policy development and cybersecurity compliance Leverages its alignment with our Global IS and Global Security Health and Safety structure to protect critical information,1
Member of legal department Works with General Counsel to update Board on relevant privacy issues that may impact our business manages Global Privacy Policy and helps Company navigate complex evolving regulatory landscape of data protection,1
Full board level oversight of cybersecurity matters Two of our Board members have extensive cybersecurity experience In addition our Boards cybersecurity expert meets with our Chief Information Officer CIO on a quarterly basis and the Companys CIO and cybersecurity experts report to the full Board at least once annually,1
Executive level committee Reports twice annually on cybersecurity matters and creates action plans from biannual reviews Works with Global Data Protection Officer and General Counsel to update Board on cybersecurity matters to provide quarterly updates to our Enterprise Risk Committee and annual updates to our Board of Directors on cyber risk information security and technology risk as well as policy development,1
We take a protect monitor and respond approach to our program,5
Protect Expeditors implements various standards and controls that aim to protect data and prevent incidents,1
Monitor We measure the success of our protection efforts through assessments and audits and monitor our systems for any incidents that may occur,5
Respond We believe in continuous improvement and implement action plans based on our monitoring efforts We have dedicated teams able to respond to incidents if they occur,5
We believe privacy and data protection form a critical element of corporate responsibility for every organization Customer trustin our products our services and our business practicesis foundational to our mission We recognize that we cannot protect our customers and achieve our mission without a deep commitment to information security and data privacy ourselves,1
As a part of our privacy compliance infrastructure Expeditors has a Global Privacy Policy that regulates our collection use and disclosure of individuals personal information determines responsibility if there is a violation and assures the rights of individuals to access their information in accordance with applicable laws Mandatory annual training for all employees is included within this policy We also maintain an online Privacy Statement that describes some or all of the ways we gather use disclose and manage customer thirdparty service provider or employee personal information We have in place industryaccepted physical technical and administrative security measures appropriate to our business to safeguard and secure the personal information we process,22
The Six Privacy Principles Our processing of personal data follows all six of the following privacy principles,22
Lawful fair and transparent We collect use and retain personal data in a fair lawful and transparent manner by issuing privacy notices that explain why and how we process personal data Our privacy notices contain the following information type of personal data we collectuse purposes of collectingusing the data third parties to whom we disclosetransfer the data security safeguards employed and a data subjects rights,22
Purpose limitation We collect use and retain only personal data that is relevant and useful to our business operations and as needed to fulfill our legal and business obligations Personal data may not be collected in advance and stored for potential future purposes unless required or permitted by law This simply means that personal data collected for one purpose should not be used for a new incompatible purpose There is an exception however when further processing is purely for statistical purposes in which case we will ensure that the data is anonymized or pseudonymized,22
