paragraph,predict_label
Expeditors offices are located worldwide to create a geographicallydiverse network that provides our customers with local support wherever they need Our global operations allow our network and operating systems to continue operating as a whole even when a local operation may be impacted by acute events including flooding or other weather issues Relying on the strength of our global network and Business Continuity Plan has proven to be successful throughout several regional national and global disruptions See Business Continuity for further details,13
Given our geographically diversified non asset business model we do not perceive any material risks or opportunities related to climate change beyond risks and opportunities inherent in our business at this time Our flexible footprint and our ability to change locations modes and carriers based on evolving operating conditions and customer preferences translate into a model that may be less potentially prone to acute climaterelated risks than more assetheavy models We are confident that the flexibility of our non asset based business model geographically diverse network Business Continuity Plan and Enterprise Risk Management Framework around Catastrophic Risks are sufficient for identifying assessing and responding to potential disruptions including climaterelated risks and opportunities,13
We recognize that some operations and offices could be impacted in the longterm by climate change for example due to potential compliance costs or transition risks eg related to a warehouse facility located in an area expected to experience gradual changes in sealevel However it is unlikely that this type of change would have a substantive financial or strategic impact on our overall business,13
We also recognize that it is possible that certain ports may become more or less advantageous over time however we anticipate that major port operators and governments would adapt their facilities and infrastructure in response to such climaterelated changes and adjacent warehouse and office space may shift accordingly,13
Similarly it is possible that customers will seek out more fuelefficient routings or options such as those provided by our consolidation services and multimodal options which could create opportunities,4
Working with Our Customers to Reduce Emissions,21
We analyze many of our customers supply chains and recommend ways to reduce costs and carbon emissions through options such as modal shifts reducing distances traveled and consolidating freight to utilize transportation assets more efficiently Through our tools and services our customers can make informed decisions regarding their transportation footprints Because many of our tools are focused on maximizing transportation efficiency both cost and the environmental footprint of our customers supply chains improve,17
For example Expeditors Freight Efficiency Score FES synthesizes three drivers into a single comprehensive metric to measure the efficiency of the ocean transportation program These three drivers include the mix of container size used the cost ratio between container sizes and the container fill rate Expeditors analyzes these drivers on a lanebylane basis and highlights opportunities for improvement Our customers can realize both better costs and lower environmental footprints by optimizing how much they are able to ship per container and how many containers they are able to send per shipment,24
Expeditors Green Logistics Solutions offer our customers multiple levels of insight through several different tools,15
l Carbon Footprint Summary Report This tool illustrates emissions across a customers,25
network by mode geography and business entity,1
l Supply Chain Carbon Diagnostics This service delivers a more detailed assessment of,17
supply chain flows and carbon emissions identifying opportunities and recommendations for emissions reductions,17
l Network Carbon Reduction Project This tool is our most comprehensive approach and,25
guides customers in reducing carbon emissions through overall performance optimization of the supply chain,17
As mentioned above we incorporate the GLEC Framework into our customer carbon emissions methodology and use EcoTransIT an EN16258 compliant software tool which allows us to report our customers transportationrelated emissions more accurately We report this information to our customers using an interactive dashboard that allows them to easily understand and analyze their data Further information about our CO2 dashboard can be found on our website,25
Global Fashion Retailer Delivery Optimization,15
In 2021 we worked with a global fashion brand headquartered in Europe to streamline their air and ocean deliveries to their European distribution centers This company was receiving air shipments from multiple providers and over 3500 ocean containers each year They were looking to optimize their delivery process by gaining access to greater capacity moving containers more efficiently and sustainably and reducing the level of administration required,24
Expeditors was able to optimize this companys delivery process lower costs and reduce their greenhouse gas emissions from transport by 15 by,25
Reducing trucks and increasing barge by 43,24
Consolidating airfreight which resulted in the reduction in trucks by over 30,21
Securing access to road rail and barge capacity,20
Scheduling night deliveries at the distributions centers which led to increased efficiency reduced traffic delays and increased truck availability,5
Water consumption at our facilities is non industrial and used for drinking and sanitation purposes only However a significant number of our operations are in watersensitive areas As such our Green Teams are empowered to proactively identify water conservation methods based on their facilitys activities and needs Past methods include upgrading to automatic sinks and toilets and reducing water used for landscaping We track water consumption at 108 facilities and we plan to continue increasing the number of facilities that report this information In 2021 our water consumption was 13981218 gallons,20
As Expeditors continues to digitize its operations in what has been traditionally a paperintensive business we strive to reduce and recycle our paper along with other waste streams including computer equipment food and everyday waste Our Global Business Operations team communicates best practices for waste stream reductions to our district management who then implement them locally We also monitor the number of printed pages from our online server to identify opportunities for improvement and track paper reduction through a Print Ratio dashboard We plan to report on additional waste data such as recycling waste to landfill and compost in the future as this information becomes available,19
Expeditors has a paperless deployment project that is focused on creating a paperless office environment globally We utilize various strategies to reduce our paper consumption including,24
l Dual monitors at workstations,24
l Webbased workflows for every product,15
l Digital copies of documents,22
These efforts have led to a significant reduction in our global paper use In 2021 we saved over 9 million pages of paper,24
Expeditors employeeled Green Teams take ownership of reducing waste and increasing recycling efforts at their local districts,19
Various teams across the world have implemented programs to reduce the consumption of singleuse plastics and to collect and recycle items that benefit from coordinated collection including batteries and cooking oil We responsibly dispose of all computers and electronic equipment across our operations in compliance with the Waste Electrical and Electronic Equipment WEEE Directive and the Restriction of Hazardous Substances RoHS Directive in the European Union,19
Expeditors continues to offer recycling in our digital solutions services including within Cargo Signal Solutions our whollyowned sensorbased logistics business New plastic and electronics are increasingly introduced in the waste stream as the market continues creating disposable devices To help reduce this waste Cargo Signal Solutions has implemented a recycling program for lithium metal batteries In 2021 over 1500 batteries were recycled compared to 300 batteries in 2020,19
Our employees are passionate about reducing the impact we have on the environment,10
South Asia Districts in our South Asia region had initiatives around electronic waste recycling and carton box and pallet recyclingreuse,19
Cambodia One of our districts in Cambodia provided reusable bamboo cups to service providers,15
China One of our districts in China created an initiative to reduce the use of disposable utensils by customizing stainless steel tableware boxes for all staff,15
India One of our districts in India replaced singleuse dishes and utensils with reusable options to reduce the amount of waste they produced,19
Europe One of our districts in Spain installed drinking fountains to reduce the usage of plastic water bottles,20
Expeditors unwavering commitment to make our communities a better place to live and work is ingrained in our culture We integrate positive actions into our daily practices and procedures that build skills and trust with our employees service providers customers and communities to support strong and effective operations To fulfill our commitment we provide extensive training and support on health safety and security give back to the communities in which we live and work and engage with underresourced young adults and veterans on career development to help develop promising jobs for these individuals,2
People are core to Expeditors whether its our own employees or those in the community Expeditors is committed to building a stronger business while making a better world Hear how Expeditors SVP Account Management views our social responsibility here,10
For more than 40 years Expeditors has set the standard for excellence in global logistics by prioritizing our employees Our founders believed that if we took care of our employees they would take care of our customers This founding principle remains at the core of our philosophy today and is why Expeditors Vision Statement is about our people first rather than logistics,9
To create unlimited opportunities for our people through sustainable growth and strategic focus inspiring our premier customerfocused logistics organization,3
Our founders sought to create a different kind of company where people could do well for themselves a place of unlimited opportunities Expeditors employees are vital to our ability to serve our customers manage our partnerships with service providers and run our business We are committed to providing opportunities throughout our employees careers that help them grow,8
we serve and we are extremely proud of our highly talented inclusive and multicultural global workforce,8
We provide training on DEI with our Code of Conduct and workplace harassment trainings as well as through selfled options on LinkedIn learning Diversity is also considered at the leadership level for our executive succession planning and required for our CEO and Board of Director candidate searches We have formalized in our governing principles that qualified female and raciallyethnically diverse individuals must be included as part of any candidate search,8
We proactively pursue diversity in our recruitment process We have recruitment programs for youth and veterans through our job training program Opportunity Knocks and have recruitment web pages for,8
l JA Worldwide Alumni a global non,8
profit youth organization equipping young people with employment and entrepreneurship skill sets and mindsets,8
One of the many ways we prioritize our employees is through our nolayoff practices during unprecedented events We instituted a nolayoff policy during both the Great Recession and COVID19 pandemic where we prevented layoffs from occurring due to the financial pressures of these events When many companies were furloughing and laying off staff we sought to protect our most valuable asset our people,18
Diversity Equity and Inclusion DEI,8
l Cristo Rey Network Alumni the broadest,4
Diversity equity and inclusion DEI are fundamental to our vision of unlimited opportunity for our employees In 2021 our United States workforce was 44 women and 40 raciallyethnically diverse persons,8
Our global practice is to hire local employees in our offices so that our operations continue to reflect the diverse and vibrant communities,8
US high school network for lowincome students serving 98 people of color,8
l Veterans and Veteran Spouses service members of the US armed forces returning to civilian life,8
Each web page including the job openings shown is tailored to the respective audience with the intention of expanding the diversity of our applicants,8
Expeditors is a leader in the global logistics industry with a culture of organic growth and promotion from within that attracts high caliber candidates We are committed to developing our employees capabilities so that they grow their knowledge and experience have better opportunities to service our customers and further their careers We ask our employees to complete at least 52 hours of training each year which can be achieved through Expeditors developed training courses external webinars conferences,8
and university courses among others In 2021 we began providing LinkedIn Learning to all Expeditors employees and had over 4500 hours of training completed through this platform Thanks to the efforts of our employees the average hours of training per employee was 60 hours in 2021,11
4500 hours of LinkedIn training in 2021,2
60 hours of training per employee,11
Our commitment to our employees development is reflected in our annual review process and hirefromwithin culture Our Professional Development Center PDC houses our online trainings and career development tools where goals and annual reviews can be tracked to support completion We encourage a 31 approach where employees have three formal touch points with their manager throughout the year and complete one annual review process which are all tracked in the PDC to support regular communication on employee development,8
For over 30 years our management trainee program has provided employees with the opportunity to spend one year focused on gaining both operational and managerial knowledge of Expeditors business products and services Employees are eligible to apply for the program once they have been employed at Expeditors for at least one year,8
On average there are 58 programs each year with 812 employees per program depending on district capabilities Over 500 employees have graduated from this program with 34 trainees graduating in 2021,8
Many of these graduates currently hold district and regional leadership roles including several vice presidents,7
We also prioritize employee development by providing upward mobility opportunities All job openings are posted internally to allow any employee the opportunity to apply and we aim to retain employees from hire to retire,8
In 2021 we deployed 20 episodes of Career Conversations to our employees Career Conversations are internal podcast interviews with leaders across our network that aim to encourage relationships diversity career opportunities and culture throughout Expeditors The interviews are 30minute conversations that give employees the opportunity to get to know Expeditors leadership from diverse voices and backgrounds and learn about their journey to their current positions,8
Our expectations regarding labor standards are outlined within our Code of Business Conduct This includes information on equal opportunity employment prohibition of harassment intimidation or discrimination of any kind and the prohibition of forced or child labor Expeditors is also a party to collective bargaining agreements with a limited number of employees outside the US,11
OPPORTUNITY KNOCKS YOUTH PROGRAM STATS,2
We proudly offer opportunity to youth through our Opportunity Knocks Youth OKY program OKY is Expeditors internalannual paid internship program to assistthe professional development of youth and young adults who lack opportunity or facemore obstacles than some of their peers by offering workplace readiness mentorship skill training and viable career pathways Our Senior Vice President of Digital Solutions oversees the program and it is managed by our Program Director We have gained candidates through collaboration with nonprofit organizations including The Cristo Rey Network of Schools and Year Up among others,8
Our program benefits the youth we work with and provides Expeditors with an expanded talent pipeline broader employee diversity and increased employee development plus engagement and positive relationships within our communities To further our impact we provide a downloadable toolkit through our Opportunity Knocks in a Box so that other companies can replicate a program like Opportunity Knocks in their organizations,8
Further information about Opportunity Knocks is available on our website,8
offered since inception in 2008,2
The Cristo Rey Network of Schools The broadest US high school network for low income students serving 98 students of color,8
Year Up A nonprofit workforce development organization committed to ensuring equitable access to economic opportunity education and justice for all young adults,8
adults have gained longterm positions,4
have been hired in 5 countries,8
with tenure up to 12 years,7
Despite the pandemics continued interruptions of internships and student workstudy opportunities,11
During the 202021 school year Expeditors supplemented remote classroom instruction for 400 students across 15 cities in the Cristo Rey Network of Schools through hosting a guest interview series featuring executive leadership and other subject matter experts from across the company Guest speakers shared their unique experiences and perspectives as well as expanded on topics familiar to students to help strengthen the connection between classroom instruction and practical application,2
Since the expansion to remote outreach we have impacted more than 800 students in the USA and India through 16 schools and five education or workforce development organizations The remote outreach impacted these students via,2
l Career Exploration l Excel skills training l Resume tips interview skills and mock interviews l Professional dress appearance coaching l Guest speaking student mentoring,8
Five offices reached years of partnership with,12
The Cristo Rey Network of Schools,2
placed students or financially contributed to youth programs,2
Daniel began as an intern in 2012 at 16 years old He went on to college while working at Expeditors gained a degree and is now a District Sales ExecutiveExpeditors is a great company As cheesy and clich as it sounds it turns into a family Starting my career under the Opportunity Knocks program as an intern paved the way to build myself up not only as a business professional but as a person I am grateful to be in the position that I am today and it all became possible with Expeditors and the OKY program,8
Launched in 2015 Opportunity Knocks for Veterans is a recruiting program that honors veterans and hires extremely talented and highly motivated individuals that embody Expeditors cultural attributes More than 200000 US service members return to civilian life each year and our program supports veterans in their transition Our program has three pillars recruit and hire provide career guidance and mentorship and recognize service Currently 35 districts are active in the program and more are hiring veterans as a direct result Over 50 program volunteers have coordinated and supported hiring and recruiting events across the United States as we partner with various veteran service organizations at the state and national level,8
Through partnerships with organizations such as Hiring Our Heroes Microsoft Software and Systems Academy and veteranowned service providers Expeditors is honored to support our veterans and service members transitioning back to civilian life and benefits from adding these talented and motivated individuals to our organization Despite the challenges associated with the pandemic the Expeditors Opportunity Knocks Veterans program was able to hire corporate fellows through the Hiring our Heroes Corporate Fellowship Program and continue volunteer efforts within local communities supporting Flags for the Fallen and Wreaths Across America,8
The Avasar Foundation Helping Underprivileged Youth with Education and Employment,2
The Avasar Foundation Avasar was employeefounded and has been part of Expeditors Indias Corporate Social Responsibility program since 2015 Avasar is a nonprofit with the mission to empower talented but underprivileged children and youth through education training skill development coaching and mentorship,2
Veteran Employees Experience with Opportunity Knocks for Veterans,8
What really caught my attention immediately was Expeditors company culture and its core valuesI could easily relate to them thus making my transition from military to civilian that much easier Expeditors is a great place for veterans I love that I can once again be challenged daily to learn new things never a dull day at work I can also share some of my experiences and knowledge with the team hoping that it can also benefit othersAs a veteran Expeditors gave me back something I missed once I left the service I felt I was part of a team again,8
Fernando Huerta El Paso TX,4
Expeditors is very supportive and understanding of the military community and the upandmove lifestyle that comes along with it Given the number of locations that Expeditors has both domestically and abroad there will always be a branch location somewhere near wherever we might end up next almost as important with the companys core values there will be a guaranteed strong continuity between locations and a feeling of consistency along the way,3
Avasars growing impact through Expeditors includes,3
PrePrimary Schools 5 schools providing 100 free early childhood care and education are running successfully with 300 students Since March 2020 learning has moved online,2
School Development 7 schools adopted to improve infrastructure including improvements of classrooms and bathrooms and solar installations among others,2
Digital Literacy 48 schools are now equipped with stateoftheart computer labs 12 of which also offer,2
staff support Due to the pandemic the labs were closed for most of 2021,5
Training Center 600 college graduates have completed a threemonth Job Readiness Training program since 2018 which includes computer skills soft skills and English conversation training,8
Scholarships Started in 2012 our program currently funds the education of 160 students over the age of 14 and is largely funded by Expeditors employees A recent partnership with Crowdstrike in 2021 provided scholarships to a total of 15 students between 6 and 18 years of age who may have lost one or both parents due to COVID This support covered tuition fees books uniform fees stationery and travel costs in the form of bus passes for two years,2
At Expeditors we embrace both the opportunity and the responsibility to make a positive impact in the communities in which we live and operate We give to our communities at the corporate level and globally through our districts,10
Expeditors Charitable Giving Committee meets twice a year to review the organizations we partner with and donate funds to We focus our corporate donations on organizations involved with research to cure insufferable diseases and those that help individuals and families meet their basic human needs We also allow employees to propose organizations they would like to see the company support which broadens our giving reach and increases our engagement,2
Each year Expeditors conducts a Corporate Matching Gift Campaign During this campaign employees select any 501c3qualified charities they wish to donate to and Expeditors matches 50 of their donations In 2021 total employee contributions were more than 13 higher than the previous year and we were able to support 3 more charitable organizations At a corporate level we donate to various charities such as,12
District offices are involved in their local communities and create their own charitable initiatives Beyond these district initiatives many of our employees generously give their money and time to their communities at a local level Employees regularly partake in activities such as charitable drives to donate supplies to those in need and racing events to raise funds for various causes To further give back to their communities all US employees regardless of tenure receive one paid day off to volunteer at a local nonprofit of their choice In 2021 community engagement activities continued to be subdued due to the pandemic but many districts got creative by conducting and participating in virtual events allowing them to still show up for their communities,10
Race for a Cause Expeditors is a gold sponsor for Bike MS a cycling fundraising event that supports the National Multiple Sclerosis Society,9
Expeditors is currently ranked 2 in overall fundraising out of 109 teams and raised over 75000 in 2021,12
Mens Mental Health Expeditors employees in England participated in Movember a campaign where participants stop shaving during the month of November to raise awareness for mens health In 2021 Expeditors participants provided their funds to organizations that aid mental health,9
Middle East Africa and India COVID Support Expeditors employees in Mumbai India donated COVID test kits to local hospitals to aid in the testing of underprivileged people,2
